44488,何が一番困るかと言うと「日本語のマニュアル」がない販売先に質問してもトンチンカン、2台繋いでその後どうするのかが分からず困っています。 またPC起動時にアプリの起動を聞いて来るので必要のない時は起動しないようにしたいが分からず、他のアプリの購入す進めてくる等々で結局外して使用していません。,2
79159,最初から表面に汚れか傷の様なものがありとてもギフト等には使えない。小銭入れの口が狭く、小銭が出し入れしにくい。安物は安物なりです。,2
64254,画面はすべすべして操作しやすい。 粘着が上下左右の2mmぐらいだけなのか、張り付けても強めに押せば動いてしまう。 上下左右の粘着力が弱いのか多少浮いてしまっていて、ポケットにいれているとホコリが入り込んでしまいすぐに汚くなってしまった。 中央部分に気泡は入っていないが、虹色のような映り込みがしていて、電源オフの時に目立つ。,2
63435,アマゾン解約かな 面白そうなの有料だよ Cmで追加料金なしとか宣伝してるけど 実質レンタルで有料 詐欺みたいなやり方 ダメダメだ,2
68915,ありがとう。 ありがとう。 こんな安い 値段で いいね。 ありがとう。,2
51985,値段の割に使いやすくてよかったのですが、半年ほどで充電できなくなりました。 耐久性に難があるのかもしれません。,2
64432,最近購入しました。 キレイな箱に入って届きました。おまけでキーケースも付いていました。デザインも悪くなく、カードなどの収納力も高いです。この値段にしては満足出来る商品です。 ただ残念な事に、ボタンで開閉出来るカード収納部分のポケットを一杯にして、私の様にズボンの後ろポケットに入れて、仕事するとクセが付いてしまい、ボタンが簡単には止まらなくなってしまいます。私の場合たった2日でそうなってしまいました。 おそらく、スーツの内ポケットに入れて持ち歩くには問題ないと思いますので、そういったビジネスマン向けの財布だと思います。 ボタンが止まらないと困るので、すぐに私は財布を買い直しました。 いい勉強になりました(TT),2
40148,直ぐにジッパーが馬鹿になりました。 砂や泥からカバーすることはできますが風の日などは無論上部はカバーできません。 返品したいくらいです。,2
58000,安いので購入しましたが、生地が薄くなってしまうのが早いです。水着は高くてもそんなに長持ちするものではないので安いものをいくつも買い替えるのがよいかもしれませんが、もう少し長持ちしてほしいと思いました。,2
48455,カード入らない 無理やり両手で開けないと入らない,2
43372,シルキータッチ感はあるのですが、肌が弱い私にはマスク面が当たる場所が痒くて肌荒れしてしまいました。,2
52281,5.5ℓ×2が魅力的で購入しました。当たりに当たると音は静かで国内メーカーの商品より静かです。はずれに当たるとエアーが出ない、音がうるさい、内部で部品が転がる音がする。 輸入品では当たり前？箱が潰れてる。付属品のエアーチューブ、エアーストーンは使い物になりません。 エアーチューブはフニャフニャ過ぎて折り目が付くと直りません。 エアーストーンはエアーが出ない、エアーチューブを抜こうとするとエアーストーンが砕ける,2
51886,安いセットなのである程度のことは承知の上で購入（サイズが微妙にあわない・縫い目が汚い・レビューと違う等） サイズは許容範囲、半袖の表の縫いが裏と逆じゃ？と思えるが他人が見てもわからないのでよし 問題は長袖のちょうど真ん中あたりが伝線してて、これをOKして送ってくるとはさすがにどうかと あとは袋が開いてた 粘着が弱かったのか知らないが非常に気味が悪い 長袖だけ交換してくれるならいいが、多分応じないだろうしそんな販売会社と思ってるのでこの評価 アマゾンチョイスなのが驚きだ,2
78058,商品は問題なく偽物とレビューあったりしましたが正規のちゃんとした物が届きました。 問題なのは宅配業者ですデリバリープロパイダ！ お急ぎ便で23日着だったのに住所不明で届かず連絡もなく次の日何食わぬ顔で配達してきました。 住所不明のことや連絡がなかった事を指摘しても昨日の担当者が~って言うだけ。子供なんですか？謝罪の言葉も無く、絶対確信犯で届かなかっただけだと思います。楽天とamazon両方使ってますがデリバリープロパイダが介入するなら楽天で買えばよかったと思いました！最悪の業者です。,2
72653,直ぐに留める所が壊れました。 残念です,2
48694,無段階変速❓ Maxにしても、切断用には無理ですね。回転数が遅すぎ。私は低速での バフ研磨用として購入しましたので なんとか使えましたが、回転数の バラつきが素晴らしく…もしかすると、何度も使わないうちに 安物買いの銭失いになる可能性が大でしょう。騙し騙し 使ってみます。,2
56147,ゴムがキツくて、一時間もしてると頭が痛くなりました。 スポーツ用になら、取れにくくなり良いと思いますが、私は気になってムリでした。,2
53541,音飛び？フリーズみたいでした 申し訳ないが返品いたしました ただ 対応はよくありがたかったです,2
49161,２０本使用可能と言うことですが フル充電で１０本で使用不能に、なりました。,2
57703,食べていて塩辛いのが気になり、食べられません。,2
76237,説明写真のチェーンは見るからに強そうな四角断面ですが、カバーが外れないので目視できないものの、触った感じ丸い断面のチェーンです。 その四角断面のチェーンで「高品質マンガンチェーン」とか太さも詳細に書いていますが、現物が別のチェーンでは全くあてになりません。 また、ダイヤルとダイヤルの間に妙にアソビがあって、指で広げると隙間から鍵内部が少し覗けます。 アソビというより単純に低精度です。（100円ショップにあるようなちゃちさを感じる） 余裕でマイナスドライバーをねじ込めるくらいの隙間なので、試してはいないものの簡単に破壊できそうです。 セキュリティ強度は怪しいですが、値段のわりに強そうではあるので、あくまでも「強力な鍵が付けてるよ。盗みにくいよ」と牽制アピールとしての効果は高いと思います。,2
78524,帽子を中心に 利用してみましたが、連の間隔が短くて きれいに収まらない,2
53101,購入から半年は良かったですが、レンズの中が曇って見にくくなり再び購入を考えなければならず 残念。,2
44585,手持ちのに変えて使っています。 雑な縫い方で、びっくり。ちゃんと検品して欲しい。,2
61859,退職後の遊びで種々のコロンを試していますが、この製品は香りは良いのですが、持続性がないです。 朝つけると昼過ぎにはもう香りを感じなくなってしまいます。,2
59807,他の配送業者はわかりませんが、郵便配達だとポストに届く可能性があります。集合住宅の場合は気を付けてください。,2
49552,いつもホームセンターなどで購入している商品より履き口のゴムの部分が弱く、洗うとすぐ伸び伸びになりました,2
44412,マット一枚ずつが大きくてゴミがたまりにくくてよかった。色合いが写真と違って残念でした。,2
64089,マフラースプリングが信じれない位に固くて、全く伸びず使い物にならない。 マフラーバンドも品質が今一つで、取り付けると無理矢理感が漂う貧乏くささ。 マフラー本体の品質は可もなく不可もなくです。,2
44865,音楽を聴いているとノイズが入って不快な気分になります。 サイズも大きすぎ。,2
61974,充電式じゃなかったので起きたいところに使えず 数回しか使ってませんが、 眠れた？かな？,2
69347,前回2本購入し、次の1本を交換して使用したら、かすれて使い物にならず、急遽購入。 不良品は、色も濃いブルーでなく、かすれも酷くかろうじて書いた字がわかるほど。 使っているクリスチャンディオールの太軸ペンと、その適応の本品の書き味が好みなので注文しましたが、 決して安くないリフィールだけに、残念。,2
49188,健太郎くんはカッコイイし大好きなんですが… 私としては、もっと日常の、何気ない健太郎くんが見たかったなーと。 セミヌード？とかアイス食べる？みたいなのはいらないかな。写真集ってこういうものかなー？ 私の年のせいかもしれませんが💦 私が世間とズレてるのかな？,2
49676,便利そうで購入しましたが 小銭がすり抜けちゃって逆に不便だと 個人的には思いました。 100均クオリティ,2
68115,この価格で、色んな香りが楽しめるところは良いです。ですが、香り方が弱いので結構な量を滴下しなければならず、気のせいか人工的なものに感じました。,2
53088,ブラウンのシールをはがすとブラックのシールがあらわれます。適正な商品なのでしょうか。,2
44673,商品は良いが、持ってきた宅配業者が最悪な対応だった。改善してほしいですね。,2
40666,ピンクを購入しました。写真よりピンクって感じで少しびっくり。 iPadでの使用、ソフトはアイビスとメディバン。 縦・横の線はあまりズレなく引くことができましたが、ナナメになるとクネクネと波線に。 これではあまりお絵描きには向かないなーとおもいました。しっかりお絵描きしたい方にはオススメしません。 ツムツムはやりやすいです,2
76780,初日に食器洗い機でも対応しているので洗ったら飲み口の部分の白い蓋の方が変形してかなり閉めずらくなった。男の大人しか開けられない位です。,2
53073,ウエストポーチが良かったのて、ついこちらも購入しました、 が、先ずは安っぽいです。,2
60244,本革で豪華だが、人間工学に基づいていない。形はどっしりしっかり、この価格で本革と申し分ないですが、腰痛持ちには不可。 キャスターがついているが重く、座ったまま移動は重い。最低高が高いので身長170cm以上でないと足が床につかない可能性あり。,2
41478,映像や雰囲気は謎めいていてよかった。しかし仮にも本を題材にしているのに、主人公は預かった希少本に煙を吹きかけるし他の古物商も煙草の灰を本に落とすなど、全くといっていいほど「本」の希少価値というものが描写されていない。それを飯のタネにして、色々な知識や希少価値を理解しているはずの人間が歴史ある書物に敬意が払わないのは違和感がある。私が古書マニアだったらどんなに腕が良くても絶対に主人公に依頼しないと思うレベル。世界に3冊しかないとされる本をその扱い、正直意味が分かりません。 別に煙草を吸うなと言っているわけではなく、重要なキーとして扱っているアイテムはもっと大事に取り扱ってほしかった。素手で触るのも論外。煙草を吸うジョニーデップはかっこいいが、そこがどうしても気になってしまい非常にもやもやしたので星２です。,2
76064,説明文でも目立つんですが、それよりもコードの誤植が多すぎてかなり致命的。 掲載されているコードでは変数が違っていたり、引数の指定方法に抜けがあったり、 画面遷移のロジックが間違っていたりetc サンプルコードを正にしないとかなりつまずきます。 この価格で実践的な内容が書かれているだけに本当に残念です。 校正して第二版を期待します！,2
56557,安価ですが、下記問題があります。 ⑴使用後に畳んで仕舞うと、折り目のところのビニール面がすぐに剥げます。このエプロン２枚目の今じゃ、ダイニングテーブルに出しっぱなしになりました。 ⑵後ろでエプロンを留めるのにプラスチックのスナップボタンを使っていますが、介護者には簡単でも本人には困難です。後ろだけマジックテープにしました。 ⑶ビニール面の色が赤や青ですが、他の色も揃えて欲しい。,2
61631,カード入れは沢山あり、仕切りも多いけど・・・かえって使いにくい印象で、私には合わないので返品しました。見て買わないと難しいですね。スムーズな対応で助かりました。ありがとうございました。,2
43857,カーペットの上にカーペットをひいていたので、つけてみました。けっこうずれます,2
41431,プレゼントで購入。 使いにくいと言われてしまいました。,2
44508,届いた物に濡れた跡のようなシミが有りました また、小さく畳んだ状態で送られて来たので畳みシワ付きです 薄く伸びる素材なのでテンションをかけて引っ張ればシワは目立たなくなりますが残念でした スクリーンとは言えないただの極薄の布です 付属していた取り付け器具も粘着力が低くテンションかけた状態だと剥がれてしまいます 安さに惹かれて購入しましたが、後数百円出せば裏地付きの厚みのあるしっかりした物が買えるのでそちらを選んだ方が良いと思います 初めてのスクリーン購入でしたが失敗でした,2
79731,空気が抜けづらくて少し残念💦 もう少し貼りやすくなるともっと良い。,2
59106,YAMAHA バイクミラー用オフセットホルダー にはまらなかったので☆２つ。,2
65743,3か月の使用でペン先が反応しなくなりました。ピン部分もすぐ外れてしまい中がむき出しに。値段相応ですかね。。,2
75548,タンパク質100グラムあたり29.6とあったので製品ひとつでそんなにタンパク質がとれて凄いと思い購入しましたが、実際は半分以下のタンパク質しかとれないと分かりました。 表示がややこしいので、一本あたりのタンパク質を記載しないと勘違いする 味は美味いが、それではコスパが悪すぎる,2
47188,東芝製のDISKが書き込みエラーが増えてきたので、予防交換で安かったのでこのDISKを購入したが、動作音がかなり大きく、耳障りな感じ。それ以外はほぼ問題なし。,2
69605,知識が薄い私には、難しい。 ドライバーをインストールして一旦認識したが、差し入れする度に認識したり、？が付いたり。 役に立たなかった。,2
53869,欅坂での実績や本人の素性等全く知らないまま購入してみました 強いていうならフライデーの先行ページの自転車の写真で期待してたんですけど… 印象としては 写真集としてのテーマがあんまりみててピンとこない 海外に連れてってご機嫌にさせた上でバンバン水着や大胆なポーズの撮影しましたって感じはします スレンダーでも女性らしいラインの出るところは出ている感じは確かに水着向きな気はしますが… モデル的なフォトブックやスタイルブックのような構成にしたかったのか？と思うようなページもありどっちつかずというか 被写体「今泉佑唯」の素材は十分すぎるほどいいのに1枚1枚めくっていった写真に引き込まれるほどの魔力はあまりないです 構成の悪さのせいかもしれないです 変顔を合間合間差し込んだりメイクは違えど同じような表情のカットがあったりとか この子をどう見せてどのように魅せるか？のこだわりな部分があんまりよく私には伝わらなかったです 今泉佑唯のスタイルがいいってのはわかりました ファンからしたら大胆なカット(下乳見えたり)もあって頑張ったねっていう感想なんでしょうけど 1冊の写真集の出来としては星2〜3くらいが妥当だと思います 勢いのあるアイドルグループの人気メンバーの今だからこそ撮れる表情ではあるかもしれません 切羽詰まった感はないんで表情に… 一個人「今泉佑唯」として写真集を出すならきちんと見せたいコンセプトは固まってたはずです いろんな表情を出そうとしてたんでしょうけど(タイトル的にも) 一冊の作品としては並み以下かな 薄着や水着を集めた写真集と 本人がノリノリで好きそうな服を着させて撮ったフォトブックorスタイルブックの2冊に分けて本を作った方がもしかしたらよかったんじゃないか？って思うような一冊です 詰め込みすぎて欲張った印象が強いです ファン向けですね 写真が好きで勉強のつもりで買おうとしてる人がいるなら 買うなら長濱ねるの方買ったほうがいいよって言いますね私なら 写真のチョイス順番の構成含めてなんかイマイチ、ピンとこない印象が拭えません,2
56159,左のボタンが正常に動作しなくなりました。ハズレだったのかな？,2
46626,重い。しかも重心が普通の傘と違うから、さしづらい。車乗る時、やはり濡れる。満員電車乗る人にはいいかも。,2
46961,強い香りを指摘されることが多そうな商品ですが、私はその辺り問題なし。外国の香水や柔軟剤が好きなら大丈夫でしょう。ただ何度か使ったら、私にはかゆみが出てしまいました。残念ですが人に譲ります。,2
68807,使いやすさなどは非常に良いが、防水性能に難がある(怒) 水が入り込んで、写真のように変色し、故障した。 パナソニックと比べると、防水に絡む作り込みが甘すぎて話にならない。(防水用のゴムを電池格納部の外につけるとか) 早急に対策版を作るべき。,2
68647,裾の長さが中途半端で気持ち悪い。でもお腹はすっぽり隠れる。ちょっとおばちゃん臭いです。,2
47989,ニキビと肌荒れが顔中心上半身に強く出て、落ち着かせようと購入しました。 相性が悪かったようで肌に合わず。 ニキビは余計に広がり酷くなって、使用中止しました。 顔はやめニベアの代わりに手足にも使いましたが、そちらも保湿は物足りず、他に改善されたような感じもなく…。 合えば最高、合わなければこんな物かという感じかと思います。,2
56571,旅行中の血圧計として使いたくて買ったが、数値が異常で使い物にならない。 取説のQRコードが関係ないアプリに繋がる設定で、誤って登録したら、しつこく迷惑メールが来た。 コンプライアンス上問題ないの？,2
71464,箱から出す段階で液晶からキシキシ音がしたためよく見たらネジが１つ付いていませんでしたあり得ませんねw今のところ使えているしテレビ無いと困るので返品しませんがもう買いません,2
57682,物は良いのだか傷だらけでした。 デザインや強度は申し分ありませんでした。 ただ、角に落としてついた削れやその傷口に土が詰まっていたのが残念でした。 流石に土まで着いているのは嫌だったので返品しました。,2
52757,他の製品よりは少し長持ちするだけって感じ。 この量でこの価格でこの使用感は…ちょっと高いですね。,2
57010,底の方から水漏れするので、濡れて困る物や電子機器の側に置かない方がいいと思います。 機能事態には、満足してるので惜しいです。 とりあえず、下にタオルを敷いて使用しています。,2
75665,迷彩の柄は良いが、テープの粘着力が非常に低く、使いづらい。,2
40179,オーディオインターフェイスを新規導入にあたり購入いたしました。Macのシステムレポート上は認識されているようですがオーディオデバイスとしては使用できない状態です。デバイスの輸入元にも質問中ですがやはり製品により合う、合わないはあるのでしょうか。正確な評価には少し時間が必要です。現状はここまでしか書けませんでした。すみません。,2
51296,ケーブルを挿すアルミニウムプレートが本体と剥がれかけていました。手で押し込めて嵌めようしましたが無理でした。充電に関しては、PDは試せていないですが、コンセント周辺がスッキリして気に入っていただけに残念です。返品して別の充電器を購入し直します。,2
61150,スプレーガン収納用に購入しました。 素材がいまいち安っぽいかな… 高級化粧品に使用するのに… 後ちょっと。。かな💦,2
72144,一ヶ月使いました。付けて流した時はしっとり、タオルドライした時もしっとり、なのにドライヤーで乾かしたとたんにすべてが無になりました。当然洗い流さないトリートメントも使ってます。使い続けても変わらなかったので、私の傷みすぎてる髪にはダメみたいです。最後まで使いきって効果が出ればいいです。期待を込めて星２です。,2
66272,商品自体は良い物だと思うが、通風生地のため防寒性は全く感じられなかった。北国に住む人間や、チャリで使おうとしているならばオススメできません。春秋用といったところ。,2
61135,期待はずれ。手間をかけずレンジで簡単献立ではないです…このシリーズはもう買わないと思います。,2
69394,Tゾーン用に購入したけど、たしかにテカらない！ でも小鼻の横のファンデーションが粉吹いちゃって。後々ニキビも💦 海に行く時など、ずっと外で活動する人はいいかもしれません。,2
79113,対応機種を使っていますがサイズが合いません。 画面全体を保護出来ないので気に入りません。,2
58262,6月18日の震度６の地震で水槽割れました。 水槽も水槽台も壁に固定していたので倒れはしませんでしたが、揺れによる水圧で割れました。 我が家には水槽が4つあり、この水槽以外は無事でした。 割れた時は水が完全に漏れ、ソイルが部屋にばらまかれ、魚も瀕死状態でした。 もう少し耐久性が必要だと思いました。まあ運もあると思いますけども,2
76153,1月上旬に本品をティグアン装着。きりりと引き締まった感が出て、最高でした。 しかし、装着後約１ヵ月後の本日、サビがそれなりに発生していました。 おそらくは、道路に散布された融雪剤による影響と思われますが、ステンレスでもサビるのかな？ かなりカッコよくつけれたので、非常に残念です。,2
75892,教育おもちゃとしての価値はあまり感じられず、販売目的と実際とにかなりのギャップあり,2
53004,B2より長くて上が余っている。下との余りを同じにしても下がってしまう。後悔してます。,2
