3615,箱の封もなし、ボトルキャップの封もなし、説明書もなし、シリアルナンバーも無し、不信感200%。 資生堂へ問い合わせた処、『アドバンスト』と入った商品は業務用としてのみ出荷しているものでネット上 では販売していない、従ってAmazonと言えども当方は関知しない（何か有っても保証出来ない）との事。 シリアルナンバーについては、ボトルの底に必ずプリントしてあるそうです。 （カスタマーサービスの手元にあるもので確認） 折角購入したので現品を送るから本物か否か調べて欲しいと願ったが、そういう事は一切出来ないとの事。 詰替えられていても分かりません、やはり安い物は何かありそうですね。 Amazonカスタマーサービスに電話してその旨伝え返品することになりました。,1
29930,購入後、一週間程でバッテリーがすぐからに。一回の使用ももたない。 パワーがない。 今まで色々なメーカーの製品を使ってきましたが、最低評価の商品です。,1
25199,10台買って3台直ぐに電源が入らないし、1か月内に充電ケーブルが5本すぐに壊れた！ 最悪の粗悪品！ 絶対に買わないほうがいい！,1
18782,レビュー評価が良かったので購入しましたが、実際はノイズが酷く、更には時折もの凄く大きな雑音があり、鼓膜が破けるかと思いました。それなりにいい値段してたのでショックです。もう買いません。,1
34369,プライム会員で翌日到着する便で注文したにも関わらず、到着予定日を過ぎても届かず、結局ゴールデンウィークで旅行に行く日までに間に合わず、帰国後の受け取りとなりました。,1
1395,2カ月経っても届きません。 連絡しても無しのつぶて。 アマゾンも然り。 世界一の金持ちの人、何とかしてください！,1
30991,全く聞こえません。 イヤホンの機能がありませんでした。 頭にきて、即返品！ 最悪の買い物でした。 ちなみに、出品者は『チャイナ』です。 やっぱりね...。,1
6346,一晩で壊れてしまった！ もう買わない,1
5228,期日に届かない 問合せには応えない 定価よりも3000円も高い もう２度とKINGには頼まない,1
4394,なんどやってもカメラ追加できず、問い合わせても返答こず使えない。返品だな。,1
882,24日も待たされて、商品は新品とは思えないような感じ。最悪。,1
38860,使用途中でスクロールを上若しくは下に連続作動させると画面が上下に移動する不具合が発生する様になり始めた。上面カバーを取り外すと正常作動したとの報告も有るが私の場合症状は改善せず。不良品として交換か返金を要求したい位憤慨している。Amazonの回答を待ちたい。 以上,1
27996,今まで使っていた電源を交換するためにこちらを購入しました。 届いてすぐに接続し、電源を押しても起動せず、あらゆるチェックをしても起動しなくなり、泣く泣くPCショップへ。 そこでチェックをしてもらった際にマザーボードとCPUが破損しているため交換が必要と聞き、相当落ち込みました。 しかし、PCショップの修理担当曰く、この電源ユニットを接続した際にマザーボードとCPUから煙が出たとの報告があり、今現在は別のものを使用しています。 電源ユニットは過電流等が流れないようになっている筈なのですが、根本的な部分が破損していたようで、非常に大きな損害を被りました。 次はより信頼度の高いメーカーの商品を購入したいと思います。,1
21264,一年以内でスイッチが反応しなくなり 壊れました。悲しいです。,1
14988,写真とは全く似ても似つかないようなスカスカな物が届きました。色も黒じゃなく灰色。付けてみたら振り向き出来ないし押し込みも効かなくなる。とんだ粗悪品を掴まされました。星1も付けたくない。,1
17841,・心拍：自動では30分間隔でしかとれない（精度不明。ただし、前述の通り30分間隔なので連続した運動をしてないと高い値がでにくい） ・血圧：自動では10分間隔でしかとれない（精度不明） ・睡眠：精度は非常に低い。まったく役に立たないレベル。 ・電池の持ち：悪い（連続したデータが採れないにもかかわらず）。 ・アプリとの連携/通信状態：悪い（遅い） ・唯一よいところ、電源オフ機能がある。,1
5894,1ヶ月もしない内に根本内部がダメになり充電しなくなりました。,1
1179,カバーとの相性が悪いのか直ぐに空気が入ってしまった,1
32161,お得便で定期購入していますが、気がつくと1000円くらい値段がアップしていることが最近多々あります。ほかの商品でも2倍になっていることがありました。多少の変動は仕方ないと思いますが、申し込み時は安くて届くときに値上がりしているのはいかがなものかと思います。商品そのものは気に入っているのでとても残念です。,1
19700,値引き前の価格は信じがたい、ノベルティグッズでも不良とはじかれるレベルの品質。ブラシは乱れスポンジは潰れておりました。ケースもビニールでチープ。返品致します。,1
4269,新品時だけなのかドライヤー使用時に例えようのない異臭がします。ドライヤーの機能は問題ないので使ってみます。,1
27482,１ヶ月経たないうちに左が全く聴こえなくなりました,1
11140,インナードライ肌で、普段はそんなに肌荒れを起こさない肌質です。 日本盛の化粧水をリピートし年間使用していて、冬になったら…を考えて、気になっていたこちらを使用してみました。 2-3日使用したのですが、結果顔にぶつぶつが出来ました… 残念ながら私の肌には合わなかったようです。 使用感は、他の方が化粧水の後にと書かれていたので、化粧水→ジェルで使っていましたが、ペタつきが気になりました。あと臭いも…言い表せませんが、ちょっと臭いました。臭いが気になるもので肌荒れを起こす事が度々あったので、今後気をつけようと思った一品でした。,1
29225,スイッチがないため残量がわかりにくい。 出力が止まってしまったときにスイッチがないためわざわざ刺し直さないといけない。 厚い、重たい、よく見たら内部端子が斜めになってる。 端子不良のせいで接触不良を起こしているのか相性が悪いのかよくわからないがUSB給電対応のドライブレコーダーが動くときと動かないときがあって非常に困る。→この製品の端子部分に問題があるようで、ドラレコだけでなくどのケーブルでも接触不良を起こすので試しに本体を上下逆にしてみたら無事充電出来るのでケーブルの重みで接触不良を起こしているみたいでした。これは流石に相性やケーブルのせいではなく初期不良の範疇だと思いますが…。 別の機器でQC充電や2A出力ができるようなケーブルでも1.8Aでバッテリーの充電が出来ないなどケーブルによって充電スピードが全然違って困る。大変めんどくさい。 日本のメーカーを信用して購入したがこれだと期待できるのは安全性だけで、それ以外はANKERやその他メーカーの方がサイズ、重さ、性能、サポートすべてがよさそう。(初期不良や故障があればとりあえず別の新品を送ってくれるだろうから),1
2890,使用して6ヶ月で壊れました。造りからして耐久性に疑問。,1
39652,まだ届いてない 配達予定日から２日・・・届いてないです❗来るのか不安になってきました。,1
18845,商品が到着後、すぐに開封して商品を確かめていたところ、内側にある衣装収納のところのファスナーを下げたとき、片側の金具がすでに外れていました。買ったばかりでの不良が見つかり、がっかりです。値段で決めてしまったところもあったので、やはり少々高くてもしっかりしたものを選べばよかったと後悔してます。,1
6664,色が選べないので覚悟の上でしたが最も嫌いな色が来て残念でした。余っている色を安く販売しているのか？と疑ってしまいます。もしそうなら明記して欲しい。 サイズは合っているが素材自体がゆるい生地のためすぐ脱げる。締め付けないので犬は楽そう。元々足を舐める癖があり保護のためだったので、すぐ取ってしまった。脱げやすいので靴下慣れした子にお薦めです。,1
26058,ツールによってちゃんと入る入らないがある,1
39540,不良品なのか土に突き刺しても待てど暮らせど針は動きませんでした 安物買いの銭失いを勉強させてもらいました,1
32410,"梱包箱,開封前に開け口ゆるゆる⁉︎ 少しおかしいなと思い開封すると無造作に よれよれなビニールに入れられるテープ留め無し口の開いた３点 カメラ本体擦り傷あり、レンズ部にも傷あり... 評価見て購入したが大丈夫か⁉︎ みんなこんな梱包で送られて来たのかな？ 少し残念な感じです",1
39891,届いてすぐ開けてみたら、ガラス面が割れていました。 よくよく見るとダンボールに穴が… ガラスも突き破る程の衝撃を加えたヤマト運輸さんありがとうございました。,1
29892,お弁当用のドレッシング容器として購入。平日のみ使用して、約1ヶ月で割れてしまいました。当然、液漏れしますので廃棄予定です。 価格に見合った商品とは言い難いですね。,1
27723,鍵が硬過ぎです。やっとの思いで任意のナンバーに変更しましたが、爪が割れました。爪が長い人やネイルアートをしている人は使い難いと思います。,1
36788,臭いがキツすぎる。 コケのような臭いがキツく、一度も使用していません。,1
23417,付属のコードがすぐ使えなくなりました。。 (( _ _ ))..zzzZZ,1
18978,5月7日に配達遅延のお詫びメールは来ましたが 今だに商品が届かず（怒）です。 もう要らないので送らなくていいです💢💢💢,1
19971,形はとても気に入ったが、持ち手を束ねるボタンがすぐ壊れてしまい、とても残念です。,1
26172,TP-Link 無線LANルーター専用 縦式 シンプル スチールボディ ルーター用スタンド この商品は不要です。 スタンドは自作できます。 この商品は購入しない事を推奨します。,1
7414,GALAXY note8で購入したがキレイに貼れるけどタッチの反応が全然ダメ… 上下のフチは結構反応するものの中央＋サイドが全然反応しづらい！せっかく貼りやすいがガラスだからか接着がフチしかないからかホントに残念…,1
2000,糸が細すぎてネズミが絡まり団子になります、 また、このシリーズの細い糸は、すぐに噛み切られてしまいます。,1
3561,すぐ熱を持って熱くて表面のビニールが１回使っただけでボコボコ浮いてきて、３回目で壊れた。買って損しました。,1
11231,何故か動作しません ディスクを受け付けません ディスクを挿入できません,1
30386,１カ月ちょっとでＢＫが完全目詰まり。スクラップとなりました。,1
16903,GPSモジュールを20cm以上離し、受信感度を調整してもGPSが受信できません。また、速度表示も切り替わりません！そのため運転支援システムが働きません。どういうことですか？？？対処方法はあるのですか？？？交換可能ですか？？？,1
34422,簡単便利で使用できる、業務用の低出力、小型版みたいな感じだか 本当に効果が有るのかは不明、使用感は使った後多少効果は有ると信じたい しかし箱の裏には注意書きがあるが『本製品はアミューズメント用景品です』と記載がある となると原価は８００円以下（景品は基本８００円までなので）おそらく５００円以下かな？,1
16320,中国製で本体の作りは悪くありませんが肝心のレンズが傷だらけでした。 保管ケースはリサイクルショップのジャンク箱にあるのが相応しい酷い状態で手に触るのも嫌です。 一応使えますがいくら安くともこれを売る神経が理解できません。 これを仕入れる店があるとは思いませんが店頭で手にとって見たら決して買わなかった。,1
27844,使用し初めて1週間でカバー内側の部分がひび割れいつかちぎれそう。 こんな早くにダメになるのは初めてです。 この値段でも耐久性があるものは今どきたくさんあるのに残念な買い物でした。,1
8574,商品箱から出し試射しましたが、 セイフティ解除して初弾から作動しません。 アマゾンの返品処理もスムーズに入力しようとしても、画面が写りません。,1
7057,返品手続きした時、手数料￥５００とはどこにも記入されてない。どこかにされていたとしても、もっと明記すべき。こんな事なら手続きしない。,1
2550,レビューを見て高評価だったので購入しましたが見た目だけで何の機能もついていないボールペンが送られてきました 充電してみてもどこか光る、パソコンにさしても何も起こらず、USBとして認識されません 電源スイッチはついていますがインジケータなるものが見当たらず 電子部品が使われているのかすら疑問です Amazonで購入した商品でこんなものがくるとは思っていなかったので不愉快です 星1つすらつけたくありません,1
32769,プレゼンの1時間前に突然反応しなくなった。最悪！！！！ふざけんな！！！！,1
35632,商品到着後、電源は入るがPC、タブレット、スマホ、Bluetooth送信機全てでこの商品を認識しませんでした。即返品しました。まぁデザインはそれなりに。音質は当然分からず。,1
5711,新品で使いました フルに充電をしてももって30分程度 音質は普通ですが聞いてる途中でいきなり女性の声でbattery lowやpower onと爆音で流れてきます めちゃくちゃびっくりしますよ 又音量を最小にしてもそこそこうるさいです。 安かろう悪かろうなので仕方ないですが買わなければ良かったです。,1
32064,まったくつながらない。何度やってもインターネットに接続できない。,1
32336,ウィッグスタンドや手入れブラシまで揃っていて、とても安価です。 しかしながら、毛量が多すぎて「人類としては、ありえない髪型」なので、 とても人前に出ることは不可能でした。,1
25775,最悪。二回で捨てました。 まともな計測一回もありません。 さすが韓国製品,1
35261,性能は良いのかも知れない。が 常に青いライトが点灯するのは 目立ち過ぎて夜は使いたくないです。,1
37730,付属のアンテナでは街中でもほぼみれません。別でアンテナ購入する必要があると思います。 リモコンの効きが非常にに悪いです。 壊れたかも思うくらい効きが悪いです。,1
15723,商品到着後、左側だけでサイズ確認をしやや大きく感じたけど、見た目も良かったのでとりあえず満足し、100均で買った布袋に入れて通勤用のカバンの中に。 数日後、帰りに雨が降りいざ装着しようとしたら試し履きをしていなかった右側が靴底とシューズカバーとの境目の圧着がほぼ出来ておらず、みるみる剥がれて１／４を残し靴底が垂れ下がる状態となり、役立たずのごみ状態に。 履いたときに勢い良くやって圧着部が裂けるなら仕方ないと思いますが、履く前から裂けていくのは検品しているのか？,1
28728,注：新パッケージにしています。広角レンズの保管も可能です。と、記載があるにもかかわらず、画像にあるように厚紙に緩衝材で簡易パッケージで届きました。最後の画像は商品説明画像ですが缶に入っています。違うものが届いてがっかり。返品しました。,1
6263,食用に買いました。ミルでガリガリひいてましたが、夫が食べてるときに塩じゃないものが入ってると気が付き、よく見ると時々ピンク色の本物の石が入っていました。この量を石が入ってるか見分けることも難しいので、破棄するしかないです。安いからとこれは買わない方がいいです。,1
4525,シルバーの部分が、写真と実際で違います。返品も受け付けられなかったので、購入する際は、実際の商品を見てからネットで購入することをお勧めします。,1
24650,再生を途中で止めました。 プライムの帯が、あるのに、有料になりました。 映画の評価ではなく、運営側への評価です。,1
4748,僕の耳には合いませんでした。また、汚れます。,1
18425,honor9の性質上、フイルムサイズが 小さいのは仕方がないと思っていたが、 両端が２ｍｍ程浮き上がるのは保護フイルムとして失格。 隙間があるので使っているうちにゴミが入る。 pet素材のフイルムの方がhonor9には良いのかもしれない。 これから購入する人は注意が必要。,1
22568,83歳の母のために購入。サプリであって薬ではないので、即効性はなくて当然なのだろうけど、2か月ではなんら効果を感じないよう。身内としてはやはり何の効果も出ていないと思う。本人が望めばまた買うけど・・・・。ま、毎日飲むことは覚えているようなので良かった。,1
26233,手にフィットして料理などしやすく、手が荒れません。魚の料理や骨抜きの時素手の感覚のように、骨を発見できます。 ただ一点耐久性があれば言うところ無しです。,1
2037,円形の画像だったので購入したが四角だった‼️,1
38463,マーケットプレイス販売者ではなくアマゾンが販売する商品を購入しましたが、 皆さんのレビューにあるとおり｢HOT SPACE｣の中に｢NEWS OF THE WORLD｣の歌詞カードが入っていました。 交換をお願いすると４回連続で同じ不備のある商品が届いた挙句、 アマゾンはこの商品の販売を停止するとのことで返金処理を強いられました。 交換の際に「商品の確認のために時間が必要」と言われるがまま待ち、 連絡をすると言いながらこちらが連絡するまで回答は為されず、 結局最初に購入した日から約１か月という時間と手間を無駄に費やすだけで商品を手に入れることもできず、 徒労に終わりました。 その後他の会社から同じ商品を購入したところ、不備のないものが届きました。 ＣＤ自体は音も良く、ボーナス版も入っているのでとても満足しています。,1
30431,4個中1つが取付けた当日に点灯しなくなりました。 端まで流れた後、真ん中くらいで止まります。 の繰り返し,1
2473,帽子は、届きませんでした 残念です 皆さん気を付けて下さい(T_T),1
39072,ひもを緩めても無理。痛くて履けません。 捨てることにしました。 また、縦のサイズも少し大き目の靴を買ったほうがいいと思います。 今の靴が、ゆるめならそのままで問題ないかもしれませんが、ぴったちの方は爪が当たって履きにくいです。,1
24652,今回購入の前にアイリスオーヤマを購入し、動作を確認して再購入と思ってましたが、 この商品を見てセンサーの範囲が広そうなので方向転換しチャレンジ購入しましたが、なんと！窓のない納戸で人の気配あっても点かない、 一度オフにすると点いても今度は何分待っても消えない。 これでは人感センサーの意味がなく普通のＬＥＤ電球です。 残念ながら使いものになりませんでした。 センサー部分が他社には先端に普通ありますが、これはそれらしきモノは見当たりません。 （箱のシールと説明書には人感センサーと一応ありました） 申し訳ありませんが返品します。,1
19041,自分は比較的肌は強い方だと自認していましたが、このジェルシートを使うと、火傷しているのか、接着面の肌が荒れるので使用はお勧めしません。 星一つにも値しない,1
35420,生地も縫製もだめ！ 衣料品と呼べるものではない 評価するとしたら買ってはいけない代物ということ,1
9413,いつも新大久保で1枚300円前後で購入していてこちらの方がコスパいいので試しに購入してみました。使ってみて初めに、中身の匂いがカビ臭い？ホコリ臭い？と感じました。シートに刻印はちゃんとあり、触った感じも今まで使っていたものと違いは分かりませんでしたが、どうしても匂いだけ違和感が…。そしてこれを使った翌日はニキビが出来やすかったです。 気になったのでまた新大久保でいつものを買ってきてパッケージを比較すると、微々たる差ですがこちらで購入したものの方が緑色が薄かったです。でもこれは製造工場による差なのか製造時期による差なのか、そこまではわかりません。肝心の匂いですが、新大久保で購入したものはティーツリー特有の薬草のような匂いはあるものの、カビ臭さのようなものは一切感じませんでした。翌日の肌の調子も向上しました。 素人なので偽物と断言はしませんが、個人的には使うのが怖くなったので残りは捨てました。 スキンケア用品は相性もあるので、自分には合わなかったというだけで、おすすめも注意喚起もするつもりはありません。,1
33093,20枚以上テープを固定する部分から剥がれ漏れてしまった。 今回の商品が良くなかったのか分からないが、この商品を利用する事は無いと思います,1
13874,自分には、合わないのか頭が痛くなるので、返品しました。,1
10616,初めて使った時、持った場所から穴があき、一度しか使用出来ませんでした。,1
6648,届いて、3回目で飲み口の部分割れました。これは・・。飲み口割れたら使えないんですけど。 新しいの送って貰えますか？,1
1935,ソニーの似たタイプを使って紛失し、安いから これでいいやと思って割り切って購入したらUSBの蓋の構造が甘く、 USBががっちり刺さらず接続が不安定すぎて返品しました。 あとランダム再生はありません。操作性も良くないしダメですね。 典型的な中華のハズレ商品です。,1
1428,同時購入の安価な他社製品と比較しても傷が多すぎ 材質もくすんでおり写真とは全く異なる。収納袋もコードロックではなく、紐で結んであるだけ。,1
11922,道具は申し分ないないのですが、ケースの中にシリカゲルも入ってましたが、カビが点々とかなりの数で発生してました。 道具によっては先がかなり鋭利なこともあり、ケースの生地を突き破ってはみ出してました。これはケースの作りの上で仕方がないとは思いますが、カビは気分のいいものではありません。道具は良さそうなので、ケースは処分します。,1
13767,３月１８日未だ届かず。 だもんで物の評価の仕様がない。,1
27625,残念ながら日本製ではなく、16年生産のタイヤでした。レビューでは日本製で17年生産と書いてあったので残念でした。,1
5971,強力な悪臭、窓に付ける気はしません。 すぐに捨てました。,1
8480,テスト電池入りと有るが一切つかない… キズがかなりついている…新品ではないのか？,1
