141599,災害があった際の緊急用に容量が大きいタイプを購入。 現物は画像で見るよりもサイズは大きいなと感じました。サイズのイメージとしてはテレビのリモコンです。細長いので、小さなカバンに入れるにはちょっときついかもです。覚悟はしていましたが重さもまあまああるので、ちょっとした普段使い用というよりは、旅行等遠出用にぴったりかなといった感じです。 製品ですが、製品本体への充電は特に問題はなかったのですが、使用しているiPhoneへの充電が可能か試すと、2種（12Wと18W）ある差込口の内、12Wは問題ないが、18Wからはコードを差し込んでも充電が開始されず。 5〜6回かに1回は充電されるが、充電されない方が多い状態でした。災害用に購入したので、なるべく2箇所使える状態でいたかったため、問い合わせをしようかなと思ったのですが、その前に色々試そうと、電池残量を確認するボタンを押してみたら、18Wでも充電がされるではないですか。もしかして、これが充電のスイッチだったのかなと説明書を読んでみたのですが、説明書にはボタンのところは電池残量の確認としか書いておらず。 そもそも12Wはコードを差し込むだけできちんと充電が開始されるので、18Wだけボタンを押さなきゃいけないのは謎仕様ですしイレギュラーなのかもしれませんが、とにかく説明書が簡略すぎて、説明書を読んでも仕様なのかそうでないのかわからずじまい。 とりあえずは使えるのでこれで使っていこうとは思います。 もしかしたら、同じような方がおられるかもしれません。そういう方は試しに一度、電池残量の確認ボタンを押してみるとよいかもしれません。 容量や充電スピードには満足しています。,4
129081,デザインはイマイチだが、実用性は十分。 チタンで対アレルギーで日常のビジネス使いに惜しくはない。,4
135404,手が使えないけど、携帯をそばに置きたい時に最適で、簡単に取り外し出来るのは良いと思いました。アウトドアなどで活躍するしそうです。,4
145174,正規品より少し大きいが、何も問題なく使えます。 もう一箇所起きたい場所があるので再購入決定です。,4
151865,5年くらいジェットストリーム一択で来ましたが、書き始めにダマが出やすいことと、紙によっては裏移りする、時間が経つと裏面から滲んだようになるなどの欠点が気になっていました。それでも書き味がやっぱり最高なので使い続けていましたが、ふと849をお店で持った時、手に吸い付くような感覚があってしかもインクの発色も良く、どこか懐かしい油性の感じ。滑らかさではジェットストリームに劣るものの油性インクでは十分で前述したような欠点もありませんでした。しばらくして忘れられずにAmazonで購入しました。いま手帳用の主力ボールペンです。 注意として、ペンとしては短いですし、短いのに重いです。私は手が小さいのでジャストフィットしますが、手が大きい方には窮屈かもしれませんね。大量に筆記する場合、重さがジワリと来るかもしれません。 デザインから趣味性が高いのかなーと思いきや、実用性も今のところ満足度高いです。 価格もべらぼうに高くないのもいいですね。 文房具に興味が惹かれる人なら、試してみてはいかがかな。,4
126928,普通に使えます。 耐久性も動きも問題ないと思います。 マットはもう少し大きくても良いかもしれないです。,4
133690,外観が前から気になっていたので購入しましたが、3種類とも美味しかったです。,4
135990,刺激もなく大容量なのでおしげもなく使えて良いです。使用後のベタつきも私は気になりません。 家族みんなで使っています。 ただこれを洗顔後化粧水の後に使い初めてから日焼けをよくするようになった気が... なので現在は体メインで使ってます。,4
138059,外に出ているときに、アンテナ代わりのイヤホンを刺さなくてもテレビが見られます。 ただ、イヤホンジャックに挿す部分が、初めから曲がっていたので、壊れるの覚悟で無理やり修正しました。 また、イヤホンジャックに挿しても、手で補助していないと重力に負けて下に下がっちゃいますね。 普段はスマホでテレビなんて見ませんが、エマージェンシーとして購入したのでまあまあと言った感じです。,4
130762,思ったより早く到着し、助かりました。 商品も問題なく交換出来ました。,4
130852,観客は新人アンダーソンをとおして、主人公ドレッドのごりごりバイオレンスを心置きなく楽しめる。 冒頭にちょこっと世界観が語られ、あとは本編まっしぐら。 ストーリらしいストーリもなく、テンポ良くアクションシーンが続く。 ゴア要素も多いが、そこはハリウッド流のぼかし表現でそれほどキツくはない。 ただ、飛び散るCGiの血糊が安っぽく見えてしまうのは減点。,4
136552,ラブストーリーです。 初めから登場人物がやたらと涙を浮かべます。演出上の整合性は有りますが、ヒーローが何度も泣くのは抵抗を感じました。 背景は綺麗だし、アクションは良い技量と演出で見入ります。繰り返し見たくなります。 今回、京アニは涙と水の演出にこだわったのでしょうか？ 難点は、敵役の動機が取ってつけた感じなのと、ヒーローの母親が余分な事です。 女の子が皆んな可愛いのもアニメの良いところです。,4
151940,Surfaceでまともに使用できたのはこれだけです。 問題なく使用できています。 星ひとつ減点の理由は、薄型ですが、重量少々あるのと、 ケーブルが短いため設置に少々苦労があるためです。,4
153334,質感はそこまで安物な感じがせず良かったがほつれがけっこうあって縫製が雑な感じがした。消耗品なので低価格にしたいなら充分。,4
137978,専用バックがついて、簡単に収納出来てよし👍,4
124045,レビュータイトルは個人的かつ勝手な勘定計算です,4
130047,まだ使用はしていませんが、太めです しっかりとした作りです。 安心できると思い期待して星4つにしました。 (^ ^)♪,4
157930,最新刊を購入して、一気読みしてみました。非常みまとまっていて、読みやすく、血液専門医としては読みやすいと思いました。 一方で臨床に必要な情報（どの疾患でどの程度その症状が出るなど）よりは、疾患の理解を深める目的の本だと思っています。疾患の理解も臨床には必要ですが、現場の本というよりは実習用の本なのかもしれません。 絵もカラフルで読みやすいし、良い本だと思います。 ただ、医師、看護師、薬剤師、臨床検査技師、ME、ほか医療従事者と広い対象にしているため、どうしても医師を基準としたレベルになっています。医師と言っても研修医と非専門医のレベルだと思いますが、看護師に入らないだろうという知識、薬剤師にも入らないだろうという知識が多い。実はこの本はかなりレベルの高いことまで書いています。 僕がこの本を読んだのは「医学生」がこの本をみんな持ってくるので、一回読んでみたかったのですが、少しレベルが高いのではないかと思いました。もしできるのであれば、医師（医学生）向けと他の医療従事者対象を分けてみたら良いのではないかと思いました。 その必要な知識かどうかを見極められれば、本当に良い本だと思います,4
142227,静音性:リテールクーラーからこちらの商品に変えましたがめっちゃ静かになりました。youtubeを見ているだけでCPUファンの音が気になっていましたが、ゲームをしているとき以外はほぼ無音です。ゲームをしているときは多少音がしますが気になるほどではありません。サイズは思っていたより大きかったです。 取り付けやすさ:予想よりも大きかったのでつけるのが大変でした。小さいケースを使っているとつけにくいかもしれません。 コスパ:かなり良いと思います。 性能:リテールクーラーだと何もしてないの６０℃くらいありましたが、このクーラーに変えると３５℃くらいでした。,4
142429,商品のAmazonでの説明欄と、実際に届いた商品の箱の表記で異なる点が気になりました。箱の表記はタイトルと写真の通りです。 しかし注文した次の日に通常配達で届きましたし、デザインも良く、つけ心地も悪くないので愛用させていただきます。大人でも違和感なく装着できます。,4
159303,このお値段で購入出来て、大満足です 使いやすいく、とても綺麗です,4
134515,パッドが入ってるから仕方ないけど、風の抜けはイマイチかな？ ただし、これは言い方を変えると夏以外でも使えるという利点でもある。絶対に転ばないという補償はないから、多少の暑さは安心感と引き換えですね。,4
121242,ps4コントローラー充電用に購入 普通にいいです 使えます,4
134773,BSのレーシングエアゲージからの変更、ホースが少し硬いのでバルブが奥まった位置にある車種は使いにくいかも。 精度はバッチリです。 エア抜きのボタンはそれほど抜けは良くないのですが微調整には使いやすいと思います。,4
142853,雨の日に使える靴を……と思い、人生初のレインブーツを購入しました。 サイズはぴったりで、履き心地も良いです。 生地の硬さがあり、特性上、足首上あたりが擦れやすく、歩くと少し痛いです。 ズボンや長めの靴下をはくことで解消できそうですが、あいにく雨の日はストッキング＋スカート派なので、ズボン派に鞍替えをするか、靴擦れ覚悟か……。 値段も履き心地も最高なのですが、そこだけは個人的に残念だったので、星4つです。,4
128013,iMac 27 late2009 i5 OSX 10.13.6にて使用。外付けfirewire800に録画しています。 対象外機種ですが問題なく視聴、録画できております。 ただ、OSの問題かstationTVの問題か、予約録画したファイルが数分起きに分割されていて、調べたところ、スリープ、スクリーンセーバーの自動解除をせよとの公式情報。設定するも、録画7分後に1度分割されるため、その時設定していた 10分後にスリープするを1分後に設定して、分割されることなく録画できるようになりました。 ただ、録画中はiMacの画面がつきっぱなしになるので、OSのバージョンを下げてみようか検討中です。 Macminiとかならモニターの電源を切っておけば良いので問題は無いのでしょうが…。 画質は悪くはないとは思うのですが、マウスでしか操作できないのは… せめてチャンネル変更はキーボードでもできるようにして欲しかったです。 不安定レビューが多かったので、BootCampでwin対応のUSBキャプチャーを使って録画してきましたが、メインがMac使いのため、思い切って購入。なんとか録画予約も上手くいくようになったので、満足です。,4
133456,PX-045Aとインクの互換ありベター。,4
143889,これまで日本茶の飲み物が色々な会社から発売されて居ますが、より日本茶の味を求めたと感じさせて呉れたのが「生茶」です。,4
136300,いい感じです サイズもピッタリで、違和感なしです おススメです。,4
131429,登山でハーネスを使うために購入。素材的には柔らかめのためすぐに手に馴染みます。その反面穴が開きやすいです。値段相応だと思います。,4
155093,色が思っていたより濃くてショックでしたが頑丈そうでたくさん入り使いやすいです。 左右にペットボトルや折りたたみ傘が入るくらいのポケットがついていて良いです。,4
130687,組み立てに10分ぐらいで終わるぐらい簡単。 でも予想より横のサイズが小さい。 10~20センチぐらい広かったらいいな (そんなラインアップあればすいません),4
142775,あまり期待はせずに購入しましたが、思ったより軽く装着感も悪くないので良いとおもいます！バック ライトがもう少し明るいと完璧なのですが？,4
155623,価格も安かったので、どうかと思ったんですが、そこそこ強度もあり、これで十分です。,4
142275,小さいサイズのバックが欲しくて購入しました。だいたい500mlのペットボトルと充電器、手袋などを入れて、ちょうどいい感じです。ただ、正面上の方についている、紐？みたいなのは必要性をあまり感じません。,4
143058,趣味で飛行させるのなら、初心者でも飛ばしやすくカメラも綺麗だと思います。GPSとブラシレスですごく安定している 満足してます。,4
134209,持ち手が 大きさに比べ 長すぎのような 本体は丈夫そうで良いと思います ２６センチも欲しいが 品切れでした,4
144069,便利なお財布です｡ただ……表記の通り､カード入れが少々小さいですね｡それさえ改善されれば星5つです｡,4
136262,お値段の割に美味しく、香りも良いので家族も気に入り喜んでます。,4
138955,最初の位置決めに苦労しましたが、それ以外は貼りやすかったです。,4
132671,多少伸びがあって、ソフトでいい感触。もう少し長いといいなと言うことで☆４つ。,4
143768,ほぼ予想して他とおりの商品でした。中央のディスプレイの映像は鮮明に映りますが走行中に映像が消えないためルームミラーの機能を損ないます。,4
151651,錆止めに、いいですね。 匂いは、甘い安菓子に油が混ざったような感じで、つれぇです。 ストローは、刺さりませんでした。,4
159146,キレイにカバーでき、ありがとうございました。,4
121688,栄養のバランスが良く、ボリュームもある。,4
155060,まだ使って無いけどタイヤ交換でトルク確認にと購入。ある程度誤差はあると思うけど安心の為に、家庭用にはこれで充分です。価格的にも十分満足しています。,4
143757,ドライブレコーダーが前から 気になっていましたが、ついに今回 購入してみました。 開封した時は画面が少し安っぽい？印象だったのですが、 電源を付けてみると思ったより画質が 良くて映像も見やすかったです。 少し取り付けが分かりにくいところが ありましたが女の私でもつけることが出来ました。,4
154248,落下させて画面がグレーになってましたが見事に治りました。青みがかってますが値段考えたら許容範囲。また有事のために一つスペアあってもいいと思いました。難易度は高めです。,4
120045,UQ WiMAX版WX04を利用していましたが、再起動を繰り返す通信速度が著しく低下するなどが頻繁に発生するので修理対応依頼したところ、代替機での確認を依頼されましたが同じ現象で、しばらく使用していたが実用に耐えられず、UQ での機種交換でなくW05の購入をしました。 この機種は非常に安定しており、速度も問題なく交換してストレスがなくなりました。 ただ、ファームウェアのアップデートを促す表示がありアップデートしましたが、どういった内容なのかがホームページで確認できなかったので星４個にしました。なお、アップデートの効果を実感できていません。,4
142308,見たことないカバーでしたので、家族も喜びました。カバーの猫と寝てるかんじです。,4
141837,今迄アダプターをネジ止めしていて、プラスチックなのでたまに交換しなくてはならなかったのですが、このジョイントにしたらアダプターの交換しなくて良くなりました。普通の水道の様に、たま～にパッキンを取り替えるだけです。他のレビューの様に、もう少し角度が下を向いていたらいいなと思います。値段はコスパいいですね！,4
129001,購入サイズＬ 購入者サイズ 身長168 バスト92 ウエスト73 肩幅44 袖丈51 普段Sサイズでタイトに着ています。 前出のプレビューで2サイズ上を推奨していたためＬサイズを購入。タイトではないですが普通に体型にフィットしています。 生地はそれほど伸縮性はなし。 裏生地はないのでコンプレッションシャツなどを着て運動すればある程度の寒さは気にならないかと。,4
130772,バストはきれいには見えないけれど、着けていても全く苦しくない。すごく伸びるので、普段はＬサイズですが、Ｍで問題ありませんでした。,4
130275,サイズは気持ち小さいが、とてもフィットしている。,4
126914,私感ですが 値段の割にはしっかりしています サイズは大きくも無く小さくも無く そのままのサイズ注文で🆗だと思います,4
153164,小さめとレビューに書いてあったので普段23.5ですが24を注文したら、ちょっと大きかったです。 でも今は寒いのでモコモコのインソールを入れてなんとか履いてます。,4
153786,iPhone6で使用、手頃な値段だったので試しに。両面テープはよれやすいので貼るときは注意。,4
121644,小学五年生の次男からバスケットボールを依頼されて、他のお友達との差別化を図りモルテンの黒を購入しました。 子供いわく室内用の為に、外では中々勿体無いからと大事に扱い気に入った様です。 メーカーのモルテン商品は安心出来ると子供ながらに喜んでバスケに励んでいるみたいです。,4
131330,横幅・高さは申し分ないスペースで、一人こもってバイクと居られる時間が最高です！ただフレームの繋ぎが緩く、強風が心配でガムテープでの補強をしたのでこの点数にしましたが、品物は最高ですね！,4
149798,朝起きたときに何が違う、とははっきりわかりません。 歯周病関係は長い目で見る必要がありそうです。,4
143498,値段もちょうといいし、梱包も丁寧だし、機能も問題なし。 ただ、長さはちょっと長くければ良かったと思います。,4
155140,とてもデザインが可愛くて気に入って購入しました。しかし皆さんがレビューで書かれるように、小さめの時計でちょっと腕が太めの私には合わないかなーという感じです(--;)3歳の子供につけたら一番小さい穴でちょうど付けれて、可愛かったです！自分用にと購入しましたが、子供がつけれて、尚且可愛かったので☆４つで(^^) 画像１枚目→3歳子ども 画像２枚目→腕が太めの母,4
135435,外出する時に、車の中に置いていても匂いがあまり気にならなくなりました。二頭飼っていますが、とても重宝しています。,4
150319,かわいいし使いやすいです！友達とお揃いでこれから楽しみです！,4
122869,オレンジの香りがしてリラックスしたいときにいいと思います また、アルミの小分けパックになってるので安心です,4
158040,私たちの食品生活を取り巻く食材が、便利でおいしい裏側が 知ると怖いです。将来のある子供や大人たちにぜひ食の安全を知ってほしいです,4
156105,音質はよく音量を上げても割れることはなくクリアな音が楽しめます。 「途中で曲を止めてまた鳴らしたとき」「離れすぎてしまって途切れてしまい近づいて再開されたとき」に音がフェードインして鳴り出すのがとても聞いていて心地いいところだと思いました。このイヤホンのとてもいいところだと思います。（他のメーカーはいきなり鳴るものが多い、それが普通だと思うが） もうひとつこの商品のいいところは、バッテリーにイヤホンを差し持ち運べることで、サイズも小さくかなり便利です。そしてモバイルバッテリーとしてスマートフォンなども充電できます。バッテリー残量もLEDライドの点滅によって表示されかなり見やすい設計になっています。 説明書は日本語で書いてあり、さらに図も付いていて分かりやすいです。 ただ、なぜだかわからないが片耳が聞こえなくなることが多いです。イヤホンと端末が一直線上にあるときこの現象が起こることが多いので、電波の問題なのかなと思っています。頻度もかなり多いのでこの現象が起きなければ星５つに値するイヤホンだと思いました。,4
121485,普段用ではなく自分のお小遣い用です。 ちょうど良い大きさでした。カード入れは少なくて良いのです。,4
141350,配送に少し時間がかかり心配になりましたが結果お届け予定日よりも早く商品が届きました。梱包問題なしです。,4
149802,強度はまだ付けたばかりでよく分かりませんが 、今のところ問題なくしっかりしています。 色はHPと同じで想像通りです。 塗装が剥がれてきたら、買い替えようと思います。,4
123185,初期不良は有りましたが迅速な対応をして下さいました。商品も満足できるものです。 アトマイザーは使用前に洗浄した方が良いです。最初しばらく焦がした様な味がする。,4
121459,四隅を折って、箱型をつくり、グリルにセットして魚焼きに使っています。以前愛用していた生協のくっつかないホイルと比べて、若干薄いので、たまに破れて、汁がこぼれます。まあ、10mでこのお値段なら仕方ないかな？,4
120363,ドンキホーテのPBののイヤホンと違い、蓋を開けてもスイッチは入りません。その意味では、スムーズさには欠けます。,4
155208,良い商品。施工は簡単。内張り外しの際にキズ付けないようにやればあとは誰でも出来る作業ばかりでした。,4
158159,最新刊が出るたびに、次号がとても待ち遠しいです。 ワクワク感が止まりません。,4
133950,味といい酔い心地いい最高ですが、アルミの開け口が開けにくい。,4
141157,一般的な精密機器に使用する基本的口径がそろった商品です。ただ、ドライバーの持ち手が細いため、握力のない人は滑り止めのついた手袋などが必要な時があるかも。,4
159292,この新タイプは泡状ではなく、ジェルです。 前のタイプのものよりしっかり入ります。 よって色も手触りも良くなりました。 が、片付ける時、櫛の中に入り込んだジェルが なかなか洗い流せず手間がかかるのだけが難点です。,4
132794,本当に最高！ずっと欲しかったので良かったです。ただ、組立て式だったので、不器用過ぎるわたしには時間かかり…終いには、角が割れてしまった…。でも、使えるので満足。思ったより、結構大っきいので嬉しかった,4
147190,LANケーブルは何本か持っていますが、ネットの高速化を図れぬかと試しに購入した本品、他に比較して高速なようなので、２台目の新PC用にも追加購入しました。ただ、手持ちの他のLANケーブルに比べ、ケーブル自身が太いためケーブルの柔軟性が少々劣りますが使う上での問題はありません。,4
121101,子どもも理解でき、やってみようという気になる本です。,4
