127855,Makes greAt coffee but coffeemaker does not allow your hand to get into that coffee pot to clean it; therefore coffee residue stays in bottom of pot. I like the attachment that removes chlorine from the Warne. Auto brew timer is a great feature.,4
152307,It's everything it says it is.... Works perfect for us!!!!,4
120267,"Well in the picture it says it has 2 vibrators when it really has only one. Other than that it's light and very versatile, I use it for my herniated disc and my epicondylitis and it's great that it's wireless cos I can take it with me to trips and restaurants and stuff. I just think the publicity has to be more accurate. It wouldn't hurt if it really had 2 vibrating points, and better yet, that not only the middle part vibrated but all 3 sections we're functional. Just an idea for Homedics.",4
130126,I like this book. Glad Rebecca and Alex realized that they love one another. Sad that Heather had such hate for Rebecca that she would hurt people,4
156282,This pot is on point. Very good. No sticking.very easy to clean and cooks perfectly fine,4
133660,"These fit well and are very comfortable but are rather frail. Best hand washed or, as last resort, washed on delicate/cold water in the washing machine. Do not dry in the clothes drier if that can be avoided.",4
157316,"Not really a blue light at night, more like a yellow white light. Still, it's better than nothing.",4
141204,"I was skeptical but my better half ordered two of these. We made use of the suggestions from other people who bought these and gave them a good review. Very sturdy. We put them together with the addition of gorilla glue on the pegs. We assembled them and let them sit overnight to let the adhesives dry and do their job. The cranky comments from people who didn't follow the instructions, moving the item right after assembly, not assembling them properly, etc. are tiresome. This is not heirloom furniture but it does the job if you put it together properly.",4
153551,Love the look of this costume. My daughter loves it - good for twirling! :) Only complain is cheapness of accessories - the gems on the wand fell off after 5 minutes of trying it on. Hopefully we can glue them back on.,4
153131,It is beautiful but it slide off the table a lot.,4
141379,Basement humidity is much better using this,4
147747,My daughter got this book for Christmas. It is great to be given so many ideas of things to draw. I just wish there was some sort of instruction or a picture to copy. It is literally an empty book.,4
144727,"Nice looking, appears to be well-made. Not as lightweight as I would have hoped, but perhaps it can't serve its purpose at a light weight. The tightening screws, handles, etc., are sturdy, and legs are stable. Will work well.",4
136619,"But the metal join on one side has a small snag. It isn't enough to stop me from using them, but it is noticeable as I knit. Otherwise they're great, and I like the finish on the needles--not so slick my work slides off but smooth.",4
140855,"Thought that I would stand upright for the most part, but it kind of folds over when it is full. It is durable and lightweight for taking to the laundromat",4
128778,"as advertised, loved it",4
128391,This game is a lot of fun.,4
148765,I also bought the solar ones--love it. My advice is to get the solar and not worry about batteries,4
150547,As noted in at least one other review product arrived with no top. When I have purchased this product in a pet store it has always had a top on it. This is my favorite aroma of the other colognes in this product line; last only a day or so which is disappointing.,4
124668,Love it and results!! Only thing is it was pretty messy,4
137341,Bras are very comfortable. Perfect for breastfeeding.,4
137402,"Fast-paced romance with a little magic thrown in for good measure. Not an intensely deep story, but still a fun read.",4
155376,My dog loves these treats. Just wish they were a little less expensive.,4
120130,I love these glasses. Very good quality and they look great on me. I'm happy.,4
131492,"The window of time to return this product was one month. Although the product broke one week after that return window closed, the merchant was very responsive and was able to rectify the situation by replacing the product. I’m very impressed with their professionalism and responsiveness to the matter. They are definitely customer oriented.",4
159639,"They're a little looser than I was expecting but I think I'm just in between sizes (xs and small). Overall, length is great.",4
138131,"Loving it so far, although I do feel the suction isn’t perfect but enough to do the job.",4
131197,"The bottles says to take one, three times a day. I take one a day and lets just say that has been plenty.",4
120335,Very cute! Fits the note 9 well.,4
129935,As advertised though heavy and need larger bite.,4
136014,"Almost as I expected, the picture on the case is faded and not as clear as I would've liked.",4
123297,This movie was funny however some parts didnt play well,4
155661,"Using this in my work computer for meetings instead of those ugly and uncomfortable headsets with the arm mic. The sound quality is very good, both hearing and speaking (with the mic)",4
125507,"Great material, I have washed it twice with no problems and no wrinkles.",4
138976,Is good quality for a great price.,4
140632,"Sleeve offers great compression, really helps my tendonitis. Gave 4 stars because the copper healthy emblem and print started wearing off on 2nd days and looked really bad. After a few days was worn enough to peel the rest. Other than that I highly recommend.",4
147442,Great item. Price is right! Just exactly what I needed!!! Super cute,4
130874,Adult wipes. Larger than those purchased in 99 cent store,4
139913,Was pretty good and solid. The phone didn't work out for me so replaced it.,4
126197,Top is a little big while bottoms are a little small but still super cute.,4
141460,"Beautiful dress, just did not fit",4
151287,"I got a defective unit, but manufacturer was quick to replace it! Great for charging my Apple Watch on the go.",4
144299,"How can I replace LED, I bought this item and the light only worked for about 2 month?",4
152763,The controller functions well overall. the only negatives are that the dpad is nearly unusable and that the rubber pad on the left stick wears over time.,4
148564,"I think these are a great value if you are looking for something cute. You get a variety of cute patterns for a fantastic price, and I definitely think they are worth buying. They are made out of a soft knit cotton t-shirt like material which is just what I wanted. Just know if you want to use these to workout or just casually wear them for a long time that you may have to readjust them as they like to slip back and then off in those instances, at least on my hair which is really sleek. I also have a medium-large head so that probably plays a part. It's definitely not a deal-breaker and I am sure once I wear them more they will stretch out a bit.",4
122279,I like the magnetic capability. I wish the product came in colors. I will have to paint it and hope that it will still be durable.,4
133981,"Kind of expensive for boxes but they are good quality and shipped faster than expected. There aren’t a lot of options in this size, I recommend these!",4
140536,For indoor use only . Gravel collects around foot too much to be useful outdoors in the Desert. Insole becomes a little sticky after a few hours. Wool insole lining would be better.,4
120299,has all that is needed,4
120440,"Likes: great design, well built. Dislike: I have a tendency to want to lean slightly on the table but am afraid to with the 20 pound capacity.",4
136634,Had hubby install this weekend. Now both sides of garage roof are set to collect rain water this afternoon.,4
138637,Yes the price is steep for a print - but it is the perfect addition to our apartment.,4
155686,Good thickness to the pages but the coloring pages aren't very interesting.,4
130060,"It was cool for about 2 minutes, and then I just didn't see the draw to these. Also, if you have a wireless charger, they tend to get in the way. My wife uses them still, well, until I bought her a new case she can't use them on.",4
154537,It was a gift for my husband. He likes the color and it's very nice. Magnet isn't very strong but it holds about 10-12 bills,4
158117,"I love the ideal of stretchable lids. It goes well on pyrex glass boxes. Just make sure it is of perfect size. dishwasher safe. Do not leak but don't store liquid in container and then hope it to replace your lid. About the zip seal bags, they are ok not that great but fact that it is re-usable I have lot of use cases for organizing my fridge with them.",4
130784,"Looks nice and is good sized. However, the holder for the wipes has already ripped after 2 months of use and when you put a small stack of wipes, it does not close. The closing strap needs to be long and the magnet needs to be stronger.",4
143442,It only worked for about 3 months and stopped working,4
124522,A bit large for a size 8. But it shines so nice!! Looks great. It’s a tad brighter and lighter than my real diamonds but perhaps with wear it’ll settle in. Looks great with my real diamonds! Love it.,4
158467,"I’m 5’5 and bought a Large. Pros: the price, lightweight fabric, very breathable. Cons: top is pretty thin shows bra, stripes are more like a bright red, and the sleeve length is a little too long for me. Mine did come with the belt and pockets.",4
151715,"My end table is metal, so the magnet works great, especially when my wife goes to sleep and I have to turn off my bedside lamp. Yet to be used for work projects.",4
125100,We got these for our living room table. They go well with our decor and they are great for the price (added bonus that it comes with a holder). Bottomline - they do the job while looking great,4
140771,"This rug pad is a good value for the money. Product was as represented and advertised. I would order a thicker size next time--but that was my issue, I got what I ordered and recommend.",4
155054,"There are pros and cons to this product. Pros: it works well; I can see my kids while they sleep; the monitor let's me know when it needs to charge; I like that there is a music button, with the VOX setting, the screen turns off when kids are quiet which preserves battery life; it gives us the option to mount to the wall with 2 holes on the back; it does not connect to WiFi which prevents hackers, so keeps my kids safe; it has volume controls and I can talk to my kids through the monitor which is great when I see them doing something they should not; the monitor for my kids room can twist different ways which is great when mounting. Cons: the screen is small; picture quality is not so great; because of the piece that stands the parent up and the charging cable, it can be awkward to stand up; the volume is not very loud; even though it's given the option to mount, no screws come with it to mount; the speaker control is not great and sometimes my kids can't hear me through it; it only sometimes beeps when the kids monitor gets unplugged. I've given it a 4 because for the most part it does it's job and it's good for what I need it for and that is to be a second monitor to the one of a different brand that I already have. It's not as good as my other one, but it works.",4
122265,Super cute! Just a little smaller than I thought.,4
151095,"I bought these because I needed to keep the moisture down in a few rooms. Mold tends to grow. So far, they are absorbing the moisture and I haven’t seen any mold. I do not smell any of the lavender vanilla scent, but it serves its main purpose.",4
139497,These require that you add your own lead wires; they don't have a square pin on the back like some others.,4
139682,Don't bother with the overpriced stock filters. These are just as good and half the price. I couldn't be happier.,4
130688,"The stylus worked great for a few days. However, now when I try to use it, it does not work. I've only had it for about a week now, and I've only used it about 3 times during school. The buttons on the stylus also do not work. I do see that sometimes the stylus will work for a few seconds while I have my palm rested on the iPad but it stops working once I take my palm off. This only lasts for a few seconds even while keeping my palm on the screen. It also will not connect to my iPad anymore. The stylus is not recognized anymore when I try to pair it to my iPad. It was such a great product at first, so I don't see how it is not working anymore. Update: I contacted the seller regarding a refund and I was granted one with no hassle. I’ve had the new one for months now and it works great!",4
139942,"Not had to put it together, took me an hr, it blends well in my baby’s room",4
151488,"It's really outstanding book. Comparing this book with other book it will be foolish, because you can find the exact information in this book, I'm pretty sure that you will not find any book like this one , It will be very difficult. I highly recommend this book.",4
128998,"the taste is very sweet! the sizing is a bit smaller than expected, but it’s still pretty decent! i would recommend it to anyone who loves honeycomb! 8/10 !",4
140066,I 'd like to see the sides a little higher. We use it to play Canasta.,4
129009,"These diapers are adorable, and are a great price compared to others. After doing some research, these have been highly rated for durability. I unfortunately have not had the chance to use these yet, as they are way to big for my 7 lb newborn. We are using disposable diapers until he can fit in these, which is a little disappointing as we were hoping to avoid disposables this time around, but it's not the end of the world. I have given this 4 stars because I haven't been able to actually try them out due to the fact they do not fit newborns as advertised. Due to the size of these diapers, I anticipate we won't get to use them for at least another few months. I will update my review when we get a chance to use them.",4
127478,Item was canceled never received need credit,4
142418,"These were a little heavier than I expected but, the kids seemed to enjoy!",4
141963,This book contained many cliches pertaining to black people. All in all that didn't overpower the valuable resources given out throughout the book .,4
147697,Liked the size and that the battery life is pretty good.,4
129708,Engaging fleshed out characters. An enjoyable book for a romance. Head and shoulders above other writers in the romance genre.,4
121967,"I buy this tea for my father-in-law who is more of a coffee drinker and isn't fussy about tea. I personally find it fairly harsh and not a soothing beverage. Organic teas that cost more tend to have a better flavor and go down better, even black. Still for the price, it's not bad.",4
152699,"This dress fits well, have to size down tho.",4
147256,"Just want to thank the seller for thier great costumer service..had an issue with battery not staying changed,contacted seller and they send me replacement battery right way...so now laptop seems its working as it should. So super duper happy with the purchases...thanks",4
132762,"When I purchased this I didn’t see the disclaimer about it not fitting some coffee makers. I have a Bunn and the filter is too small. However, I decided to try it anyway and so far it’s working just fine. I hardly ever make a full pot, so the grounds don’t over flow and there is very little sediment in the bottom of the pot. I’m satisfied.",4
156161,Good product. Easy installation. Just what we needed.,4
132246,"Great style, like the fit - only drawback is the fasteners - they come apart",4
137271,be sides the colour the jacket was all I wanted,4
156859,It relatively easy to replace and seems to be working out. I will keep you posted on the durability.,4
155155,"Works well, but you need to figure out the correct flow rate. Test these out prior to your trip for best results.",4
152795,Very good Requires minimum effort . Used only once but I’m pleased with my purchase,4
155261,Good shirt but shrinks an entire size.,4
139838,"Good One, but not his best. Make it a great one Stone wins the day with Lances help Happy reading",4
142413,"Wasn't that bad to put together, just took a bit of time. One board did come without a few of the main holes drilled though. In the end it's a decent table and gets used quite a bit.",4
136834,The smell of the wood or maybe the paint don’t go away.,4
136853,Haven't dropped my computer so can't tell you how good it works..,4
121247,"This is a sturdy ball, however, the 55"" is not good office seating. I am 5'2"" and at my desk while sitting on the ball, my chin is just above my standard desk. Going back.",4
136816,Very nice item are use it all the time,4
135006,Perfect for around the house. Must wear with thick socks tho because they feel like tiny needles without socks.,4
155525,Great product with fast delivery!,4
142571,Using to feed a beta with the small round beta pellets. Tested it out before installing on the tank. Works good on 24 and 12 hour feeding. Pellet food is very small and it was a little tricky to adjust food release. Instructions are in Chinese none in English. If I didn’t have something like this before I would have been in trouble. It is still new so we will have to see how it performs in future,4
141875,This is the second set of these I've had..and the motor has quit in one of them each time. Guess I will have to send these back too. So disappointed. Edited to add: I am going to change this to a 4 star as the seller has contacted me with an offer of a refund and replacement product. This kind of offer goes a long way with me and hopefully the new set works well.,4
158053,"This is to replace a similar product which I lost, and it appears to be equally waterproof.Tried the leak test seems to look good slight condensation around the edge at the top but I'm sure that will be ok as tissue inside was bone dry.Using for a holiday looks sturdy thanks.Tested these whilst in the garden pool and they worked brilliantly..",4
127951,Love it! Looks great and holds flower pot well just wish they had a little more room between bottom and top shelves.,4
147202,A long book but reads quickly. Writing is clear. Naval action tied to its effect on and participation in the land war. A good introduction to the naval history of the era. More photos would have welcome. Maps are clear but in tiny print in this edition. An accompanying atlas of WWII naval battles would help the reader understand maneuvers and strategy. Recommended.,4
129306,Great case trust my purchase with it.,4
138013,This was suppose to be a skull and it was wolves.,4
149785,"Small and practical, lovely shape. Simple and convenient operation.",4
140432,My skin is oily and it works for me i like that.,4
142242,My son who is 11 likes it. Feels a lil bit cheap but for my son works just great. Queen size,4
150154,"The quality and concept of this product is excellent. So much better than the dial ones, cleaner and less awkward to use. The only difficulty I have is the length the bar extends can be a little can be dangerous when doing skull crushers.",4
136314,Great quality for the price. Works well with any action cam that has a tripod mount,4
123222,"These socks provide great compression. They do the job and my feet/legs feel great after the end of a 12hr shift. They are thick near the foot which provides great cushion. I have 2 complaints. 1) the foot/toe part of the socks are very wide. Which can make it difficult to fit into well-fitting tennis shoes. 2) The band are the top can be very tight. I end up having to roll it down by the ned of the day. Overall, great compression. Wide toes. Thick sock with cushion",4
150876,Product has potential to be a five star product. The only issue was the stitching along the main zipper started coming off immediately after the first use. Overall satisfied.,4
145700,"The ""but"" here is because I should have ordered the wider banded one made by the same excellent company. The thin band put a little too much pressure on my waist. I love this company, though. I own about 5 different leggings that they make.",4
158177,"Great fit on my shower door. Easy to install once I figured out the proper arrangement of adapters, gasket and screws. Could have included instructions to make it easier but not to difficult with some understanding of how the opening needs to seal.",4
125524,"Very easy to install. It is reversible, so you get much longer useful life.",4
130038,Portable little recorder and works as it's expected. Buttons make it easier to operate than just menu options like some other models.,4
131592,This bag looks amazing....my daughter loves it! The problem I've had with it is the neoprene bags do not work well to keep a cold temperature. Every day her large ice pack is melted and everything in the bag is at room temp.,4
154504,"loose on my small 250cc honda rebel. but the included buckle straps are a HUGE plus to make sure it doesn't get blown off the bike in the wind! I used to need to wrap a large bungee cord around the bike in a couple spots to keep my covers from being blown off the bike, specially in storms, this one has held strong for a couple weeks now without any current signs of breaking. this is a CHEAP cover however, don't hold high expectations for longevity of the cover. it's not super thick and will break if continued to be used as I am currently using it!",4
154261,"This works well to help organize cosmetics and jewelry, particularly given limited storage space in the bathroom. It appears to be well made and is easy to stack, although the drawers can be a tad sticky. I am using the bottom three tiers on my dresser, to store jewelry, and the top levels in the bathroom, to store cosmetics. I like the versatility that you can separate the pieces and stack them as necessary Why four stars instead of five? I wish it were a little larger, and I wish that there were deeper compartments on the top for storing brushes and pencil eye and lip liners.",4
138653,"The antennas work good, once you get them installed and set up your TV to scan channels the video is good. Depending where you have it set up, the picture quality and/or channel availability will have an impact on what is available for reception. By extending them to the maximum height or on/by the windows is even better for viewing your maximum channels that are available in your area. Does the job and the price is good as well.",4
127123,Good seller. Would do business with again.,4
146245,I love the diamond picture. Some of the symbols are really hard to make out( an example is a white symbol on a light gray background). There are 3 different ones in this picture. I am having to use a magnifying glass. Plus all the colors are really close in color. It is going to be spectacular..I was short some beads in one color and the seller was very quick to respond.,4
134130,"What I really enjoy about this duvet cover is how soft the material is and the comfort you get when you touch it. I've had some duvet covers that are simply not good, they are all crunchy and sleeping under them is a nightmare. This one also comes with matching pillow cases and I really like how you can tie the duvet down to the corners.",4
125766,Great lock but stopped working suddenly. The company replaced it with express delivery.,4
142656,Soo cute works well love the color,4
121795,This is a slick little display that works just fine.,4
126566,"The bag is cute, has average quality...it is small. I actually gave it to my niece. If you like smaller bags or clutches then this is for you. It was not for me, I need more space. Better yet, you can use it for a date night cute little makeup and phone bag.",4
156259,"My duck feet waddle off to the side, but that is probably more of a personal problem. Solid construction and definitely true to size.",4
148861,"works well, would be better with on/off switch.",4
143454,"The installation was simple and straight to the point. Putting your head under there to reach was a bit hard. If you had problems like me, a hack and pliers made it easy. My issue was that the new side markers needed a bit of force to stretch the wiring harness so that the side marker clip can lock in (the clip on the right, the closest one with the led wire+plug).",4
123753,"Wanted to buy one of the new fancy dish drainers. As if it would make washing dishes more fun! None of them fit in one side of my divided sink. Funny, but I had never thought of my sink as small. Gave up my dream of fun dishwashing and bought this drainer of old reliable design. It fits and works perfectly. Some times tried and true things are best. Only thing I would change is having glass holders incorporated into sides to keep mugs and glasses from rolling over or taking too much space.",4
152328,It’s a cute band but you have to tie it a couple times real tight because it will get loose. But other than that it’s nice. I have the black and white one.,4
150727,"Lightweight, sturdy and almost comfortable. Great buy!",4
146241,Item was as advertised and arrived in a timely manner. Thanks!,4
132893,Quality seems ok. Nothing special. No eco-drive. Bought it for my wife. She is satified with it,4
125923,"The kit was handy to get, but the fan and heat sink are too small for the Peltier device - wish it was maybe 25% larger to cool the hot side down more. Unknown water cooling block configuration internally - would have been good to know the type: posts, fins, or what.",4
