145475,"This cat tree is really pretty and fits well in my one bedroom apartment. It was a bit of a headache to put together (but I guess that's a bit to be expected). My cat is a bit uninterested in it right now, but I suspect that before long she'll discover it (hah hah I think she's a bit fearful of it). I have a small 1 year old cat (probably not fully grown, maybe 10 lbs?? idk). It seems large enough for her, though the small pad on the side that she could theoretically use as a step to the next level looks like it might be too small (but maybe she'll figure out how to use it anyway). I can come back and leave more info later when she starts actually playing on the thing. Anyway, it's about what I expected from amazon (because the parts were all there and it didn't seem to be a knock-off of an original product lol). I still can't wrap my head around how expensive these things are given the materials are a bit cheap, but it appears steady enough. The fabric that was used is a nice blue color (exactly as pictured on amazon) and it's very soft. The specific things I would suggesting changing in this model are (1) make the board material a bit heavier/more substantial, (2) wrap the fabric covering all the way around the underside of the boards that are higher up because the top two levels underside can be seen when standing, and (3) make that small ledge a bit larger. Otherwise, the tree seems really great, and I think the cat will enjoy it.",4
131143,"product arrived in good shape, so I'm happy with it",4
147901,I think for the money the light and built in laser could both be brighter but they are as described by the seller and make my Springfield XD9 look great! See Pic!,4
123274,It is a somewhat entertaining read. I hope the Dan Coast series continues. The location is better in the Keys.,4
140899,love this shirt and I get compliments all the time. I wish there was some grip to the shoulders to help it stay in place.,4
151115,"These covers fit my 15"" RV tires perfect, but the vinyl material seems like it will degrade kinda quick when sitting in the Phoenix sun all the time... we'll see.",4
136947,"This skirt is awesome! It is so comfortable and looks amazing! The elastic waist is true to size and the lining is perfect. My one note is that the size of the holes in the overlay are just the right size to get caught on EVERYTHING, so be careful.",4
136114,"These undies are comfy and cozy, and are really absorbent in case there's an accident. But, not too absorbent that my little one doesn't realize that she's wet. My only beef with them is that they're really high cut on the sides which doesn't always provide full cheek coverage in the back.",4
146609,Works fine and quite easy to handle. Definitely help the messy chore.,4
124266,"Overall, I'm pretty satisfied with this product, except for the fact that I'll have to do some modifications. The fabric super nice and thick, no need to worry about seeing through. I got the red, and it does appear a little bit lighter than the picture when in daylight, but nothing that bothers me too much. I have two very small issues with the dress. The first one is the sleeves have some holes, and they're a little bit too low for my liking, the sleeves are a perfect length for me naturally, and the some holes are a little bit higher up which stretches the fabric. I feel if you had shorter arms, this wouldn't be much of an issue but for me it was since I'm a little bit longer there. My other issues that I'm quite busty, and the corset comes too high up. It comes up about halfway up my bust, so I'm going to remove the top couple fabric eyelets. Overall, this product is perfect if you aren't super tall or busty, but even if you are, they're easy modifications! (Remember to order a size or 2 up!)",4
141542,"For inexpensive pillow covers, these did the job. They look festive and colorful during this holiday season. And they are certainly cheaper than buying 4 holiday decorative pillows!",4
132420,I've always appreciated his grouchy old man approach to life and his love of peoples' food . I will miss having more of his writing to entertain and educate.,4
152565,The following chapters of this book would teach us everything we need to know in order to start taking advantage of this burgeoning field successfully. First we will learn about what bitcoin is exactly as well as everything we need to know in order to get started on the right foot.,4
124655,I bought this to hold my reading glasses and it performs well for that. No issues.,4
152506,"I was so excited about this product and was over the top happy it was delivered earlier than predicted. The packaging is BEAUTIFUL but there was zero scent. Zero scent even after an hour of burning. How discouraging. I thought I had found the solution for teacher, family, and co worker Christmas gifts. Update. This company has wonderdul customer service. Extremely professional. Will continue to purchase their product thanks to their top notch attention !",4
137558,Perfectly fit as expected. Good price.,4
138416,The case is super light and better than I expected. It’s not bulky like the others. I love that the ring can turn 360 degrees in both ways.,4
132025,some what pricey i think for a wallet but it has everything i needed to quit carrying my purse.. so far so good,4
122421,"Nice product, good value for the money. Some of the pieces are cracked though still useable.",4
125236,Have to re-apply regularly,4
138277,"We are having some trouble installing this AC unit. The measurements posted online were slightly off, due to the window seal wings. so we are trying to make 1/8"" adjustment to the height. The packaging was in perfect shape upon arrival, the AC looks perfect. It arrived the day it was scheduled to.",4
6468,Not great as hair gets tangled in brush. And this with short hair,1
14064,I normally wear a 2xl got the Xl I could have gotten the large very thin material Fix's like a maternity top,1
20862,Absolutely does not work for my new iPhone 7Plus. After about 5 seconds the screen showed “not a supported accessory “ or something to that effect.,1
35994,"seriously. it was so hard to open my arms hurt and hour later. I can lift a 20 lb bag of cat food (not that I do it often, but it's possible for me to do without issue). in comparison, this was a nightmare. I'm using it as a grow light, not for a workshop, so I have no experience with work lights. So the word clamp has specific connotations... They DO NOT INCLUDE, that they must be twisted TOGETHER TO close. It's not like a hair clip, like a regular clamp. I figured id attach it to the shelf above to keep it upright by CLAMPING it on.. You know, like a CLAMP. YOU CAN'T. it needs to hang from a pole. a freaking pole. it's basically the equivalent of a stronger twist tie that will supply power to a bulb. it's cheap - in price, looks and construction. So the only people who will be able to find this useable are those very strong, with freaking POLES!",1
27746,Says it was delivered and I never received it. Unsure of how to contact seller,1
37654,Had to constantly change battery. Worked sometimes,1
15250,"This is the worst scale I've ever owned. I can step on the scale without clothes and then again fully clothed and weigh the exact same thing. It's almost like this scale remembers your last weight and if it's close, just displays the same thing over and over. Other scales I've had in the past are so accurate that you can literally see an ounce difference when you add or remove weight. DO NOT buy this thing if you are weighing in daily or keeping close track of your weight. All it is good for is a generalized number and is definitely not accurate!",1
18387,"Needlessly had way too many alien species. Physics as described made no sense. Like the human eye could see ships across a solar system, or see laser beams in vacuum Portals visible at distances described.",1
28565,"I love tapatio, so this is not a bad review of the product but rather the vendor. They shipped the glass bottles with no type of protection and when they arrived to my location all the bottles were broken.",1
29449,Way too small band ! Doesn't extend.. partner feels his area is going to loose oxygen cause it's so tight.. other than That it's good,1
32921,Horrible! They are very tiny and are not the same as the ones in the pictures. They could probably fit into the mouth of a newborn baby but that's about it.,1
33703,"I loved it, but it broke right away!",1
17740,Two of the bulbs burnt out within a day of use. One is still working. I would NOT buy these again!!,1
32096,"The main point I want to make is that the camera works as expected, unfortunately as soon as summer came along the body could not stand the heat and warped so that it no longer will stay in the mount. I live in southern CA and it isn't really that hot. I think that anyone using this camera in Phoenix would likely have a puddle on their dash after leaving the car closed up all day in the AZ heat. In my humble opinion I would not recommend this as a first choice.",1
33990,Don't Wast your Money,1
2880,"Made with low quality plastic which breaks easily, not good for daily use.",1
34605,The package my tiara was sent in didn't protect it and when I opend the package the tiara was broken. Very unhappy that it was delivered broken and bent.,1
18357,"Balls and mounds of lint everywhere. Covered my sheets, my clothing and after three wash and dry cycles it was worse than ever. Very soft but just made too big a mess.",1
36068,Mine was broken where the warranty seal is. I tried to put it in the printer anyways very gently and it was so fragile that it broke apart. Good packaging so I doubt that it was damaged during shipping.,1
4829,"To small for my motto e4 plus, will send it back.",1
39208,The pole of the umbrella bent in wind that wasn’t blowing hard enough to rustle trees. Don’t waste your money.,1
18947,"I replaced the ink with these and the printer does not recognize them. I have tried several times to take them out, put them back in. I shut off the printer and tried it again. Nothing seems to work. Brand new and useless for me as they are not recognized.",1
36291,Have it for a week doesn't work bug still flying around my house,1
19947,Did not seat properly upon rib of 870 shotgun. The baseplates under the rib bend when you screw them in tightly. Upon tightening one of the baseplates stripped out. Pretty cheap design.,1
543,The chord either was defective or not compatible with our PC and monitor. There is little help provided from the manufacturer,1
4108,Junky. Poorly made.,1
2740,This product came broke out of the package. One of the supports on the frame.,1
16742,Shirt looks like picture. XL fits like a L,1
31332,"Not a Cold Steel product, axe head was made in Taiwan.",1
35172,Not touch sensitive at all. Taking it off.,1
36402,This picture frame arrived all scratched up and used/old looking. We are unhappy.,1
26723,when we recieved this product it was hard as a brick and still trying to break it up. Very disappointed.,1
26,Totally uncomfortable,1
8401,I had such high hopes for this but it is poorly made and not worth the money.,1
30436,This does not fit a 2005 Pontiac Grand Prix as it said it would. It is also very hard to figure out. Took 20 minutes just to find out it would not fit my car.,1
15168,I pulled this out of the box today it is crap it is broken everywhere scratches all over the chalkboard don’t waste your money on it I am very upset I was going to use it for back to school pictures literally where I hang it up it is all broken the chalkboards all scratched can write on it without the scratches showing up save your time and money and buy something else !!,1
25405,"I ordered 2 boxes of these, and they are yellowish/tannish (they should be white with a light purple center) and they don’t taste right. They’re either fake or really old. Do yourself a favor and go to the store to buy these. They carry them everywhere now.",1
31839,"This smells significantly stronger than the green dawn we usually use, and just smelling my hands after using it triggered an asthma attack in my wife and she needed to take her inhaler. She has no trouble with regular green dawn. Whatever they used for a fragrance in this product smells terrible, is highly irritating, and they put way too much of it in for a product that is marketed as having ""no dies or strong perfumes"".",1
37419,Won't load even a bit. And it does not have a lot of options. So sorry not for me. Plus I make better houses.,1
13665,"Within days of putting it on the computer, the bottom part of the case broke, rendering it useless. My daughter already had stickers all over the top part, so we could not return it. Contacted customer service to try to get the bottom cover replaced & received no response.",1
38631,Did not increase reception. Antenna provide with receiver as good if not better.,1
12671,"Good for the first few uses, but now has lost its firmness and is almost useless. I’ve substituted a rolled up towel and it works better",1
27630,"It fits the cargo area perfectly, however it is hard plastic so things slide around on it. I thought it was going to be rubberized. Will be looking for an alternative.",1
10922,"ordered these in small and also in extra small as I was a bit confused by some of the reviews, not sure exactly what I was getting and didn't want a real long leg boyshort, but didn't want cheeky panties either. was very disappointed but decided to keep the small size as I can at least wear them and the legs were a bit shorter in the small size than they were in the xs size, which did not make any sense. the material was very shear, and yep, see thru, so the cotton used, not real quality here and they didn't shrink at all in hot water, so maybe its that new synthetic cotton (wink/wink) that resists shrinkage. when product said made of cotton, used to be really good quality cotton, but those days are no more and cotton can really mean so many things now, and this makes womens underwear virtually unwearable, even when spandex is added to hold shape.",1
4135,"The memory upgrade packaging was sealed with a seal which stated ""If this seal is broken do not accept product:"". The seal was in fact broken when it arrived and was stamped VOID on the seal. I contacted AMAZON and they sent a new product. I am satisfied with AMAZON handling the issue so promptly, however the product manufacturer should properly package the item.",1
1005,"I disliked the keyboard very hard for me to type and it kept dropping my wi-fi, so I returned it and am going to try an 11” this time",1
28178,this is way too small for adults.,1
6973,Looks good but I've had mine only a few weeks and it has already begun to tear at the end tips around the perimeter of the umbrella. Not happy at all right now.,1
11121,you may as well save your money and go to the local Dollar store. the quality of this product is the same as what you would purchase there. very disappointed. it looked cheap and not at all like the pic.,1
15716,"Does not smell good. Left my typically normal hair feeling greasy, even when used sparingly.",1
3889,Didnt work with my phone and they would answer so i could get a refund,1
12858,It's impossible to use it. Waste of money.,1
21575,"Such a horrible product, super heavy, looks fake its hideous, not even worth a star a huge waste of money, please dont buy, I regret this purchase, so disappointing",1
36406,Who is writing these good reviews? I purchased it because of what others said. When I received it I felt fooled. This will NOT protect ur phone. Do NOT buy. What a piece of crap.,1
11846,I've tried looking at the weather channel but nothing ever comes up. It's useless.,1
20919,This projector has no bluethooth as advertised,1
7807,It would not feed the pouch through. It just clicked and hummed but never processed the pouch.,1
1963,I've had this mirror for less than 1 month & the charging port is already not working. I put.good Energizer batteries in it & the light& it is very dim I am very disappointed with this cheap product !,1
8068,Material feels cheap and the feeling is horrible. A pain to remove from the trackpad.,1
13805,"I was sent a pair that was broken, asked for an exchange. They wanted me to cut my wires before sending me new ones, I had to convince them that driving st night without headlight 's is illegal. I finally got my replacement bulbs and they were used! They have rust on them and electrical lube. Filing a complaint with Amazon.",1
18976,It's a bit short and boxy. Still wearable though. Problem is after two washes the seams have pulled out and it is practically unwearable.,1
27257,The plush I received was a boot leg and wasn't authentic. The plush was missing it's tush tag and the tag was wrong. Plush quality was okay but not for the price. I had to return the item which is upsetting due to the fact it was for my little sister's birthday. Don't order unless you want to run with the risk of not getting an authentic plush.,1
11104,If it actually arrived I would write a review. It said it was delivered but it’s no where to be found. Hope it works for everyone else.,1
29635,"The first one I purchased started leaking at the base within a couple of weeks, so I returned it for a replacement. the 2nd one is now leaking at the base like the first one. Don't Purchase this product!",1
39324,In my quest to find the best electric razor I read some reviews and bought this. I loved it at first and had a pretty close shave but the plastic it’s made out of is cheap and the head would come off when using it. It does hold a charge for a very long time. I would spend the extra money and get a better product.,1
23960,"Poor customer service, they kept asking for my personal info and wouldnt offer any help. Never worked on my vehicle, junkyard remote did.",1
37917,"Shallow plot and character development. Lacking vivid description of setting, motives, and characters. Disappointing ending, not believable in the least.",1
35869,"Not weather resistant, shielded or as pictured! When I received this cable, it was not thick like it’s shown. It’s very thin, smaller than the line I received with my camera system. In addition, the picture quality is not very good and finally went out in less than 8 months. It’s not weather resistant as moisture easily gets in between the connections. Last but not least, I ran the cable 90 degrees and over 12 inches away from power switch. The EMI had a direct effect on the already horrible picture quality. Found a better, thicker, and more shielded cable for less money on Amazon! DO NOT BUY!",1
6432,They gave me blister on back right heel after one hour wearing them. And they squeak so loud in the office. Terrible. I thought crocs were comfortable?,1
1611,Only had them for a few days and they are already tarnishing.,1
3393,"Sadly, I purchased thinking it was authentic. When I received it I noticed it was just stuck inside a plastic bag, no box. Then I realized it was not actually sold by Big Green Egg. I purchased another authentic gasket from a local store, and didn't pay much more for it. Comparing the two, the gasket sold by Amazon was much thinner. I reported the issue wth Amazon, return it, and received a refund. I am shocked to see that this has not been clarified.",1
10382,Unwearable for me and I ordered oversized,1
18898,play with other animals,1
7840,The main purpose I bought this is to make almond butter. I have a professional blendtec and a twister jar. Tried for over 30 min. All it made was almond powder. I threw the whole thing out 3 pounds worth,1
28530,ordered Feb 26 .. Due April 9th .. I would have ordered this from CHINA had I known Amazon was going too .. and it would have arrived MUCH QUICKER .. So much for Amazon Prime 2 day shipping .. LOL .. Amazon sux !!!!!!!!,1
38861,"I did not receive this item, it showes delivered, and near or around my front porch. Unable to locate the item.",1
21405,"The adapter connected both monitors but the system only could only read the generic adapter and both monitors just mirrored each other, was a waste of my money.",1
20909,Did not get the handles with the order.,1
18276,Very bland. Not tasty at all. Would not buy again. Not worth the money!,1
16992,"Not hefty enough for a paperweight. Seriously, who can figure out how to use this? It comes with a 3 inch software CD that can only be used with a tray type CD device. Anyone have one of those any more? I don't. Tried finding software online. Don't Google Dansrue to try to find it, you won't. It's actually Audacity. Couldn't find anything for Mac, although one of the reviews said Mac software was on the CD. I don't know why Amazon continues to carry this worthless product",1
35592,"I have used OneNote forever, but in my new kindle fire, it won't login for me either!",1
18406,These bolts are garbage. They broke in half over and over. Ended up going to home depot to get some more and they worked great.,1
31383,"I was unable to find a way for my HP printer to accept these cartridges. After 3 evenings and about 5 hours of research, I counted my time and money as a loss. I will be attempting to return this item.",1
10999,"Opened the produce for the first time today. It constantly gets jammed and only shoots about 50% of the time, if that. Definitely not worth the price. Would not recommend.",1
188,Not what I anticipated. It's bulky and heavy. It doesn't recharge my phone it just maintains the level I plug it up in.,1
16237,Do not buy not worth it. i heard that it make you hair so shiny and less dry total opposite felt like straw. also you get so little product for that price.,1
22037,Wish I could say but this didn’t have instructions unless I’m missing it? I’ve checked every piece and box and nothing ...now what?,1
33235,Very thin material and the buttons are almost down the middle of this shirt ....not on the side as shown. Returned item!,1
20795,It literally did not work at all. Like the first time I tried to use it hair was getting stuck in it and it wasn’t cutting at all.,1
17870,The shirt was too tight and see through. I ordered a large which is my normal size and way too tight. The sleeves were super cute.,1
28387,They were stall and hard.,1
12960,The bag that thia came in was empty didn't receive the brushes,1
16731,"This camera is horrible compared to the original Q-See cameras I have. The light sensitivity is too sensitive. I used this camera inside the house (because image quality is so bad I moved the better cameras outside.) But even when lights are on, it just keeps flipping back and forth between night vision and regular color. I ended up just setting it to night only just to keep it from constantly switching back and forth. Inside I just need it to see if baby is asleep and ok. Quality is so bad you can't tell any kind of facial description of someone outside. These are far from any kind of HD quality",1
34101,"Good for listening, not for talking. Sound quality is good (to me). I use cheap skullcandy headphones so I am hardly an audiophile. Battery lasted a full 8 hours with some charge left. The mic makes me sound very quiet to people on the phone, so this isn't what I was hoping for. Update: Sound turned ugly too. Everything sounds like it is underwater now. This will be going back.",1
10326,"Does not seem original, it has a plastic label? I have others store bought and are not labeled with plastic it’s printed on the bottle?",1
32426,Never got the package and Was denied refund or replacement,1
25451,"Horrible product! I bought two of these cases, one for myself an the other one for my wife. My wife HAD an iphone 7 plus which was completely ruined with water. Somehow th plastic ripped and water came gushing right in! We’re down $700 due to ththe fact that we had to purchase a brand new phone! Don’t buy this case!",1
29470,"worthless and the so called ""prime"" that I pay for won't let me return it! Watch urself w this one!",1
6576,This device is not efficient. In my opinion the suction power is too weak. Maybe it is not bad to vacuum a toy car.,1
20171,These boxes were all wet and squished and had been resealed. I don’t like wet nasty packages of anything.,1
38710,TShirt has spots on the bottom in two areas and this shirt was bought for a drummer to wear to his show. Not happy. Shirt was nicely made just dirty in he plastic.,1
15096,"The light does not work, no way to change the battery. Came in small yellow bag. No box or instruction. Suspect it was someone else's return.",1
34835,"I really liked this toothbrush, but it gave up the ghost after just three months. It began as what I think was probably a bad contact somewhere, where the brush would just randomly stop spinning in the middle of brushing, and then became completely useless after a couple weeks of this behavior. It doesn’t seem like a good investment if you’re interested in longevity. Too bad!",1
38289,"Bought May 2018, left me stranded September 2019. A standard battery at half this price would have lasted much longer. Trash.",1
186,Didn’t work for my 16 months old baby. He still sucks his thumb even if I just put a few coats on his nail. Sad.,1
203,"Thia style of tap is garbage. These have failed every single time i ve used them, even after using pliers to seat tap and tape to hold the assembly together. They damage the supply wire terribly, often leaving only 3 or 4 strands unbroken. Do not buy these. Watch a few youtube videos on splice taps if you feel you need to run power from an existing component feed.",1
15325,Product came with holes in the socks! Do not order!! Deserves 0 stars,1
25715,Several in the package were already broke,1
7561,"New one is delivered in teared box instead of Original and sealed HP package. I bought as new, not used. Amazon refunded it. thanks. I am sorry that can not suggest you supplier.",1
