166141,Oh boy these are great! Really enjoying all the cases covered in this set!,5
191715,What a wonderful feel. Purchased after a Youtube review put it at the top.,5
185954,This brush works very well on my dachshund. The bristles are sharp though so don't press too hard.,5
188701,Set is so cute and quite study. Love it!,5
181197,I wasn’t expecting this loaf pan to be so good. But it is better then expected. It’s easy to use and clean. My loaves come out really good.,5
185726,I purchased this for my daughter’s iPad in February. Recently she didn’t have her iPad in its case and it fell on concrete. The screen cracked or so I thought. The protector actually cracked since it’s glass and I thought it was the screen. It saved and protected her iPad sceeen from damage. Good thing I purchased two. Great product!!!,5
176735,Got it for my wife. She had supply issues. This helped her to boost supply. We buy 1 every month. Good Stuff!!,5
172324,Just what my husband was looking for! He wanted a bag that was a certain size for fishing while wading. It's is it.,5
192190,"I sincerely love this product. it'z big enough to contain the water. itz exactly the right size that i am looking for. Also, i do like the overall quality and the design. it seems like it's pretty durable and the function fit what i need. itz good to have it in the basement area and bathroom. it helps absorb the humid and keep all the places away from humidity.",5
172486,i am a computer technician. i bought this tool to cut something. it works great and come with some small saw blades. it helped me a lot. thank you. five star for you.,5
187670,Wow! Great songs. Steve Perry delivers another great album!,5
189674,"the USB 3.0 ports are working, the other ports such as HDMI and SD or TF ports work well,excellent product !",5
167366,Very high quality material. I bought this for hubby's car. It is nice and functional without being an embarrassing addition to a man's car. I plan to buy another for myself.,5
160248,Perfect for my daughter’s Bed. Love how easy it is to put on or take off. Color matched great. Love how it lays too.,5
173151,"My only complaint about these books wound be that I found the main character to be mildly annoying. However, the story made the books nearly impossible to put down. The twists were so well done and I didn't see most of them coming. Wow. Well done. I highly recommend this series.",5
193969,"Smaller than expected, but still a great case and value.",5
176027,Sturdy. Works great.,5
185512,"I often use my Iphone 6S plus. It's always out of power, so I bought this cell phone charging box in Amazon. It's really good to use, it can be carried in real time, it can be put in your trousers pocket, it can be put in your bag, it doesn't need to use charging wires, and it can protect your Iphone 6S plus, let's go. It is free from wear and tear. It's not very big, and it weighs just right. It charges really fast. There are many reasons to like this situation. One reason is that it feels smooth but not slippery. So it won't slip away from me. Gold: Another important reason I really like this charger is that you can use your iPhone charger! Therefore, you don't need to carry extra cables with you, or you don't need to use two cables. If you don't have Bluetooth headset, you can still use the headset adapter. Gold: In addition, it charges very fast and lasts a long time. I think I can charge my cell phone twice when a full battery is charged",5
161196,"Nice bright light, very easy to put on, can be used for holiday or daily lighting",5
177817,"These boots are warm, fit right and really cute. I get alot of compliments on them.",5
181160,"if you love going out to get cocktails but don't want to brake the bank this is a must have. It's already paid for itself so many times. Great quality, love how discrete it is, plus it's cute enough to wear any wear.",5
176688,Yummy all in one piece! Fresh!,5
197139,This backpack is awesome!,5
197629,"Nano towel it really does what it says . Great well made product , makes my cleaning task very easy and fast . Thank you and keep up with the great quality product I will order more soon .",5
169868,my girlfriend loves it,5
188902,literally the cutest little book ever! perfect for my boyfriends present for valentine’s day! absolutely adorable,5
169819,"It fits my 11"" iPad Pro with keyboard folio perfectly, provides nice protection on all sides, has a zippered pocket for small accessories, like charger and cable.",5
192803,"Great product, great price, great transaction!",5
180636,Used it to teach my teenagers to clean the stove. It worked really well and the smell was not nauseating. Also work really well cleaning the stove.,5
169354,"We used these grippers on a rug in the entry of our home. Since they were installed, we have had no curling and the rug has not moved from its place. I could not be more pleased.",5
185672,"I’m a 38D 200 Pounds and 5’6 and it fits perfectly, just the end of the sleeves were lose. But, I’m sure with times washing it , it’ll shrink. Delivery was prompt.",5
160747,Great case for my 7 year old boys IPhone. Have been on for a couple weeks now and not having any issues with. Has helps up to a mountian camping vacation so far.,5
177404,"Love this calendar, exactly as described!!!! Beautiful!!!",5
178424,Use it in all motel rooms,5
198156,Just received it check back in a month,5
160751,Bought these for my gentleman friend for Valentine's Day and he absolutely loved them. It's days later and he keeps talking about them. I wanted to find a way to express how much of a strong King I think he is and these did the trick! Great quality and reasonably priced. Will order more in the future.,5
168753,"Easy to use and warm for my baby. Best car seat cover purchased, yet.",5
182789,"Exactly as described, they'll work great with my ice fishing pants. They are super adjustable, I am 5'9 and they could easily fit someone much shorter and taller than me.",5
176709,This purse is amazing! It's super big on the Inside and had a couple big pockets! I wasn't sure I was gonna like it but I love it! It's perfect for what I need it for!,5
174275,Used a netgear before but this product is by far much better,5
175637,"If you follow the sellers very easy instructions, you will be pleased with the performance from the battery as well as the value of the battery. I would definitely order from them again and recommend using their batteries.",5
161372,My first Superman cape! Fits great. Excellent quality. Wore it on top of Pulpit Rock in Norway and got many complements about it! Highly recommended!,5
199419,So nice to have a lid. Fits well and way better for travel than foil.,5
180831,Protects and secures my Samsung Note 8 exceptionally well. Very good product!,5
191339,"These fit my average 4.5 yo very well, and he does not mind wearing them. My son is learning to ice skate and we put these over his snow pants and jacket. The pads will also fit well on his skin in the summer when learning to ride his bike without training wheels. I bought a small. Fantastic do not buy anything else. The bag the pads come with is perfect for storing the little pads.",5
171635,A awsome reciever. Loud and very satisfactory. Ordered plume speakers which rock hard,5
181199,This is really neat to be able to easily adjust the shower head and have it stay in place. It looks nice too and matches the silver in my shower.,5
187235,"came with no damage and work well,ordered several more sets as we had to redo our movie collection. back out of the dvd book (total of 200 think)",5
163593,this is good book for communication in this book we learn the all levels of the communication and the report writing.,5
185161,I love these for my air fryer. I also use them in my round cake pans!,5
173662,So cute and my daughter loves it.,5
194232,Works great. Bright light.,5
172189,it was as the seller descried and easy fit,5
168822,Works perfectly and charges all 4 of my controller which i could only charge in waves before.,5
166314,Bought for my daughter starting collage It works good does what it should.,5
198241,So far I am very pleased with these LED's. They are bright and provide very good coverage. Installation was a breeze and the ty-straps came in very handy,5
186317,My dogs seem to like it and it’s great value for the product. Will be ordering again!,5
197739,Very comfortable and lightweight.... Don’t wear in rainy/snowy weather,5
187962,The buckle positively engages the belt so there is no slip. The belt is flattering to pants. I was pleasantly surprised. I really like it.,5
168319,I replaced all my plastic hangers with these - they take less space in my closet and I can hang light sweaters and shirts without the shoulders getting those pokey dents. Great deal!,5
194526,"They work great, hopefully I’ll never run out lol",5
180975,Very Easy to Use and link up to your cell.,5
190412,love it. we have a sheltie and this one is a perfect fit,5
171517,"Beautifully crafted frame, second one I’ve purchased for my home. Nice rustic look.",5
180514,"Some reviews complain about the Vacuuming and sealing. I do not find that at all. The vacuum is a bit loud. But vacuums are. I've not found one that isn't. I am paranoid and double seal all my bags, of course, it stopped after several times, but i know it is normal. Because the seller told me there is a protection design. By the way, some guys may grasp wrong way, the bag should be loaded in the correct position, just like the picture i showed.otherwise,it's impossible to do vacuum and make air out of bag. I really haven't seen any problems with this.Anyway,it's important to grasp the method. Thanks to the email from seller.",5
194374,"I absolutely love this pair of glasses. The frameless look is elegant. I got a blue pair and it is very snuggle to my face and not tight at all. It feel like not wearing them at all so light. Love the clear frame, and let's be honest for that price is really a bargain. These pair of glasses fit better than my very expensive ones with an unique look. I'll be buying all the colors available.",5
178794,"Great, saves me from having to keep a watch on my wrist in labor and delivery.",5
190638,"Apple iphone charging cord was exactly what I needed, price was great & received in 2 days! Awesome service!!!",5
174403,Good straw - but eventually starts bending and breaking down. But that's paper right?,5
190161,Very nice. Relaxing.,5
195560,"This T-shirt is GREAT. I was really surprised., because I don't usually order T-shirts online. I'm a funny one to fit (5'3"" and over 200 lbs, most of it in the middle, which makes it hard to fit most clothing). So I ordered the XXL and it fit perfectly. Now, like every single thing I put on, it hugs up to me too much on my gut, but that's my gut, NOT the shirt's fault at all. Once I lose about 10 lbs (of the 50+ I need to lose), it will fall and flow just perfectly. Usually, I have to order a size larger than I wear just to fit my middle, then the shoulders and neck are too big. With this shirt, the shoulders and neck are perfect, and will be even once I lose the 10 LBS. Can't wait to order more colors of these!! Love the material and colors.",5
189600,Exactly as described,5
188398,This is great shea butter! I will buy it again. Very healing and melts nicely.,5
182915,My daughter loved this and it's great for beginners,5
168741,There’s no secret that selecting the right tools for the job are vitally important. These hex tools provide favorable hand position for small medium or large jobs. These exclusive RexBeti quality hex keys have a desired appeal while also featuring an elongated arm to help reach any challenges while minimizing possible danger to the hand. The design of the caring case is easy to store in pockets and durable enough to twist clockwise and counterclockwise multiple times. Truly a great addition for high-quality tools on the job.,5
191716,I have pretty sensitive dry skin with eczema. This sunblock works well for my daily use! And I really the texture of the cream as well as its subtle scent.,5
173518,I bought it for daughters 4th birthday cake. It worked perfectly. Loved the product.,5
160362,Fit and works perfect in my 97 ranger,5
172287,"I'm only on week one and I'm LOVING the simplicity of this meal plan. I have 3 kids and so much to keep up with as is. My only qualms are a few problems with editing such as, week one ingredients list avocado oil when it's supposed to be avocado for the burger recipe. I've seen a few other comments about this. This is the perfect plan for a busy person though. Very simple recipes that are absolutely delicious.!!!",5
181989,easy simple way to make your own ice pops!!!!!! washes well.,5
172649,"I selected this product to create ""keepsakes"" for a family reunion. The trays were better than expected quality and cabochons were perfect. Excellent size for a keepsake.",5
165187,As described. Takes the work outta shucking oysters!,5
174729,Works like a charm. I’m glad I didn’t waste my time trying to get exhaust isolators off without this tool.,5
167290,I have taken White Oak Bark for years to control Hemorrhoids. They really work wonders,5
182582,I am a physical therapist and got this for my dad. It really worked well,5
184264,"I’ve purchased this book for several people and everyone that has read it has been moved in different ways. This book is life changing. I’ve been able to understand myself, my patterns and my habits. This book sheds light on every area of life. Applying the things I’ve learned from this book is helping me to become a better person.",5
172784,Most comfortable underwear,5
181649,"I’m an avid book reader - so, I was a little skeptical selecting this book, but truly, the reviews were spot-on. It was a brief, easy read that was a pretty good story line. I wasn’t disappointed. Kudos to the author!",5
168430,I’ve had them for a while now. Use them everyday and they’re still sharp.,5
199242,"This is exactly what I was looking for for the gym! Very soft, very comfortable. It was a little long on me so I just tie it in the front and it's perfect!",5
161212,Taste fine In the oven,5
179744,It is small size and very convenient. Worked well.,5
175313,A great watch very easy to use and is very cheap but good value.,5
194786,Worked as described nice to be able to reach the tall vents.,5
163864,My husband says that this is a great SPF shirt - not to bulky and doesn't feel like a rash guard - no skin irritation,5
188000,You will learn things you never knew about American history..,5
184607,"The masks I ordered arrived on time, they are great quality (the detail is amazing) and they are perfect for my event! Thank you!",5
179770,big enough for 4-5 days trip.. there is a cable coming out from inside of the bag so you don't have to carry powerbank with you. very creative.worth every penny,5
183825,Great quality. Good battery life. Worked great.,5
169702,Seems to work pretty well. Can is very large (ie heavy). Doesn't work as well with paper towels as it does with microfiber cloths.,5
173133,great knife for beginners and pros,5
186631,Bought these for my boyfriend and he says they are great. He didn’t expect them to be so nice for the low price but he was impressed. No more messing with cords!,5
71782,"Won't buy another one, ever.",2
75206,Not at all a master chief story like we’ve come to expect.,2
65709,"These are nice glasses, however, this is the second time we ordered these, and the second time in two weeks they were shipped with no packing materials...no bubble wrap, no peanuts, no paper, no nothin.' Both sets arrived with broken glasses. Now we have two uneven sets. One set of glasses was shipped with other heavy items and no packaging material...the other was sent in an empty box with no packaging material. I hate to give nice glasses a low rating...it's the shipping that lacks.",2
62893,"These did not work out for me at all. I wear a Women's size 10 medium and these were too small and cramped my toes. The fabric made my feet feel very hot too. I did like how they don't slip around your foot though. Because they were too small for a Women's 10, I returned them.",2
79853,For the price I figured they wouldn’t be as good as the more expensive ones but they are made of extremely thin sheet metal. Have a 1-2” gap around them and do not even include rubber for the edges just a foam round foam sticky pad for the bottom corner. If you aren’t looking for quality or a tight fitting door then these are for you! If you want something that actually seals up the lowers then purchase a different product,2
47356,"These wipers clear the windshield well but are very noisy, will not buy again.",2
47801,"Probably dont get this if you need a protector because you drop your phone frequently. I dropped my phone and the entire protector just popped off (because it attaches around the circumference of the screen, unmentioned in the product description) and the entire right side of my screen is all cracked now. Probably fine if you just want to protect your screen from scratches? I guess.... Wishing their ""Lifetime Replacement Warranty"" worked to replace my phone. Also, this thing definitely is not smudge resistant, which isn't important to me, but worth mentioning.",2
75100,"Wasn’t what I expected, material really thin and the speakers keep shifting in the headband, it doesn’t stay aligned with the ears.",2
66019,Disappointed that the case broke after having it on my phone for only a month.,2
63580,3 pods didn't grow this is not my first time using aero garden pods!!!!!,2
77178,"The color of Turmeric in my second order is different. It is lighter Turmeric color, and does not smell the same. I think it is a lower quality Turmeric",2
42840,It is cute but not durable. I got it in April and the little strap broke all ready. The band isn't even broken in yet.,2
74486,The cover is pretty. But I've had it in my purse for a few weeks and it's not in a high traffic pocket and the binding is already coming undone. If I used it every day I could see that be justified but I don't.,2
64412,i found this book pretty boring! did not finish the book !,2
57524,you get what you pay for,2
45348,The product is very miss leading of the size they are nowhere near what it looks like in the picture. Definitely read the description the pieces were no long that 16 inches and less than a 1/2 inch thick. Better for a small 10 gallon,2
67333,Stiff and the gloves restrict finger movement making clutch brake and throttle motions more difficult,2
43084,I tried all three flavors and I usually like pumpkin seeds but these bars did not taste at all good.,2
43543,Two stars because they're absolutely adorable. They don't stick on my daughters ears well at all so we've lost most of them already 😢,2
58349,"When I received the product, it looked as if it had already been used. There was water in the steamer slot and hair on the iron. I used it once when I first got it and haven’t used it since.",2
67782,No matter what I do I cannot get these to stay in my ears. I've almost run the lawn mower over them coz they keep falling out. So now they just sit in a drawer. Big waste of money.,2
75651,They are soggy after toasting. I tried to fix that by adding more time to the toasting but they just came out dry and difficult to eat. They also fall apart while trying to eat them. You'll need a spoon... I can get better waffles.,2
54732,"Pillow Cover slick and not a typical pillow material. Would NOT recommend. The REAL Better Homes and Garden pillow from Walmart that has insert included and not just a cover has a cost of $2.00 more and is worth the money, NOT this pillow COVER. DO NOT RECOMMEND this seller's pillow cover at all.",2
45813,Silicon portion does not quite fit and I'm very disappointed that you cant put the phone in the holster with the screen facing out. The picture shows the holster being used as a kickstand but you can't actually do that because the phone wont lock in screen facing out. Also I bought two of these in different colors and they are not even close to the same case.,2
54549,"The reason I am giving this a low rating is because these briefs are labeled as Gentle Wash, Do Not Tumble Dry. I have ALWAYS washed my underwear in regular wash and tumbled dried them. I suspect the elastic is of poor quality and will not tolerate regular wash and dry cycles.",2
78954,These claim to be hypoallergenic but I don’t believe they are. I have very sensitive ears so I’m very cautious about purchasing random earrings. I read the reviews and decided to give these a go. The INSTANT I put theb in my ears my ear holes ached! I took them out immediately. I have since painted the studs with clear fingernail polish and that seems to be keeping the irritation at bay.,2
68249,died after 2 months.,2
70247,Not as durable as I thought it would be.,2
58152,"We are very disappointed. We bought a ""good"" (so we thought) peppermill. It worked for awhile, but now doesn't, and we missed the window for sending it back. Guess the name Peugeot doesn't mean what we thought it did. It is very difficult to select the grind, and it doesn't come out when you do get it there.You cannot fill it very full. Junk for $42.",2
61163,Fable 2 Heavy and too hard to get on I did not care for them at all the material was so thick too heavy for me!,2
65545,I loved the pattern but they were way shorter then the cheaper compression socks I ordered. I was really disappointed and will not be ordering from them again.,2
67028,Photo is VERY deceiving. looks like real marble in the photo and it is just a piece of plastic when you get it not worth the price wish I actually looked like rose gold and marble but it definitely doesn't.,2
67944,"The Rapid Remover Vinyl Letter Remover does not not remove vinyl letters. I tried it on several types of decals and letters over a period of a few days. I let it soak per directions, longer than required and shorter periods. It does not remove the letters even with a lot of scraping. I removed the letters with a heat gun. The adhesive left behind did come off with the product. Very disappointed. Not worth the high price. Would not recommend for vinyl letter removal.",2
79696,We replaced both nozzles; one is barely spurting out enough washer fluid to reach the windshield. The other doesn't work at all.,2
43699,Disappointed in the air volume that it moves.,2
65184,"These batteries worked GREAT for many applications and tools. However, less than two years after purchasing, heavy use with my Ryobi brushless trimmer caused the batteries to overheat and the area around the contacts melted. Almost ruined my trimmer, as one of the batteries almost wouldn't come out. Neither are currently functional. I have purchased 4 of these, as I gave two to my son-in-law as a gift. I also own some of the actual Ryobi batteries which I have owned for years, and have had no problem. I can't recommend Energup at this point, unless you are only doing light-duty stuff.",2
40478,"The case itself seems fine, but it doesn’t work well with my phone so I need to return it. There was no return label included or option for exchange. This is really frustrating and will mean that I will choose a different product.",2
45567,"I like this product, it works very well for me, However, placed 2 orders with the seller, total 12 bottles, all will be expired within 2 months.",2
61512,It works okay... The lip on mine doesn't snap into place anymore. Also the dogs absolutely hate it.,2
48050,"Not for me, may work for others but my hair didn't like it, dried my hair out",2
66475,"I got these to help keep my medicine patch on while swimming, but it just peels away when wet. I've tried using medical tape on the corners and it helps some, but if you're planning on getting more wet than just a shower, I would try something else.",2
65690,Some of these waterers are just too large at the bottom & the water just guzzles out. I’ve had others that work much better.,2
58578,"If I had written this review when I first bought the headphones it would be an all 5 star review. These headphones sound and work great. That being said now that I’ve had them for some time and haven’t really used them very hard. Just mainly a few hours a week. The battery life has dropped pretty low, I’m lucky if I get two hours out of them and it takes a long time to charge them back to full. A lot of times I use one headphone at work and when the battery dies now I basically can’t use it again the same work day.",2
79296,Installed but continues to have a high pitch buzzing sound that is quite distracting...don’t buy and spend extra on the real thing.,2
62019,Just junky plastic. Hard to turn and not lose salad stuff. Going to goodwill!,2
64790,"The colour is good , but they are very cheaply made",2
72237,"I am a skinny guy, but even with having the waistband at max length, it still was pressing super hard into my side. Not for me.",2
69099,The book arrived with the front ripped. It was a gift and so looked bad,2
53517,"I'm a DD cup, which is aligned with XL. My cups are a bit small for DD. My breasts kept spilling out whenever i bent over. I wore the bra for a day and i must say that the feel of the lace is wonderful. Just disappointed I'm unable to enjoy due to the cup size.",2
41781,Not shure if works rest of parts don't work from Amazon purchased all new part,2
74198,"I don’t like this screen protector. It is too reflective, making it hard to see my screen. It doesn’t allow for scanning of barcodes on the screen either. Tried it at the grocery store and the scanner couldn’t read the screen. The film is also very dark, which doesn’t look good on my white phone. Finally, the surface isn’t perfectly smooth and has an uneven texture to it. It was easy to install, but that is the only thing I liked.",2
