100804,"Hormis l'odeur très forte, le produit correspond à la description.",3
119356,C bien pratique mais le câble de la coque se n’est pas sa du tout,3
116811,"Bonjour bien reçu ma commande mais je vous signale que l emballage était ouvert ,le carton pas suffisamment scotché et aucune protection à l interieur",3
91164,je posseder se produit auparavant il c est user avec le temps et je l ai acheter de nouveau pour un prix plus interressant ! nikel,3
81862,Ces coupes mangues ne sont pas super pratiques car la lame ne coupe que la chair mais pas la peau. Il faut donc entailler la peau avant de pouvoir passer le coupe mangue... pas idéal pour cette raison,3
110821,Bien mais attention à prévoir un adaptateur EU pour la prise.,3
86426,"Les 2 boutons (émetteur et récepteur) ne sont pas identiques mécaniquement (visuellement ils sont identiques). Le bouton à pile se comporte comme une bascule (on appui en haut ça allume, en bas ça éteint), tandis que le bouton du récepteur se comporte comme un bouton poussoir simple (1 clic allume, 1 clic éteint). C'est un peu déroutant à l'utilisation. Les visses pour serrer le boitier récepteur dans le mur sont de faible qualité (attention à ne pas détruire la tête en serrant trop fort). Installé depuis quelques jours, je ne connais pas encore la durée de vie des piles.",3
87748,"Produit conforme à la demande,rien à signaler par ailleurs, le service rendu est à la hauteur de mes exigences !",3
98708,Produit pour permettre la lecture de DVD mais malheureusement n'a pas joué son rôle.,3
89842,"Bien corresponds à la description. Par contre l'avoir en verticale à la ceinture, n'est pas agréable pour s'assoir, il faut bien l'avoir sur le coté, si vous le ramenez trop devant il gène quand on marche. Je ne regrette pas mon achat, il est bien, mais le prochain étui, je le prends horizontale. J'ai testé un étuis avec pivot, cela n'a pas tenue le temps.",3
86151,Bon produit cependant 5 jours après être collé il ce détache donc je ne conseille pas ce produit a voir selon les utilisation moi j'ai mis ça,3
106044,Bon mais ne tient pas tres longtemps,3
105273,"Le produit correspond bien à mes attentes, le soucis est qu'il est arrivé avec un pied cassé. 4 jours avant Noël, c'est juste pour un retour et une nouvelle commande.",3
93535,Ce produit est trop petit j zi demande un j6 + mon tel ne rentre pas il faudrait me le changer,3
103572,Pas du tout satisfait,3
88111,Bonne marque mais cet article n'est pas top. Les fermetures métalliques sont trop dures et s'ouvrent et se ferment trop difficilement. Inutile du coup pour s'en servir au quotidien pour moi.,3
92088,ensemble correct pour le prix . . . . . ; . . . . . ; ; ; .,3
101767,"Je l ai utilisé pour sur un carrelage,mais hélas il reste une fine pélicule un peu blanchâtre qui se voit avec la lumière du jour,pas a l éclairage élèctrique(c est du gré céram).Après plusieurs nettoyage a l eau claire,la différence se perçoit toujours.",3
112381,le chargeur semble charger correctement le problème c est le câble ! il ne semble pas standard un jeu au niveau de la connectique ce qui fait que ça ne charge pas,3
96999,"La taille est un peu grande pour les doigts des 3 ans, elle s'amuse bien avec , mais difficile à couper du papier ,pas top!",3
118539,"Ce pistolet à colle est pratique pour réparer n'importe quel objet de tous les jours, mais il a tendance à chauffer après une utilisation de plus de 15 minutes ! Merci de m'avoir lu. Si ce commentaire vous est utile, veuillez cliquer sur ""Oui"".",3
85970,"Bonne qualité mais avec les frais de port, la ramette double son prix. Si les frais de port étaient offert à partir d'un nombre de ramette cela pourrai être bien",3
118394,Utilisation quotidienne pour protéger,3
91106,"Bonne housse mais pourrait protégé mieux notamment sur les côté .. Je l'ai acheté il y a 1 an et elle n'a pas bougé, quand même de bonne qualité malgré le manque de rembourrage sur les côtés.",3
88964,Projecteur assez correct pour le prix je ne suis pas sur de la qualite on voit un jour tout autour du bloc led le detecteur quand a lui n est pas assez ecarte du bloc led ce qui fait qu il touche et qu on ne peut pas l incliner droit ou vers le haut a moins de mettre l ensemble tete vers le bas. A voir dans la duree sinon le detecteur de luminosite ainsi que celui de presence fonctionne tres bien. Eclaire plutot bien.,3
113089,"On m'a conseillé ce produit et dès que je l'ai reçu, je l'ai adoré. Ce fauteuil est facile à monter, très agréable pour le dos, mais les parties en simili-cuir se détériorent assez vite, notamment au niveau des accoudoirs.",3
107997,Un bon livre mais parfois difficile à mettre en pratique parce que les exercices ne sont pas toujours adaptés aux situations de tous les jours.,3
92200,"Fais son taff mais la qualité reste faible , sûrement dû à son bas prix . Les feuilles ne ""s'avalent"" pas toujours droites se qui bloque la machine. Si je devais racheter un destructeur je mettrai plus cher !",3
100379,Pour protéger mes fleurs pendant l’hiver c’est super. Par contre à faire gaffe quand il y a beaucoup de vent car ça s’envole.,3
116326,Première commande correcte. La deuxième le scotch n'est pas transparent et se coupe de peur.,3
83936,"Produit conforme aux attentes et au descriptif du vendeur, facile à nettoyer, utilisation facile également. Le changement de lumière est agréable",3
110863,J'ai reçu mon produit ....tres contente ...et huit aprés une des boules ne marche plus ....,3
95209,"Je n'ai pas encore essayé le produit mais je suis déçue par sa taille, il est tout petit !! Pour le prix j'espère qu'il va faire des miracles à ma peau",3
113361,Joli petit avion le seul bemol les melodies sont en anglais..il est ni trop petit ni trop grand parfait pour mon fils de 2 ans,3
90280,Contre les moustiques,3
103849,"Pratique, esthétique mais le plastique reste fragile...",3
97719,Un petit peu déçu Parce que les couleurs ne sont pas aussi jolis que dans la foto Sont plus sombre,3
100668,Il faut chercher la meilleure fréquence et s’y prendre à plusieurs reprise un petit retard lors du début il faut qu’il soit connecté 10mn avant,3
83227,"Obligation d'utiliser un smartphone ou tablette pour diffuser le texte après avoir installé l'application. Pour moi ce n'était pas clair. Le prompteur va trop vite comme indiqué sur des avis de l'application. Pas d'éditeur de texte performant sur l'appli. le clavier de ma tablette samsung n'apparait plus lorsque je veux modifier le texte. Il apparait uniquement lors de la création du texte. Sinon, obligé de retoucher le fichier txt (pas de lecture d'un Word) sur mon pc puis de le remettre sur ma tablette. Les accents, guillemet... et autre caractères ne sont pas reconnus dans l'application. il faut rester très basique sur les textes. Aucune aide en français.",3
91420,Je trouve ces chaussettes jolies mais elles se sont trouées au bout de 3 mois d'utilisation.. Donc pas de très bonne qualité,3
108226,"Chouette produit de part sa transparence et sa couleur mais mal ajusté, au niveau des boutons latéraux. C'est dommage. Mais je ne regrette pas.",3
92016,"J'avais cru qu'il s'agissait de la housse + la bouilloire. Mais sinon, excellent produit, qui orne bien la bouilloire que j'ai acheté par la suite.",3
89455,"Je crois que fins et le vrai mot pour décrire ces préservatifs. A condition que je ne me trompe pas sur les termes employés en général, fins, super fins, ultra fins, etc...etc.",3
90321,il fait le job mais pas plus pas de métal dur sinon vous risquez d'être décu.,3
99355,malgres un soucis rencontrer le service client à bien gérer,3
94393,"Le produit est dans l'ensemble satisfaisant, mais la mise en œuvre est difficile dans les emplacements ou l'accès n'est pas commode. La fixation ne peut se faire qu'en vissant les supports, ce qui dans certains cas peut s'avérer un exercice de haute voltige (par exemple si le plateau est déjà en place). Un système d'enclenchement aurait été bien plus pratique. De plus, je recommande de faire un gabarit car il est difficile par la suite de bien aligner les coulisses. De plus, la hauteur minimale est en fait assez basse car la patte qui détermine la hauteur est d'origine longue, et ne se fixe au premier cran qu'avec un décalage d'environ 7 mm. Ceci n'est malheureusement pas modifiable. Donc, si vous fixez ces coulisses en espérant être à ras du plateau, vous n'y parviendrez pas.",3
87241,"Les chaussures sont assez rigides. Même en les mettant souvent, J'ai eu des difficultés à les porter sans avoir d'ampoules. Première fois où je ne trouve pas les chaussures Rieker confortables dès les premières utilisations...",3
85966,"bon materiel, mais il serait souhaitable de pouvoir commander un diametre particulier plutot qu'un lot dans lequel on n'utilisera qu'un seul... il serait souhaitable aussi d'avoir d'autres diametres disponibles, plus gros, afin de mieux repondre aux demandes clients.",3
83939,"Dur dur le plastic, les boutons sont très difficile à appuyer. Dommage car l'idée est bonne.",3
109849,chargeur qui ne fonctionne plus au bout d'une semaine. Est normal ?,3
119855,Pour mon petit fils cadeau de noël. J ai dû le renvoyer le bouton de démarrage s est enfoncé je n arrivais plus à l éteindre. J en ai commandé un autre qui pour L instant fonctionne,3
117409,"Les points positifs: Le parfum est agréable. L'efficacité est bonne (durée pour moi d'environ 12h). Les points négatifs: Le prix. Le manque d'applicateur, (c'est un déo à boule sans boule) chacun doit trouver sa méthode d'application.",3
86443,Qualité satisfaisante sans plus. A voir dans la durée.,3
101676,"J’avais lu dans un commentaire que les CD coupaient, grésillaient... malheureusement je fais ce constat :-( pour de l hypnose, c’est d’autant plus gênant !). Je n’ai pas eu le temps de lire encore tout le livre, juste le début donc à voir pour le reste mais à 50 euros j’estime que les CD devraient être de bonne qualité...",3
80232,Déçu produit bâclé pas très agréable à porter,3
115819,"J'ai ressenti une sensation de brulure en l'appliquant sur mon visage, je pense que ce produit n'est pas adapté pour les peaux sensibles. Cependant, je l'utilise comme un gel pour plaquer et nourrir mes cheveux, ils sont plus doux et fortifiés. Excellente alternative au gel classique qui abime fortement les cheveux.",3
110358,Le produit chargé bien le téléphone mais j’ai toujours comme des grésillements meme l’orque je suis sur la bonne fréquence,3
95602,Pas a fond de mes attentes,3
99462,"Je suis contente de mon achat, pas contre pour la livraison je trouve que c'est inadmissible. Ma voisine a trouvé mon colis par terre dans l'immeuble. Heureusement que c'est une personne honnête et m'avais rendu mon colis.",3
103401,Très pratique mais il faut un temps d’adaptation pour réussir sans tout casser autour,3
107437,je l ai utiliser en fait comme pendentif car il m a fallu écarter l anneau pour pouvoir le mettre à mon sac et du coup risque de le perdre !!!,3
97418,Impossible de connecter les 4 limités à 3 vraiment dommage,3
81902,"pas conforme a mon key mode, du coup retour à l'envoyeur Mais les pièces sont de qualité",3
96108,Un peu fort plastique,3
107750,"L'adaptateur est conforme aux attentes, l'ensemble de la connectivité fonctionne normalement. Toutefois le bloc chauffe énormément. A voir s'il tient sur la durée",3
80315,trop liquide pour mon utilisation. il faut un temps fou pour avoir un épaisseur satisfaisante,3
104788,"Tout est dit : on achète la robustesse et le design, mais au final la cuisson est tellement lente que nous mettons la chauffe au niveau 6 pour pouvoir sortir les tartines plus tôt. Un réglage plus précis de la durée de cuisson aurait vraiment été apprécié !",3
108545,"Pour utiliser l'imprimante 3D, nous avons du acheter certains matériels qui sont normalement livrés avec le produit.",3
96899,"Aspirateur petit peu encombrant, mais qui présente quelques défauts : Le fil d'alimentation est trop court ( même pas 1 mètre) L'embout n'est pas biseauté , ce qui pose problème pour les coins dans un poêle à granulés. La puissance diminue très rapidement quand la cendre est fine et que celle ci colmaté le filtre intérieur",3
89157,Préparation pour le ski. Bon une fermeture de poche complètement coincé. Comment fait on pour la garantie. le blouson est bien en dehors de cela,3
113012,Laisse les cheveux souples et soyeux sans les alourdir tout en les nourrissant et son parfum est agrèable. Je recommande ce produit sans hésiter.,3
110646,"On installe, on branche et ça marche tout seul sous Windows 10. Boot sans problème sur disque système sans pilotes complémentaires. Pas testé les ports externes esata. Seul bémol : pas d'équerre low profile livrée avec la carte... dommage pour les petits boitiers !",3
91841,Pour stimuler le jeu de façon efficace pour mon tervueren de 2 ans. Je trouve malgré tout que les picots sont un peu petit. J avais choisi la taille L.,3
92942,Prise installée dans le fond de notre îlot de cuisine. Le bloc 3 prises est parfait en taille pour tenir dans le vide sanitaire de notre meuble Par contre le plastique semble un peu léger et le cran de bloquage en position sortie accroche un peu. Dans l'ensemble bon rapport qualité prix. On verra si cela dure dans le temps.,3
84714,"Meuble livré avec impact. De plus, la notice est très très mal expliquée. Montage compliqué ! Sinon meuble plutôt jolie, correspond à la photo. Par contre un peu petit. Par exemple des classeurs ne rentre pas dedans.",3
117008,Produit vraiment pas top,3
193078,Un peu coûteux mais la qualité est là! Je recommande!,5
166523,quitte a me repeter a voir tres bon film,5
184007,a bien résolu les problèmes de réception causés par la présence de pins sur la trajectoire de l' émetteur,5
164688,Un très grand classique je le conseille à tous ceux qui comme moi aime ce film légendaire un pur bonheur,5
164368,Après une protection d'écran en verre qui a fini par fissuré au bout de 5 mois je suis revenu à cette protection souple qui disparaît littéralement a l'œil une fois bien mis en place ; je suis parfaitement satisfait du résultat pour un bon rapport qualité prix.,5
161787,M’a bien dépanner pas besoin de changer la poignée au complet réussi à le retirer de l’intérieur attention à ne pas rayer bien protéger votre porte,5
173895,Mon neveu ne le lache plus et s amuse tout le temps avec pour le moment pour les petits bouts le robots train c’est la grande mode,5
196665,retour tablette envoyée en double. Retour poste le 29 janvier. A ce jour aucune nouvelle ? Merci de me tenir informé/ Accusé retour poste en ma possession,5
163751,"Ce chargeur induction multiple est très pratique, il fonctionne aussi bien avec mon samsung S8 qu'avec un telephone iphone à Induction. Il permet de charger egalement ecouteur et montre iphone. Il est leger et solide, question utilisation il suffit de brancher et de poser, charge rapide du telephone egalement.",5
192343,Joli bracelet livré avec tous les accessoires permettant de le monter sans problème. Toutefois un peu lourd.,5
191382,Je recommande cette paire de basket car elle est très confortable et légère. Passe bien en machine avec le programme basket.,5
179846,Cela donne des idées pour notre Eglise... Une très belle expérience de lecture qui fait réfléchir. A diffuser sans modération !,5
198580,Le début de la fée Clochette... A regarder sans modération,5
170545,"Excellent produit, j'ai été surpris par la très bonne puissance du ventilateur (il y a 3 vitesses). Fait son job, rapport qualité /prix correct, vendeur à l'écoute de ses clients et tres commerçant !",5
198505,Mon fils est très satisfait,5
178148,Cet objet est très utile et ludique.,5
195778,la texture et la longueur correspondent à l'usage que je souhaitais en faire.Il donne assez de volume.Je l'ai associé à une robe vintage années 60 .C'était le jupon parfait pour donner le volume la robe.,5
191946,J’adore ce produit en cuisine comme dans le jardin,5
172095,"cordon plus grand que l'original, a l'air solide, pour l'instant ras fait le job, livraison rapide ras pour un gaufrier lagrange",5
178701,Parfait - égal à la description,5
162881,"Je ne reçois que des compliments sur mon sac ! Il est pour moi le sac idéal, beau, élégant et raffiné, il est aussi grand pour transporter mon ordinateur pour les cours. Il est même possible de rajouter des cahiers et autres accessoires sans déformer le sac. Reçu rapidement et très bien emballé, je recommande !",5
162760,"Décoration complète de l’anniversaire et décoration de la chambre comme décoration du gâteau Il y a beaucoup de choses dans ce jeu d’anniversaire, il est bien équipé … Il y a des couteaux, des fourches, des cuillères, des tasses, des serviettes en papier … Très bon shopping. Tout était très complet, je suis entièrement satisfait et je réponds à Mes Attentes. Jolie et de bonne qualité. Je le recommande sans hésitation",5
197902,livraison conforme a mes attentes et dans les temps je recommande a faire ces achats,5
172805,j'ai été livrée dans les délais impartis. le produit correspond parfaitement mes attentes puisque je le connais. Excellent produit,5
194311,Plus compliqué qu'un telephone pour poser. Plus de superficie a nettoyer etc... Bien prendre son temps...,5
161074,"Dès que je les ai reçus je les ai congelé à plat et séparément comme l’a conseillé le vendeur pour une bonne conservation, personne très agréable au bout du fil! Je ne les ai pas encore utilisé.",5
177119,"Excellent produit que je connaissais depuis déjà longtemps. Le prix est compétitif avec ce fournisseur, 2eme commande livrée aujourd’hui, sans aucun problème. Je recommande.",5
174228,"J'utilise les interrupteurs Dio depuis des années, le pied. La pile fournie dure longtemps et on peut en placer jusque 16 par relais. J'adore.",5
198161,JE M'EN SERS POUR PROTEGER MES MAINS ( VAISSELLE ETC ) PRODUIT DE QUALITE ET SURTOUT SANS POUDRE,5
169585,Tout a été comme il faut : livraison rapide et produit de grande qualité.,5
176354,Ce produit est top. Je le recommande. C est du plus bel effet. L application est très simple. J adore.,5
161239,Conforme à la description me sert bien et plastique solide,5
161670,"Très utile, tient très bien. Soutient parfaitement un miroir et de la déco murale. Attention toutefois, le harnais est un peu épais et ne convient pas aux boucles fines.",5
164022,"Cependant, elle a fait le choix de se sauver un soir de sa cage et mon chat l'a donc dévorée avant même que l'article me soit livré. RIP Billie!",5
171199,Ma fille aime toute la collection - nous les avons tous Très bien fait - concerne des sujets de leur âge Chaque soir une histoire différente,5
179050,Je recommande étui super et de bonne qualité,5
164200,"Articles de qualité et de durabilité. Je peux charger rapidement mes deux téléphones en même temps, ce qui est très pratique et rapide. La qualité est très bonne et le prix est raisonnable, ce produit est parfait.",5
186820,"Difficile de trouver des graines de Moringa dans les magasins en France. J’ai commandé ces graines et je ne suis pas déçu du tout, graines sèches comme il fait. Idéal pour combler vos carences en vitamines. Je recommande vivement ce produit. Merci 😊",5
183226,Pratique et utile mais attention c est un petit modèle !,5
174747,"Franchement au top, rien à dire de négatif sur cette coque",5
163987,Échangé pour une taille plus grande du 46 EU s'il vous plaît car je mets du 44 EU mais le 44.5 EU est trop petit. Merci d'avance,5
182642,CABLAGES HAUT PARLEUR,5
199296,"Bien plus de moyens que pour le premier épisode, mais le scénario est toujours génial.",5
166894,"L'écran de protection semble être de tes bonne qualité. L'application est très simple en utilisant le cadre en plastique qui se met sur le 6t. Impossible donc de mettre l'écran en verre de travers. C'est très bien fait. Par contre, bien faire attention pour la poussière sur l'écran du 6t, mais aussi sur le côté un peu collant de l'écran de protection. Je n'avais pas de poussière sur le 6t, mais 2 poussières de sont mis sur le côté collant de l'écran de protection. Pas très grave. J'ai laissé. Je préfère garder le 2eme écran (et oui, c'est super, il y en a 2 dans le paquet) si jamais le premier se casse.",5
168417,c'est vraiment un très bon produit comme je cherchais et surtout un grand merci pour votre sérieux et pour la rapidité d'envoie,5
163880,"Parfait, recoupable , bien lumineux, se recharge bien , sécurité pour la nuit . Bravo Kolylong à bientôt pour une autre commande",5
183316,Produit arrivé à temps le produit est neuf et fonctionne très bien. Petit interrogation sur la jaquette un petit peu abîmée sur le côté. C'est normal ?!,5
174932,parfait commandé la veille à 19h reçu le lendemain à 15h franchement amazon est très rapide sur leurs livraisons c'est impressionnant et surtout le produit est bien arrivé en parfait état rien à dire . Je recommande !,5
161839,"Figurine en vinyle d'excellente qualité, finition impeccable et souci du détail à la hauteur de la réputation de Funko Pop! A acheter les yeux fermés !",5
190268,La boite est conforme au descriptif Le socle fourni tient bien en place.c est facile a manipuler. Envoi rapide et bien emballé,5
185774,"Foncez vraiment !!!! un moment vraiment intense on avale les pages. Une magnifique histoire, très facile à lire véritable coup de coeur Merci pour cette merveille <3",5
161869,"J'ai utilisé ce produit pour copier un disque interne sur un SSD, il fait bien son job.",5
195276,Très bon rapport qualité prix. Très facile à installer le design est sympa. Ils se replient très facilement,5
162289,On connaissait la version Elsa reine des neiges et on a fondu sur ce olaf ! Très pratiques pour un enfants qui souhaite aller au toilette seul la nuit ou même pour ce rassurer,5
164972,Depuis quelques mois génial pour sa compatibilité HomeKit qui ne l’était pas au debut …,5
181853,"Ma fille de 5 ans 1/2 ne voulait pas quitter sa tétine, je ne savait plus quoi essayer. J’ai acheter le machouyou en n’y croyant pas spécialement. Ma fille l’a adopté au bout de quelques heures et ne parle plus du tout de sa tétine depuis !!! Ca a été magique. Reste à voir dans le temps si ça fais quelque chose sur ses dents. Mais mon but été de lui faire quitter la tétine donc je suis très satisfaite de mon achat.",5
199265,Une personne hospitalisée. Les repas préparés à la maison.,5
162141,Demandé par l'école et il est bien pratique de ne pas à avoir à courir dans les librairies pour le commander.,5
188120,"J'étais septique à l'utilisation de ces films qui me semblaient épais. Mais l'ajout du film ne change en aucun cas l'utilisation du tactile. En revanche les traces de doigts se voient bien, mais un coup de chiffonette et elle disparaissent. A voir si quand le téléphone tombe le film rempli bien son rôle de protection",5
171672,super produit pour soulager l'hallus valgus,5
193205,J’ai apprécié ce livre qui se lit très bien avec une belle histoire. Je le recommande pour passer un bon moment,5
165109,Malgré le prix de zippo qui reste hors de prix le briquet reste unique bien emballer dans une boîte ( d'origine ),5
165662,"A la réception de ma commande il manquait un centreur, à la place une chute de cuivre. Après ma réclamation, Amazon m'en a envoyé un autre lot sans retour de l'autre. Merci. Amazon c'est du sérieux!",5
187877,"Idéal pour les fins de soirées au jardin où la lumière du jour viendrais à manquer, très pratique avec la fixation sur le pied du parasol (ça fonctionne même avec des plus gros pied de parasol le miens étant de 5cm de diamètre ça fonctionne aussi) Il y a 2 modes d'éclairages, un fort et un plus faible, dans mon cas je n'ai utilisé que le mode fort, après un test d'autonomie on peut l'utiliser pendant facilement 10/12h avant d'avoir une baisse significative de l'intensité lumineuse. Au niveau de la recharge il y a un câble fourni avec (câble USB vers un connecteur DC) il faut compter environ 8h pour une charge complète. Mon seul regret sur ce produit l'absence d'une petite LED pour faire témoin de charge.",5
176397,"des petites boites qui ferment bien, qui passent en machine et qui sont réutilisables. J'y mets de la soupe d'os que je donne à mes chiens",5
190736,Super produit. C’est quand même un bon produit car il protège quand même toute la partie tactile et caméra.,5
183420,Produit commandé pour l'animation de mon équipe pour le nouvel an chinois. Bien fini et agréable à porter. Prix correct au regard de la qualité.,5
174040,"J'ai dévoré ce livre que je qualifierai comme un mélange entre histoire intéressante et développement personnel, saupoudré d'un humour simple et efficace ! Étant moi même de la génération de Thomas, ce livre dépeint parfaitement les doutes auxquels nous pouvons être confrontés en tant que jeune professionnels en quête de sens. une bonne idée de cadeau de noël !!",5
168821,Petit rangement supplémentaire sur une penderie ceux-ci m'ont permis de mettre mes short d'été où je n'avais plus de place sur mes étagères malheureusement je garde trop d'affaires,5
179900,"Super pratique ce HUB multifonction. Ici tout est réuni, fonctionnalité et design. Je l'utilise sur mon pc portable qui possède une entrée usb type-c et ça fonctionne sans soucis. L'USB 3.0 est un gros plus, finis les transferts lents.",5
