127855,Pour des chocolats viennois.,4
152307,Elles sont confortables chaudes,4
120267,"Matelas très épais, confortable, ferme correspond à mon attente pour le moment. Un mois d utilisation du matelas à ce jour.",4
130126,"La carte est arrivée dans son emballage d'origine sans protection... Pas top (d'où l'étoile en moins). Mais surtout, elle est arrivée en retard et son prix avait baissé entre temps... Et franchement, BRAVO pour le service client Amazon Prime! Ils ont pris en compte le désagrément et ont totalement assumé ces déboires. Sinon, la carte est de très bonne facture ,silencieuse et encaisse PES 2018 ou Call Of Duty WW2 sans bronché. Encore merci Amazon",4
156282,"Conforme à la description. Un peu trop grand pour la siège haute, mieux sur la table",4
133660,LES GLACONS METTENT TROP DE TEMPS A SORTIR 1/2 H POUR HUIT GLACONS POUR UNE SOIREE IL FAUT S'Y PRENDRE LE MATIN ???,4
157316,"Très bon rapport qualité prix. Points positifs : le balai rotatif, les 2 lances, la puissance. Points négatifs : l’e flexible est beaucoup trop rigide. Il s’entortille en permanence du coup l’enrouleur Est à bannir car il renforce ce défaut. Je range le flexible à plat pour l’utiliser plus facilement.",4
141204,"Étui acheté pour offrir en même temps que le nouveau Huawei Y5 2018. Il s'adapte parfaitement au téléphone, est très beau et de bonne qualité. Le petit bémol qui m'a fait enlever 1 étoile est que la protection enveloppant les touches latérales oblige à appuyer très fort, sinon il n'est pas possible d'enclencher les boutons.",4
153551,"Très grand sac de rangement qui permet d'accueillir l'ensemble des coussins de mon salon de jardin soit 7 assises et 7 dossiers. Parfait pour l'hivernage. En terme d'étanchéité, j'émets des réserves. Dans le doute, je ne tenterais pas de le laisser non abrité. Vu le prix et la taille du sac, cela en fait un bon rapport qualité prix.",4
153131,Fonctionne très bien juste un bémol ce déclanche quand il y a du vent donc a prévoir de lui enlever mais sinon ras,4
141379,Bon café ni trop fort ni trop léger. Mais les capsules ont tendance souvent à s'écraser dans ma Nespresso. Dommage,4
147747,Le produit correspond à la photo. Il est de bonne qualité. Je vous donnerai un avis dès que les p'tits loups les resteront.,4
144727,Produit rien à dire le bon produit à la livraison mais l'étui présent sur la photo ne se trouve pas avec l'ensemble,4
136619,"Acheté pour le lestage réglable, mais les petits sacs de sable ne sont pas facile à retirer ou à remettre en place dans les compartiments...! Sinon le produit est de bonne facture, devrait durer dans le temps et répond parfaitement à mes attentes ; merci.",4
140855,"Très bonne réception, bonne émission. Par contre un peu complexe pour le paramétrer.",4
128778,Un peu de retard sur la livraison mais suis vraiment très content de mon achat !!!,4
128391,"Je suis très contente de mon achat, je vais le recommander. Mon petit garçon est très bien dans son lit",4
148765,Très bon livre bien documenté,4
150547,"Arrivé bien avant la date prévue, et ça marche. Le transfert de portable à clé usb et l'inverse se fait sans encombre. A bientôt, Amazon, pour un autre achat. 😘",4
124668,Encens Palo santo me donne une sensation de d’apaisement et de tranquillité Son parfum me convient très bien Livraison rapide et bien emballé!,4
137341,"Je voulais lire ce livre depuis quelques années. Je trouve que l'auteur semble assez détaché par rapport à tout ce qu'il a vécut et même si certains passage du livre sont difficiles, cela m'a permis de ne pas m'impliquer trop émotionnellement tout en étant dans l'empathie. Le livre se lit assez vite et au fil du livre on a tendance à s'attacher au narrateur.",4
137402,comme je pensais mais au départ une sale odeur pendant 15 jours environ,4
155376,"très bonne qualité de son, mais pas forcément ultra confortable avec la barre au dessus mais c'est absolument pas ultra gênant non plus franchement pour le prix ça vaux le coup!",4
120130,"Bon kit pour commencer car très complet. Les poils ne tombent pas, bonne qualité.",4
131492,Maniable et pas trop fragile. La batterie se vide rapidement à mon gout.,4
159639,"Produit reçu à la date de livraison. La matière même si ce n'est pas du véritable cuir, sa tien assez chaud dehors tactile pour les smartphone.",4
138131,"Bonne enceinte, un peu déçu par le son qui n'est pas aussi net que je pensais(grésillement en Bluetooth) et un peu lourde",4
131197,produit très hydratant,4
120335,Un bout cassé à l'arrivée sinon rien à dire très jolie bois,4
129935,Bon ok .. je suis peut être allée un peu vite en l'achetant ... mais il n'y a que la housse qui est conforme à la description ... réglable assez facilement. Pensez donc à acheter le pistolet qui va avec ...,4
136014,"Ces deux brosses sont très bien pour les petits. Cela permet à l'enfant de choisir ce qui lui plaît le plus. Par contre, pour les plus grands (environ 2 ans), ce n'est plus adapté.",4
123297,Un livre sympa avec des anges beaux et drôles et une héroïne en devenir. Elle pleure beaucoup et beaucoup meurent autour d elle... j espere qu elle se transformera bientôt en guerrière déterminée à ne plus subir pour s'étoffer un peu. Un bon moment de lecture,4
155661,"Casque sans fil de bonne qualité (pour son prix). C'est mon fils qui l'utilise et il en est ravi. La batterie tient longtemps et sinon, il l'écoute avec le fil.",4
125507,Article conforme a se que j'attendais le seul bémol les bouchons ne rentre pas dans mes barre dommage!!,4
138976,Conforme à ma demande,4
140632,"Très contente de mon achat, il est très joli, et correspond bien à la photo, la lumière solaire, semble un peu fragile à l'intérieur, c'est pour ça que j'ai mis que 4 étoiles, à voir la durée dans le temps. Si non, oui bien sûr que je recommande cet article.",4
147442,Le sac est satisfaisant de nombreux rangements... Un seul hic le livreur a jeté le sac dans la cours alors que nous étions la ? Il n'a même pas sonné à la porte !,4
130874,"pas de taux de transfert testé pour le comparer aux autres disques de mon pc, mais pas bruyant pour son prix peu élévé.",4
139913,"Jolie lampe, lumière apaisante, personnellement je trouve le socle en bois un peu petit par rapport au diamètre de ma lampe mais je reste assez satisfaite. Elle est arrivé bien emballé, Par contre pas de certificat d'authenticité.",4
126197,"j ai choisi se modele, car il est grand, pratique, et c est plus écologique que les sachets en plastique pour l instant niveau charge je l ai utiliser pour 5 pots donc 2kg500 et le sac a tenu sans problème... honnêtement pour l instant je suis contente a voir avec le temps... niveau prix correct..",4
141460,"Le sapin est beau, mais plus petit qu'annoncé, 180 cm au lieu de 210 comme annoncé. Les boules sont couleur or et non rouges, mais bon c'est un beau produit avec une belle finition. Décoré il donne l'illusion d'un vrai sapin, donc à recommander.",4
151287,Pas très solide mais vu le prix je ne m'attendais pas à quelque chose d'autres. Sinon il est vraiment très très bien. Grand et imperméable,4
144299,"conforme à la description et perd parfois des cheveux, rendu assez fidéle pas trop synthétique. Longueur des cheveux importante, un peu plus court aurait suffi. utilisation : enfant de 10ans qui adore coiffer, utilisation régulière.",4
152763,Très bon produit mon fils de 5ans et demi est conquit! Il ne veut plus le lâcher. Petit bémol peut-être sur les cordes un peu longues bien que réglées au minimum pour notre portique... sinon très bon produit que je recmmande,4
148564,Superbe activité pour les enfants. Attention au sens pour mettre les rubans avant de coller l'arrière du poisson qui est autocollant.,4
122279,"On va faire rapide, non, il ne recouvre pas TOUT l'écran (comme je l'ai mis, il y a 2-3mm en haut, 1mm en bas et sur les côté), mais recouvre le principal et fonctionne très bien comme complètement d'un coque (celle fourni par ASUS ou une autres, si on préfère avoir un clapet) Donc pas parfait, mais fait son taf.",4
133981,"Offerte à mon père qui aime beaucoup les montre mécanique, il aime bien, mais si les finitions ne sont pas superbes, rien à signaler sinon, ça vaut son prix.",4
140536,OK. Fonctionne comme une éponge. Ce que nous en attendions ! OK OK OK OK OK OK OK OK OK OK OK OK OK OK OK,4
120299,pour ouvrir le tiroir de la carte sim ou changer la carte sd,4
120440,"Utilisé en intérieur au dessus d'un établi . Convient parfaitement pour des travaux d’électronique. Petit,discret, orientable. Câble d'alimentation très court mais facile à remplacer pour un bricoleur moyen. Au démontage pour changement du câble constat de la bonne étanchéité du matériel par montage de joints de qualité. Par contre la fixation est un peu légère mais pour le prix rien à redire.Éclairage suffisant pour mon utilisation.",4
136634,Utiliser pour recharger des batteries LI-PO !,4
138637,"C’est une très bonne application, elle propose notamment des gratuite qui son parfois payante cher le concurrent, si télécharger beaucoup d’application et que vous souhaitez faire des économies cette application peut vous intéresser.",4
155686,j'ai bien aimé ce film rien a redire acheté le,4
130060,"Très bon rapport qualité prix. Très maniable, pivote facilement, beau design. ... A recommander",4
154537,Pas mal je m attendais a un poil plus grand mais très bien pur mettre des perles paillettes slime ou autre,4
158117,Ce livre est très positif !!,4
130784,fonctionne correctement rien a dit a voir avec le temps,4
143442,tres bien pour la pelouse de mon pavillon individuel,4
124522,Ma fille est très contente elle as pu commencer les entraînements de majorettes et peu aussi commencer les préparatifs pour les prochains défilé,4
158467,"Bien reçu. Cerclé en 2 paquets de 10 et emballé dans un carton avec calage, donc aucune plaque abîmée.",4
151715,Bon rapport qualité prix,4
125100,"Acheté pour ma fille qui en est ravie! Descriptif conforme. Je retire une etoile, rien à voir avec l'article mais plutot la livraison. Une fois de plus (car ce n'est pas la premiere fois que ca arrive), le colis a été balancé au niveau de mon jardinet d'entrée. Le livreur n'a ni pris la peine de sonner alors que j'etais presente, ni je pense franchi le portillon. Probablement un basketteur sur son temps libre!!!",4
140771,"J’ai eu cette manette à noël et 2 semaines après aucun problème, la livraison a été rapide, pour les points forts de la manette c’est pour les FPS, avec un joystick merveilleux pour un super shoot ^^ Ensuite les palettes tombent bien en main, on peut choisir de bloquer ou non les gâchettes L2 et R2 pour tirer plus rapidement. Autre point fort qui est aussi un point faible, la manette est imposante et assez lourde, donc à la fois elle tient bien en main mais peut faire un peu mal aux mains au bout de 3/4h de jeu non stop... Il existe une application mobile pour personnaliser les touches et les leds sont très jolis. Le plus gros point noir sur la manette est son Bluetooth, il y a bcp de latences et on ne peut pas utiliser son casque/micro si la manette est en Bluetooth, mais il y a un grand câble de 2/3 mètres qui règle les problèmes de latence et de micro, donc au final c’est pas si grave... Pour conclure, le rapport qualité prix est correct même si 190€ c’est très cher pour une manette, je suis globalement satisfait du produit, je mets 4 étoiles 😁",4
155054,"livraison ultra rapide, produit parfait. Très facile à nettoyer, bonne aération de l'habitacle grâce à ses petites ouvertures. super contente et les poules aussi :-)",4
122265,"bon matériel , merci .",4
151095,Vraiment très instructif que ce petit fascicule très bien documenté. Il m'a permis de me rendre compte que malgré mes recherches sur le net pour l'écriture de mon roman en cours je me trompais complètement. Je vais pouvoir rectifier le tir :),4
139497,"envoyé avec de l'avance et bien emballé,rien a redire",4
139682,Après un déboire de livraison tout est rentré dans l'ordre et le produit est satisfaisant merci,4
130688,"Article conforme à notre demande , délai respecté , prix correct , emballage et livraison ok , tout est ok",4
139942,"Marrant, se lit très rapidement.une bouffe d'air frais dans ce monde de brut..en lecture à n'importe quel moment de la journée.",4
151488,"A offrir pour un fan de zelda, plutôt pour un enfant, car le porte feuille est petit, pas assez grand pour mettre tous ses papiers. Et il n'est pas en cuir.",4
128998,Reçu rapidement embalage impeccable,4
140066,"Facilité d'utilisation, compacité, prix promotionnel",4
129009,Installé au plafond dans mon cellier de 4 M par 2.5 : largement suffisant!,4
127478,"Livraison très rapide. J'en ai pris 2 boîtes et dans l'une d'elle quelques mines étaient cassées mais rien de dramatique. Les crayons sont de bonne qualités, agréable à utiliser et les couleurs sont belles",4
142418,Un abreuvoir à poule sert à abreuver les poules,4
141963,"Le produit est arrivé très rapidement, mais avec un défaut (le stabilisateur n'était pas adapté) ce qui rend l'outil inutilisable. Le service client a été réactif et m'a proposé une solution rapidement. Donc quatre étoiles pour ce service (malgré un français un peu approximatif), mais pas pour le produit que je n'ai pas pu tester dans sa configuration normale.",4
147697,fonctionne parfaitement pile fournie juste à mettre les dip dans les mêmes position que l'original et sa fonctionne.,4
129708,le strop est de bonne taille mais le cuir n'est pas très épais c'est dommage .,4
121967,Que 4 étoile car il est un peux limite pour un iPhone 6s Plus Mais sa marche,4
152699,excellent article taille parfaite pas eu besoin d'aller chez le bijoutier reçu rapidement il et trés jolie resiste bien a l'eau je recommande,4
147256,Très bon produit pour les cheveux,4
132762,"A priori ,RAS.A voir dans le temps...",4
156161,Jolies bagues pour petites filles mais fragiles. Achetées pour donner aux invitées de l’anniv de ma fille. Elles étaient ravies.,4
132246,Je ne peux pas dire grand chose pour le moment car il s'agit d'un cadeau de Noël. Livraison impeccable et emballage correct.,4
137271,Super comme il faut et tres bon prix et tres vite livrer et facile a instaler je recommande voila merci,4
156859,Efficace. réduit bien la lumière des phares,4
155155,"Bon emballage, livré au jour d",4
152795,"Article propre, j'aime le style de l’emballage. On apprécie également les 2 vitre pour le prix et puis le kit qui est fournis pour poser simplement et proprement les vitres. Les découpes sont les meme que le téléphone au niveau des capteurs.",4
155261,Pratique pour mettre uniquement portable et clés lors d'une sortie à vélo et qu'il fait chaud donc pas de veste,4
139838,pas facile de mettre les poignées en caoutchouc ! ! ! ! ! ! ! ! ! !! ! !,4
142413,Cable un peu court.... sinon produit conforme à la description,4
136834,Facile à monter....ma fille est ravie,4
136853,"Bon couteau pour l'entraînement, un peu lourd donc peut faire mal au doigt mais on s'y habitue",4
121247,Fonctionne très bien. Conforme aux attentes. Pas cher. Pas d'écart avec un autre thermomètre. Beaucoup plus pratique et hygiénique qu'un thermomètre classique.,4
136816,Arrivé dans les temps embalage nikel 4 etoil pck ma fille ne la pas encore essayé,4
135006,Utilisé pour mes pneus de voiture et la piscine,4
155525,la livraison est assez rapide ce sont de bon produits je le recommande / nos tenues de ski sont nickel,4
142571,Juste un bémol à réfléchir le rabat de la pochette peut gêner pour prendre quelques choses à l'intérieur de la poche principale,4
141875,Pas assez de recul pour le moment.,4
158053,Très sympa effet design assuré ! Petit bémol sur la luminosité mais je suis contente de mon achat!,4
127951,"Canevas complet, aiguille, fils. Mais les fils de coton sont pas de très bonne qualité, ils s'effilochent vite.",4
147202,Bjr! produit très satisfaisant pour sont prix NICKEL Je recommande .,4
129306,article conforme à ce que j'ai commandé mais par contre j'ai trouvé très long le délai de livraison,4
138013,"Bon produit, de bonne qualité ! L'envoir est rapide !",4
149785,"rien a dire sur le produit mais l'envoi n'est pas à la hauteur, le bidon fait 5kg et à chaque envoi l'emballage arrive détérioré, les cartons ne sont pas assez solides pour supporter le transport.",4
140432,"Housse souple parfaite pour petit transport, imperméable. Pour une utilisation non intensive elle est très bien. Je l'utilise pour l'apporter à mon cours de guitare deux fois par semaine. La housse à déjà pris la pluie sans que l'intérieur ne soit mouillé. Elle peut se porter sur le dos.",4
142242,"Très bonne taille, il ne s’agit bien évidemment pas de cuire mais la qualité n’est pas mauvaise pour autant. Par contre, je ne sais pas s’il s’agit d’un défaut de fabrication mais comme on peut le voir sur la photo, impossible d’ouvrir la pochette..",4
150154,"a la recherche d'une caméra sportive , j'ai trouvé celle ci de bonne qualité surtout que je l'utilise en sorties quad, je viens de la recommander à un amis qui a passé commande après l'avoir vue .",4
136314,Reçu sans ruban seul la balance était dans le colis balance super bien de utilisation,4
123222,"Très agréable, tablette fine et légère. Bonne fluidité.",4
150876,Un peu cheap mais pour l utilité qu' on en a c est largement suffisant,4
145700,"Bon rapport qualité prix, fonctionne bien pour le moment, avoir dans le temps.",4
158177,"Idéal pour mixer la soupe, émulsion de fruits et fouetter les œufs.Il est simple d utilisation et facile à nettoyer(passe au lave vaisselle).",4
125524,J'ai employé ce produit pour orthodontie que je pose sur les bagues,4
130038,Coque conforme au descriptif Bon produit,4
131592,Mon fils ce regale avec ce produit.,4
154504,"Matériel impeccable et un bon rendu, seul bémol un côté du plastique fendu et un petit morceau de plastique",4
154261,Bien sent un peu beaucoup le petrole,4
138653,Facile à installer. Ne glisse pas des mains.,4
127123,Adorable petit personnage qui fait sin effet auprès des petites filles,4
146245,On les aime ces chaussettes !,4
134130,"Ce ventirad a donné un second souffle à mon PC ; je recommande ! Attention à la hauteur du ventirad cependant, le mien dépasse un petit peu dans ma tour dans laquelle il était censé rentrer. Cela n'a pas d'effet particulier sur le produit si ce n'est que je dois légèrement forcer sur la tôle de la face amovible de la tour pour pouvoir ouvrir/fermer la tour.",4
125766,"tres bonne batterie, tient bien la charge, qualité / prix intéressant. je recommande cette batterie pour les visseuses Makita. Bien",4
142656,Je m'en sert pour les bras très bien ont ressent pas trop sur le ventre peut être que je fait pas le bon programme ? Il manque une notice plus détaillée.,4
121795,Sympa à lire de temps en temps,4
126566,Achat assez satisfaisant. J'aurais aimé que le yaourt soit creux sous l'opercule mais ce dernier se ferme par un scratch.,4
156259,La Néoprène est de bonne qualité et permet une sudation régulée et sans odeurs. La porter pour la vie quotidienne et le « sport pour les abdominaux » » c’est l’idéal. « je recommande ce produit!,4
6468,"Aucune notice, impossible à allumer encore moins à faire fonctionner. Vraiment déçue",1
14064,"Difficile de juger sans jamais avoir reçu l'article. Heureusement, amazon m'a remboursée rapidement",1
20862,"idem , inutilisable , ne fonctionne pas . dommage car la mesure me convenait , petit et portable mais impossible de le mettre en route .",1
35994,Aiguilles qui reste bloqué au bout de 7 mois très mauvaise qualité,1
27746,"pas pu le garder , extrêmement bruyant",1
37654,"Ce produit n'a pas été ""livré"" mais lancé pat dessus le portail ! Il a été en partie écrasé parle portail automatique.....L'emballage est détruit, mais heureusement le produit n'est pas endommagé......Et ce n'est pas la première fois !",1
15250,"Utilisation une fois par semaine. Le support de pain coulisse très mal, se bloque à la descente ou à la remontée , se courbe alors et va toucher la résistance sur le bord. Disjonction immédiate. Ce grille pain est fabriqué en guimauve, à l'exemple de la plaque de récupération des miettes. Était présenté avec deux fentes et il n'y en a qu'une; j'ai l'ai déjà signalé à la réception, sans aucune réponse d'Amazon !",1
18387,Tombée en panne le 31/07/2018 soit au bout de 18 mois et pas de garantie.....alors que depuis mars 2016 la garantie est passée à deux ans....,1
28565,Toujours pas reçu mon colis,1
29449,"J'ai commandé, 3 tomes de mangas et je n'en ai reçu seulement un sur les trois, de plus le site amazon affirme que tout a été livré ce qui n'est pas le cas. Je déplore le fait qu'il n'y ait pas possibilité de porter des réclamations pour des articles manquant .",1
32921,Pour connecter le psvr et disque dur externe mais cela ne fonctionne pas.sa reconnaît que la manette. Donc je ne m'en sers pas.,1
33703,"Article défectueux après quelques jours , contact avec le service après vente qui dit m en envoyer un nouveau puis plus de réponse ! Très mécontent je veux une solution , échange ou remboursement !",1
17740,"Je voulais un moyen petit et facile à ranger pour faire glisser mes pizzas dans mon four. La planche en bois est trop épaisse et pas toujours pratique. elle fait le boulot 70% du temps , il faut juste espérer que rien ne se colle dessus car la pizza ne glissera plus et là c'est le drame ! Après une semaine j'ai découvert que la planche était en train de pourrir, et que tout pleins d'organismes semblaient se développer à l'intérieur. Bref, poubelle et on va en commander une en inox.",1
32096,J’ai commandé ces attelles parce que j’ai les doigts qui se déforment par l’arthroSe. Ces attelles sont beaucoup trop gros. Peu maniable et le côté rigide est sur le dessus et en dessous au lieu d’eTre sur chaque côté du doigt. Ils sont peut-être utiles pour un doigt cassé mes pas pour dés doigts déformés par l’arthrose.,1
33990,J'aimais reçu. Après de multiples reclamations le vendeur m'a proposé de me le renvoyé ou de me rembourser. J'ai demandé plusieurs fois à ce qu'ils me le renvois. Mais n'ont jamais accepté et m'ont remboursé malgré mes demandes répétés de me le renvoyer.,1
2880,Non conforme pour le Nokia 6 2018 je suis vraiment déçu de ma commande alors que sur la boîte et l'annonce ces bien marqué Nokia 6 2018 arnaque total .......,1
34605,"Alors que le titre, la description et l'image nous font croire à de l'or véritable 22 carats, ce n'est que des feuilles IMITATION or comme vous pouvez le constater sur ma photo. C'est étonnant que ce genre de vente mensongère existe encore !!",1
18357,"Certainement un très bon produit, mais pas du tout adapté pour un gaucher ! Produit inutile pour moi, c’est dommage...",1
36068,J'avais commandé cet article par colissimo et je devais l'avoir aujourd'hui et rien. Je suis très déçu car je l'avais commandé pour l'anniversaire de mon petit fils. Je crois que vous avez perdu une cliente,1
4829,"Après une dizaine de bains, le produit ne fonctionne plus. Trop gros pour un enfant de moins de 6 mois.",1
39208,"Pour couvrir mon VTT qui a sur mon balcon. Je pense qu’avec plus de temps style 2 mois elle aurait craquée . C’est pour toutes ces raisons que je l’ai renvoyé. Sur les photos du produit on a l’impression que c’est une bâche de l'armée qui subit toutes les épreuves météorologiques, mais lors du déballages j’ai été déçu du produit( trop fine).",1
18947,"produit ne sert a rien, aucun resultat avec cette bombes. je suis decu et perdu mon argent",1
36291,"Ces protections ont été mal conçues et s'adaptent mal à l'écran. Du coup, il faut appuyer beaucoup à certains endroits pour avoir une action sur l'écran. J'ai essayé avec les deux produits car je me suis dit qu'il y avait peut-être un souci sur le premier, mais c'est la même chose avec le deuxième. J'ai tout mis à la poubelle !",1
19947,"Marqué livré dans la boite aux lettre , je n'y ai rien trouvé !!",1
543,Vraiment trop cher pour ce que c’est pour le reconditionné,1
4108,On en a pour son argent .... elles se rayent très vite du coup pas pratique ... même emballée elles sont déjà rayées. C'est moche,1
2740,Véhicule puissant mais au bout de : - deux mois : perte d'une vis de l'amortisseur : pièces détachées difficiles à trouver (possible après attente d'une vis d'un mois depuis la Chine). - six mois : la voiture ne peut plus rouler bien que le moteur répond à la télécommande : engrenage moteur usé. Pas de garantie apparemment... à jeter.,1
16742,"Ce tablier est beaucoup trop petit, sa grandeur ne correspond pas à la photo. Dommage car il est de bonne qualité, bien coupé et très joli.",1
31332,Coutures mal faites et pas solides,1
35172,Cartouches présentées comme compatibles avec mon imprimante HP. L'imprimante ne les reconnait pas et affiche le même message d'erreur. 32 euros foutus en l'air,1
36402,j ai acheter les deux en lisant la notice pensait vraiment au produit miracle j ai fait exactement comme c est écris et résulta sert a rien. ça et rien reviens a la même chose pourquoi nous vendre des chose comme ça comme si on avait de l argent a dépenser pour rien trouve çà honteux vous dit pas merci c est un anti rien alors oui y a même une araignée qui était dessus pour vous dire mes attention y a de la lumière LED woua,1
