26723,les prises fonctionne tres bien mais il faudrais penser au personne ne parlant que le francais,1
26,Bloqué dans le Tel au bout de qqs jours! Decevant Je ne recommande pas Je suis en attente de le faire rembourser,1
8401,"Très déçu, ne fonctionne pas",1
30436,"Nul, ne recommande pas du tout ce produit , passer votre chemin vraiment.",1
15168,Le 4ème que j'achète.. Le dernier je l'ai acheté le 30 mars et il fuit un truc de dingue tout comme les 3 autres.. J'abandonne cette fois je vais pas mettre 11€ tout les 3 mois !!,1
25405,"Ne fonctionne pas, le sav n est pas à l écoute.",1
31839,verre trop petit voir photo elle n'est pas adapté au Samsung A5 2017 demande de remboursement,1
37419,"Un brumisateur qui arrose davantage qu'autre chose, ne rafraîchit rien du tout, malgré tout mes bergers qui adorent l'eau se régalent à jouer dessous mais pour l'usage qui lui était destiné ce produit n'est pas du tout adapté... dommage, sinon installation facile, les raccords sont simple à mettre en place, le tuyau n'est pas très long, le raccord au robinet fuit... bref ça peut dépanner en fonction de ce que l'on veut en faire.",1
13665,"Emballage en très mauvais état, carton ouvert et pièces cassées a l'intérieur, très déçu.",1
38631,Ne tiens absolument pas Article de mauvaise qualité,1
12671,"Très décu par le produit, celui livré ne correspond absolument pas à la photo concernant la couleur de cadran",1
27630,Trop lourd pour un rétroviseur.. Je l'ai installé et ça a cassé pour accroche pas pratique !!!! Très déçu à vous de voir,1
10922,"J'ai acheté cette abat jour pour mettre dans mon salon et j'ai été déçu car c'est vraiment petit pour mettre dans un salon sejour séjour c'est trompeur par rapport à la photo je , peut être pour un petit bureau ou des toilettes à la rigueur mais c'est tout je ne conseil pas .",1
4135,je suis déçue par la couleur qui n'est pas rose mais orangée. Je n'utiliserai pas cette couleur qui ne me plait pas du tout,1
1005,"Bof, différent en situation réelle....",1
28178,Cette nappe n'est pas transparente comme on pourrait croire en lisant le descriptif ou en regardant les photo. Elle est assez opaque et pas lisse sur un des deux coté avec un motif strié.,1
6973,utilisation en VTT .... une douzaine de fois. la batterie est deja HS et ne prends plus la charge .... deçu,1
11121,"le produit prevu livré entre 30 aout et 06 septembre, n'est pas arrivé, nous sommes le 08 septembre",1
15716,"Je ne peux rien dire sur ce produit car celui ci n a pas été remis en main propre, pas livré du tout. Très déçu",1
3889,Coque fêlée au bout d’une semaine,1
12858,J'ai acheté ce verre trempé par rapport au prix. Et j'en suis très mécontent. Le premier verre faisais que bouger sur mon écran il ne se collait pas bien. Je l'ai alors changé car je pensais l'avoir mal collé. Or j'ai le même problème avec le second. C'est même pire car de la condensation s'est formé entre l'écran et le verre me laissant avec une bulle d'eau en bas de l'écran. Je déconseille vivement.,1
21575,Fuyez ce vendeur je n'ai jamais reçu l'article et 2 plus il ne répond jamais aux messages pas du tout commerçant,1
36406,"Les 2 verres sont bien, ils rentrent parfaitement sur le téléphone mais j'ai remarqué que la protection ne collait pas parfaitement sur le haut. Petit plus : Il y a avait une coque transparente dans le paquet {EDIT} : Au bout d'un mois les protections sont rayées et gardent énormément les traces de doigts. La vitre arrière se décolle complètement au niveau de l'objectif.",1
11846,Très vite cassée. Dommage.,1
20919,Bonjour j'ai toujours pas reçu ma commande merci je voudrais savoir comment je peux faire je voudrais un remboursement merci,1
7807,N’achetez pas ce verre trempé ! Instructions suivies à savoir laisser poser 9h. Résultat il a tenu à peine une journée. Je ne recommande pas !,1
1963,produit super mais livraison nul le gars a pas trouver mon adresse faut le faire pour un livreur du coup j'ai payez pour avoir ma livraison le lendemain pour rien colis privé mauvais prestataire pour les livraison,1
8068,Les semelles sont en mousse tout simplement. aucun intérêt.,1
13805,"il m est ecrit que j ai recu le thermo, alors que je n ai rien recu.... je cherche a joindre le vendeur, mais il n y a pas l option...",1
18976,jamais reçu déception c'étais pour un cadeau je recommande pas ce marchand,1
27257,On a l'impression que c'est du l'eau ! Je vous le déconseille.,1
11104,"Je n'ai toujour pas recu ma commende , inposible de contactez qui que se soit , dessus , merci de reglez se problemme .",1
29635,Trop déçue …. Les chocolats de Pâques envoyés à mon petit fils sont arrivés tellement fondus et déformés qu'il n'a pas pu les manger. D'où retour à l'envoyeur ! Dommage,1
39324,Dommage que la coque soit bombée n'est pas a plat sur une table Ne fonctionne pas dans les coins du smartphone très déçu du produit.,1
23960,Bonjour. Produit renvoyé par voie postale classique car personne est venue le chercher,1
37917,"Facile à poser grâce au guide fournit avec mais alors vitre de très mauvaise qualité. La première ne se coller pas dans un coin donc il y avait une bulle. Et la deuxième ne se colle pas sur les bords de l’écran. De plus, installer il y a 3 jour et là vitre est déjà fissurée alors que le téléphone n’a pas subit de choc particulier. Je déconseille cette achat.",1
35869,"ça fait chip les faux strass collés ... je ne peux même pas retourner l'article, du fait , d'imprévus , perso, les congés etc, j'ai juste oublié, mea culpa... une autre pochette a fait l'affaire pour l'occasion... il restera dans son emballage... ça ne vaut pas le prix.",1
6432,Article toujours en en attente de livraison 3 jours de retard soi disant 3 tentatives de livraison alors que personne n'est venu ...,1
1611,Ne correspond pas du tout à l Amazfit stratos le verre de la montre est bombée et la protection est plate donc elle bascule et ne colle pas c est une m.... inutilisable surtout ne pas commander c est de l argent perdu,1
3393,Inutile juste de la poudre à effet placebo pour les parents,1
10382,La carte présentée comme compatible est en fait une SDHC donc inutilisable lors qu'on veut une SD. Une belle arnaque.,1
18898,L article réceptionné n est pas celui de la photo. Il est cependant de bonne qualité. Déçue malgré tout.je ne recommande pas,1
7840,"Attention !! Fraude , j'ai été grandement déçu , une carte par booster dont deux ne font même pas partie de cette série !",1
28530,Voilà après 2 mois. Le fil a chauffé,1
38861,"Article reçu sans boîte à chaussure, sans lacet et taille trop petit ! 2 semaine avanr davoir une réponse et un remboursement c abusé sinon les chaussure sont exactement comme sur la photo !",1
21405,"Pas du tout satisfait du matelas. Obligé de le tourner chaque semaine car la mousse a mémoire de forme ""se tasse"". Acheté en 2016 nous avons deja changé de matelas...",1
20909,"Fait un bruit de frottement ,certainement les lames qui frottent quelque part Ne rase pas mais arrache plutôt les poils beaucoup moins efficace que mon ancienne tête qui a plusieurs années . Je m’étais dit pour le prix je ne risque pas grand chose effectivement je n’ai perdu que quelques euros . Amazon ne devrait pas vendre ce type de produit de piètre qualité,cela dévalorise ce site.",1
18276,Assez déçu de ce produit car au bout de 5 jours d'utilisation des coupures réseau sont apparues (l'appareil n'est plus reconnu).... Il faut débrancher et rebrancher l'adaptateur pour que le PC le re-detecte... Cela devient assez rapidement lassant voir inutilisable. Dommage car la finition du produit est plutôt sympa !,1
16992,Galaxy note 9 Il casse au premier impact!! Soit il était défectueux soit de mauvaise qualité.,1
35592,"Qualité déplorable, il aura duré en tout même pas jours ! Les morceaux de plastique qui unissent le tout explosent littéralement à la moindre pression, tout à l'heure en sortant de la douche j'ai eu la surprise de trouver ma fille de 2 ans qui était censée faire la sieste dans son parc en train de retourner le salon, heureusement qu'elle ne s'est pas blessée ! Bref je suis dégoûtée de mon achat parents de jeunes enfants s'abstenir idéal pour un nouveau né qui ne bouge pas du tout ou pour mettre un petit chien à la rigueur bref une catastrophe.",1
18406,J'attends toujours le remboursement de mon article! Je n'ai pas trouvé le lien pour envoyer une réclamation au service client .Est-ce normal?,1
31383,"Contrefaçon, plastique cheep et cassé au bout d'une semaine...",1
10999,"Je ne peu pas évaluer le produit vu que je 'ai commander ce produit le 12 mars avec amazon prime livraison prévu le 14 mars , nous sommes le 19 mars est toujours rien j'annule ma commande je n'ai pas le temps de jouer , soit vous avez le produit est vous le livrez en 1 jour ouvré soit vous vous retirez",1
188,"Très mais vraiment très déçu de ce produit, mauvaise qualité en tous les aspects l’emballage abîmé, la totale. Et en plus livraison en retard comme d’habitude.",1
16237,"Attention, ils envoient les couleurs qu'ils veulent. Je pensais avoir du rouge ou au moins deux trois couleurs différentes mais non. J'ai reçu 5 pièces, toutes grises et abimées. Solidité peu convaincante.",1
22037,"Ce gros livre faisant partie d une trilogie est arrivé très abîmé, enfoncé, déchiré. Paquet Amazon éclaté et reconditionné par la poste.c est un cadeau d anniversaire pour un enfant que je ne peux offrir. Je suis très déçue.",1
33235,"Très mauvaise qualité, beaucoup trop fragile. La bouteille s'est cassée après deux utilisation s je ne conseille pas du tout",1
20795,"Très déçu du produit, reçu dans le carton moitié ouvert et arraché, pas de câble d'alimentation, impossible de le configurer en français il reste en allemand malgré les mise à jour et ne fais que de cracher le processeur surchauffe tout le temps des que l'on lui demande un tout petit peut plus.... Très déçu mauvaise investissement 😡",1
17870,C'est juste une arnaque...,1
28387,"Vraiment déçu par mon kit anniversaire, je l'ai acheté pour l anniversaire surprise de mon fils (20 ans) mais le gros ballon zéro était défectueux impossible de le gonfler , j'étais vraiment dépité, heureusement un de nos invités à couru en acheter un autre en magasin !!! Une chance il y en avait",1
12960,Bonjour j’ai fait un retour demander par téléphone cela fait plus de dix jours c’est un produit qui à été endommagé en faisant mes yaourts la yaourtière à fondue donc vous m’avez envoyer un bon de retour contre remboursement et j attends toujours mon remboursement,1
16731,Je n'ai pas reçu les articles dans ma boite aux lettres comme la indique le livreur,1
34101,"Quand est ce que je vais être remboursé??? car colis jamais arrivé et 3 semaines plus tard, toujours pas de remboursement!!! Donc dure de noter à part le suivi de vos clients",1
10326,"Je n ai toujours pas recu cet article, je ne suis vraiment pas contente car la somme a été prélevée depuis bien longtemps",1
32426,"Très déçu par la qualité de cette article, utilisé 2 semaines en tente en écosse, au bout de 4 nuits il s'est dégonflé tout seul, légère fuite trouvé et réparé, il a tenu 3 nuits supplémentaires et à nouveau il se dégonfle seul, trou impossible à localiser, matelas inutilisable.. dommage, il semblait être bien, plutôt léger mais trop fin je pense.",1
25451,"Je m'étonne qu'il y ait 100 % de commentaires ultra positifs... Alors que le bouton principal (pour allumer, éteindre et faire varier la luminosité), est capricieux et difficile à utiliser. Il fonctionne a priori avec la chaleur du doigt, mais la plupart du temps, il ne réagit que très difficilement. Suis-je la seule à avoir ce problème ? Ajout du 12 janvier, 1 mois 1/2 après mon achat : le bouton est quasiment devenu hors service. Je n'arrive pratiquement plus à allumer ni à éteindre la lampe. Déçue.",1
29470,"Celui que j'ai reçu m'a franchement déçu : matériaux de piètre qualité, assemblage peu soigneux, et en plus il reste des petits residus de fabrication. Une contrefaçon ? Je n'ai même pas envie de l'essayer, pas question de mettre de la nourriture en contact de ce truc. Donc je vais le retourner.",1
6576,ma fille vient de se faire une fracture ouverte de nez en retombant sur la barre métallique du contour. Ne prenez pas ce trampoline... prenez plutôt un trampoline avec le filet qui revient à l’intérieur du contour!,1
20171,La pochette s est arraché en quelques jours très mauvaise fabrication ne recommande pas !!!à éviter verre de protection correct,1
38710,J ai acheté cette batterie au mois de février et voilà ça marche plus déçu car ma fille l utilise pour l école..Je ne recommande pas,1
15096,je suis très déçue par ce produit pas pratique du tout Pas facile à monter (sans notice) un seau avec un engrenage au milieu qui sert à essorer le balai pas pratique un manche avec un système de va et vient pour essorer le balai génant je regrette beaucoup cet achat,1
34835,"Vraiment nul , ah oui il a l’air solide mais je l’ai utilisé 1 fois dans ma voiture et il y a 1 faux contact ...il ne charge pas !",1
38289,"Dans l'absolu, le produit me semblait idéal. Mais à l'utilisation il est très irritant pour le conduit auditif et très compliqué à retirer des oreilles. Sans compter la résistance très médiocre, une des protections à cassé au bout de trois utilisations il a fallu retirer le deuxième morceau avec une pince à épiler au fond de l'oreille. Croyez-moi, cela fait un peu peur quand même. Bref, je préfère l'utilisation des bonnes vieilles boules Quies en cire d'abeille.",1
186,"Non seulement j'ai du attendre plusieurs semaines pour recevoir mon chalumeau, mais en plus il ne fonctionne pas. Très déçue.",1
203,"Article endommagé, bien rayé !!",1
15325,Trop petit pour son prix,1
25715,C'est un scandale je fais ma commande le 15/09 et reçois mon câble que le 28/09 pour au final ne recevoir qu'un câble d'occasion qui déjà servi et qui en plus ne fonctionne pas !,1
7561,J'ai reçu une facture qui était totalement hors normes et absolument impossible à utiliser.... même pas dans le paquet mais sur demande. Hallucinant !,1
37577,"Pas satisfait pour cette fois les anneaux sont plus petits et plus fragiles, je ne les ai pas compté, je ne sais pas si les 100 y sont... Je suis donc déçu et pourtant c’est au moins la sixième fois que j’en commande.",1
33536,"Remplacer des bâtonnets de rotin de parfumeur (chers, mais qui fonctionnent), par des bâtonnets chinois qui coutent pas grand chose, en se disant ""c'est du rotin, ca coute pas plus"", n'est en fait pas une bonne idée : - ils sont beaucoup plus courts que la longueur nécessaire pour un flacon et la diffusion - ils n'absorbent rien même au bout de plusieurs jours - ils ne sentent donc rien 2 euros pour rien, c'est toujours trop cher",1
12216,Impossible à mettre !!!,1
34889,Je n ai pas reçu mes jeggings et je ne sais pas quoi faire merci de faire le nécessaire afin de recevoir ma commande,1
33899,La batterie ne tient pas la charge,1
25181,"J'ai déjà donné mon avis sur cet escroquerie,ils ont gardé mon argent plus d'un mois et n'ont jamais expédié l'article. Je déconseille.",1
11976,Jamais reçu le colis,1
39859,Alors la ne pas acheter .!!! Ne pas acheter ce produit. J ai renvoyer car tout petit. Cela ne ressemble à rien.,1
8385,Bonjour je vous renvoie la tente dans l'état quelle est après une journée. Tente livrer samedi après midi et monter pour le soir . Elle n'a tenu que la soirée elle c'est effondré!!!! Tubes de très mauvaise qualité . De plus les tubes ont percer la bâche.,1
12850,Il m'est difficile de donner mon opinion car elle n'est jamais arrivée... Cette fameuse Ceinture Homme Camping Randonnée Tactique Sauvetage Sangle mili... devrait m'être remboursée ... à voir !,1
15695,Mauvaise qualité. 2 lavages en délicat et le noir n est plus noir petite bouloche qui arrive... Je ne conseille pas ce n est pas un vrai.,1
38295,Déçu par la face avant pixelisee,1
14896,"C'est le 3ième casque de ce type, à un prix équivalent que j'achète, ça sera le dernier, c'est vraiment de la m***e. Au bout d'1 mois (curieusement, juste après que le retour amazon ne puisse plus se faire), le casque le fonctionne plus (impossible de l'allumer ou même de le recharger). A fuir!",1
118,"Pas les bons, il m’on envoyer un complètement hors sujet.",1
28735,Livre pas reçu personne pour vous informer,1
5493,Batterie ne tiens pas Plusieurs applications qu'on ne peux pas effacer Impossible a mettre à jour Surement une vulgaire contrefaçon ... A FUIR,1
39429,Ne convient pas pour le corps,1
26079,La télécommande ne fonctionne pas,1
9780,"Comme disaient les grands sages d'Elmer foot beat, le plastique c'est fantastique... J'ajouterai juste pas pour un lustre car en l'espèce c'est juste horrible ! On s'attend à un style industriel et on a un style ... Sans style.",1
83787,La couleur est jolie mais j'ai retiré la clochette. ça devient énervant de l'entend sonner à tous moments de mouvement.,3
107394,Qualité médiocre mais satisfait les enfants et rempli donc bien sa fonction,3
119023,"Quand j'ai regardé les dimensions, je l'ai vu moins grand ! Je suis déçue aussi par le tissu qui est presque du coton alors que la description disait polyester ! J'avais besoin d'un nouveau sac pour partir en vacances donc je l'ai gardé , mais un peu encombrant ! Par contre, il est joli pour l'été ! j'ai pris le porte monnaie assorti qui est très fonctionnel ! Bel ensemble en définitive",3
115646,La robe est arrivée dans un emballage si petit qu'elle était très chiffonnée. Une fois deballée la taille est bonne mais le tissus de qualité médiocre. Quand au motif il est loin d'être aussi joli que sur la photo... un peu déçue même si je la porterai quand même pour le matin de noël...,3
115171,Ce polar manque trop de subtilité pour mon goût mais force est de reconnaître le savoir faire de l'auteur.,3
104384,"Oui le confort est top, facile à gonfler et on dort très bien! Mais... on dois gonfler le lit chaque soir avant d’aller dormir car il se dégonfle. Pas beaucoup dans la nuit mais il y a un difference. On ne peut pas dormir 2 nuits sans gonfler entre temps car trop mou.",3
95389,Il semble que l'appareil est efficace mais malheureusement une des électrodes est déjà en panne après une vingtaine d'utilisations. Pas 'information concernant le remplacement,3
105667,"Produit de qualité mais délicat à poser car épouse légèrement les bords extérieurs de l'écran. Sinon, belle épaisseur et paraît solide et résistant.",3
108393,"Bof bof, jolies couleurs mais la finitions est mauvaise. Certaines perles sont mal percées, certaines se cassent. De plus je doute du fait qu’il y ait 400 !",3
107849,Ce produit a une belle image et un bon son mais il ne permet pas de lire une clé USB (photos ou vidéo); on ne peut pas changer le format d'affichage de l'image. Ces précisions m'ont été confirmées par le vendeur que j'ai interrogé qui m('a répondu très rapidement. Je recommande ce vendeur mais je regrette le manque d'informations techniques sur ce produit et le fait que le manuel d'utilisation (très petit) soit très succint et en anglais.,3
101944,"Livraison catastrophique, je suspecte que ça pourrait être la cause de pixels morts sur l'écran. Mais globalement l'écran est probablement le meilleur rapport qualité/prix que vous puissiez en terme de contraste, couleur et de taille. Tout aussi bien en bureautique qu'en jeu par ailleurs, grâce à un temps de réponse vraiment peu élevé. Le prix se ressent réellement sur la connectique vraiment limitée ainsi que le minimum syndical pour l'inclinaison de l'écran. Si je n'avais pas été déçue par les pixels morts et la livraison, je pense que j'aurai réussi à vraiment être surprise de cet achat.",3
118027,"produit de bonne qualité malgré le prix trés abordable, il reste toutefois un peu féminin et je l'ai acheté pour mon mari !!!",3
91302,"Attention, mauvais rendu de couleurs ! À moins qu'il s'agisse d'une erreur d'envoie, la couleur Tan (censé être marron à beige) est en réalité complètement jaune, du même jaune que la taie jaune. De ce fait, n'ayant pas de jaune chez moi, elles sont inutilisables. Toutefois les taies en elles-mêmes sont très bien.",3
117890,Une ampoule manquante,3
111706,"Système d'attache des sangles coulissant mais sort de son attache trop facilement, lorsque je cours. (de chaque côté)",3
81044,Produit correcte mais fragile et pas très solide mais qui fait l’affaire selon le besoin.,3
114311,article très fin et pas très fiable,3
112078,Le flacon pompe ne fonctionne pas obligé de l ouvrir à chaque fois......dommage !,3
89969,"pour la cuisine ""ustensiles""",3
81532,pas mal pour le prix mais le pied est un peut petit attention quand on monte dessu il bascule facilement un peut dommage,3
109392,"La lampe est très bien, mais consternant les vernis le conteneur n'est pas efficace et beaucoup suinte malgré tout les couleurs sont sympa et tiennent relativement bien les autres équipements ne sont pas exceptionnel voir bas de gamme mais pour le prix c'est plutôt corect",3
98485,je n'ai reçu que 5 pièces,3
106294,sac pratique mais la qualité semble moyenne a voir comment il tiendra,3
96606,"très grand mais mignon, peut être sympa pour une enfant",3
113144,Je suis déçue par l odeur même gêne un peu.,3
110686,"le titre de l'annonce n'est pas correct ...je me suis faite avoir ! sinon, la qualité semble correcte...donc déçue de cet achat",3
105691,Belle boîte Seul petit problème les charnières ne sont pas de bonne qualité Au bout d’un mois une charnière est déjà enlevé,3
85307,"Reçu avant la date prévue . Bien emballé dans du papier bulle . Je pensais que le mug était plus clair , il est gris donc pas comme sur la photo mais c’est jolie quand même . Il est assez gros . Au niveau des oreilles on voit le collage mais dans l’ensemble c’est un mug mignon pour un enfant .",3
107112,Les valeur du podium être sont pas dune tout correct elle compte des pas alors que je dors et pendant mon travail aussi si je fait certain mouvement du bras Mit à part ce point négatif les valeur cardiaques et tension sont juste Pour le sommeil je regrette que les résultats soit pas en forme de graphique (elles sont en forme de camembert sur l'application) et pas plus détailler,3
95572,Housses de couettes conformes à la photo un peu fines mais pas plus mal pour des lits enfants car rapide à sécher et pas de repassage,3
101463,Nuance difficile à trouver et ne rend pas aussi bien qu'un feutre professionnels . Seul point positif la quantité de crayon recu,3
82725,"Produit moyen, c’est sympa pour garder ses AirPods autour du coup, mais gênant quand ils sont aux oreilles. Un peu déçu",3
108222,J en fais une allergie respiratoire.,3
87568,Trop longue obligée de retoucher la longueur et le rendu cuir n'est pas au rdv mais reste correct pour le prix,3
91090,"Arrivé comme prévu,la baguette est hyper fragile !!, mais la couronne ça va !Mais comme c est pas cher... ça va !.",3
112733,"Difficile à prendre en main avec le système de roulement à bille , comparé à une corde classique. Mais est solide, de bonne facture, légère .",3
83285,Bel écran assez facile à installer. Ceci dit et gros bémol n’a pas de trou pour l’appareil photo avant du téléphone (non adapté au 7),3
84544,produit correct mais mon chat ne s'y interesse absolument pas,3
111060,j'ai déjà acheté flacons de 120 gélules qui étaient beaucoup moins chères. celles-ci ne sont que de 30 je n'ai pas vu la quantité sur le descriptif et me suis fait avoir. je ne recommanderai plus chez ce fournisseur et j'ai déjà trouvé l'équivalent sur autre site,3
103555,"J’ai acheté ces faux cils, il ya quelques jour, mais je n’ai toujours pas réussi à les mettre car c’est super difficile! Mais les cils sont très doux et naturels.",3
92791,Ces lunettes sont bien adaptés,3
84236,"j'aime beaucoup ce produit, pratique, confortable,se maintient bien sur le dos, beaucoup de poches, le Pc portable est bien maintenu et protégé, très content de mon achat.",3
102689,"Très bon produit, il donne de très belles boucles, mais je ne peux pas supporter l'odeur!! C'est horrible !!!! mais je le conseille comme même",3
116075,Dans des sachets plastiques.,3
104583,"Boite très jolie mais fragile , à réception elle etait abîmée le couvercle etait plié très dommage Car pour un cadeau",3
89643,Aspirateur correcte mais impossible de réussir de contrôler l'aspirateur a partir de plusieurs smartphone. Mais sinon il va bien. Satisfait,3
110599,La coque semble de bonne facture je l'apprécie néanmoins le film de protection d'écran est très mauvais j'ai été incapable de l'appliquer.,3
113917,"Produit conforme a sa description et livré dans les délais. Par contre au ne peut que regretter la qualité de l'écran tactile et des photos pas toujours nettes... Le nombre de filtres,... sont limités et oblige à passer par une application en changer...",3
119314,Montre plutôt bien. Juste dommage que tout l'écran ne sois pas tactile.,3
119776,Produit conforme a la description mais le son est pas terrible après pour ce prix la c’est pas bien grave,3
110158,"Bien, sauf que le bouton d’éclairage vibre et fait un bruit très gênant !",3
98511,"Cet ordi fonctionne bien, mais il ne connaît que l'italien J'ai galéré pour changer de langue système, mais toutes les applications office sont en italien aussi Comment les mettre en français ????",3
