24749,写真①明らかに一度開けて、巻き直した感満載 写真②カッターでシールを切って開封したのに、内側にはすでにこじ開けた跡 写真③よく見たら、頑張って綺麗にシールを貼り直している。ズレてますよ。 ということで、一度返品された商品にシールだけ貼り直して納品してきました。 中古ですよね？新品じゃないですよね？苦笑 中古品も含まれるって注釈あるんですかね？当方の見落としですか？ 交換を依頼しようか迷いましたが、この料金の商品を返送することの配送会社さんへの負担とご迷惑を考慮し、今回は諦めました。モノは普通に使えましたので。急ぎ必要でしたし。ま、返品制度がある以上は致し方ないのか。 結論：中古品も届きますので、開封前に注意です。新品が急ぎ欲しい方は、おススメできません。,1
35797,使えるのはBだけでAとCは何なんだよ❗こんなイカサマ品を売るんじゃないよ😠だけじゃあ無かった！一本＋－があべこべになっている❗マルイおかしんじゃないか❗,1
34935,貼り付けは補助シールなどが付いていて、ズレることなく綺麗に貼れたし、気泡も入ったけど綺麗に抜けました。画面もグレアなんだけど少しザラっとしてて、触り心地は悪くない。 しかし、外周部の気泡が抜けません。 そもそも密着してないし、フチが指にシュッと当たります。持った感触が悪く、手すら切りそうなほど。こんなのではフチから欠けてくるのは目に見えている。 横から見たらはっきりわかりますが、ラウンドエッジ構造になっているというのは偽りで、「完全に平面」です。処理などしていません。 ありえません。なぜ素人でもわかるような嘘を表示するのだろう。 カーブ部分まで覆いたいのでこの製品にしたけど、がっかり。ホームボタンも同様の状況で押しにくすぎる。 平面だったらそう表記してくれてれば最初から買いませんよ。 すぐ別のを購入して張り替えたらエッジの処理の差は歴然でした。 ふざけるなという話。,1
9819,ガラスが浮いてます、そもそも合いません、残念です。返金対応はありがとうございます,1
36026,クソつまらない映画！役者が良いのに！これほど最悪な映画ない！！,1
34174,どこにでもくっつく分、ケースには細かい埃がたくさん付きます。そして特殊な素材なので、黒ベースに描かれたプリントは購入して1ヶ月もしないうちに剥げてしまいました。残念です。,1
879,取り付けて3ヶ月で壊れました。 カメラは大丈夫ですが、モニターの耐久性はかなり低いです。,1
33181,中１女子160cm細身ですが、小さいです。ウエストゴムがキツいです。履けません…,1
9217,最低の商品かつ最低の会社です。買ってはダメです。通常のLEDの寿命よりはるかに短い寿命です。クソのように作られてます。中国製品です。テメーの事しか考えてないし品質最低です。買ってはダメです,1
9720,デザインや成形状態・仕上に見劣りはないが、肝心の機能が駄目 バッテリーの端子差し込み部は隙間が少なく、樹脂の差し込み口に当たってバッテリーが挿入出来ない。 無理やり差し込めば入るのかもしれないが、バッテリーの差し込み口に樹脂が挟まると面倒なので無理せず返却にした 使えた人の話を聞きたいね。,1
17896,色間違い。黒を頼んだら、まさかのベージュでした。 これは痛恨。,1
21445,購入したドライブレコーダーの配線固定用に購入しました。取り付け場所の原材料や相性の為か 数日で外れてしまいました。幾度か張り直して、様子をみましたが、やはり車内高温の為か、 貼り付け場所の相性が悪いのか？外れていました。粘着シールが弱いのか？分かりません。 カーショップで「超強力両面テープ」を購入してサイズに小さく切り、サイドダッシュボード や各所に取り付けしましたら、しっかり付きました。屋内で使うには宜しいかもしれません。 残念ですが車様に購入したので自身では「★一つです」,1
27363,タイルの壁に付けようと思いましたが10秒としないうちに落ちます。説明書通りにやりましたが、付属の補強シールは賃貸のため跡が残りそうなので使用できませんでした。イラついて捨てました。星ゼロ希望です,1
10463,保護フィルムには取り付け後に取り外せない気泡がたくさんあるので、私はそれをお勧めしません。,1
20708,電池マーク満タン状態で電源を切れ、おしても、電源がはいらず、再充電したら、画面が正常てきに表示,1
16663,残念でした。本牛革と書いていたので、長く使えるかなと思い購入しましたが、外側がいきなり剥がれるわ、なんかネチョネチョするわ、大外れでした,1
24425,組み立て用のスパナ2個付きのはずなのに、ついて無かった。,1
19892,お金は払っているのに、品物が届いていません。,1
16358,あまり使用する機会がなかったがたまたま5ページ印刷することがあったため両面印刷したら、4→2→3→5→1ページとバラバラに印刷された。データをまともに送れず、順番通り印刷できないとは恐れ入った。（笑） 本製品はA4片面印刷までが限度かもしれない。,1
11836,中国からの直送便で届き到着まで時間がかかりました。金額も安いので仕方ないと思いますが再度購入する事はない商品でした。,1
5679,黄色いヘラは、研磨して使用しないと、フィルムを痛めますので注意が必要。 青いヘラは、一枚、スコッチみたいな緩衝材がついているので扱いやすいです。 スキージは力が入れやすくていいです。 久しぶりに、道具の補強で購入しましたが、価格的には十分な品質かと思います。 ・・・・・・・黄色いヘラには、要注意で！！,1
6922,画面フィルムとの相性が悪いのか、ケースを取り付けて側面ボタンを操作するとフィルムが浮いてしまう。 造り自体はいいです。,1
35530,何時間充電してもつかない… 楽しみにしてたのに残念です…,1
23546,届いた商品が、注文した車用12Vのと全く違う100V商品だったので、交換をお願いして確認して送ります10日～20日位と言われ、それでもいいから送って下さいと言って12日位して送って貰いましたが、以前送ってきた商品と全く同じ商品が、届きました。それで直ぐメール注文した商品を送って下さいと2回、日にちを変えてしましたが、その後全く返事のメールが、来ていません。最悪の事態です。このショップは、信用ゼロです。何処に言えば良いのか分かりません。本当に困っています。ちなみに10月12日に注文した商品です。宜しくお願い致します。,1
1450,広い範囲に散布できることは利点だと思いますが、何より、においがきつくて、鼻がツーンとします。 においの感じ方に個人差があるかもしれませんが、私はもう買いません。 実家の母は、スプレーが広範囲に広がるし、スプレーして1分待てばシャワーで洗い流すだけで良いので、良い商品だと言っていました。 においに敏感な人でなければ大丈夫なのかもしれませんが、他の洗剤に比べてもいいにおいとも言えません。 スプレーして1分待ってもザラザラが残っている箇所もあり、ブラシでなくとも、手でこする必要があります。,1
8354,使い始めて1分もたないで壊れた。最悪の商品です。,1
12487,小指の爪だけが白く変色し、爪水虫？と疑いましたが、介護で忙しく皮膚科が近くにないので、迷った挙句購入してみました。ところがです、広告で謳われてるような効果があるどころか、爪の間に塗り込むと沁みる、沁みる。そして数日で白い部分が広がり、爪全体が浮いてきました。やはりちゃんとしたお薬ではないので危険です。結局かかりつけ医の整形の先生に診てもらいましたが、浮いた爪は剥がさなきゃいけないとのこと。使わなきゃよかったと後悔しています。安易に使うのは非常に危険です。やっぱり無理をしてもお医者さんに行くべきだと強く思いました。こんなの売っていていいの？先生のお話だと白濁した爪はそう簡単に綺麗になる訳はないそうです。ググると悪評と書いて結局広告だったってサイトが複数ありますよね。騙されちゃいけません。 ※追記・・・爪を検査に出してもらった結果が出ました。白癬菌はマイナスでした。爪が白濁した原因はわかりませんでしたが、あきらかにこれを使って悪化したことは事実でした。やたらと宣伝しているみたいだけど買ってはいけません。医学誌もいろいろあってお金を出せば乗せてもらえるものもあるそうです。胡散臭いことこの上ないです。称賛するレビューがありますが、その方のプロフや過去のレビューをよく参考にしてみて下さい。サクラですよ。,1
29076,繋げてみたが、電波は強くなっただけで、凄く遅くなった…期待していただけに残念,1
21985,ジャンク品で購入した訳でもないのにちゃんと機能しない商品が届きがっかりしています。電源SWをONしたらすごいうなり音で音声がまともに聞けなく不快な思いをしていたら、いきなりデッキ後ろにある冷却ファンから異音が出て中のファンが壊れてしまい、ガッカリで外部入力のプラグを挿しても音が出ずとさっぱりです。腹が立つからそのまま放り投げています。通電テストに続いて機能チェックをキチンとしたものを扱ってもらいたい。返品できるものなら即刻でもしたいくらいです。お金の使途の無駄でした。,1
32111,[MENGS] D29mm x H56mm 3/8''ネジ スプリングフック注文しましたが、写真とデザイン、寸法の違う物が届いたので返却しました。,1
28538,可愛くもないし、商品も薄く何に使いましょうって感じ。 水分を吸いそうにないし、安っぽいランチョンマントでした。,1
24355,最初から全く点燈しませんでした。中国製とは言え、欠陥品を出荷するのは信じがたいです。こちらのメーカーの製品の購入は控えた方がいいんじゃないかと思います。サポートから交換する旨の連絡がすぐにありましたが、返品しました。,1
1639,十分大きめのサイズを購入したが、一度の使用で股の部分が破れてしまい手で隠しながら一日滑りました。スポーツ目的の商品なので明らかに強度不足だと思います。,1
33998,重いし、カード入れるとフタがちゃんと閉じてない感じします,1
30352,色が違う 返品しようとしたら届いた前日が返品期限 意味がわからない,1
39737,買わないほうがいいです。 接続できないことはないけど、ABXYボタンが反応しない。LEDライトが光らない。 これだけは絶対に買わないほうがいいですね。,1
19116,例えると、行き付けのカレー屋に行くと新メニューがあったので頼んでみたら 皿に山盛りのクソが出てきた、そんな感じです,1
19717,1歳子どものお出家用に購入しました。 まず、フタがないことに気づきませんでした。そして漏れる。 もともと介護用なのかな？まっすぐ持ってられない子どもには不向きだと思います。 介護用に使うなら星の数はかわっていたかもしれませんね。,1
31352,ちょっと汚れていて残念でした 配送に問題なしです。次回は考えどころですかね、、,1
24430,中国から届きました。2週間は掛かったかと。一先ずは使えています。,1
5499,暑さでダッシュボードに粘着の跡が残ります。いくら磨いても取れません。残念,1
15239,使用して２か月で壊れました。メーカーに保証期間中のため修理依頼をしましたが沸騰するところにフィルターを使っていないと保証対象外と言われました。取説ではフィルターを使用してくださいとありましたが、初めからフィルターなど入っていませんでした。フィルターを使っていないので保証対象外でした。,1
26330,コメント見て購入したのですが、我が家ではあまり好みでないようで、ほとんど破棄しました！,1
2261,あまりに汚くてびっくりしました。メダルを入れる部分がごみだらけでした。,1
4159,字が違う 電話が繋がらない 配送会社に連絡してもらったが、普通は電話してきて謝罪すると思う いつ再発送するかも明記されていなかったし。,1
24594,バッテリーが、はまらない。 バッテリーの固定用溝が小さく、はまらない。自分で少し溝をカッターで大きくして 何とかはめれる様になった。,1
13412,え？普通になんの意味もなかった 前回別の商品を購入してよかったのですが、あえてこの商品を買ってみたら残念でした。 買い直します。,1
19788,2週間経っても届きません。 発送のメールが来てから随分経ちますが、何の音沙汰もなく商品が届かない状況です。,1
22775,安いだけに安っぽい。まさしくシール。立体感がないので、ペラペラですので、接着面同士がくっつきそうになります。貼るときにはしわしわになってしまう。まさしく安物買いの銭失いですオススメはしません。星5をつけてる方々は、おそらく良い壁紙材を使用したことがない方々なのでしょう…。これは恥ずかしくてお客様をお招きできるレベルではない…。,1
31654,耐久性に難あり？ 一週間ほど使用しましたが、ある朝突然R側から音がほとんど出なくなりました。 元のケーブルと交換しようとした際にコネクタの根元からスッポリと抜けてしまいました。 前にあるレビューの方と同じ症状でしょうか？ 音は抜けが良くなりましたが、この値段でここまで脆くては…。,1
31701,新品を購入したはずなのに、包装されておらず、挙げ句の果てには排便の汚れが付着していた。明らかに使用済の中古品。 カスタマーサービスに電話したが、なぜ、このような状態の物が出荷されたのか、本当に中古品なのかの追跡調査は不可との事。（返品・返金・交換を提案するのみ） 今まで、頻繁にアマゾンを利用してきたが、このような事は初めてです。 すぐに使用しないといけなかったので、返品・交換はせずに、入念な清掃・消毒で対処しました。 膨大な量の商品を扱っているので、管理が大変なのは分かるが、新品と記載して中古品が届くのは問題だと思います。,1
2291,お尻よりもまたが痛い。 中央の穴がある周りの縫い目が超絶粗い。 剥がれて来そうな予感。 MTBには向かないね。ロードの長距離用には良いかも。 その辺チョロチョロならいいんじゃない。,1
8595,レビューでこれだけ酷評されても販売を続ける理由をお聞かせください。,1
19146,それ以下だった。低音は割れっぱなしで高音はカスカス・・・ 100円ショップで売ってるようなイヤフォンのほうが10000倍まし。音楽再生には全く不向き。聴くに耐えないのでゲームにも使いたくないですわ。 ま、今回の買い物は大ハズレでした,1
29733,粘着が弱すぎます。 日にちが建つと取れます。,1
18670,うどんを期待して食べるとガッカリします。,1
10971,病院で進められる使っていた時期があります。 たしかに、頭皮の状態が敏感な時やかゆみがある時は使用感さっぱりで良いですが石鹸シャンプー特有のパサパサと香りが継続して使用したいとは思えず現在は使ってません。 夏場の汗をかいた後の自分の髪から、商品の石鹸臭と体臭が混ざって嫌な匂いでしたので（その頃には頭皮の状態が改善してきたので）使用中止しました。,1
34976,商品は 最高^ - ^ でも 空気入れポンプが入ってなかった…から星一つ…確認してから 発送して下さい,1
37104,中国産のウナギで堅くて本当にまずかったです！お腹も痛くなり下痢しました。お金を返して欲しいです。,1
19928,大型トラックに取り付けしました。 購入が30年6月頭でしたが、8月頭に片方が点灯しなくなり1年保証内だったので連絡し、写真が欲しいとの事だったのでメールにて送り代替え品を送ってもらいました。 8月終わりには６月購入したもう片方も点灯しなくなり諦めました。 点灯色は良かっただけに残念な商品になりました。 せめて1年もってくれれば再購入したのですが。 他を購入します。,1
28073,返品交換したい、でも交換方法が解りません。,1
331,買って5日目、使って4日目で急につかなくなりました。 不良品でしょうか？ 元々使っていたものはついた為、車の不良ではありません。すごく良いと思って使っていたのでショックです。,1
35374,扁平足対策にはなりはしない。 だが足の負担は減ったかなぁ() と思うくらい。 扁平足対策では買わないほうがいいと思います。 アーチサポーターを買った方がまだマシ。 それかドクターショールのほうがまだ価値ある。,1
34384,リピートで注文しましたが コズミックブルー、ブラックを注文した際 コズミックブルーが二つ届いてきたのでこの評価です。 以前使用していた帽子は大きさを調整するプラスチックのベルト部分に付いているポッチが外れてしまったため買い直しましたが、今後買うことはないでしょう。,1
20962,本来は〜0です！ 商品が届きませんでした！ここでの注文は〜辞めた方が良いです。,1
3132,期日に商品が届かなく、先にAmazon.comからレビューのメールが届くのがおかしい！,1
12272,2018/06/24に注文して 届いた商品は２枚１組のはずのニップル １枚だけしか届かず、、、。 出品者に連絡して再送するとの事でしたが まだ届きません。 ニップル１枚じゃ使いもんになりません。,1
24264,２０００円のひげ剃りは、髭が濃ゆい、いろんな角度に生えてる人間には、髭剃りきれない。３枚カミソリの方が普通に剃れた。ひげ剃りは高い商品を買うべきだと、思い知らされた。,1
21385,クリームは良かったんですが、これは抜けないし、拭き取りシートで吹いてもなかなか取れず、石鹸で洗っても簡単にはベタベタしたままです。,1
6858,アップルウォッチのタッチ性能を著しく落とします。左右へのスワイプもめちゃくちゃやりにくいし、画面を強く押さないと反応しにくくなった。何度か貼り直しても変化なかったので、こういうものなんだと思う。すぐに外しました。,1
23805,写真で見るのと全然違います。あまりにも細いし、質が悪いです。,1
27633,どれだけ頑張っても気泡が一切取れない。 粘着力が弱いが為に気泡となっている可能性が高い。,1
18490,いつもレビューを見てamazonで商品を購入しています。 隅々まで説明文を見なかった自分が悪いが充電式だと思ったら電池式、交換用ジェルなんてありません。 他のEMSより大きめで効き目がありそうって、全然普通のサイズです。 日本語の説明書もありません。 どの商品のレビューでしょうか？ 届く物はみんな微妙に違うんですかね？,1
12665,香りが全然弱く 楽しめなかった,1
35639,一ヶ月もしないうちに使えなくなってしまいました,1
990,音も大きいしすぐ動かなくなるのでちゃんとしたものを買いましょう,1
25712,買うだけ、金の無駄遣い。利用価値ゼロ。★印を付けたくない粗悪品。,1
36961,他の方のレビューにもありましたが、外箱に直に伝票が貼られて配達されました。不快に感じたのは、封をしてある透明ガムテープが一部剥がれていて箱を開封しているのではないかと疑いたくなる状態だったことと、品物の脚の底に茶色い汚れ(土？)がついていたことです。衛生に関わるもので使用されているとすれば問題です。なので☆一つです。,1
13850,おすすめできません。 角度によっては見えずらいのと 時間を設定してもズレてしまいます。 操作方法も説明書がなくよくわかりませんでした、、,1
3917,常夜灯で使用、全くもって虫よけ効果無し。 効果を確認するため２ｍ離れた普通のLED常夜灯と比較しましたが、同様に虫が集まります。,1
1384,ピン180度を買ったのに150度が混じって入っていた使い物にならない❗ ハイフラになる,1
10780,公共の乗り物で使おうと思って購入。 耳の形のせいなのか、使い方が間違ってるのか、 まったく耳栓の役を果たしませんでした。,1
29086,耐荷重200キロとあるのに会社からの折り返しメール90キロ以内と… 騙された感がハンパない。男180㌢ 体重90キロ…すぐ壊れそうだ。,1
13221,商品が届くのは早かったが、商品そのままで、ダンボールや袋の中に入ってもなく、最悪でした。,1
36271,お得商品のせいか、すぐコンドームが乾く印象でした。サイズも表記して欲しいですね！小さくて装着する際、痛かったですししっかりと装着できなかった。高評価だったので、期待して買ってがっかりしました。リピートないです。,1
7903,使って3日ほどで直ぐに壊れました。 引っ張ったり負荷をかけていないのに断線したのか、右側から音が出なくなりました。ガッカリしました。最低の商品です。,1
18845,商品が到着後、すぐに開封して商品を確かめていたところ、内側にある衣装収納のところのファスナーを下げたとき、片側の金具がすでに外れていました。買ったばかりでの不良が見つかり、がっかりです。値段で決めてしまったところもあったので、やはり少々高くてもしっかりしたものを選べばよかったと後悔してます。,1
13829,海外から注文ですか、こんなパッケージは最悪だった、昔は箱で運送のほうがよっかたです。,1
19558,接続して表示はするが、ちらつきが収まらず、動画を見たり、オンラインゲームをしても、もちろんデスクトップ表示でもちらつきが収まらず、小さなイライラが増すばかりでした。結局接続をやめると元通りになりました。期待していたのにとても残念でした。,1
20904,初めてレビューします。 使用してまだ1週間程度ですが、毛玉と透明な糸が沢山抜け始めました。 そして、レビューでのひんやりするという星五が多かったので使ってみましたが、熱がこもり全然ひんやりしません。洗いに関してはまだしてないので分かりません。 8/20まで返品可能見たいですが、面倒なので使いません。,1
28953,ホットモードにしても全く温まらないため常にEMSモードで使っています。 一応不良品ではないか問い合わせてみましたが一週間経っても返信なし。 現在毎日1時間掛けて太もも、お尻、ウエストに使っていますがホットモードが使えないからなのか変化なし。 安いから仕方ないですね。 多分そろそろ捨てます。 皆さま、せめて公式でこうにした方がいいですよ。,1
