134993,読み終えた後、山中先生との対談で、失敗こそ『自分が予想できない新しいことを知るチャンス』になるのです、辻村深月さんとの、辻村さんのクラスメートになって作品を読ませてもらいたかったです、がとても印象に残っています。村上春樹さんに私、ハマってしまったみたい！も年代を重ねていってハマっていった様子がわかりましたね。 同じ本でも読む年代によって感じ方が違うのは同感です。また人によって同じ本を読んでも、とらえ方は変わってきますので、本選びの参考にはなる一冊です。 まなさんの、語彙力の凄さはここからきているんだな！とつくづく感じました。,4
155874,作る毎に遊べるものが増えていく。 見ていて楽しそう。,4
153488,ひのきの香りがとてもよく、オシッコの臭いが気になりません。 固まりは悪いとは思いません。近くのペットショップで買っていた別のものよりは良く固まります。使い心地も悪くなく、猫も気に入ったいるようなので、リピート中です。 ただ、粒が細かくて軽いので、トイレから出るときに部屋に巻き散らかります。その掃除が大変なので☆-1です。,4
122255,まだ前半しか読んでいませんが、冒頭から面白くて、しかも翻訳が上手なのか読みやすいです。,4
124368,持ち運びも軽くて良かった。枕の高さ調節も弁が付いているので細かい微調整が行えました。簡単に膨らみますが、空気を入れすぎると寝るには少し高くなりすぎるので注意。使った方が良いです。,4
142381,フィギュアの造形は悟空もフリーザもとても良く、特にフリーザは文句なしに完ぺきです。ただし悟空は角度が悪く、台座にセットすると下を向きすぎているため、イメージ画のように2体を並べても悟空だけ下を向いてるように見えてしまうのが残念。顔の造形はいいだけに惜しい。 とは言え、とてもカッコよく出来がいいと思います。,4
129848,旧型HP ノート用のアダプターを裕子活用の為購入。 1か月使ってますが問題なく充電出来ています。,4
136123,2歳の子供用に購入しました。子供用のイヤホンを買い直す予定でしたが、問題なく使用出来ました。,4
139005,塗料も付属で付いていますし、組み立てもしやすいので初心者には良いと思います。部品に多少のサイズ違いがあるようなので、少し手を加える必要があります。,4
157720,肌ざわりもよく、吸水力も有り、他より少し安くてよいです！ 体重10キロ細身の息子、Lサイズ着用で見た目はぴったりです。ただ、他のモノでは言ったことないのですが、おまたが痛いということが何度かありました。ギャザーが深めかも？ 履かせるときに、はさまないように注意してあげれば大丈夫でした。 あとは、厚みがありパンパースなどよりも嵩張ると思います。保育園に持っていく時に気になります。 でも、絵柄も可愛いし！クオリティ高いです。,4
134719,介護には欠かせませんね。他と比べてちょっと安いのもいい。 さらに、開封してもシールで何度も密閉できるがいい。今どき何度も密閉できるのは当たり前といえば当たり前なんですが、いつのまにか乾燥してカサカサになっているという経験を一度もしていません。偶然なのかシールが優れているのかわかりませんが、私の中では高ポイントです。欠点はちょっとティッシュが小さいことかな。もっと面積がほしいときがあります。私は折っておって使いますので、小さくなり過ぎるときがあるんですよね。,4
136304,昔、有名メーカーの物を購入しましたが、それより、小さくて、意外と性能が良いと思います。,4
149887,商品を受け取りにいった ローソンの店員の対応に ムカッときたけど カードの内容は 良かったです。,4
150381,海外でのプールや海用で購入しました。当然だとは思いますが、防水に関しては全く問題ありませんでした。最初につけた時チープな感じがしましたが、実際にプールや海では軽くて薄いのでつけているのを忘れるぐらいでした。文字盤も視認性は高いと思います。,4
141298,朝食にフレッシュフルーツを買い忘れた時、冷蔵庫に冷やした本品が有ると助かります、一人１缶が丁度良い分量,4
135458,第1巻を読み終えた時点での満足度は満点です マンガというよりかは戯曲を読みはじめたかのような感触がありました 今は舞台に人が登場し作品という装置が動き出そうとしている感じです ただこれからどうなるのかによって この第1巻の評価が出てくると思うので 星を1つ下げておきました このマンガのルール 規則性というのはKindleで読んだせいなのか私は まだわかっていません 目次を見ると3人目の途中で第1巻は終わっています となると第2巻も引き続き同じシステム 内容も含めてはたしてどうなるのやら,4
155795,お風呂上りにいつも使用させていただいてます。 カサカサした肌も徐々に潤いが出てきて、シミもあまり目立たなくなってきてくれました。 これはコスパも良いのでしばらく続けてみたいと思います！,4
145614,解像度が高いと思う。取説がもっと詳しくのが欲しい。,4
139438,普段の化粧水に混ぜてもう3年くらい使っています。 それまで肌がカサカサして痒みがあったのが、しっとり潤い痒みがなくなりました！ 値段も手頃だし、是非お試しを！,4
156297,お値段と量を考えたらとてもお得だと思います。 縫い目のあるものが入っていたのが少し残念だったので☆-1です。,4
156922,肌触りもサラサラで心配していたウェストもぴったりでした。 洗濯後がどうなるの試してみたところ、いがいと乾くのに時間がかかります。 でも、気に入ったので色違いを検討しています。,4
132980,皮の触り心地がとても良い やわらかく物を入れても ごわつかなくてよかった 強いて挙げるならば 小銭が少し取り出しにくいとこかな ちょっとだけでも ファスナーがL字になってればよかったかも,4
125951,子供は2歳3ヶ月です。ベビーカーで遠出するのに新幹線や電車で寝てしまった時に抱っこ紐を使いたかったのでこれをサブデカいました。 長時間の,4
125964,半年もしないで底の縫い目から解れてしまいました。レザークラフトの糸(？)を買っきて自分で補修しましたが、最初からボンドなど塗ってコーティングしとくのをお奨めします。それ以外は、サイズ、革の硬さ等満足しています。が、底抜けるのは致命的でしょ…,4
154933,やまぼうしなどの庭木の剪定用に購入。直径５０ｍｍ程度は難なく切れました。切った枝をゴミとして出せる長さに切り、10束くらいにするまでに、剪定開始から3回充電しました。このバッテリの大きさであれば及第点かな。 枝キャッチャーの止めネジが外れて、ソーの歯が当たり樹脂部分が真っ二つに切れてしまい、以後枝キャッチャーが使えなくなりました。剪定中もそれほど必要としなかったのでいいかな。,4
128803,使用上は問題なし、認識もしっかりされた。価格、品質の安定を期待！,4
146463,片付け場所に困っていたポスターを収納できて満足。 へなへなしてないので使いやすい。,4
127105,比較的安価でデザイン、サイズ、保冷力申し分なく使わせてもらっています。 但し、氷や魚が入るとかなり重いのでキャスター付の物が良かったと思います。,4
123202,他の方のレビューにあるように商品の厚みはかなり薄いです。ゆえに軽くてキャンプ道具の収納には持ち運びに重宝しています。 重ねて使用も出来るためもう1個追加購入予定です。今までRV‐BOXを使用していましたがこれで車への積み込みはかなり楽になる予定です。 希望として、せめて蓋だけでも固くて厚くしてくれると使い勝手もよくなって嬉しいです。,4
154570,レビューを見て覚悟はしていましたが、想像以上にオレンジ色のボーッとした光でした。 まあ、買っちゃったしこれはこれで良しとして使います。,4
138150,少し落花生がおおいかなぁと言う印象ですが 再度購入しました！,4
142771,少しハマり具合がきついですが、問題無く付きました。当たりだったのかな？いい商品です。,4
121514,価格と機能、使い勝手はベストな商品でした！3泊の旅行に使用しましたが！ショルダーでも背負うのもバッチリですよ。 バック内の仕切りも価格で見れば、中々です！匂いも気にならず買いだと思います ただロックキーは買い増しの方が良いかな,4
123253,少しキズはありましたが、中古の割には程度は良かったです。これで2400円はお買い得だと思いますよ,4
133191,商品が到着した時はかなり埃があったのでしっかり磨いて使っていますが全然問題なく使えてます。,4
144287,チャイナ製なので心配していたパーツの欠品はゼロで質もgoodです。むしろスペアパーツまで付いておりチャイナクオリティーを見直さなければいけない内容ですよ。 見栄えもカッコ良満とても満足です！,4
144765,価格の割にはとても良い商品。音楽など聴きながら聞けます。2階にPCが有りますが音楽や解説を聞きながらトイレに行こうが、コンクリートの部屋ですが3階に行っても実用になります。他の製品と比べても電池は良く持ちます。音は普通と思いますが、なかなかです。,4
159854,レザインのスーパーGPS用に購入。 センサーの認識が上手くいかないので電池交換を実施。 センサーの認識されたので継続使用中。 工場で電池を入れた時期が全く分からないのでいつ切れるか不安解消のためにも実施。 これなら電池別売りの方がよかった。,4
159079,紛失して『外れる可能性がある』と思い知らされた。 少しでも外れにくいシンプルな（横方向のラインがない）デザインと考え、流用した。,4
125178,安心して使えるものを 購入できました。,4
138823,黒い砂漠用に買い替え。 有線のロジクールを使ってましたが、左スティックの反応が遅延がありこちらを試しに購入してみる。 全体的な作りは樹脂製の軽いコントローラーで値段相応の質感。 PCでの認識は、XBOXコントローラーとして認識してくれました。 ドライバーは特に入れずに認識してくれました。 肝心のX-Inputの切り替えをと思い、コントローラー本体をくまなく調べましたがそれらしい切り替えスイッチは無し。 試しに黒い砂漠で動かしてみると、普通に動きました。自動で切り替えてくれる？仕様のようです。 操作性はスティックが若干軽く反応が過敏気味なので、プレイするソフト側のコンフィグで要調整。 まずますですが、長持ちしてくれることを願います。 なにかあれば追記していきたいと思います。購入時は★４。,4
150470,スポーツ指導の隠し撮りに使用しています。モニターがほしいです。,4
156903,音質がちょっと物足りない。（低音が弱い）,4
125733,27cmキューブ水槽の水換え用のストックとして使用しています． 同じTRUSCOから販売されている20Lコンテナに内寸がピッタリなので，他の水槽メンテグッズと一緒に収納しています． ノズルも水換えにはちょうどよい太さで満足しています． 不満は１点だけ．ノズルの空気抜き穴からの水漏れが目立つので，空気抜き用に小さなキャップ付きの穴を本体につけてくだされば，★5の出来になったのではないかと思います．,4
134434,スマホのバッテリーを買うに当たり、悪い評価がない製品をピックアップしてこれに決めました。 届いた時には、深圳の会社の物で、失敗したかと思いましたが、初期不良はなく、問題なく使えています。 日本語の説明書はありません。どのケーブルが引き抜けるのか、最初は恐る恐るでした。 ケーブルのコネクター部分が弱そうで、やや不安は残りますが、本体に綺麗に収納されるので、持ち歩きにはとても便利です。,4
156401,機材と雑貨が入り必要最低限の大きさのバックを探してこのカバンに行きつきました。機材は、1DX1台、24-105と100-400のレンズ等でどちらかのレンズを付けた状態で収納しています。サイドから取り出させて快適。カメラバックらしくない外観も気に入っていつも持ち歩いています。今のところ大きな不満はありません。使いにくい点もありますが、値段からして、上出来です。,4
127919,論文の基礎的な技術としてとても参考になりました。,4
152152,ポケットにiPhone7Plusが入ったので安心しました。 また、走っていてもずり落ちず良い商品だと思います。,4
133769,ピンは 思っていたより太いと感じました。 届くまで日数は かかりましたが 安く買えたので良かったです。,4
134907,タイトル通りリングがゆるく、すぐ動いてしまう ケース部分はつるつるしている、乾燥肌の人や手袋着用で使う方は滑って持ちづらいかもしれません 追記 レビューを書いたら、販売から連絡があり対応をしてもらえました。 メールの返信等はやく、非常にサポートが良かったので星4にしました。 リングがゆるいのは不良品みたいです。,4
151768,ペットが居るので、これは大丈夫と言う事で購入しています。昆虫などのペットには良くないです。,4
128369,喫煙歴も長くて 「一生辞めれないと」思ってました。IQOSにしてましたが髪や服に臭いが染み付いて(好きな臭いがでなかった)気になりました。友人からDR VAPEを勧めてもらいました。 味もフレーバーも好みでしたので IQOSを自然に辞める事が出来ました。今は、DR VAPEだけとなりニコチン中毒から抜け出せました。（笑）,4
131457,デザインが秀逸です、木のぬくもりが感じられます。シャープなカッティングがとても私は好きです、あとは耐久性だと思います。,4
126018,価格が値打ちだったので、問題点がなければ、いいなと思い購入いたしましたが、市販のmicrSDと変わりせんでしたので、買って良かったです❗,4
150356,薄くてもしっかり締め付けてくれてよかったです。,4
147661,まだ海外旅行には使っていませんが、軽量、8輪キャスターの動きもスムーズ、TSA ロックもあり、安価。あと空輸にどれほど耐えられるか未知数なので、星4つ。,4
139888,問題はやはりバッテリーですね。てっきり単三か単四だと思ってました。,4
139304,レーザーでシミ取り治療をした後のダウンタイム中は、2週間ほど絆創膏で治療した部分を保護しなくてはならないのですが、顔に絆創膏を貼ることにはやはり抵抗がある、というか、恥ずかしいものです。が、このテープを使えば、そのストレスははるかに軽減されます！ 極薄のテープを、薬を付けずそのまま貼り、その上からメイクできるのですが、ほとんど目立ちません。 貼っているのがわからない、なんてことはありませんが、紙絆創膏とは比較になりません。 大きさも数種類有るので、治療している部分の大きさで使い分けられます。 本当に薄いので、扱いには注意と慣れが必要です（私も最初の１枚はダメにしてしまいました）。 価格はけしててお安い、とは言い難いですがほんの２週間ほどの使用です。２箱もあれば足ります。 これまで絆創膏を貼るのがイヤで、レーザー治療を躊躇していましたが、もうこれがあれば安心、って感じです！！,4
156720,これと「ぜんぶ解くべし! 第2種電気工事士筆記過去問」を併用し、勉強期間2ヵ月、1日1時間半を続けて、96点で無事合格。完全文系で普段は事務系の素人。 写真やイラストも多くて、分かりやすい記載。ただし理論の分野に関しては、ページ数の少なさから少し分かりにくいので星は四つ。 ただ試験に合格するだけを目的にするなら、この本の内容で十分。お勧めします。,4
143259,サイズもぴったりでよかった。操作も問題なく行うことができる。つけるのも簡単だった。,4
133627,使用しても、最初走行距離だけ「０」表示のままだったので、故障かと思い連絡を取り、結果左ボタンを押してスタートするということを知らなかった初期的なミスに気づきました。以前はワイヤレス式のサイクルコンピューターを使用していたので、スタートボタンを押す必要が無かったのでこのようなミスを犯しました。他の設定は特に問題なくでき、値段の割にはよいものだと思いました。まだあまり使用していないのでもう少し様子を見てみたいので星４つにします。,4
137383,息子の3歳の誕生日プレゼントにブロックを買おうと思いましたが、レゴデュプロとブロックラボと迷いました。 親としては基本ブロックを多く揃えたほうが想像力が養われるのではとレゴの基本ブロックのセットの購入に傾いていたのですが、実際に店頭で見せると本人はアンパンマンに興味がそそられる様子。 嵌合が緩いとか作りに批判的なレビューも読んだので、デュプロの基本ブロックとアンパンマンのドールセットとの組み合わせでの購入も考えたのですが… ○ブロックに興味があるかわからないし、すぐに飽きてしまうかもしれない ○初めから完成の目標を自分で考えさせるのはまだ難しいのかもしれないので、簡単な組み合わせで完成させられる楽しみを知ることのが良いのかもと思った ということで、方針転換して子供が特に好きなSLマンが作れるこの商品とドールセットを購入しました。 結果、組み立てた後に動かして遊ぶことを楽しんでいるので不正解ではなかったかなと思います。食玩で出ているブロックラボのキャラクタードールも増やして自分の世界観で動かして遊んでいます。 やはり嵌合の悪さは気になるので、自分で考えて作りたい様子があればデュプロや互換性のあるもので基本ブロックを増やしていければ良いかなと。 使う目的が決められるようなラベルが貼られているのはつまらないなと思っていましたが、それはあくまで親の目線かなと思いました。,4
132726,強いて言えば、持つところを長くしてほしい。,4
123445,専用ソケットを使用しないと、脱着ができないので、盗難防止としては優れていると思いますし、見た目も通常のナットとは形状が違うのでGood!です。脱着にはインパクトレンチを使用しているのですが、外したあとに専用ソケットにナットが密着してしまい、ソケットからナットを外すのにコツがいります、注意してください。,4
158806,コスパは相当高いものの、音がうるさく周りが騒々しい所じゃないと使いづらい。笑,4
138856,この値段で、画質も思ったよりよく、アタッチメントも十分付いてきてよかったです。 自転車での利用ではどうしても激しくブレますが、それも愛嬌だと思って遊んでいます。 一点残念なのは、バッテリーを入れ替えると時刻設定が初期化される点でしょうか。毎回、手動設定するかスマホとWiFiで繋いで時刻同期するのがちょっと手間です。,4
123264,アンパンマンのお絵かきはすでに2こ持ってたのですが長距離のおでかけがあったので持ち運びに便利かと思い購入しました。2歳娘がとても喜んでます。 旅行から帰ってきたらお絵かきの表面がぽこぽこになってしまっててスムーズに書けなくなりましたが、持ち手がついてるので嬉しそうに持ってウロウロしてます。,4
153583,長いこと使用しています。一年ぐらい経ちスポンジ部分にカビが生えてしまいましたが、漂白剤に浸けてきれいになりました。冬の入浴後、冷えてしまった水滴を布で拭くのがつらかったため購入しましたが、今では一年中ないと困るものとなりました。浴槽の向こう側にある窓の水滴を拭くのにも、柄が長いため苦ではありません。,4
147108,中古と言っても過不足ありません。満足です。 エアコンほどではないと思いますが、やはり点けていると部屋の湿度は下がります。 整理整頓出来ていない部屋でも火事の心配無く使えるのはとても便利です。 数日留守にして冷え切った部屋を暖めるのに、風が出ないのは、部屋の温度が上がるまでの間に寒い思いをしなくてすみます。 ただタイマーが独特なので最初は戸惑いました。 すぐ慣れますけど。,4
128722,少し柔ないから安定性はあまりないかも でもこの値段でこの可能性なら満足です！,4
138890,高さ10-40ｃｍくらい、幅3ｍくらいの真っ暗な隙間をのぞきました。 光の届くのは1ｍくらいでしたが、自動でピントも合い、結構はっきりと映ります。 照明が点かなくなりますが、カメラはＵＳＢ接続ですので、そのままにＰＣにつないで見ることもできます,4
159154,女性誌で見かけたり口コミの良さに惹かれて目元用を買い、なかなか良かったのでこちらを購入しました。 通常２枚で700円ちょっとするので、お得感があります。 使い慣れていない立場からするとパッケージだけ見ても何の事だか解りませんが、週の真ん中である水曜日と週末の２回使用するというコンセプトで、８枚入りなので４週間分＝28日という期間になります。 ●使用感 水分が垂れてくること無く顔にフィットするマスクです。 その反面、広げる時に折りたたまれた部分がくっついて簡単には広がりません。 特に視力が悪く裸眼でしようとするとマスクのふちが見えにくいこともあり骨が折れます。 それぞれのマスクにはツボに当たる部分がプリントされているので、そこを押すと「成る程確かに分かりやすく押せて効果が出そうな気がする」と感じます。 ●効果 私は目の下のくまとくすみが気になって使っていますが、それに対してははっきりとした効果は感じません。 ただ、５枚で7～800円の商品と比べると流石に価格の違いもあってか肌の潤い感が違います（夜パックして翌朝顔を洗うと実感）。 ツボに関しては疲れている時は特に目頭が効果を感じます（見た目の変化は微妙）。 ●総評 ついつい他のお手入れ用品もアレコレ試したくなる質なので、週２回を忘れがち…（効果を感じていれば浮気しないんですが）。 使い切るのに１ヶ月以上はかかると思うので、リピートは未定です。 シートタイプのマスクを使いたくなったらこの商品はなかなか良いかも、という位置付けです。,4
132226,飽きやすい猫なので、先っぽが多くてよかったです。 羽根が色違いで4個くらいあったので、もう少し違うものも入ってたらよかったです。,4
