55460,湾曲部分が覆えないという話は見てましたがどのぐらい気になるのかは個人差かあると思うので試してみましたが、流石に両側もう1mm伸ばして欲しいかなと思う横幅でしたね(^_^;) 幅による使いにくさで大幅減点ですが、それ以外は五点でもいいかなというレベルです。 覆えてる部分は操作しやすいですし。,2
46956,アプリが中国なのかな？日本語にはなって使えるけど中国アプリは嫌なので使ってません,2
65690,届いて驚いたのは、バリだらけ、先もタイヤに傷が付くほどの切断状態でした。 急ぎで使いたかったので、返品はせず グラインダーで角を取り使用しました。 今後の為に、工具屋で再度購入！,2
71874,すぐ鼻が出ます。もう少し一体感があったほうが良い。ネックウォーマーとしては首が重くなるし、いまいちでした。,2
50365,中古で使用ができるものの、かなり汚れが激しく、これならいらなかった。,2
66019,ガラスケースが歪んでるしサイズがあってなくて使えない｡これでこの値段は高すぎる｡返品したい。,2
71981,ペラペラで丈も寸足らずで、ディスカウントストアで一枚100円で似たような品質のが売っていました。 裾も丸まってしまいます。 でも、ペラペラなので着膨れせず、なんだかんだで重宝しています。,2
70528,"4,5回トライしましたが麺の表面だけが茹でられ、中は粉っぽく食べれた物ではありませんでした。 後悔しております。",2
43311,正規品より時間が短い気がします。 コスパは良い。,2
53966,保管には、いいが持ち運びで重なり使いにくい。,2
43942,パラソルが固定されず、ぐらつきがあり、風が吹いたとたんパラソルが飛んでいってしまい、穴が空いてしまいました。きちんと固定されていれば飛ばされないのかもしれません。,2
44691,いつも買っています。 購入してちゃんと確認しなかったのが悪いですが、後ろの灰色の紙とその前の2L版などを入れるポケットが剥がれていました。 買ってから時間が経っているとはいえ、これはアルバム。 保存しておくことが前提なのに！と思いました。,2
44934,デザインはよいが、逆さ構造からか？畳んでも太く大きいが、広げた大きさは小さく肩とか背中が濡れる。バックパックを背負っているとカバンはびしょ濡れ。もう一回り広いものが欲しい。,2
71227,喜んで遊んでいました。 耳や角、前足と噛みつきやすい 部分があり、引きちぎられてしまいました。,2
58521,とにかく、本体から化学薬品の臭いがきつく、リフト1本乗っただけで、装着をやめました。 また、ミラーレンズの外縁部がオレンジ系から青色に変化している部分が、使用した際に、不自然な光の変化をして、左右の外側部分が見にくくなってます。 バンドも写真では丸い囲みにL7のロゴがあしらわていますが、ロゴは無く迷彩柄のみとなっています。 救いは、付属のハードケースがしっかりしていので、評価は1点を加算して2点としました。,2
65253,良いんだけど、すぐダメになる！ 樹脂の中を金属の玉が水圧と共に回転するんですが、樹脂が削れてすぐダメになります。これは純正品でも同じ事なので、本体の金額がいくら安くてもパーツが高いので、高いパーツ買わなきゃ使えないのは大不満です！！,2
56864,洒落にならないレベルの粘着力でうっかりしてると明後日の方向にくっついてしまうこともあるくらいの接着剤です。 強力です。優秀です。 接着剤は。 その接着剤が強力であるがゆえにスプレー糊としては噴霧しきれず糸を引きながら飛んで行き対象物に斑に網掛けのように付着します。これってどうなんでしょう。均等に糊がのって欲しいペーパークラフトの工程でコレは向いてないかなぁと思います。 その辺の安っすいヤツか７７が使い勝手では上かと思いますのでご注意ください。,2
69311,シルバーが緩くて外れやすいです。 落としてないか気にしないといけないのでめんどくさい。 交換してほしいです。,2
40478,思ってたよりも薄いマットです。 寝つきが良くなった気がします。,2
49027,新品購入なのにシリンダーを回した後が・・・。こんなもんなんですか？,2
58060,上の部分は気に入りましたがスカートの部分は自分の体型と似合わないので返品しました。生地も良いしオシャレです。この値段ではなかなかない商品ですねー,2
58738,"手間取ったとかはなく問題なく貼れました。 付属品は、説明書（手順記載）、wet（アルコール）とdryのクロス、ホコリがついた場合の粘着性のあるシールと、あったらうれしいものが最低限入っています。 もの自体は問題ないため、あとは経過による変化で評価したいところですがそれよりも気になる点が。 画像右下ですが""made in china""の文字があります…。 商品ページには国産の記載があった気がしますが、これはどういうことなのでしょうか。 ページ記載の内容が嘘であれば他の記載も良いように書いてある可能性があるので、疑ってかかることをおすすめします。",2
59327,安物です。すぐに折り曲げ部分が剥げてきます。当方は極力鞄に入れてますが、もう少し綺麗な状態を保って欲しかったです。ズボンの尻ポケットなんかに入れていれば１か月も持たないうちに剥げるかもしれません。,2
69015,添付取説通りに操作しましたが、うまく作動しません。 そこで、電話でオペレーションの問い合わせをいたしましたが、YouTubeにマニュアル掲載中とのことで、 そちらで試すとにしました。 しかし、それに従っても未だ正常な作動をいたしておりません。 YouTubu画像の動画速度と実際の動作速度が同じでないため、何度かやり直さなければならない。 両方のスピードをシンクロさせて、音声も入れば使いやすくなる。 もう少しやっても合わなければ、再度コールを入れます。,2
77873,購入したものの、まだ少ししか使用できてないのでなんともいえません。,2
63669,長いこと勇気がなくて観ていませんでしたが、多くの人が言うとおり映画としての出来は役者含め最悪でした。冗長でテンポもよくありませんしそのほかのダメ要素も枚挙にいとまがありません。 しかし、あの原作にあった醜悪な人間の行動を技法はともあれ表現しきったとも言えると思います。 特に牧村家の惨劇についてはその描写含め最小限のデフォルメでよく頑張ったと評価して★を２つにしました。原作のあれをあそこまで映像化するのは相当勇気がいることだと思います。子供の頃に原作をリアルタイムで読んで未だに頭に焼き付いているあの美樹のシーンはさすがにマイルドにはなってましたが、それでも十分に永井豪の残酷表現を感じられるようにはなっていたと思います。,2
55812,flacに対応していない為、自分の使い方では買った意味がなかった,2
52666,12月2日到着予定でしたが、12月13日に受け取りました。届くか心配にぬりましたが、無事届いて良かったです。,2
78610,リモコンで切り替えが出来るのはとても便利なんだけど、スピーカーの切り替え表示用の画面が点灯しなくなりました。 返品しようか考え中です。切り替え時のリレー音が大きいすごく 耳障りだ。,2
54784,確かに細く削れます。でも結構力いるし、細く削れたから塗りやすいかと言われたらそうでもない。使い方の問題かもだけど言うほど感動的なものでは無いように思う。,2
79303,見本写真で1枚目の写真と、サイズが書かれた２枚目の写真では違うモデルですが、１枚目の物が届きました。 旧モデルでしょうか？,2
54206,子供用電動カーのバッテリー充電のために購入しました。 バッテリーの容量自体が空になっていたためか、充電するのに3日ほどかかりました。 まぁ、こまめに充電をするのにはいいかな？っと思ってます。コンパクトなんで場所もとらず良いです！ ただ急いで充電したい人にはオススメいたしません。,2
69634,もう少し、長くないと、周りの景色が入りきらない。 「帯に短し、たすきに長し」といった所。,2
59043,今までは、ディスカウントショップや、作業用ショップで 冬、防水で雨に強く暖かいの使ってましたが、 自転車で20分は、とても指先がかじかんでしまっていたので この商品を購入しました。 やはり、防水です。歩きには暖かいです。待ち歩きにも恥ずかしくないです。 が、自転車通勤には不向きでした。,2
41895,デザインも音も問題ないと思ったのですが、イヤホンと充電を同時につなぐと片方の音が全く聞こえない。ケーブルを少し動かすと聞こえる、という現象でした。前に買った別の製品はプチプチとノイズが多かったが、この製品にはそれが無く、いいなと思ったのですが。。。 接続不良なのでしょうか、交換をお願いしました。返品して別の承認にした方が良いかな？,2
48354,全面が欲しいと思い、ご購入しましたが黒い部分はプラスチックで出来ており使っていくとだんだんプラスチック部分がカパカパしてきました プラスチックだとちょっと心配でした,2
54557,3シーズンに最適！ダウンなので肌寒い時は暖かく、暑い時は涼しく使用出来ました。 軽くてコンパクトに付属のスタッフバッグに収まるので移動時の持ち運びにもとても便利です。車に積んで置いて急な温度変化の時に毛布代わりにも使えます。馴染んで来てからの使い心地はとても良いです。 ただ、初使用の時の羽毛の匂いがキツかった事と虫が混入していたのか、、 洗濯せずに使用し始めた際、内ももなどに複数の虫刺されがありショックでした。>_< 直ぐにビニール袋の中に熱めのお湯と洗剤を入れて口を締め30分程置いてから手洗いして天日で乾燥させました。 以後はダウンがフワフワになり、羽根の匂いも取れて、虫刺されもなくなりましたが、 ショッキングでした！ そんな事があり星２つにしました。 クレームして良いものか迷って、結局は自分で処置しましたが、たまにクリーニングした方が快適に使用出来ると思います。,2
76164,ポケットラジオのアンテナとして購入しましたが、付属のイヤホン兼用アンテナの方がノイズも少なく聞きやすいです。何もないよりはマシ程度のレベルでした。,2
64299,使い始めて約1ヶ月経ちましたが軽くぶつけただけで角から割れました。 コツンと当たった程度で割れてしまったので残念です…,2
64965,買った時は使えたのですが、久し振りに使おうと思ったら両側とも使えず。 試しに開けてみたら、筐体の片側は溶けて、もう一方は焦げていました。 数回しか使っていないけど危険なものだったのかな？,2
48779,品物が2品届いた。私のミスだがメールして問い合わせしたが返事がなく同じ商品が2品ある。 まだ使ってない。でも庭の芝、植木に使いたい,2
53188,可もなく不可もなくってところ。 ただ、頭が折れやす過ぎる。,2
79258,ハーネスを通す部分に切り込みがなく、ハーネスを完全に外してからではないと通せません。 つまり、使えませんでした。,2
41961,すぐに使えなくなって4本あっという間に使い切った。安いから仕方ないかと思うけど早すぎる。,2
58135,商品の枠部分に小さなヒビが入っていた。 そろばん自体は普通のそろばんだが玉がプラスチックなので安っぽく軽い,2
59993,写真からもわかるように、かなりスペースを取る商品。電源ケーブルは１メートルほどのため、設置する場所も結構限られる。 ２点気になるというより、人によっては致命的な内容が、機械油の匂いがきついこと。パンに匂いが移るというレベルではなく、周囲に漂うレベル。もう一点が４枚切りに対応しているため購入したが、かなりギリギリのサイズ。入らなくはないが、パンのタイプによっては引っかかって跳ね上げられない可能性があるので、火災の原因にもなりうる可能性あり。,2
49987,一月ばかり使用してからの投稿です。 モードは５つありボタンを押すたびに変更しますが BGMが邪魔で仕方ない BGMの音量やOFFにしたいが音量変更はできず OFFは５つのモードの切り替えによってOFFになりますが 暖めとマッサージを使おうと思うともれなくBGMがついてくる・・・ ちなみにBGMは内側（目が当たる辺り）から流れます。 そのため塞ぐことも難しいです。 まぁ、操作が一つのボタン押して切り替えるだけなのでお年寄りにはいいかもしれません。 ちなみにマッサージの効果は余り感じませんでした 暖めなら蒸しタオルの方が優秀なのでそれが使えない場所での利用を考え中,2
47250,値段が安く見た目も無難かと思い購入しました。 長所と言えば安いこと無難なデザイン 短所は全体的にクオリティーが低い このケースを購入される方へ見た目はそこまで酷くないですがクオリティーは低いと思ってください、一時的や短い期間仕様するなら問題はありません,2
65719,テープを剥がすのに一苦労しますが、時間的に余裕がるなら、安いし良いと思います。,2
67535,最初に戸惑った以外は普通に使ってますが、お金のある人は普通に新品を買ったほうがいいですよ。,2
74227,電源が勝手に落ちる、画面が固まって操作できない、画像が悪くなる,2
78130,狐のお嫁ちゃんと優しい主さまのほんわか日常漫画だった前巻からガラッと趣を変え、この巻から猟師漫画へと舵を切りました。 猟に関する蘊蓄は某山賊漫画の二番煎じ感がぬぐえませんし、ケモノがヒトの武器を使ってケモノを狩り、ヒトのカネを得るという一連の行動に釈然としないものを感じました。 何より大事なパートナーである主さまの存在感が激減し、(多少の見せ場はあるものの)大部分で記号的な解説役、驚き役になってしまっているように感じます。 この漫画の主題や主軸となるテーマがぶれているように感じるのは私だけでしょうか? 次巻への期待を込めて星２つとさせていただきます。,2
59905,泡立ち、泡切れはとても良いですが、匂いがキツイです… 柔軟剤の様な匂いで、気持ち悪くなります。 それ以外は良いだけにとても残念です。,2
48950,使い勝手は良く、いい製品でしたが買って7ヵ月で、バッテリーの持ちが悪くなりだし、その後、充電できなくなり、画面が真っ暗になり、故障しました。買った後は保証書を保管することをおすすめします。,2
49175,質感安っぽさが無くて他の品より作りも優れている。風の強さは弱め。写真の青い物の方が明らかに強い風が出ます。その分静かな設計です。羽が本体に対し小さすぎるせいな気がします。 思っていたよりデカく思いのでしっかりしたところにした固定が難しい。ベビーカーのフードは無理でした。比較写真を載せました。 初日に接触不良なのかライトはつくが羽が回らないという故障が発生。本体を羽を回すように大きく振ると動き出したりします。これでは使えません。,2
54813,軽量と書いてあって買ったのですが、重かったです。,2
62768,この時期のせいもあるが、一部腐ったもの、傷ものが数多くあり、冷所においても2〜3日でカビ発生したみかんが数個、又数をサービスで余計に入れた為、数の重みで潰れたりで残念な事に,2
75589,素材や構造は最高でしたがワイヤレス充電ができない！,2
45467,風で骨がねじれるようにグンニャリ曲がりました。全体的に耐久性が足りない気がします。,2
53168,フィルムの吸着力よりも、フィルムを保護しているフィルム（伝わりますでしょうか？）の吸着力が強いので、貼り付けた後に保護フィルムを剥がすと本体フィルムも一緒に剥がれてきます。最初の1枚はそれでダメになりました。 また、貼った直後はかなりヌルヌルとした手触りなのですが、1週間ほどで指が引っかかるようになりました。,2
52673,iPhoneからAndroidに機種変し、lightningケーブルが勿体ないなと思って探してたどり着いた商品でした。 接合部の ガタツキが酷いのですが、新しいケーブルを買い足したりせずに済んだのでよかったです。,2
62465,開けた瞬間匂いがキツイです。 妊活のため購入しました。葉酸サプリを購入するのは初めてで、レビューも高いしお値段もお手頃なのでいいなと思いましたが味、匂いともにキツくて続けられる気がしないので星二つです…,2
64245,値段が高い割に耳が痛くなります。 サイズは大きい方がいいです！,2
45640,通常使用３日で折れて使えなくなりました。大破しました。 Amazonで返品＆返金してもらえました。 Bluetoothでブチッ！という音が頻繁にします。 重くてずり落ちて来るので、歩行中には使用できません。 光が一定ではなく少し強弱があるので可愛いです。 ボタンが多いので手にとってよく確認しながら使うかんじです。 実用性はとてつもなく低いです。,2
74147,床が冷たいので、あったかいのを探してて買ってみましたが、床のつめたさは防げませんでした。 じわりじわりと足底からくる冷たさは、普通のはスリッパとかわらなかったです。,2
41562,期待した程、得る情報はなかったです。初めての人にはいいかも知れないですね！,2
60139,どうやら、USBの端子が弱いようです。接触不良で、交換となりました。アマゾンの返品期間はすぎたので、エレコムに電話して対応してもらいました。噂ほど、ひどいサポートでは無く、すんなり交換品を送ってくれました。(^ ^)ただ、製品はしっかり作ってもらいたいですね。,2
64912,アトリエさくらの前作が、評価が高かったので、期待してましたが・・・。私がエロゲーで楽しみにしているのが、フェラシーンとチュパ音、最初のシーンは舐めるだけ、次のフェラシーンは期待を裏切り物で、男の脚で口もとが隠れてしまっている。何故そんな絵を使うのか？これだけで、このゲームを買った事を後悔しました。,2
40790,音が途切れることが多々あり少し不審に思った,2
57320,３０分も座っているとお尻が痛くなって来ます。まぁ、価格相応という事で。,2
48871,折りたたみ傘は携帯するためにあるものだと思いますが、これは携帯して持ち歩くには少し重くまた太すぎでした。 仕方なく車専用にしました。,2
42086,作るのが難しく間違えてくっつけると、外せず壊れてしまった。 子供には少し難しいかも,2
70515,写真も多く、上質紙仕様です。何回も読む、見ながら実践していくには良いのですが、紙の質を落としてももう少し内容を充実させて頂き価格に満足するようにしていただけたら嬉しいです。あまたあるコーヒー本の中で一つ抜けてほしい,2
46551,想像はしていたが、黒のラインは伸縮の際にすぐ取れてしまう。 まぁそこは想定内だったからよいけど、思ってた程、タイト感がなくてソックスともストッキングとも言えないどっちつかず！,2
52322,iPhone7と同期しなかった。 というより時計のほうのボタンを長押ししたがなにも起きず、設定画面に行けなかった。,2
70592,ラベンダーの香りはします… が…アルコール臭が強くて…鼻にツンとるきます… リピはないかな…,2
65319,装着して数日で剥がしました。次の3つの点が気になったので星マイナス3にしました。 理由 1. タッチ感度が悪くなる 2. 画面表示部分よりわずかに小さい 3. 指紋（手脂）が残りやすい 今はエレコムのNova 3用フィルム（108円）に代えて満足しています。,2
65363,英語がわからない私にとって、使えるようにするまで大変時間がかかりました。,2
74421,マニュアルは英語。日本語マニュアルはなし。簡単なので困ることはない…と思うけど。 音は値段（約2000円だった）を考えるとキレイかな？☆+2 ただし、頭の音がきっちり入らないです。0：02秒くらい遅れて再生されている。 遅れてる部分はカットされてしまっています。スピーカーとして致命的なので☆-3 防水性と利用可能時間を加味して☆+1 サイズとデザインの良さは嫌いじゃないので、おまけして☆+2,2
50997,23センチの息子にはキッチリでゆったりではなかった。軽いのは分かるが、値段通り予想通り薄っぺらく底に厚みがない為普段ばきというよりビーチ用かなぁと。あまりに薄すぎて抜けはしませんがバランス悪くて転びそうになるようです。,2
70167,商品説明でお絵描きにも、と描かれていたので購入してみたのですがダメですね、ペン先から線がズレてしまいます ゲーム等の使用なら問題なく使えると思います。 デザインは気に入ってたので残念ですが、この値段のものなら仕方ないのですかね お絵描き目的で買われるのはやめておいた方がいいと思います,2
41646,貼り付けてから一ヶ月ほどですがフィルムの外側にホコリが溜まりインカメのレンズにも小さなチリが侵入しました。最近顔認証が出ないことや反応しなくなることが多くもしかしてと思いフィルムを外しキレイにしたら直ったのであまりおすすめできません。 それとしょうがないことなのかもしれませんがどれだけ正確にフィルムを貼り付けてもフィルムの縦の黒い縁にスマホの画面が被ってしまいます。気になる方はやめておいたほうがいいとも思います。 ただ貼り付け自体はとても簡単でした。,2
44382,なにも知らない人は勉強になるが、すでに基本を知ってる人には役に立たない。 小説みたいで読みにくい、ほとんどが自分の経験ばかりで個人個人に活かしにくい。 言葉のチョイスや使い方がイマイチわかりづらい。,2
73509,初めてPITAKAを購入しました。デザイン等は気に入っているのですが、がたつきがあります。高いだけあってショックで返品したいです…。,2
53605,髪が長いのでキャップ自体が子供向けのような気がしました。少し小さい気がします,2
