48253,utilisation dans un diffuseur électrique a froid pas d'odeur dommage,2
50089,"Au bout d' 1 mois, panne de micro > mauvaise qualité. Trés deçu par ce prodruit, je demande un remboursement !",2
72389,"Décodeur déjà utilisé, revendu défectueux !",2
52945,"J'attendais mon tire-lait avec beaucoup d'impatience, malheureusement celui-ci ne s'est jamais allumé, que ça soit sur secteur ou avec des piles. Comment faire pour récupérer un nouvel appareil en état de fonctionnement ?",2
69703,N'a senti réellement qu'une petite semaine. Cher pour ce que c'est ...,2
58686,Pas très résistant au bout de 1 semaine déjà casser ! en meme temps vus le prix je comprend pourquoi il est pas très resistant je vous le déconseille fortement,2
48117,"Je l'utilise principalement chez moi, il est un peu rigide. Il s'est cassé au bout de 6 mois.",2
47277,"La combinaison est juste pas du tout conforme à la photo ... C est une combinaison que l'on peut trouver a quelques euros toute fine , même matière que les charlottes ( pour protéger la tête ) néanmoins le masque est de très bonne qualité.",2
71776,Pas tres solide c est cassé en quelques jours,2
50841,Trop petit pour un lustre plafonnier mais pas déçu,2
68300,Pas de tres bonne qualité. Les raille cassent très vite,2
79913,Attention Un seul autocollant acheté 4€ !!!!!!,2
61246,"je trouve ce produit utile, car il y a plusieurs taille, mais la branche et bien trop fragile et se tord facilement...",2
49205,"Nous avions prévu d'utiliser ce produit pour un anniversaire mais le produit est arrivé trop tard par rapport à la date de livraison prévue. Nous ne l'avons donc utilisé.. dommage... Cependant, d'aspect extérieur le produit semble conforme à la description.",2
55665,ancienne génération de led minuscules . à éviter.,2
61027,"Ne réchauffe pas du tout, j'utilise dans mon studio mais même à côté de ma table de nuit ne chauffe pas mon lit",2
43611,"Malheureusement taille trop petit , il a l’air de bonne qualité , bien emballé , conforme à la photo , dommage",2
57905,Beaucoup trop dosé pour moi j'ai rue des problèmes de santé au bout de 2 jours j'en ai parlé à mon médecin qui m'a dit de retourner le produit,2
74688,"J'ai utilisé les 2 présentés dans le pack: - la 1ère fois, on pouvait apercevoir une espèce de quadrillage et il n'y avait aucun signe d'une bonne adhésion. Au bout de 2 mois, je galerais pour tapoter sur l'écran. - la 2e fois, toujours aucun signe de bonne adhésion comme on peut le voir sur les autres verres trempés présents dans le commerce. Et d'ailleurs ça a fait des bulles.",2
47718,je l'ai trouvé moins enlevé que d'autres du même auteur,2
76977,"je n'ai pas réussi à le faire fonctionner avec mes appareils, un peu déçu de mon achat, mais c'est comme ça",2
56037,"Les seules point positif étanche et incassable. Le reste nul pas de mode d emploi succinct le moyen âge pour taper un sms , une seul sonnerie nul son abominable belle image.",2
72654,J'aurai bien aimé tester ces boucles d'oreilles mais je les ai payés et jamais reçu contrairement à ce qu'il y est marqué je n'ai jamais était livré donc un peu déçu car j'etais contente de cet achat :(,2
75050,"Je ne sais pas si c'est normal, mais après chaque utilisation, je vois trouble accompagné de légers maux de tête",2
76705,"Pour une taille 10 c'est vraiment très serré, prendre la taille au dessus s'il y a. Par contre la matière est très solide.",2
54415,"Le cordon tient bien mais les menottes commencent à rouiller/s'abimer aprés seulement l'avoir porté quelques jours, sûrement à cause de la transpiration et diverses éclaboussures du quotidien. Joli bracelet pour le temps d'une ou deux soirées, sans plus...",2
43927,"Extrêmement déçue, le produit est pratique, seul bémol le bouchon s’est fendu au bout de deux utilisations. Je ne recommande pas cet article.",2
74993,...peut-être un peu trop... L'écran est un peu trop recouvert à certains endroits notamment en haut,2
79078,"Le prix attractif m'a fait choisir ces ampoules mais je suis déçu : éclairage trop faible, bleu en feux de croisement, jaune en pleins phares... et passent tout juste au contrôle technique je vais devoir envisager un remplacement.",2
56689,Vraiment un produit bas game je pence que ma nièce ne va pas sauter au plafond en voyant en voyant sont cadeau Noël,2
66209,"pour cette bague, la couleur de la pierre est vraiment pas naturelle",2
75761,"J'ai acheté ces rustines dans le but de réparer des chambres à air de VTT. Elles sont trop grandes pour réparer de simples trous d'épines. C'est surtout quelles sont trop épaisses et manquent d’élasticité. Au regonflage elles ont tendance à se décoller. J'ai du recommencer et chauffer la colle et la rustine au sèche cheveux pour l'assouplir, là ça a marché. Le problème c'est qu'en rando dans les chemins il est difficile de faire suivre le sèche cheveux, je n'ai pas de rallonge électrique assez longue.",2
40442,1 adaptateur sur 2 fonctionnes inadmissible,2
77721,L' Esthétique du réveil est correct la luminosité est trop forte Les réglages sont trop compliques et l’arrêt de la sonnerie très difficile a trouver . Je l'essai encore 2 jours et je le retourne,2
40698,J AI RECU DES PIECES POUR UN MICRO TOUR. CE N EST PAS CE QUE JE VOULAIS,2
55387,"Comme d'habitude, avec l'électronique une chance sur 2 de se planter... Et bien planté! en panne au bout de quelques utilisations",2
72559,"Au début, j’ai trouvé ce livre presque désolant par le manque d’originalité, mais l’histoire évolue positivement. Les personnages sont très imbus d’eux-mêmes.",2
56752,Déçue du temps d'écoute pas même 2 heures d'utilisation,2
72350,"J'ai acheté cette moulinette en souvenir de celle qu'utilisait ma mère et qui lui a servi des dizaines d'années pour nourir une famille nombreuse, sans faillir. Celle ci est toute petite, ne tient pas bien en main; les ventouses vertes se déboitent tout de suite de leur montant en métal, il faut sans cesse les remettre pendant une seule utilisation sinon les pieds sont complètement instables. Impossible de raper des carottes tellement les lames ne tranchent pas. Le plastique blanc a été teinté par les carottes sans pouvoir le nettoyer au bout de 5 min. d'utilisation seulement. Ces 5 minutes nous ont d'ailleurs suffi pour nous dire qu'il fallait absolument rendre cet appareil. Je mets 2 étoiles plutot qu'1 parce que le produit nous a été repris immédiatement et nous avons été remboursés sans pbm",2
46538,"Bonjour, Le produit n'est pas conforme à la description: les dimensions du miroir sont de 23 x 117 cm, et même en mesurant la largeur totale avec les molettes latérales, cela fait 28 cm.... J'ai été déçue de la qualité du produit: Des trous ne sont pas en face. (difficiles pour mettre les vices) Des éléments sont de travers, et d'autres ""enfoncés"". Ce produit ne vaut pas son prix. Cdlt",2
57339,Pas de Manuel pour monter la chaise un peu déçu,2
62977,"Protégé matelas, que je conseille pas trop, j'ai des draps noir qui on déteint dessus, alors que j'ai jamais eu de soucis auparavant. Mis à part cela ça va.",2
54389,"Réglage taille très difficile il faudrait que je puisse enlever un demi maillon pour bien faire !!! Puis le fermoir n'est pas du tout sécuritaire, il s'ouvre tout le temps (avec une montre chère c'est prendre de gros risques). Donc je ne peut pas recommander ce produit.",2
71254,"Le verre n'est pas adapté à l'écran du P8 : il ne colle pas sur les cotés et fait une grosse bulle, le trou prévu dans le verre pour l'objectif frontal n'est pas au bon endroit, les coins en haut dépassent carrément de l'écran ce qui le fragilise. De plus il est hyper fragile, il s'est cassé au bout de 2 jours. Je ne recommande pas!",2
53858,"bon sans plus, reçu tout émietté et pas très ""gouteux""",2
47014,pour un enfant ce livre est très bien pour s'entraîner mais les dessins sont pas beau à voir et donne de très mauvais exemple au enfant,2
70066,Je ne sais pas si c’est parce que je ne sais pas m’en servir mais ça ne défroisse rien du tout. Moi qui pensait dire adieu à mon fer à repasser :( tanpis,2
62458,"Mais déçue car impossible à installer sur mon ordinateur, le périphérique n'est pas reconnu...Mystère, il faut certainement que je persiste..",2
48944,"commande effectuée une seconde fois, car le premier n'a fait qu'une semaine... un fil a cassé juste après la soudure, bref je recommande, mais l'article reçu est le même mais avec les clignotants intégrés.... ce que je ne voulais pas....",2
48082,"Corrsepond pas à mes attentes livraison ok emballage ok juste une remarque ! devoir mettre "" commentaire un peu long à soumettre """,2
72400,"Bonjour, Je les ai acheté pour les bons commentaires, mais je suis très déçue. Le résultat ne me convient pas alors que j'ai une nature de cheveux à peine ondulée mais avec un effet mousseux que je n'aime pas. J'utilise depuis longtemps des plaques mais celles-ci, soit brulent les cheveux par ce que trop fortes, soit ternissent le cheveux à températures plus basses.",2
68235,"impossible a faire fonctionner sur un port USB3. Lecteur micro SD déjà en panne. pas cher, mais ne vaut pas plus.",2
72485,"ridiculement petit, je m'attendais quand même à quelque chose de plus grand. heureusement que c'étais aussi un petit prix. tant pis",2
65167,"J'ai acheté ce produit pour ma fille, pour assister au mariage de mon frère, la robe n'est pas de très bonne qualité, mais elle taille bien.",2
69558,"Bonne accroche avec Free mais le modem s'éteint quand il atteint une certaine température,il est donc impossible de le charger et de l'utiliser en même temps.",2
48530,Je n’aime pas du tout l’odeur on dirait du jasmin c’est très fort et le produit n’est pas du tout efficace,2
42673,Je suis très déçue car je l’ai depuis une semaine et le revêtement part . Qualité / prix : très moyen,2
49444,"En lisant les commentaires, je pensais avoir affaire à un produit mieux pensé : 1 - il glisse en avant et en arrière, il se cale dans les fentes mais il n'est pas bloqué au bout. 2 - il est difficile a retirer, vous pouvez donc abandonner les rangement en dessous 3 - comme il se met dans les rails, on ne peut plus refermer le couvercle du rangement 4 - le chargeur étant a gauche, on ne peut pas avoir un étui folio de téléphone ouvert (si il est retourné, son épaisseur empêche l'induction de charger) Dernier point, mais là c'est de la faute de Tesla, le transformateur 12V branché, on ne peut plus fermer l'autre trappe (celle qui se referme en pivotant)... La prise 12V est très mal placée Bon point quand meme : il fonctionne. Dans mon cas je ne m'en servirais pas, je vais rebasculer sur une charge simple par cable. Moins innovant mais plus pratique.",2
41697,"Ce n est pas "" petit livre "" c est plutôt mini livre...un peu déçue car les recettes ne correspondent pas aux précautions à prendre pour le cholestérol car par exemple on propose un gâteau avec 6 oeufs .Il y a un réel problème de logique",2
57829,"Pour des impressions en noir et blanc, ça va mais dès qu'il y a de la couleur, le jaune par exemple vire en vert !",2
63150,"Bonjour , Pour un article de très bonne qualité , garanti 1 an , est il normale qu'au bout de 16 mois la fonction téléphone soit HS ? Je fait confiance à vos services afin "" d' approfondir "" la question . Cordialement.",2
67143,"Le produit a la base est sympa, je l'ai pris pour que mes filles puissent s'asperger d'eau pendant la canicule, mais au bout de 30min il y en a deja un de cassé ... j espère que les autres dureront plus longtemps",2
46149,La housse de couette et les t'aies d'oreiller sont très jolie cependant pour le prix je trouve la qualité moyenne j'ai découvert deux coutures en plein milieu de la housse avec des fils tiré heureusement je les pas commander en grise plus claire également!! j'avais vu un commentaire négatif et positif j'avais hésiter puis finalement je suis déçu alors je recommande pas !!!!,2
62627,"Je viens de recevoir le livre avec une livraison super rapide ! Gros bémol il n’y a pas la carte officielle du métro de New York, ni la carte de Manhattan, ni même les deux planches de gommette prévu dans la pochette au début du livre",2
63912,Cette lampe n'est pas rechargeable et trop gros pour les activités extérieures. Lampes a gardé au fond du tiroir et a utilisé en cas de coupure de courant. Ou pour les agent de sécurité,2
45584,"Produit pas chère mais ne dure pas dans le temps, car elle jauni au bout de quelques mois d’utilisation (pourtant j’ai jamais les mains sales ou grasses). Côté protection c’est bien, elle est plus fine qu’une Spiegen par exemple donc on profites un peu plus des courbes de l’iPhone X.",2
48773,"Le premier est tombé en panne au bout d un mois, remboursé de suite. Acheté un second à suivre ... nous avons passé une de belle soirée de nouvel an avec ... chouette souvenir !",2
67913,"Le jouet est très rigolo, ma fille a adoré... mais il ne fonctionne plus au bout de seulement quelques semaines (même pas d’ailleurs si on compte en nombre d’utilisations...). Je suis extrêmement déçue. J’ai changé toutes les batteries mais rien n’y fait. Le tracteur est cassé et ma fille très triste.",2
55334,Au bout de quelques lavages des trous apparaissent au niveau des coutures uniquement sur les noirs,2
67688,"Malheureusement, le produit ne fonctionne pas comme je l'espérais, alors oui quand on branche un cable ancienne génération dessus, on peut recharger le téléphone, par contre les données ne sont pas converties. impossible de transmettre du son via ce port de substitution, du coup l'achat ne me sert à rien.",2
49290,je ne peut pas utiliser tout les outils car les mandrins sont tous du même diamètre j ai envoyé plusieurs mail avec photo a l appui je n ai eu aucune réponse,2
64758,"On aime ou non, affaire de goût. Mais ce qui ne relève pas du subjectif, c'est qu'un coffret de 24 CD de 50mn en moyenne, en 2019, ça frise l'indélicatesse.",2
64744,Ce systeme de filtration est peu effice et revient tres cher dans le temps. Meme si ce systeme est compact et qu il est tres esthétique il n est pas efficace et coûte cher.,2
62240,Ne convient pas aux led,2
120533,Petit meuble sympa et pratique . Attention les étagères ne sont pas hyper robuste.,4
130342,"Quatre étoiles pour le prix , ça essuie , mais un essuie glass est bruyant (le plus court ) , pas des plus agréable ; gomme peut être un peu dur , a voir dans le temps.....",4
157658,"Ravie par le fait de retrouver une vérité : l'argent ne fait pas le Bonheur... J'ai aimé l'histoire , le contenu facile à lire et les personnages. Je le recommande vivement..",4
130330,"Acheté pour un mariage, le résultat est fabuleux. Le produit est conforme à sa description et contient le nécessaire pour le poser dans les cheveux mais je retire une étoile pour la pause que j'ai effectuée chez un coiffeur car toute seule la manoeuvre est un petit peu compliquée.",4
150000,Trrs bonne trousse piur stocker les 120 crayons de couleurs qie j ai. Manque une place gomme et taille crayon pour être parfaite,4
154485,Très légère parfait très content,4
124385,Des gants de bonne qualité mais la taille est du côté petit. J’ai commandé la taille L (comme mes Nike d’avant) mais les gants sont un peu serrés.,4
140405,"Pleinement satisfait de mes achats sur amazon.fr Ils correspondent à mes attentes, d'autant que c 'est pratique de les recevoir à la maison et dans un délai rapide.",4
137589,"bonjour, je l utilise pour mon paramoteur je vois quand ma voile est gonflée au dessus de ma tète .",4
131184,J’ai offert ce CD à ma mère pour Noël. Elle était ravie.,4
153591,"Satisfaite de ce produit fonctionnel, très grand correspond à la description je recommande",4
121657,C'est un bon étui pour qui veut emmener sa tablette avec lui en permanence sans risquer la casse. J'ai mis un peu de temps à choisir ce modème mais je ne regrette pas.,4
142611,Très bien bonne qualité,4
136987,"Prix abordable. Livraison rapide. Il ne faut pas s'attendre au 10ème près de degrés mais indique bien si fièvre ou non. Intérêt majeur, pas besoin de toucher l'enfant ou l'adulte.",4
148230,"Facile à mettre mais difficile à enlever, je pense qu'en cas de chute le S10+ sera protégé. Sinon par rapport à la façade avant, je pensais qui était semi tactile. Au moins il est compatible avec la charge sans fil. Je peux regarder mes vidéos tranquillement avec le rabat spécial ou bien les regarder avec discrétion par la façade avant. Tout est variable, c'est très intéressant. Mon Smartphone est Protégé, merci .",4
133995,"Ma fille l’aime beaucoup elle a mis son panda et ses livre, J’ai eu un peu de mal à le monter",4
152982,"J'ai du attendre très longtemps, mais comme il n'y avait pas urgence, mon imprimante marche encore. Prévoir du stock !",4
154683,Très bonne qualité d’images mais compliqué à installer. A distance l’appli bug faudrait l’améliorer. Sinon à domicile c’est nickel.,4
127551,je n avais pas l intention de l acheter mais ma sœur m a convaincue.. Depuis quatre personnes de mon entourage ont acheté echo alexa. je trouve cela pratique pour les recettes de cuisine elle calcule par rapport au nombre de personnes. les playlist de musique de tout les genres et aussi les quiz; Je ne regrette pas mon achat.,4
142625,UN PEU MAIGRICHONNE MAIS RESTE TRES JOLIE PLAIT A MON FILS QUI LES COLLECTIONNE.EN PLUS INTERACTIVE; RAVI DE MON ACHAT.,4
149857,fixation un peu légère mais très bon produit autrement.,4
141083,"Joli design, petit, peu encombrant. Les boutons ne sont pas forcement très facile à manipuler sur tout pour le réglage du son mais cela reste correct dans l'ensemble.",4
134936,Bande adhérente bien mais adhère moins au bout de 3 utilisations mais pour le prix vaux le coup.,4
132626,Coorespond à la description. Livraison rapide. Le 1 er envoie avais un souci et aussitôt signalé c était réglé aussi rapidement. J apprécie. Et cette marque ne déçois jamais,4
154264,Pour moi c'est meilleur de prendre celle de tournesol plutôt que celle de soja ! Le soja contient des hormones qui ne sont pas recommandés pour la santé,4
136328,"Très bon produit, déjà testé, à part un petit coup de main à prendre, mais vraiment on a enfin une technique pour ce faire les ongles sois même sans se prendre la tête, je recommande vivement ! Petit retard de livraison de 1 jour, un détail... 😁",4
157375,"Cet article m'a été recommandé par mon dentiste, je ne suis pas déçu et l'utilise plusieurs fois par jour. Je le recommande.",4
157813,Manque de piquant sinon très bien,4
125792,"Produit reçu dans les plus brefs délais, une équipe qui semble se soucier de la satisfaction client au vu des mails reçus (ce qui est rare). Produit conforme à la description, il y a qu'au niveau de la touche espace que la coque ne se fond pas à 100% mais rien de bien dérangeant. J'avais déjà un clavier transparent mais en noir ça fait bien plus propre. Très satisfaite, je recommande.",4
130689,"Je l'utilise depuis 3 jours. En même pas 5 mn (à condition de l'avoir fait préchauffer avant d'y entrer) on transpire vraiment beaucoup ! La chaleur est forte mais supportable sauf sous les pieds en ce qui me concerne, j'ai donc déplacé le panneau. Il apaise aussi très bien les douleurs musculaires. Par contre, ne conviendra pas à quelqu'un de très grand à moins de trouver un siège plus bas qu'un tabouret par exemple. Prévoir un drap de bain à mettre sous votre humble postérieur pour ne pas inonder le fond du sauna et ne pas glisser en sortant. Le cordon d'alimentation est un peu court. Prévoir une rallonge ou placer votre sauna pas loin de la prise. En résumé, je suis ravie de mon achat et le vendeur est très agréable et réactif à la moindre question. Renseignement important donné par ce dernier : La télécommande n'affichant pas les températures mais des niveaux, le premier est de 40 ° C et chaque niveau supplémentaire est augmenté de 5 ° C A voir sur la durée.",4
130751,"Un peu déçue de la qualité car le téléphone ne tient pas en mode paysage, la housse a tendance à se plier. Mais dans l’en Ça reste un bon produit, surtout pour le prix.",4
142057,Bonne bouteille qui évite d'utiliser les bouteilles plastiques. La version 1l est suffisante est bien. Seul reproche le prix que je trouve excessif,4
138980,"J'ai été surprise par la grosseur de la brosse. Heureusement, le fait qu'elle soit ovale la rend facile à manipuler. Je l'utilise en finition sur cheveux séchés pour mettre en forme la coiffure et cela donne de bons résultats. Attention, elle est adaptée aux cheveux mi longs et longs. Elle a un bon rapport qualité prix. Le point négatif est qu'elle est très bruyante.",4
146677,Nul pas de mode solo,4
145504,"Très pratique, dommage qu'on sente autant la protubérance en tenant le téléphone a une main, mais contrairement a la version usbC ça reste acceptable",4
129533,bon maintien du poignet pendant mes séances de sport même si ce n'est pas excellent mais vu le prix faut pas trop en demander. Suffit pour ce que je m'en sert (tous les jours),4
129023,"Prix très convenable par rapport à ce que l'on peut trouver. Pas encore utilisé, mais taille idéal pour clôturer pour des chevaux !",4
151818,"J’avais regarder la série puis maintenant je lis le livre. Très bien quand je lis je revois les images que j’avais vu dans la série. Bien mis à part la page de couverture qui est très rayé, ce n’est pas grave pour moi mais je préfère le préciser.",4
159370,pas beaucoup utilisé mais très silencieux,4
146566,"Le produit est entièrement satisfaisant et exactement comme sur la photo et comme décrit. Les flacons ne fuient pas et la vaporisation est bonne. Par contre, il ne faut pas être pressé, la livraison est extrêmement lente - 5 à 6 semaines.",4
154080,"Produit qui n'a pas encore été testé, car acheté pour faire le chemin de St Jacques de Compostelle. Semble actuellement convenir à son usage.",4
143793,Son de qualité. Facile d'utilisation. Léger.,4
140624,Je ne peux pas marquer un commentaire étant donné que je n'ai jamais reçu le produit . Par contre je vous remercie pour le suivi et l efficacité à répondre aux emails,4
128075,"Super, nous en avons acheté deux pour la déco de la chambre de bébé et les deux fonctionnent avec la même télécommande. Le petit adore le rendu sur le mur.",4
151270,"un tres beau livre, de qualité et très complet dans ses explications , chaque lame est décortiquée et les méthodes sont interessantes!",4
120651,Correspond a la description semble fragile.jeux de lumières fidèles à la description.bon achat pour le prix.produit recommandable pour qualité moyenne,4
126520,"Reçue avec les attaches plastiques cassées, mais cela ne m'a pas dérangé car j'attache les élastiques à mes jantes alu. Convient parfaitement à une twingo 3.",4
145788,Reçu rapidement produit conforme pas encore utilisé mais parfait à première vu,4
124751,"Ce livre permet de se recentrer sur l'essentiel nécessaire au passage du code théorique. Le livret annexe permet de s'entrainer sur quelques tests 'type'. Le point positif de ce livre étant qu'il est synthétique, c'est également son point négatif avec un manque de détails sur certains sujets",4
147843,"Bonjour, cette lampe suspendue est très jolie et de bonne qualité. L'éclairage est faible mais très décoratif dans mon saule pleureur.",4
125135,"Marre d'avoir mon reflex en bandoulière ou baladant à la sangle, j'ai opté pour ce bidule très pratique. On ne sent presque plus l'appareil. Attention toute fois à la plaque en métal qui viendra entre la partie supérieure et inférieure du bandeau de sac à dos, qui pourra potentiellement être gênant selon les morphologies de chacun avec des vêtements légers. La platine est à serrer avec un outil de préfère afin d'avoir un serrage optimal. La ""languette"" est difficilement vissable à la main. Sinon rien à redire, on a un sentiment de robustesse et de qualité de construction, mais portant pas loin de 1000€ à l'épaule, je garde tout de même la sangle autour du cou par précaution.",4
154216,Coupe bien mais s'use vite. Normal vu l'épaisseur. Ça reste un disque de coupe donc rien à redire pour le prix,4
123212,"Si ces produits sont toujours un peu chers. La qualité est au rendez-vous et mes enfants en sont très contents. En tant qu'adulte, je confirme que la finition est bonne et que les produits durent dans le temps.",4
134679,Super contente! Chaises très belles!! Ça été vite livrée. Faciles à monter mais il manquait la pièce pour viser correctement,4
129021,Tres bon spa pour le prix,4
120532,petits caractères mais bien,4
123183,produit conforme à la commande,4
120664,Pratique de bonne longueur,4
126205,"Tondeuse puissante, peu bruyante, bien finie et agréable. Je recommande pour des petits jardins. Produit assez cher mais comparable aux prix de la concurrence. L'achat d'un lame de remplacement est peu excessive.",4
130219,"Article conforme à la description. Bien transparent, malgré certains avis qui disent le contraire. Peut-être avaient-ils reçu un modèle différent ? Peut-être un peu lourd niveau poids.",4
128477,C’est ce que j’attendais,4
156083,Pratique en dernière minute! Simple à utiliser,4
