180481,Très belles assiettes. J'aime beaucoup la couleur. Beaucoup plus jolies que des assiettes en plastique classiques. Elles me servent encore.,5
160748,Acheté pour mon fils de 3 ans. On aime beaucoup car il y a les photos en papier pour le faire sur ça. C’est bien pour commencer à faire des puzzles et il adore car c’est des personnages préférés.,5
169394,La protection est super efficace. Très bonne qualité. Je suis content de mon achat. C'est un ami qui me l'a recommandé.,5
199658,"J'ai utilisé ce styler pour la première fois aujourd'hui et j'en suis absolument ravi, ainsi que le petit canon idéal pour les cheveux plus courts comme le mien. Tellement satisfait que j'en ai commandé un autre. Je le recommande vivement.",5
191343,J'ai acheter pour mon.bebe mais tellement utile et complet. Satisfaite de mon achat j'ai pris pour ma soeur qui attend un bébé aussi,5
162265,Très pratique et bonne qualité.,5
167293,"Protéger les coins d’un tableau veleda suspendu à une porte. Après quelques semaines d’utilisation, les coins sont toujours bien adhésifs et évitent les chocs et le balancement sur la porte.",5
171172,"Le produit correspond parfaitement, utilisation remplie toutes ses fonctions. Attention juste a être correctement outillé pour le changement de la pane, la goupille fait un peu de résistance.",5
170538,"Ma fille adore toujours sa veilleuse nina. Les chansons sont mignonnes, je recommande.",5
171346,Pour la pluie petite fille de 4 ans rien à dire correct,5
196593,très beau livre vu par hasard sur les réseaux sociaux très belle surprise en tout cas j'ai beaucoup de plaisir a le mettre en couleur les dessins de femmes sont très fin. les pages ne sont pas épaisses mais bon ce n'est pour ma part pas trop grave vu que je colorie la plupart du temps aux crayons et c'est un dessin par page.,5
163933,Très belle qualité. Livraison sous 48h. Parfait.,5
161786,Livré en temps et en heure. Correspond parfaitement. C'est vraiment des Converse et pas une vulgaire copie.Recommande l'article.Mérite les 5 étoiles.,5
178838,Elle est génial. Sur mon lit c'est le top. Regrette pas mon achat,5
180221,"Les Bruder sont solides et réalistes. Je peux que recommander cette marque. Par contre, à savoir, cette remorque se met que sur le tracteur bruder mais pas sur les camions.",5
195331,"Excellent produit ! Effet naturel, facile à passer avec le gant, sent bon , ne fait pas de tâches . Trés satisfaite de cet achat. Dommage que le prix est augmenté depuis .",5
174698,Je l'ai acheté car j'aime cette marque et les coloris sont jolis,5
194368,"Un ""jeu"" simple, mais qui peut réellement avoir un effet positif sur votre couple, permettant d'exprimer des émotions relationnelles au quotidien.",5
189276,Arrivé dans les temps en bon état,5
190637,Satisfait du produit,5
175146,Ce produit est utile pour une douche avec murs revêtus de céramique et permet de ne pas percer. L'adhésif est super et le panier chargé sans penser à sa chute!...,5
178218,Magnifique rien a dire bonne qualité beau rendu,5
178736,"Je mets une notes de 5/5 car le produit est arrivé rapidement, car le produit est en parfait état et rempli sa fonction : il colle très bien. Je recommande ce produit à toutes les personnes qui ont besoin de coller des photos ou des documents rapidement et sans humidifier leurs papier",5
171197,Parfait comme d’habitude sur la pâte et produits de cette marque... expédition rapide et couleur toujours conforme Recommande à 100%,5
165940,"Je cherchais un dérouleur de papier wc sans avoir à percer des trous, je l'ai trouvé sur amazon, très pratique, solide, et esthétique et il a été très facile à poser. RAVIE DE MON ACHAT",5
185624,"J'ai été très surpris de la réception de la marchandise. L'emballage des produits était très raffiné et les accessoires étaient très bons, avec des bretelles et des instructions. J'ai hâte de l'utiliser, l'effet est très bon. Comparé à la clé à chocs que j'ai achetée auparavant, ce JUEMEL a un couple important et est confortable à utiliser, ce qui m'aide à mener à bien une variété de petites opérations mécaniques. Très bon prix, je vous suggère d'acheter! ! !",5
193502,Très joli! Les couleurs et la matière super,5
197782,"j'avais une douleur musculaire persistante biceps aux 2 bras, style tendinite, je suis allée voir les médecins (prescription de volta---, sans aucun effet, échographie--rien..bref aucune solution) J'ai alors fait des recherches sur le net et j'ai acheté cette crème, et là...enfin quelle efficacité! mes douleurs disparaissent. J'en mets avant chaque entraînement de sport moi qui pensais que je ne pourrais plus en faire... mille mercis!!!",5
179450,"envoi rapide, recu apres 3 semaines (rapide pour envoi d'Asie); moules pratiques assez grands",5
198932,"Impeccable, facile à mettre en place et à retirer!",5
177652,"très bon produit, très costaux pour le prix et surtout suffisant pour nettoyer les poêles, longueur suffisante pour chez nous je recommande",5
162863,bien reçu très rapidement. Très bien emballé. Mon fils est ravi et attend avec impatience les autres qui sont signalés quand même rapidement. Merci,5
190483,Super mignon. Lumière un peu forte pour la nuit mais mon fils de 3 ans adore et peu l'allumer ou l'éteindre tout seul !,5
195103,"J'ai remplacé les pads de ma PS4 pro, très satisfait",5
177792,"je recommande cet achat, arrivé à l'heure prévue je suis satisfaite pratique pour faire partir en voyage semble solide pour le prix",5
173553,"Après avoir toujours utilisé les grandes tours j'ai voulu essayer un mini pc afin de le mettre sur la télé du salon. Je suis très agréablement surpris de cette machine totalement silencieuse. Elle est livrée avec un cordon hdmi et l'adaptateur secteur. Un mini clavier sans fil avec trackpad et la machine est complète. Le premier démarrage permet de faire la configuration de windows 10. Il est bien en français et la licence s'active sans problème. Ensuite les démarrages sont rapides. Ces 4 petits GB de ram sont amplement suffisant pour une utilisation bureautique. Il est reste fluide malgré plusieurs onglets de navigation internet activés. L'application netflix fonctionne très bien également, pour les amoureux comme moi des séries TV. C'est un petit PC idéal pour rendre une télévision de salon en une espèce de smart-TV. Il peut se fixer à l'arrière et il ne fait aucun bruit. Je l'utiliserai aussi pour montrer a des amis des photos de vacances par exemple, c'est tellement plus simple de brancher la carte SD plutôt que d’emmener sa tour du bureau dans le salon. C'est un très bon achat, je le recommande vivement pour une utilisation comme moi, ou pour des enfants par exemple.",5
195627,Conforme à mon vehicule,5
170459,Idéal pour ranger les sous vêtement et mes chaussette,5
160426,"Lecture facile, claire et efficace. Une approche rigoureuse de chaque expérience soumise au médium interrogé. C'est un livre qui bouscule, bouleverse et fait du bien en même temps aux personnes qui viennent de perdre un être cher. Très très bien",5
193174,Pour porte de sortie,5
196611,"Excellent jeu, la pub n'est plus à faire pour jeu. Bonne histoire, bonne ambiance, jouabilité correct. RAS",5
176372,produit conforme à la description. semble très pratique et facile d'entretien. hâte de pouvoir l'utiliser pour les balades et voyages avec bébé.,5
169183,"je n'est rien a redire sur ce fond de teint , parfait pour ma carnation de peaux (claire) , effet naturel personnellement il n'as pas une très grande recouvrance ou alors c'est moi qui n'en mais pas asse. mais cela me convient parfaitement . la livraison et l'emballage au top . je recommanderais.",5
173179,Très belles chaussures très confortables.,5
189298,j'ai mis cette housse de couette dans un lit ancien et le rendu est super. La qualité du textile est excellente.,5
188959,"Belle valise, pratique, bien pensée et solide. Correspond en tous points au descriptif et à la photo. Belle couleur grise claire légèrement chiné.",5
175901,Senteur au rendez vous mon amie a apprécié,5
198158,reduire la vitesse d un ventilateur,5
188555,produit neuf et commande complète merci.,5
175128,"Tube fragile, qui plie dès qu'il y a une brise. Dommage que la structure des tubes soit sous dimensionner car le reste est correct.",5
196583,"L'ensemble est exactement comme sur la photo, le bandeau est bien élastique et ne serre pas, le rendu est magnifique, je conseil vivement cet article.",5
182459,Très bonne relation qualité prix. Ce n'est pas la première fois que nous commandons des articles sans jamais avoir été déçus.,5
160565,Prix un peu élevé mais de très bonne qualité,5
177620,super produit-rapport-qualité-prix.,5
175230,"Acheté pour l'anniversaire d'une petite fille de 10 ans, elle l'a adoré, c'est très bien expliqué et cela permet aux enfants de faire des dessins très réalistes. Je le recommande!",5
193771,Jeu de détective très bien construit. Contenant 10 parties différentes. Attention une partie estimée dure un peu plus longtemps que mentionné. Textes bien écrits. Les enquêtes vous tiennent en haleine.,5
193919,Les colliers sont très beaux. Je n ai que des remarques sympathiques quand je les porte,5
191813,"Conforme à la description et aux photos, produit bien emballé,et délai de livraison respecte. Je recommande le produit sans problème.",5
162915,"Belle horloge, c'est pour offrir pour un anniversaire, Colis bien reçu en bon état et délais respectés. Je recommande ce vendeur",5
181231,Rien a dire ce produit est impeccable,5
195497,Très bien...conforme à la demande,5
188972,Coque de bon rapport qualité prix. Conforme à ce que j'attendais.,5
180576,"pas de surprise , conforme à tous les tuto sur ce produit. efficace, simple , l'application fonctionne bien, l'autonomie est impressionnante. un coup de main a prendre quand meme et l'absence de joystick pour orienté est parfois frustrant mais les images sont top (avec iphone 6 et 8)",5
195393,très contente .bien emballée,5
176631,Très bon produit je suis satisfaite,5
183936,"Bon produit, il s’adapte Très bien à mon iPad Pro de 2017. Il a l’air solide donc très content pour le moment.",5
161530,"Un thriller bien ficelé qui se lit avec plaisir. Teddy, le personnage principal, va être amené à enquêter sur le meurtre d'une jeune américaine pour disculper l'assassin présumé, à la demande de son patron propriétaire d'un cabinet d'avocats.",5
193987,"Très belle qualité , le manteau est bien chaud mon chien est super mignon dedans J adore et recommande super",5
179647,Rien a dire ! Jouet qui correspond à mes attentes et un enfant plus que ravie. Je recommande ce produit !!!,5
181459,Je l'ai prise pour ramasser les crottes de mon chien et c'est super pratique et de bonne qualité,5
184718,top et bien proteger,5
171469,"Super pratique ! J’ai acheté cet objet car je suis parti en vacance deux semaines, vous avez un kit de 18 pièce. Vous adaptez une bouteille d’eau dessus, régler avec la vis la vitesse du goutte à goutte (n’oubliez surtout pas de faire un petit trou au dessus de votre bouteille ou même la couper pour que one au s'écoule correctement ! Je peux repartir en vacance sans prise de tête pour arroser mes plantes d’intérieur",5
178095,"Super bon pas chère, je recommande tous les mois, parfait je ne peux plus me passer de ce café",5
181921,je m en sert pour ma glacière mon gyrophare je trouve la rallonge très utile,5
186617,Coque iPhone 7 . Très bien emballée avec dedans coque verre protecteur explication Chiffon alcool. Le tout es emballée ds une boîte carton au nom de Jasbon.,5
172181,Ampoules tout à fait bluffantes Une consommation ridicule pour un éclairage puissant. Reste à vérifier la durée de vie mais ce pack est d'un excellent rapport qualité/prix,5
185347,juste géniaux je commence à me faire la collection entière bon il me manque de 3 livres que je vais m'empresser de commander mais sinon j'adore les recettes sont complètes et son super bonne et pas si compliqué à réaliser je le recommande pour faire des repas sympathique,5
166675,"Produit livré rapidement, contenance exacte. En respectant les horaires de prise et les dosages, jai ressenti moins de petites fringales, comme si j'avais déjà mangé. Je recommande.",5
167882,Très bon produit !! Je fais du 38 et elles sont agréables à porter.,5
162920,Une femme hors du commun et un destin exceptionnel Quelle aventure !,5
169730,"Plus besoin de courir à travers la maison pour répondre au téléphone,le trio parfait et pratique avec le répondeur! Parfait, livraison rapide.",5
196973,Super outil. Plus leger qu une perceuse et la fonction choc je conseil.,5
161131,je suis très contente de les avoir trouver ses croquettes de chat qui sont les même que chez mon véto de plus elles sont en plus moins cher,5
165610,Bonne qualité de ce système efficace et pratique pour toute la maison sur un support permettant à la ventouse d'adhérer,5
163066,"Livraison rapide, très bien emballée et batterie qui semble être de bonne qualité. Attention ne pas oublier d'enlever les 2 bouchons de transport comme indiqué sur la batterie.",5
197121,Cadeau pour une petite fille de 8ans qui adore le jeux! Pour les grands on a le plaisir de retrouver les cartes avec le design de notre enfance :),5
166295,Deux jeux pour 16€ avec les season pass ! une offre a ne pas manquer ! Ma partie préférée est les zombies,5
162592,"L’élément qui manquait à mon enceinte. Quel plaisir de poser facilement la revolve dessus pour qu’elle se recharge. ⚠️ il s’agit bien que du socle, aucun câble ni chargeur n’est fourni avec.",5
179663,Roulettes pour porte de salle de bain,5
186515,"Parfait, qualité et prix !!! Intéressant pour sa dragonne . Commande d'une durée de 15h !!! Incroyable !!!! Pas de frais de port !!!!",5
180223,"Facile à manipuler et facile à installer, j’admire les jumelles à distance.Confortables, et de bonne définition, elles correspondent tout à fait à mes attentes pour de l'observation en montagne.",5
178074,"Objet correspond bien à la description. L'envoi a été rapide. Aucun problème de communication. Très bon vendeur, à d'autres affaires.",5
161482,"Ce livre est généreux, utile, pratique, étonnant. A travers son œil avisé, l'auteur nous livre de nombreux secrets sur nous, notre apparence, notre personnalité. Cet ouvrage à traversé les frontières et pour le bien de tous. L'auteur a mis toute sa générosité pour donner un maximum d'informations, un bouillon de culture pour un travail sur soi et connaitre les autres. Bravo Joëlle Adam",5
191731,"Je laisse rarement de commentaire, mais alors là ! Il es juste délicieux (banane) j avais déjà testé le fraise que je trouvais passable goût de poudre mais le banane es un véritable delice donc je vais continue a tous les essayer",5
178282,"Produits de qualité / facile à utiliser / luminosité intense, belles couleurs Une dizaine de modes disponibles / Mode statique (une couleur définie) / dynamique (choix de quatre couleur + vitesse variable (si la vitesse est faible, un mélange de couleur entre deux couleurs en transition se fait)) Le GROS moins concerne la livraison : le délais n'a pas été respecté, la prise de rendez-vous pour nouvelle livraison ne garantie pas l'horaire du tout... sensé passé le matin, est passé en fin de journée. Sur toutes mes commandes, je n'ai eu que deux retards de livraison cela dit ! Amazon reste un vendeur/expéditeur fiable (suivant le transporteur, la date et l'heure de la livraison relèveront un peu du hasard).",5
185416,"Ce contrôleur est toujours très bon, prix très raisonnable, la réaction de manipulation n'est pas mauvaise. Mes deux plus satisfaits du prix et de la qualité devraient l'être, et le prix est très raisonnable, pas trop cher, il ne sera pas trop bon marché pour être assuré. Qualité, le matériel est très dur, les gens dans les mains des gens très rassurés.",5
196396,Produit facile à poser et conforme à mes attentes. Je le recommande sans problème Résistant et protège vraiment bien l'écran du téléphone,5
175370,Un super petit ensemble. Ma fille en est fan ! Le téléphone fait de la musique mais pas trop fort :),5
188389,Très bon jeu j en ai commandé cinq pour des amis découvert dans un magasin ile de re,5
165387,La traîne peut se déboutonner au niveau des épaules ce qui est un avantage. Ma fille a été à l'école avec la robe mais sans la traîne. Robe très belle et agréable à porter. Taille très bien pour une fille de 6 ans.,5
187647,Parfait pour le stockage du bois,5
166932,Jeux culte qui en version star wars rajoute une autre dimension. Un must-have pour les fans de star wars! Achetez les yeux fermés !,5
160163,Jeux ludique rigolo trop bien mon fils adoré est moi aussi je vous le conseille,5
183046,Commande bien reçue dans les délais et conforme. Très jolie coque que je recommande. Amazon est le site à faire partager.,5
169864,conforme à la commande pas trés cher pour un livre de qualité,5
162969,Notre ancien kit n'était plus très frais. Nous avons été contents de le renouveler pour une somme modique. La marque évolue bien.,5
184232,Ce cosy est très bien et recommander par sécurange et utilisable longtemps. Je recommande.,5
164966,C’est super sympa! J’en ai distribuer hier pour un anniversaire au rillettes et au femmes et ça a vraiment fait son effet. Tous les serres têtes sont les mêmes. C’est tres beau. Ça peut s’adapter à toutes les têtes. Car c’est manipulable. Je vous le recommande,5
178427,C'est bien construit. Jolie. Ca présente très bien mes montres. Je suis ravi de mon achat. Le fait que la fermeture soit aimantée est très bien au lieu d'un fermoire.,5
178756,Je l'ai acheté pour ma mère et elle a dit qu'elle aimait,5
160671,"Utilisation professionnelle, tout à fait conforme au produit décrit par le vendeur ; je vais le lire maintenant ...",5
182708,J'utilise ce produit pour créer des albums scrapbooking. Il est très bien. Résistant et de belle couleur,5
193703,"Pour un drapeau corsaire solidité du fil,et suffisamment souple pour la couture",5
174244,"Franchement je m'éclate avec cet objectif.. Certes, pas de zoom, mais c'est une question d'habitude, je ne peux plus m'en passer maintenant et les résultats sont vraiment splendides !",5
163290,"La ventouse tient très bien sur toutes surfaces. Le matériau est très agréable, se lave bien. De plus, la ventouse se démonte de l'assiette pour laver le tout parfaitement. Les 3 petits compartiments sont très pratiques. Je recommande.",5
198252,Parfait et conforme Bravo,5
183255,Ma fille a toute la collection et les adore.,5
187745,"Après avoir commandé un clavier en reconditionné Amazon, je me suis rendu compte que celui-ci ne fonctionnait pas (plusieurs touches défectueuses). Je décide donc de retenter cette fois sur du neuf avec crainte vu les commentaires que celui-ci fonctionne mal. Pas de soucis pour moi, la barre espace fonctionne sans problèmes. J'utilise ce clavier depuis 4 mois et je n'ai pas de problèmes de touches sur la version grise. Les touches sont réactives et la frappe agréable en plus d'être silencieuse. Je trouve le design vraiment réussi et la finition grise très jolie. Le rétro éclairage des touches n'est pas trop agressif pour les yeux, et suffisant selon moi. Il y a 5 touches macro pour paramétrer le clavier selon vos jeux. Le logiciel swarm permet de configurer les touches ainsi que l'éclairage des touches. En négatif, je trouve dommage que l'on ne puisse pas éclairer chaque touche comme on le souhaite. L'éclairage fonctionne pas zone et groupe de touches (j'utilise le mode vague qui fait un balayage des couleurs en RGB). Sinon pour le reste il est parfait pour mes besoins.",5
171186,L envois est rapide et bien emballé. La coque protége très bien le téléphone.,5
191579,"bon produit, je m en sers tous les jours, il tienne vraiment longtemps la charge et le design est plutot joli",5
195078,"Livraison rapide, arrivée 1 jour avant la date prévue. Image et son de très bonne qualité. Prix attractif. Très bon rapport qualité prix.",5
183519,Conforme à la description les petits escargots sont gadget mais c'est sympa,5
190405,"Fonctionnel, bon produit et livraison rapide. Je recommande cet achat",5
180859,"Très beau produit pour faire une sortie cabriolet, livraison très rapide et très bonne communication du vendeur",5
199142,"Super chargeur avec une bonne capacité, ce qui est bien c'est qu'il se range partout même dans sa poche avec un affichage led très précis qui donne le niveau de batterie.",5
196012,"Je ne savais pas qu'il existait un modèle comme celui là pour la sécurité pour le vélo. Pratique pour le mettre et le régler, c'est un super rapport qualité / sécurité / prix.",5
182397,J’ai acheté ce cadre pour mon mariage je ne m’attendais pas à ce que ce soit si beau je vous le conseille vraiment c’est magnifique,5
188632,Tout petit très polyvalent,5
8971,Impossible de la connectée,1
21656,Produit pas reçu depuis la commande,1
4496,"j'ai reçu l'album abimé : la fixation en bas ne tenait plus ... vu les frais de port, je ne le renvoie pas mais je suis vraiment déçue de devoir rafistoler un produit acheté neuf ...",1
7184,"livraison en retard envoi dans une simple enveloppe en plastique, aucune protection Produit défectueux, les plumes arrivent décollées plus petit qu'il n'a l'air en photo article vraiment médiocre",1
26186,Catastrophique... L'ampoule a cassé dès la première tentative d'insertion. À fuir...,1
31964,"Colis jamais reçu,décevant,réponse du vendeur incompréhensible fait par un ordinateur avec traduction médiocre",1
12155,J'ai reçu la souri sans la clé wifi,1
6310,La housse de couette et la taie d'oreiller sont en 100% polyester ! Je n'avais pas fait attention en passant la commande et suis donc obligée de renvoyer l'article. Dommage car le dessin était très joli.,1
36816,Ce livre devait etre un cadeau et il n'est arrivé a destination. Aucun livre 120 lieux secrets etait dans le colis,1
22705,"Ce produit n'est pas du tout solide. Je suis déçue. Il a fonctionnné quelques jours puis les touches (volume, micro) se sont bloquées et impossible de remettre le son. Un adaptateur simple suffit et c'est moins cher !",1
30399,Je n'ai pas pu l'utiliser puisque je ne l'ai jamais reçu.,1
9733,"J'ai reçu le mauvais pack, il manque la plume ainsi que les pinces tetons.",1
16382,Un bruit horrible et mes rats toujours la J'ai opté pour la mort aux rats beaucoup plus efface. Plus de rats maintenant,1
27295,Cet appareil a très bien fonctionné pendant quelques semaine et d’un coup plus de son... alors que les boutons restaient actifs et l’appareil connecté au téléphone Après contact avec le sav on m’en a envoyé un nouveau (belle réactivité du service bravo) mais le nouvel appareil a fonctionné deux jours et à nouveau le même problème. Est ce un problème de série ? En tout cas je déconseille fortement,1
37717,La tondeuse aura fonctionné 5 minutes avant d'être inutilisable. C'est une honte!,1
7844,Le rose deja parti au bout d unz journée,1
19722,mauvaise expérience car n'est pas le même que sur la photo de l'écran ordinateur donc site d’Amazon,1
5685,Le produit n'a pas duré une année scolaire: une bretelle s'est décousue. Le sac n'a pas supporté le poids des cahiers de 6e.,1
29395,"L'appareil ne convient pas du tout, et impossible de le retourner. vraiment très déçu de cet achat qui s'avère inutile.",1
30774,Temps de livraison non respecté meme avec l'abonnement Prime. plastique de mauvaise qualité...la regle est arrivée tordue. cher par rapport à la qualité.,1
37991,Je n’ai jamais reçu ce produit mais on m’a pris les sous. Aucun moyen de ce faire rembourser ....,1
12226,Bonjour Impossible de recevoir ce produit 4 mails envoyés sans réponse intervention d’amazon Sans succès ARNAQUE,1
21765,renvoyé et remboursé,1
12120,"Tres compliquées d'utilisation, 1 sur 20 qui fonctionne",1
24353,pas bien pour différente chaussettes vue la pub sa marche pas aussi bien,1
24016,Je m'en suis servis une seul fois et elle ne fonctionne déjà plus pour la deuxième utilisation . Une fuite que je ne trouve pas donc plus d'air ne sors de l'embout !!!!!,1
28281,"Je n'ai pas reçu l'article, et on me dit que j'ai été livré....",1
13902,impossible a utiliser pas de notice en francais,1
13889,j aurai du être livré le 8 juin et le 20 toujours pas reçu ma commande.!!! Pas de nouvelle de ma réclamation au vendeur... a éviter si possible.,1
15854,objet de mauvaise qualité. la poche d'eau contenant l'oeuf a été tout de suite percée. je ne conseille pas cet achat,1
33385,Je n’ai pas reçu le crayon,1
16490,Je n'est jamais reçu larticle esque c'est normal ? Je trouve sa inadmicible ! Je veux être remboursé ou envoyer moi cet article,1
22241,"Erreur, l'article ne correspond pas à la commande passée ! Dommage !",1
17531,"Utiliser une semaine car le bruit était insupportable, de plus côté horaires, absolument pas précis.",1
5362,Ne se monte pas sur mon appareil donc (pas universelle) ARGENT PERDU,1
26561,"Vu la note j'ai commandé ce produit sans me poser de question, j'ai quand même lu quelques commentaires mais plutôt confiant. Par contre lors de l'installation de ce verre trempé...quelle déception !!! Le verre n'est pas à 2mm du bord du téléphone mais 2 mm du bord de l'écran... En gros l'affichage est déformé par le bord du verre !!! Super désagréable. Je déconseille ce verre trempé à tous les utilisateurs de Samsung A5 2017 !",1
32469,C’est casé au bout de 1 mois,1
