12437,"Nul ! Se collé uniquement par les deux côtés arrondis, donc pas bien appliqué. Hyper fragile, se casse déjà sans pour autant tomber (et bien que protégé en plus par un clapet). Et se salit très rapidement par les traces de doigt.",1
27135,"Cette ampoule est totalement inefficace. Les insectes sont attirés par la grosse lumière mais ne vont pas à côté sur la lumière bleue pour être tués. En 3 heures seulement 3 moucherons. La description du produit précise que les insectes tombent tout seuls après avoir été brûlés. C'est faux, ils restent comme collés sur l'ampoule (dans mon cas elle était tournée vers le bas). Apparemment on peut aussi changer la mode de fonctionnement de l'ampoule, comme éteindre la lumière pour ne laisser que le tueur d'insectes. Je n'ai pas trouvé comment faire. En bref une ampoule totalement inefficace contre les insectes. Passez votre chemin.",1
17161,cet article est tombé en panne au bout de 2 heures,1
24582,Une étoile car le produit arrivé était percé. Le SAV (top) m’en a renvoyé un autre mais le 2ème reçu s’est percé ou déchiré après quelques semaines. Ne dure pas dans le temps et pourtant mon enfant a joué très peu avec.,1
30608,"Une fille qui accepte d'épouser un militaire agent secret sans connaître son visage en mettant sa vie privé de côté pour garder le secret ( même sa famille ne doit pas le savoir ). Elle fait l'amour avec lui qui garde sa cagoule pendant les rapports, je trouve ça vraiment trop glauque!!! Surtout qu'il a commencé à lui plaire parce qu'elle avait vu son torse...Sabine décide bien vite de partager sa vie de manière définitive avec un homme qu'elle connaît à peine...",1
12158,Impossible de coller sur un SPA coté extérieur cela ne tien pas.,1
20028,Jamais rien reçu et aucun remboursement Amazon me fait comprendre que c'est à moi de me débrouiller alors que si j'achète chez eux c'est pour la sécurité.. Vraiment déçu 👎👎👎,1
18202,Réception en retard de la commande pas de message de la part du fournisseur,1
21981,"Produit de très mauvaise qualité, percé en plusieurs endroits. Monté sur une pompe pour un usage de jardin ordinaire (arrosage) Durée de vie 2H !! Plastique de structure interne, cassant et ne résistant pas à la pression ! 50 Euros à la poubelle, Merci...! Bien à vous",1
3412,"Trop petit pour un bac XL et les sacs sont trop fin. Ce qui ne sert à rien, le sac se déchire avant que l’on puisse le nouer.",1
23035,2 produit ivoler . et 2e qui ne tient pas la durée. prix intéressant mais : fonctionne tres bien au début. 6 mois plus tard la charge rapide est out. .. donc au bout du compte le contrat est loin d être équitable.,1
35048,Je nai pas reçu cette article dans ma boîte au lettre,1
11741,"je ne sais où vous joindre mais je vais devoir à nouveau commander ce livre, vos chauffeurs sont au moins priés d'essayer un minimum d'effectuer la livraison ou je ne commanderais plus chez vous! Que de temps et d'argent perdu! Même pas un appel, je suis toujours présente... Extrèmement déçue...",1
20411,"Bonjour , je j ai pas reçu la commande alors que j étais chez moi , le vendeur n a même pas sonné !!!",1
32291,Bjr veuillez me rembourser mon produit merci,1
25562,Après un mois d utilisation elle ne démarre plus direction poubelle !!!!! C est la deuxième avec le même problème !!!,1
36735,"Très très forte odeur chimique quand on le sort du packaging, avec des finitions moyenne, et la doublage orange à l'intérieur ne correspond pas à la photo .",1
1743,"Bonjour, après utilisation, le revêtement interne montre des signes de dégradation pourtant je n y mets que de l eau, des tâches noires sont apparue au fond de la cuve comme des traces d oxydation du coup je ne l utilise plus, je ne recommande pas du tout cet article pour cause de problème évident de la matière utilisée a intérieur",1
7426,pas eu ce dvd dans ma boit a letre,1
7338,Je n'ai malheureusement pas reçu ma commande merci encore une fois à chronopost encore une fois les seuls et uniques incapables de livré un colis chez moi ! Bien dommage,1
5995,"Je ne sais pas quelle société à livré mon colis mais c'est pas des bons ! je reçois une notification colis livré dans ma boite aux lettres, j'ouvre donc et là rien de rien ! Donc livré mais pas chez moi ! merci pour l'incompétence du livreur, je l'invite à partir à la recherche de mon colis jamais reçu ! En colère...",1
36991,Merci Amazon de laisser mon commentaire. La batterie après 164 kilomètres n'est plus capables de faire plus de 10 kilomètres. La vitesse est passée de 30 à 27 kilomètres par heure en une semaine. Je ne recommande pas ce produit,1
20535,Rien pour faire les branchements. Vous devez réaliser vous même les cables. Et bien sur pas de notice dans l'emballage pour expliquer comment faire. Pas du tout satisfait.,1
15121,"Produit non conforme au marché français, livré avec une prise anglaise et un adaptateur non compatible pour la france. Le vendeur nous a remboursé partiellement pour pouvoir payer un transfo conforme mais une fois mis en route l'appareil fonctionne à moitié donc impossible de s'en servir. Le vendeur vous envoie des mails pour vous supplier de ne pas faire fonctionner la garantie pour ne pas être embêter par Amazon, à éviter",1
21420,"J'adore ce jeu mais, sur le Kindle Fire, impossible de le connecter avec Facebook pour retrouver mon historique de jeu. 😠",1
19111,"Tout simplement de la camelote ! De plus, les coloris ne correspondent aux couleurs de la photo. Les torchons sont affreux.",1
34562,j'ai eu de gros problèmes avec cette montre. Le bracelet s'est cassé. Impossible de réparer. J'ai acheté un bracelet de remplacement . Actuellement elle retarde malgré un changement de pile. Comment faire pour la retourner chez vous? merci de répondre à mon adresse,1
10493,"je suis en attente de cet article depuis le 13 septembre 2018. Donc, je souhaiterais savoir à quel niveau est cet article",1
25511,Livre reçu en très mauvaise état. Très déçu,1
29437,Très faible pouvoir colorant.,1
22535,Les deux grands tiroirs sont arrivés cassés !,1
30543,"pas utilisé pour ce quoi il était destiné. Il s'enroule sur les doigts, impossible de décoller les 2 parties. Je l'ai jeté.",1
21190,Le tissu ne sentait pas bon et de plus les couleurs sont bien plus fades que sur la photo. Les finitions laissent à désirer.,1
1220,C'est dommage qu'il soit zoné en Europe et que ne me l'a pas dit avant. J'ai été dans l'obligation de retourner l'article.,1
8752,"colis déchiré, le transmetteur n'est pas étanche l'électronique a pris l'eau et ne fonctionne plus. dernier achat chez vous.",1
32300,"Éclairage de mauvaise qualité, photo trompeuse et très cher pour la qualité.",1
17484,Acheter pas c une arnaque,1
39665,Nul. Ne reconnait pas mon empreinte car trop épais. Bref ça sert à rien il faut prendre avec un trou sinon on peut plus déverrouiller le téléphone,1
7367,La batterie et déjà morte au bout de 3mois pas satisfait j'espère avoir dès réponse du vendeur au plus vite,1
16714,Les boules d'acier s'enlèvent trop rapidement. Mais sinon la semelle est confortable,1
2715,Pas adapté à mon Samsung j5 Cet etuit est trop grand et mon téléphone ne vient pas dedans !! J'ai donc du le renvoyer,1
6621,"Les manettes ne fonctionnent pas et sont d'occasion, ce qui n'était pas indiqué dans l'annonce. Remboursement rapide et sans discussion cependant.",1
17274,"Très déçu par le délais de livraison reporté, le portable a été livré il y a 3 jours et la livraison est repoussée de 5 jours Pour une commande groupée incitée par Amazon Que faire si le portable subit un dégât ?",1
22576,"Détecte ou plein de choses là ou il n'y a rien, ou rien là ou il y a quelque chose. Heureusement, la pile est fournie !",1
17485,Je n’au Jamais rien reçu ! Et aucune réponse à mes mails ! Fuyez !!!!!,1
12512,Produit ne colle pas.,1
35426,La coque ne s'adapte pas sur mon Samsung A5 de 2017.. les boutons sont en décalage.. je ne recommande pas.,1
11032,Il n'y a pas 4 coins !!!! Et ce n'est pas signalé dans la description du produit donc !!!!,1
9113,Déçue... Produit non reçu...,1
6441,elle est beaucoup plus blanche que sur la photo et aprés 1 semaine lampoule ne fonctionné déja plus je déconseil l'achat,1
21301,"Utiliser une fois , déjà cassé , n’a même pas réussi à dévisser le mousseur. Extrêmement déçu",1
22621,"Produit qui semble de bonne qualité, peut-être un peu petit à mon goût. Cependant, indiquer une difficulté « Extrême » qui est censé nous prendre entre 30 minutes et 1 mois, pour une ouverture en un seul mouvement, demandant juste un peu d’observation, et 5 minutes, c’est un peu se moquer du client ! Même un enfant serait capable de trouver la solution rapidement ! Je mets 1 étoile, comme la difficulté réel...",1
14588,C la 5 fois que je l utilise le produit et je vois absolument pas de difference c est nul,1
36167,"On ne m'a pas prévenu de l'arrivée du colis le livreur ne sais même pas présenter alors que j'étais présent à mon domicile au moment de la livraison résultats sur le suivi de la commande il dise que le colis à était mis dans la boîte au lettre hors aucun coli n'est a l'intérieur, si quelqu'un c'est comme si prendre pour récupérer mon argent, vraiment très déçu",1
36151,Au bout de quelques semaines il ne tiens plus avec un téléphone dessus. Cela s'abaisse constamment.,1
25361,"Ce n'a rien avoir avec du Gaffeur; De mauvaise qualité, très cher pour un produit bas de gamme; Je déconseille vivement",1
33275,Je suis plus que déçue. Je n’ai jamais reçu mon colis alors que je l’ai commandé au mois de decembre !!!!,1
12284,Je suis très déçue... les ballons se dégonflent tout seuls... je les ai gonflé la veille de l’anniversaire et se sont dégonflés énormément... pour les ballons en baudruche il n’y a rien de fournis donc même avec une bonbonne de hélium je n’ai pas réussi à les utiliser...,1
25128,Pas joli tout vide à l intérieur...déçu,1
31797,"Se décolle très vite, car la poussière rentre par les côtés, je déconseille !!!",1
28666,"Pas très pratique à installer, petit et peu qualitatif. Je suis déçu du produit...",1
12781,Je n’ai pas reçu la prise européenne ! Comment faire ?,1
37692,"Très deçu , ils ne sont pas étanche , le plastique se déforme et ne plaque pas , ILS NE SONT PAS ETANCHE ! le verre à l'air solide",1
30469,Je suis déçue par ce produit qui est de mauvaise qualité et qui a une odeur désagréable,1
14484,"Produit non conforme. Aucune recharge solaire. Présence d'un port USB, rien a voir avec les images et le descriptif.",1
23680,"Produit plus que décevant meme rebutant!!!! Je les ai déjà même jeter. Finition bâclé pas confortable semelle dure, je ne vois pas l effet sur l oignon vu que l endroit ou l on passe l orteil ne maintien rien. ne correspondant pas du tout à la description du produit. Pas la peine de préciser que je racheterais plus dans cette boutique!!!",1
39898,"Vraiment déçu pour des Duracell, durée de vie ridicule, à peine 3 jours dans le meilleur des cas. Sur le lot acheté, déjà utilisé une quinzaine, même constat ... Ecoeuré ...",1
3615,Après plus message au vendeur stipulant que je n'avais pas reçu le colis on m'envoie un message me disant qu'il a été livre à un centre de tri.. Pour quoi pas. Mais bien sûr il n'est pas à côté de chez moi. Après avoir trouver l'adresse je m'y rend plein de bonne volonté et on me dit qu'il envoyé de colis mais n'en garde pas pour les clients. J'espère avoir un remboursement ou un autre article de la part du vendeur. Mais pour le moment AMAZON ET LE VENDEUR mon fortement déçu. Bien sur c'était à la basse un cadeau de Noël.,1
29930,Empreinte tactile qui ne marche pas. Et sensibilité tactile rendu à la ramasse j'ai lutter pour écrire ce messages.,1
25199,"Nul, absolument inutile pour les problèmes de posture. Retour à l'envoyeur",1
18782,Je n'ai reçu aucun article commandé à ce jour,1
34369,Dommage pour le produit mais je l'ai reçu avec seulement 3 couvercles au lieu de 4. Comme j'en avais besoin je n'ai pas retourné le produit comme proposé.,1
1395,Mauvais article ne démaquille pas ou très peu je peux pas m en servir pour apprendre à maquiller .,1
30991,"Les marchandises retournées après 14 jours, ils refusent de faire un remboursement, parce qu'ils disent qu'ils n'ont pas reçu le colis. Non professionnel, j'imagine leur aide post-produit.",1
6346,Extra ma petite fille adore Très facile a monter Correspond parfaitement à mes attentes,1
5228,"Après un premier envoi d'une machine défectueuse, je viens de recevoir une nouvelle machine....jetée au dessus du mur de ma maison alors que je suis présentée et que le portail est ouvert 😱. Je ne sais même pas si j'ouvre le colis, c'est inadmissible, inacceptable pour Amazon",1
4394,Drapeau Europe Jamais recu,1
882,"Oh la la...mon Ariel et moi...c'est une véritable histoire d'amour ...on s'aime, on s'aime...c'est dingue !!! il est tellement beau dans son packaging...vraiment j'en suis folle !!!",1
38860,L'arceau a cassé dès le montage. Inutilisable.,1
27996,S'abime alors que le telephone est dans votre poche .. très mauvaise qualité,1
21264,Installée il y a moins d'un mois elle s'est déjà fendue en 2. Je ne rachèterai pas.,1
14988,"Sur les 4 grands bacs commandés, aucun n'est arrivé intact. Ils ont tous le coin ds la partie inférieure cassée. Que faire? Merci",1
17841,bonjour y a un mois je vous commande cette pièces pour mon lave vaisselles après changement impeccable pendants 1 mois et demis et la la même panne la pièces que je vous commande ne fonctionne plus .....??? question y une garantie sur l achat de cette pièces qui aura fonctionner peut de temps merci d avance pour votre réponse cdt,1
5894,ce produit manque dans mon colis comment puis-je le récupérer il me faudra en commander un autre ??????????,1
1179,"Bonjour, Colis reçu en bon état et très rapidement. Toutefois, la lampe LED a lâché au bout de 5 secondes d'utilisation. Il semblerait qu'il y ait un faux contact au niveau du branchement qui rend toute utilisation impossible. Comment puis-je procéder pour avoir (rapidement) une nouvelle lampe qui fonctionne ? Merci pour votre retour.",1
32161,"Hésitations vu les commentaires préalables sur la fragilité de ces billes, j'ai néanmoins commandé car je ne trouvais pas d'effets ""tornade"" ailleurs : les billes ne correspondent pas au visuel affiché à la vente puis sur l'emballage, et elles sont toutes altérées (aspérités multiples et bases bien creusées) : il y a manifestement un gros soucis de qualité, c'est honteux de produire ça et d'en favoriser la vente...",1
19700,Je ne peux pas me faire une idée du fait que j'attends toujours la livraison....,1
4269,Je déconseille la livraison amazon. les délais ne sont pas respectés. Malgré être prime mon colis prend plusieurs jours retard. Inacceptable.,1
27482,Appareil reçu marque abîmé sur l’encoche où on doit mettre des pilles et l’appareil marche à moitié je vous le déconseille,1
11140,"Montre en panne après 18 mois. Pas de choc, pas d’immersion ... pile changée... je ne comprends pas.",1
29225,"Très nul ! Déchirés après la 2ème utilisation, voir photo !",1
77027,j'ai reçu les écouteurs dans un très bon emballages mais l'oreillette droite est casser et retour payant donc je ne recommande pas ce produit !!!,2
58303,Pour mon déménagement...pour de petits cartons..il n'est pas très stable,2
49399,"produit au top , trop mignon mais par contre pour la livraison 4 mois de retard , je ne suis pas contente de la livraison, je ne recommande pas",2
58169,2eme commande en 6mois chez le meme marchand. Les nouvelles cartouches ne sont pas compatibles avec les anciennes. Il est nécessaire de tous les remplacer en même temps !,2
60188,"La base de savon fond vite au micro ondes. Une fois dans le moule ça durci vite. Malheureusement le savon ne mousse pas et à la touché c'est gras. Simple à utiliser pour faire des savons avec les enfants, mais la qualité n'est pas la....",2
65554,montre facile d'utilisation mais ne dure pas longtemps pourtant le son est bien ce n'est pas de chance dommage dommage,2
48149,Il sont pas mal mais très déçus après 2 utilisation certain ne fonctionne déjà plus,2
67741,"Coque integrale, avant et arrière ,couvrant le tactile qui rend celui-ci beaucoup moins sensible. En plein soleil l’ecran devient illisible.... Je ne recommande pas",2
61317,Pas cher mais dommage que je l ai reçu pliée en 2 en espérant que ça ne se voit pas une fois collé,2
54712,En remplacement de H4 d'origine je pensais gagner un peu en intensité mais il en est rien.Aucun intérêt.,2
43244,En deux jours plus de panier.,2
63480,Très ludique et adapté à notre enfant de dix ans. Cependant à la première utilisation l’arbre central a cassé net. j'espère trouver facilement une pièce de remplacement,2
77059,"Qualité médiocre, produit rayé en de nombreux endroits.",2
50373,Pas terrible comme lentille !,2
46922,"Je me suis fié aux commentaires, mais je n'aurais pas dù. Le plastique n'ai pas d'une qualité exemplaire (j'ai l'habitude d'utiliser de vrai casque de chantier et c'est le jour et la nuit coté qualité). Les fixations pour les éléments du casque ne sont pas solide, de même pour la grille et la mentonnière. La grille n'est pas métallique mais en plastique et pas très solide (une petite branche d'arbre devrait la faire éclater sans trop de problème.",2
70454,C’est pas de la bonne qualité,2
66584,"Encore dans l attente de mon produit donc difficile à évaluer mais en tout cas très déçue du retard de livraison prévu au plus tard le 6 Mai on m envoie un sms le jour même pour me le repousser au 7 Mai pour finir rien à 17h, j appelle GLS et il me dise que la livraison est prévu pour le 9 Mai car ils n ont toujours pas le produit. Hâte d être à Jeudi pour connaître la suite de l histoire.",2
55363,"Le piquage des fibres est clairsemé, on voit le tissus blanc à la base. ils auraient du mettre un tissu noir en support. déçu !",2
66870,"Très jolie coque. Au départ j'étais ravie, elle etait très jolie, se clipsait. Elle semblait solide. Mais 6 mois après, un des clips s'est cassé et du coup la coque se tient plus. Je suis decue car elle a une très jolie couleur et me plaisait beaucoup..",2
76796,"Commande livrée rapidement , un peu déçue du bois qui est humide et légèrement moisi, mais surtout en montant le produit je me suis aperçue qu'il manquait 2 planches de bois de petites tailles et je n'ai pas la possibilité de contacter le vendeur dans mon interface client... comment faire??",2
63374,Dommage que les dimensions soient trop petites pour un double matelas d'épaisseur 30 cm.,2
71050,Piquets trop flexibles se tordent trop vite! Filet qui ne tient pas ! Nous avons du tout ajuster ! Envoi parfait,2
40418,Pour information cette tablette est géniale au niveau du vidéoprojecteur par contre surchauffe du chargeur et la batterie se vide très rapidement. C'est dommage compte tenu du prix.,2
74249,Cela ne protège rien ne compté pas sur c'est produit pour protégé votre téléphone plastique qui se tort dans tous les sens . Si le téléphone chauffe le plastique deviens élastique ... Ne le prenez surtout pas,2
72894,"Hori pour les accessoires Nintendo est d'habitude gage de qualité. Cette fois-ci je suis déçu de constater qu'après 5 mois, la charge de mon appareil est aléatoire (utilisé tous les jours car en plus de ma Switch, je l'utilise pour mon téléphone dans ma voiture). Suivant la courbure du câble, l'appareil charge ou non. Pas pratique.",2
77335,"Comme beaucoup. Batterie HS en a peine 1 an. Et pour 10€ de plus que le prix d'une batterie de rechange vous avez une nouvelle visseuse avec sa mallette, sa batterie et son chargeur. Efficace quand elle fonctionne. Déception.",2
77161,Colis reçu mais la tête du bouda est coupé.,2
59896,"Nous avons du attendre assez longtemps pour recevoir nos balles de ping-pong. Nous les avons achetes pour amuser nos deux chatons. Malheureusement ces balles ne sautes pas beaucoup et devient creuse assez vite. Je sais qu'elles ne sont pas cheres, mais nous sommes un peu decue. Peut etre qu'elles viennent de la Chine, je ne suis pas sure. Pour amuser les chats ca va, mais elles ne sont pas bonnes pour jouer au ping-pong.",2
76770,"Le plus : joli, assez grand pour ne pas courir dans le fond du jardin tous les jours, le moins :sceau intérieur en plastique avec une anse qui permet de l'emmener à votre compost, ma fille a trébuché en revenant, le sceau est tombé et là un morceau du fond du sceau est cassé (plastique très fin) alors que je suis allée au compost trois fois ! Pas solide, une autre chose me dérange, lorsque on met le couvercle en place il ne s'emboîte pas, il est juste posé et cela bouge dans tous les sens, je n'ai pas regardée si je pouvais acheter un sceau supplémentaire pour remplacer celui qui est cassé. Je regrette mon achat... Dommage car il est assez joli",2
44512,Très jolie collier mais le fermoir a cassé au bout de 2 jours ...,2
68213,"Efficacité encore à prouver, très long à sécher",2
76199,"Acheté pour un cadeau. Très déçue car une une des notes de la mélodie ne fonctionne pas et fait un bruit de métal.. C'est juste une note, mais elle se répète plusieurs fois lors de la mélodie",2
72190,"Les sandales sont vraiment jolies et sont arrivées rapidement, mais l'élastique de maintient derrière la cheville est vraiment inconfortable et irrite le pied ... je ne les mets plus du tout c'est bien dommage ..",2
53037,non je ne suis pas satisfaite du tout car il y a toujours des mouches des araignées chez moi et les puces donc je trouve que le matériel ultrason ne fonctionne pas très bien et au bout de 2 jours il y en avait un sur les quatre qui ne fonctionnait plus,2
65360,Pas pratique du tout à monter et à utiliser,2
45831,Je suis vraiment déçu les tétines du biberon n'était pas bien protégé. La boîte d'une tétine était ouverte. Mon bébé à 6 mois et n'a pas réussi à boire son lait sans s'étouffer.,2
77840,Le produit est envoyé sans l'emballage photographié-,2
71222,"pratique le fait que le pot tourne, de bonne taille. Design sympa. Petit bémol lorsque j'ai enlevé l'autocollant sur le pot il y avait un choc dessus !",2
76217,"D'une part on ne peut mettre qu'un seul câble s'il est un peu gros ou 2 petits . Et ça ne tient pas beaucoup et uniquement sur du bois. Sur les murs , peintures ou autres matériaux ça se décolle 2 jours après Du coup je me retrouve avec beaucoup de pièces en rab et qui ne me sont d'aucune utilité",2
58104,deux livres sont manquants,2
49730,J'ai achété 2 lampes. Le détecteur du premier est tombé en panne au bout de quelques mois et celui de la deuxième après un an et demi. Elles sont donc devenus inutilisables car une ne s'allume plus du tout et l'autre s'allume en permanence... Il vaut mieux choisir un modèle avec interrupteur au cas où le détecteur tombe en panne.,2
45417,J'ai acheter cet épilateur pour changer du rasage au traditionnel rasoir et il est actuellement toujours dans son emballage au fond d'un placard. trop douloureux pour ce que c'est et n’enlève pas tout les poils en plus il manquais des accessoires dans la boite. Assez déçu donc mais pour celle qui sont des habituées de l’épilateur pourquoi pas mais il y a surement mieux,2
45056,"Je suis déçue du produit , moins joli que sur l'image. Je voulais la couleur bleue,j'ai reçue un bleu/vert. La qualité n'est pas au rendez-vous. Une pacotille que l'on trouverai facilement sur un stand de marché. Mais ce n'est pas grave car le prix est minime. On ne pas être content à chaque achat.",2
47177,"Les barres sont bien, mais colis reçu avec barres rayées et endommagées. Comme je ne l'ai pas ouvert de suite, il est trop tard pour le retourner. Mais je suis très déçu de ce service d'Amazon !",2
70914,Ne convient pas pour des zones courbées peut être faudrait il le chauffer! Je ne le recommande pas .il est préférable de les faire soit même,2
61500,"Ce petit sac répond à mes attentes, mais la fermeture éclair, se découd, après quelques jours d’utilisation",2
72696,"... le jack 3,5 ne tient pas en place solidement. Essayé avec plusieurs smartphones et tablettes même résultat",2
73881,Extrêmement bruyant et n'aspire pas super bien. Déçu...,2
42794,Pratique mais poignée cassée en moins de 6 mois. Donc pas solide et devenu inutilisable.,2
45292,"Nageur confirmé, j’ai utilisé pour faire quelques exercices de musculation dans l’eau. Le concept est interessant mais les bandes sont arrivées déjà déchirées. Peut-être un coup de malchance.",2
41848,"Colis livré explosé. Obligation de trouver des vis maison. Structure du chariot trop faible pour des buches de 50cm. Déplacement du chariot bruyant, des pneus auraient été préférables. Le poid global est trop élevé. L'étagères est plutot genante. Difficile à reprendre lorsque ce chariot est placé de face plein. Finalement prix trop élevé compte tenu des inconvénients.",2
76915,Bonne qualités mais ne s'adapte pas du tout à mon téléphone. Pourtant je suis sur que dans la description c'était possible. Du coup je me retrouve avec ce câble qui me sert à rien.,2
50402,"Le piege a l'air costaud, mais je n'ai toujours pas compris comment l'utiliser !!! Faut-y que je sois bête !!! En tous cas une petite notice pour les novices, cela n'aurait pas été du vice !!!",2
57004,arrivé cassé (2 boites) malgré un emballage qui semblait intact..,2
