72272,"Le filament n'arrête pas de s'emmêler, obligé de dérouler à la main pour ne pas rater les impressions. Jamais eu ce problème avec d'autres marques.",2
65426,Les Housses n épouse pas parfaitement les sièges des tabourets...,2
74456,"Déçu par ce produit. Après utilisation de ces pastilles ma bouteille a gardé une petite odeur de vieux. Du coup, j’ai du acheter une brosse à bouteille qui a fait un bien meilleur travail.",2
48710,Il n'y avait que 2 crochets dans le colis au lieu de 4 crochets. La boîte qui contenait ces 2 crochets n aurait même pas pu en contenir 4 tellement elle est petite...C'est pour cette raison que je vous renvoie ce colis dans son emballage d'origine et que j en demande le remboursement. C'est dommage car ce produit me plaisait.,2
60151,je l ai installé sur ma terrasse . il manquait les caoutchouc du verre de la table basse . qualité moyenne,2
64047,"Je ne pensais pas qu'après les micro machines, ont avait aussi des micro couteaux. Je met 2 étoiles, parce que conforme à la description 6,5cm de manche, et je met pas plus parceque je vais aller pleurer de rage.",2
54783,Le câble marche pour afficher un appareille photo directement sur la télé... ! mai sen aucun cas avec des tablette ou smartphone !!,2
77726,"Assez déçue, ne fonctionne pas bien du coup mes enfants ne joue quasiment pas avec",2
66400,"Joly forme et couleur, mais finitions mal faites et matériaux utilisés très chip.",2
65429,Facile à nettoyer esthétiquement jolie par contre utilisation et café moyen,2
68411,Je suis convaincue que l'avenir des coton tige plastique touche à sa faim tout comme les sacs plastique ou les pailles... Seulement ces cotons tige bois qui doivent être une alternative sont de mauvaise qualité... Le coton reste dans les oreilles. Je déconseille fortement ceux la que je trouve dangereux mais l'idée est la,2
72464,Après réception du colis je suis très dessus car tous les ballons bicolores sont plus noir sur fond blanc que blanc sur fond noir de plus il en manquait un.,2
66176,"J'ai acheté ce kit pensent qu'il était complet mais pas du tout il manque le liquide pour la résine qui est elle même en très petite quantité le reste des objets y sont, mais je ne recommande pas ce kit",2
54402,Produit chinois donc cher pour ce qu'il est ! J'ai voulu le renvoyer mais il faut avancer le port !,2
41259,"Produit jamais reçu !! Merci à ce site formidable qui se nomme Amazon et qui fait le nécessaire pour que ses clients soit toujours heureux de commandez chez eux, pour ma part je n'ai jamais reçu le colis mais le service client à procéder au remboursement.",2
78446,le système de ventouse n'est pas au point. Le siège ne tiens pas au fond du spa,2
69028,boite cassé dans le transport,2
70579,"On m’a conseillé cette tétine pour mon bébé prématuré... si la tétine en elle même est parfaite, le gros cercle tout autour et le poids sont complètement disproportionnés par rapport à la petite taille et la force d’un prema. C’est dommage car mon bébé a mis plusieurs semaines a pouvoir réellement l’utiliser mais une fois que ça a été possible, il en était fou !",2
52780,Depuis que j ai change la cartouche jaune et rose mon imprimante Canon n imprime plus correctement. La couleur rose ne fonctionne pas. Dommage,2
43736,"le ressort dans l'anneau a laché au bout d'un mois, du coup l'anneau pend quand je manipule mon telephone, ca fait du bruit, ca me gene, je l'ai jeté.",2
56899,l'éclairage est fort jaune ce qui diminue les lux.,2
44127,"Acheté il y a 2 mois, un des deux écouteurs est déjà défectueux....",2
62579,"Bonjour je l'ai installé sur mon Xperia xz2 compact. Il n'as pas duré longtemps, fragile je trouve.",2
67774,Efficacité réduite pour une mise en œuvre compliquée. Production de froid minime. Gadget,2
70504,"Produit qui ne fait pas vraiment ses preuves. Pas d effets notables, un petit tôt peut être. Je reviendrai plus tard pour compléter ce témoignage.",2
78057,Jamais reçu l'article que attendais mais pas vue le produits je vous conseiller de compenser.. toujours pas reçu j'espère que je sera rembourser..,2
41268,Ne couvre pas correctement les côtés de l'écran. Je suis un peu déçu du produit,2
51623,"Le produit est de très bonne qualité mais j’ai voulu brancher mon ordinateur portable de la même marque le produit (Lenovo) sur le port USB C vers un câble VGA pour projeter mon écran sur un vidéo projecteur, mais cela ne fonctionne pas. L’ordinateur dis qu’il ne prend pas en charge l’adaptateur alors que mon PC est récent, sous Windows 10 et les drivers sont à jour.",2
46601,Ne pas prendre pour un Samsung note 9 les dimensions en hauteur et largeur sont trop petites.,2
69085,MAL Expliqué sur le site et le produit n'est pas adapté à ce que je recherchais. Je le laisse dans un placard car je n'ai pas envie d'avoir des frais de retour,2
56610,"Confortable pour les enfants, mais trop lourde et pas facile à plier",2
79093,"Transfert rapide , mais la clé est très chaude en même pas 10 secondes.",2
45723,"Draps trop fins, qualité du coton moyenne, on voit au travers.... Je ne recommande pas",2
42854,Acheté pour mes enfants de 9 ans et 7 ans Contenance faite pour un petit goûter ! 🙄,2
49011,"Assez déçue par la qualité d'image. Je ne conseille pas cet achat, qui ne vaut pas le prix payé.",2
75583,Produits fragiles les paillettes s'enlève facilement,2
73843,"Ce sapin prend du temps pour être monté. Il ne ressemble pas vraiment à la photo, qui évidemment, met le produit en valeur et paraît impeccable. En réalité, c'est tout autre chose... dommage il n'est pas réaliste du tout. Un sapin Nordmann est bien différent de cela.",2
47926,trop dur trop lourd difficile a placer trop complexe trop peux sensible,2
51451,"Je suis plutôt déçu par cette ampoule car elle est indétectable par mon réseau z-waves en mode inclusion. De ce fait, c’est un peu chère pour une simple ampoule",2
53620,"La livraison est rapide, mais il est livré à 5 villa Camus, une rue parallèle de la mienne, demi KM plus loin. Heureusement, le voisin lointain me l'a donné. J’espère que la prochaine livraison soit dans ma boite aux lettres.",2
67901,"Je suis un peu déçu de ses écouteurs, j'ai déjà une paire du même style mais d'une autre marque et je voulais donc avoir une paire de rechange. Mais celle ci n'est pas comparable à mon ancienne paire ! le son est bon mais la batterie ne tiens pas du tout longtemps, je dirais même pas 2heures, alors qu'avec mon ancienne paire elle tenait largement plus !",2
59477,"La qualité de fabrication est très moyenne, l'affûtage n'est pas suffisant pour avoir un fraisage bien net. Le revêtement jaune s'en va rapidement. Si vous souhaitez faire du bon boulot, et longtemps passez votre chemin.",2
43806,Utilise avec un iPhone 8 Pas pratique du tout,2
78425,le produit est bien et pour le moment marche comme prévu cependant le prix vis à vis de la concurrence qui est nombreuse est beaucoup trop cher,2
71363,"Pour un caméscope qui doit filmer en Full HD, très très déçue de la qualité... J'ai eu l'impression de retrouver la qualité vidéo des téléphones à touches... Dans des conditions optimales (en extérieur, avec du soleil, et sans zoom !) on peut dire que ça va. Mais en intérieur, avec de la lumière et un peu de zoom, ce n'est pas envisageable... Ou alors il ne faut pas avoir d’exigence qualité ! Le zoom x16 : le caméscope filmant en grand angle, quand vous zoomez au max. vous avez le même rendu qu'à l'oeil nu (soit comme un 55 mm), je ne peut donc pas venter ses capacités... Le matériel est en plastique et ne m'a pas l'air des plus solides... Et pour couronner le tout, la télécommande ne fonctionne pas ! En plus il y a une ouverture au niveau de la batterie, qui peut prendre la poussière et/ou l'humidité... Je l'ai commandé pour filmer mon voyage en Australie, après quelques minutes d'enregistrement et la vue du résultat sur mon ordinateur, j'ai immédiatement demandé le renvoi et remboursement.",2
69038,Intéressant mais pas indispensable Peut être fait trop pour les initiées //,2
65507,"L'appareil est vraiment petit. Soit, ça peut être intéressant si on n'a pas beaucoup de place. Par contre les filtres sont hors standards et très durs à trouver pour un prix normal. On perd donc l’intérêt d’économiser sur le prix du modèle. Je le regrette. Par contre il fonctionne correctement tous les jours depuis 6 mois.",2
49851,Les bouchons d'oreilles en mousse sont bien plus efficaces,2
46884,"genouillères trop serrées pour mon fils de 4ans !! c'est fort dommage, il aurait fallut que le scratch soit plus long.",2
60000,a éviter je m'attendais franchement à autre chose dans le genre Lune de Fiel -que je conseille vivement l'écriture est percutante mais trop vu,2
67589,Portefeuille d'assez bonne qualité sauf la fermeture éclair qui se bloc à chaque fermeture. Très embêtant car assez galère pour fermé. Je pense se quel va pas durer très longtemps,2
60685,Fragile pour des enfants,2
55960,"Montre trop épaisse pour une femme ,la photo représentant la montre ne permet pas d'estimer l'épaisseur de celle-ci, les chiffres du calendrier sont vraiment tres petit.",2
78307,Rendu lamentable ne tient pas au mur j'ai tt retiré ça faisait limite minable,2
62418,Difficile à supporter à cause de la buée.,2
78562,Pour l'écoute de music sur ma tablette et mon portable.le problème est que les écouteurs ne tiennent pas dans l'oreille,2
40551,Excellente petite radio internet mais vendue sans mode d'emploi en français ce qui est illégale. La Dgccrf devrait agir pour obliger Amazon et ce fournisseur à fournir un mode d'emploi dans notre langue.,2
76091,Délai de livraison Premium non respecté,2
62761,"Même en respectant toutes les étapes, en prenant le temps de faire les choses bien. Un bidon entier pour une capote de Mini (3 couches) Malgré cela, l'eau ne perle pas. Extrêmement déçu. Vu le temps passé et le prix de ce produit. Pour moi, à éviter.",2
43208,"Les boucles d'oreilles sont très belles (plaisent beaucoup à ma copine). Cependant, il manque un fermoir et celui fourni n'est pas adapté..",2
68458,Le plastique qui cercle l'aimant était cassé à l'arrivée. Matériaux en carton.,2
53689,Produit reconditionné. Au niveau de l’un des pieds du portemanteau l’ecrou de vissage était défectueux et nécessité de racheter un réparateur de bois et des écrous. Deuxième achat de produit reconditionné et deuxième déception. Je ne renouvèlerai plus.,2
78665,Produit conforme a la photo sauf que elles ne tiennent pas du tout bien les cheveux et ca tire beaucoup,2
51821,Produit qui pourrait être parfait si les zip étaient en bon état de solidité car la languette pour ouvrir et fermer s en va et évidement impossible à remettre sinon. Le plastique est epais et protégé bien,2
49765,jolie qualité mais encore trop petit déçu,2
69995,"Éclairage super, rend bien sur BMW e90 mais n'est pas Plug and play. J'ai maintenant 2 VOYANTS défauts Attention ampoule beaucoup plus grosse que celle d'origine à prendre en compte pour installer dans leurs emplacements",2
46463,"Outil de piètre qualité. Casse très rapidement. sinon, c'est plus ou moins bonne qualité sur le reste. Vu le prix, on ne peut pas s'attendre à une grande qualité. Ça fait le travail pour sauver un bracelet montre. C'est tout.",2
79898,Coque souple assez fragile et opaque pour ne pas voir l'écran a travers sauf de nuit ou nous avons une légère visibilité.,2
61806,"Maintenir ma clé à portée de main, en haut de la poche, pour ne pas avoir à la chercher. Le produit correspond exactement à mon attente, malheureusement le fils s’use très vite. Il casse près de l’attache. Aucun n’a duré plus de 2 où 3 mois.",2
52192,J’ai acheté 3 livres pour mes neveux et nièces mais quelle ne fut pas ma déception de constater que le stylo spécial n’était pas livré avec...!,2
77798,Malgré le soin apporté une des articulation est déjà fendue. Je l'ai donc consolidée avec un adhésif très fort. Pour la taille et le principe c'est parfait et les DD rentrent parfaitement. Seul le morceau de mousse est trop dur et trop épais. Il serait judicieux de le remplacer par une mousse plus souple.,2
56210,Je m'attendais à ce que ça plaque mon ventre mieux que ça. Du coup ça a été un achat inutile pour ma part.,2
70103,Pour le prix je suis déçue. J’ai attendu pour faire un commentaire et honnêtement au départ le moelleux est top ce n’est plus le cas...,2
75358,"Mon conjoint était très content au début (achat en septembre), mais depuis 1 mois la montre beugue au moins 3 fois par semaine, et depuis cette semaine elle ne compte quasiment plus les pas fait... Vraiment déçu de cet achat.",2
50153,"la notice est mal faite ,le matériel est vendu pour l'Angleterre et bien sûr il n'est pas dit de modifier la prise de courant ,ensuite quand on est malentendant les sonnettes supplémentaires sont nécessaires même en appart car un bouton supplémentaire fixé à la porte d'entrée est nécessaire il est dommage qu'Amazon n'en vende pas et qu'il faut donc se tourner vers d'autres fournisseurs",2
54666,L'image ne correspond pas au produit livré. D'autre part il n'y a aucun mode d'emploi livré avec ce produit,2
49978,"Clavier qui n'est pas repéré par mon mbp... Son seul avantage... Les raccourcis qui permettent de monter et baisser le son, pour le reste le pad est lent et impossible de le régler ! Impossible d'écrire une phrase sans erreurs du fait de l'impossibilité de frapper d'eux fois de suite la même lettre... De plus il provoque très régulièrement des disfonctionnement (ttes les 10 minutes) impossible d'utiliser le pad correctement, celui ci ne propose que des clics droit... Bref a éviter !",2
52548,"Portée 2 heures, des plaques rouges se sont développées sur ma peau ( partie métallique en contact avec la montre), ce qui ne m'était jamais arrivé avant. De plus bracelet très dur et inconfortable. Très très décevant pour cette marque...",2
58805,Le damier et les pièces ne sont pas dans un très beau bois. Cela fait toc. À la limite on aurait préféré du plastique,2
76802,Produit simpa mais se détache très souvent donc facile à perdre dommage,2
45465,Je ne l'ai utilisé qu'une fois car j'ai du mal à chaque fois à le mettre comme il faut... Je suis gauchère et n'est pas vraiment adapté...,2
69531,Le petit matelas gonflable qui est intégré dans le siège est percé. Son utilisation va être limitée. je ne recommande pas,2
54585,Soirée année 80 installation compliqué ne peut être installé sur n importe quel surface.,2
72199,"Je me suis trompée sur mon achat , seulement deux compartiments monnaie c'est un peu peu ! Enfin c'est ma faute, à l'avenir je serais plus vigilante !!!!",2
55910,Facile à mettre mais le film commence déjà à s'effriter même sans choc... J'espère que la protection sera utile en cas de vrai choc.,2
46949,Ne déborde pas suffisamment pour protéger l’ecran,2
43679,En tour du monde pour ranger livre et papier ... Ne résistera pas plus longtemps ...,2
58281,Le câble de 3m m’a lacher au bout de 4jours,2
48583,Produit de mauvaise qualité je prenais ça pour une corde à sauté adulte et bien non c'est pour enfant . Je l'ai donc donné à ma fille qui est contente mais pour combien de temps?,2
46711,"la lampe reste allumée du soir au matin essai a l'exterieur ,tout ce qui bouge l'allume et reste allumé a l interieur detecte tout bruit et mouvement meme a travers les vitres et les portes donc systeme de detection beaucoup trop sensible et non reglable",2
45815,Elles étaient bien sympa et mignonnes le premier jour à s'allumer et changer de couleur sauf que le second deux lampes ne s'allumaient plus du tout et le troisième jour plus aucune je suis décue et je ne recommande pas ayant jeté l'emballage car croyant que cela fonctionnait nickel je ne peux pas retourner le produit,2
50843,"Bloc d'alimentation de qualité, par contre le câble avec prise française est mauvais, son connecteur 3 broches, une fois inséré dans le bloc, n'a pas un bon maintien et peut provoquer de faux contacts ce qui est potentiellement dangereux. J'ai remplacé le câble par celui d'une alimentation Samsung (compatible), et là le maintien était parfait. Retour Amazon car je ne veux pas prendre le moindre risque. Dommage.",2
54661,"Écran qui scintille, chargeur propriétaire et autonomie en veille catastrophique. Plutôt lourd même sans clavier. Pour le reste tout est conforme à la description du produit.",2
76601,la prise n'est pas tout à fait conforme à la description il n'y a pas de port USB comme indiqué dans le titre,2
71398,"Un des 3 matelas que nous avons acheté se dégonfle pendant la nuit. Ce problème est arrivé juste après 2 bivouacs sur des terrains « doux » , herbe rase. Il est maintenant complètement inutilisable.",2
73441,"matière synthétique épaisse , a l air résistant , bonne ergonomie dans l usage , pratique en ajout sur un sac à dos mais hélas au bout de la 5 eme utilisation les sangles (attaches avec boutons pression) ont lachées ! Mauvaises coutures c'est dommage .",2
69105,"Parfait pour une chambre d enfants ou une maison de poupée, mais pour une salle de bain , à moins de mesurer 1 m 30 ce n est pas réellement adapté",2
57411,J'ai pas pensé de regarder la taille avant l'achat. Voila une photo. Boite et rempli qu'à moitié.,2
52805,Jolie figurine mais petite. Un peu déçu il faut vraiment bien lire les dimensions. Et un peu cher du coup pour ce que cela représente. Mais elle reste Jolie cependant.,2
46744,Belle montre mais le bracelet montre des défauts petits bouts qui dépassent. Ca ma même blessé a la poignée.,2
47559,La croix de Camargue a un maillon trop petit pour y passer une chaine J ai du la renvoyer,2
48124,aucune efficacité pour maigrir et il faut vraiment marcher toute une journée pour s'y habituer,2
66982,Commandé en prévision de la canicule. A lire la description je pensais vraiment sentir la différence avec la fonction cool qui est censé rafraîchir l'air. Pas plus rafraîchissant qu'un ventilateur classique finalement . Même en ajoutant de l'eau froide et des glaçons dans le bac prévu à cet effet. Cher pour ce que c'est,2
64788,J’ai bien aimé mais j’ai pas pu le finir mon livre se stop net et plus rien après . Je suis déçu,2
78428,"La tête est trop grosse,mon ancien braun était plus efficace que celui-ci. je déconseille.",2
64389,"J ai acheter cette table pour me dépanner je ne m'attendais pas a ce qu'elle soit aussi petite, elle n'est pas large on ne peux même pas repasser une jeans en une fois, et elle n'est pas haute du tout il ne faut pas faire 1m70 😂",2
50043,"Qualité du produit excellente mais attention produit compatible que pour une machine Dremel. Non compatible sur l'ensemble de la gamme , dommage ce kit serait super pour l'option défonceuse de certains modèles de la gamme.",2
46871,Je n'ai entendu aucune différence comparait avec mes écouteurs d'origine livrés avec mon téléphone Sony. J'ai renvoyer le produit pour un remboursement.,2
43572,Produit qui à l'air efficace mais reçu avec l'affichage digital défectueux.. Il faut serrer fort sur le boitier pour que l'affichage apparaisse... Dommage.,2
68183,Description fausse! Il n'y a qu'une pièce !!!!! Cela devient donc cher pour une seule pièce. Néanmoins le pare soleil fait son travail,2
60880,Je m'attendais à des anecdotes mieux que ça je suis déçue. Moi qui pensais l'offrir à mon conjoint pompier je ne le ferai pas et du coup je ne sais pas vraiment quoi en faire. Pour des personnes qui ne sont pas du domaine ça peut peut-être le faire pour un pompier je ne pense pas.,2
69233,"l'écran est vraiment trop petit, on a du mal à lire en conduisant! vous ne pouvez pas simplifier le graphisme et mettre beaucoup plus gros : l'essentiel : les panneaux, la vitesse maxi la direction....",2
43757,le colis était cassé je ne m'en suis rendu compte qu'au moment du montage Dommage je ne recommanderais pas de nouveau,2
73345,"Dommage ça ne fonctionne pas chez moi, les murs sont trop épais",2
63923,"la structure est jolie mais une partie étant casser elle ne se fixait pas dans l'autre carre en bois et j'ai du en jeter la moitier , je ne recommande pas ce produit",2
50395,"Écran cassé au premier petit choc, un impact ridicule et il faut en commander un autre. Dommage perte de temps à faire pour au final recommencer au bout d'une semaine",2
62163,"Coque arrière sympa au touché très souple et fine, par contre la protection d'écran est de l'épaisseur de tout les films plastiques que nous avons lors de l'achat d'un portable donc ridicule. Très déçu du produit à éviter si vous cherchez une protection d'écran !",2
64473,"A connu des pannes... Et pourtant, ne fonctionne pas tous les jours.",2
72678,N a tenu qu un hiver avant d apercevoir des trous dans la bâche . Et elle se déchire a certains endroits. Dommage..,2
40621,"le jeu est très répétitif, la qualité graphique est digne de la PS2, il n'est pas très intéressant et trop court.",2
75721,Tres moyen : ma master card rentre dans l'etui tout juste et après impossible à sortir pour ceux qui ont les doigts très secs.... ça énerve quand vous êtes payer au supermarché avec une file de 3 kms de long derrière vous et vous ne pouvez pas sortir votre carte pour payer....,2
65398,"La lampe a remplie sa fonction correctement pendant 1 an et a très bien servi à éclairer en toute sécurité mon escalier d'entrée, après 1 an la lumière c'est tellement affaiblie qu'elle n'éclairait pratiquement plus . Donc il fallait trouver une autre solution d'éclairage de mon escalier.",2
72543,"Le remplacement est facile mais le diamètre non négligeable par rapport à l'ampoule halogène classique. Gros doute sur la puissance des leds, je remplace une 80W halogène par cet équivalent 100W leds et je perds au moins 30% de luminosité...",2
65593,Produit très bas de gamme avec des traces sur le jouet.... On a l'impression que ce jouet à déjà servi.... Je n'ai pas le temps de le retourner car c'est pour un anniversaire mais je suis très déçu du produit.,2
50754,La semelle est plutôt lisse et fine. Les bottes ne sin du coup pas adaptées pour un usage en jardin par exemple.,2
43268,Un peu déçue. Se lit sans difficulté mais l’histoire est assez cousue de file blanc. Pas de surprise au moment du dénouement.,2
64468,le casque était trèsbien mais non compatible avec le portable Huawei donc ne fonctionne que partiellement ...je l'ai renvoyé et j'attends d'être remboursée on verra.,2
50518,L'écran protecteur n'est pas collé sur la totalité de l'écran juste sur les bords. La moindre chaleur des beau jour l'écran de protection c'est entièrement décollé.,2
158154,"Après avoir pas mal hésité pour l'achat suite aux commentaires mitigés, je me suis laissé tenté du fait du faible prix. Et j'ai très très bien fait car ce mini studio est très bien. L'éclairage LED est bien plus puissant que je ne l'aurais imaginé, pour un très bon résultat photo. Le système de fixation par bouton pression permet de rendre le mini studio parfaitement stable. Le produit pourrait être amélioré : - si on avait 2 barrettes de lumières, une fixe comme actuellement et une amovible, notamment pour des photos de figurines qui peuvent avoir de l'ombre sur le visage pour peut qu'elle porte un chapeau etc. - si on avait un font gris dans le lot (à la place du rouge par exemple dont je ne vois pas l'utilité) et éventuellement un font bleu clair",4
134858,Produit acheter pour une Fiat Idea 95 CV livraison rapide bon fonctionnement,4
132467,"J'ai pu fixer des tableaux et cadres sans problème, par contre n'hésitez pas à mettre une bande compléte et non pas des morceaux. Sinon pas de traces au mur. Très bon produit. Protégez le restant de rouleau dans l'emballage.",4
142133,"Qualité HD 1080p produisant une image exceptionnelle. Luminosité parfaite, en plein jour l'image est visible. La fonction 3D, avec lunette active DLP, donne un très bon rendu La ventilation est audible mais pas gênante. système aptoide est moyen et c'est dommage (une étoile en moins) période de test en cours... Amazon : livraison rapide en 1 j merci",4
156518,Très bel objet et qui va ravir ma petite fille. Saint Nicolas va lui apporter sous peu. Livraison rapide et sans problèmes.,4
130690,Fidèle à la description,4
132176,"Je suis vraiment satisfaite, très bonne tenue dans le slip,agréable à porter quand à la qualité SUPER TOP merci bye",4
129625,Il faut acheter en plus les dalles pour stabiliser le parasol et éviter qu'il ne s'envole.,4
129464,"Suffisamment éclairante en plan rapproché, aspect très jolie, très légère, rapport qualité prix parfait. montage facile.Je ne regrette pas mon achat",4
142387,Je m’en suis servi finalement tout au long de mon voyage afin d’avoir sur moi tous mes papiers,4
142234,"Dilatateur efficace qui apporte un confort respiratoire immédiat. Adopter des le 1er essai , tout a fait toléré, ne gene pas car matière souple qu'on finit par oublier que nous le portons. Attention taille S convient pour tous les nez sauf les tres larges et grand, inutile de prendre du médium cela serait trop grand, la matière est très souple et s'adapte à tous les nez !!! Un bémol pas bien génant mais bon.... la notice est en allemand anglais russe mais zéro Français !!!!!! AH OUI CHER AMAZON JE VOUS INFORME QUE MON COLIS EST ARRIVE DECHIRE ET PERCE DANS SON MILIEU DONC IL A ETE FORCE CAR LA BOITE AUSSI ETAIT OUVERTE !!! CELA N'EST PAS ACCEPTABLE !!",4
139136,J'ai utilisé un petit retroviseur,4
150191,"Bon produit, conforme à la decription",4
