128744,"Très efficaces, ils isolent bien des fréquences les plus dangereuses mais permettent d'entendre les gens parler en fonction de l'adaptateur sélectionné. Petit bémol, le fil qui permet de tenir les bouchons autour du cou n'est pas très fiable.",4
129878,produit mis plusieurs fois . effet garantie. taille correcte . pas de surprise négative sur le produit . tissus léger,4
145012,Je l'ai bien apprécié par ce temps de canicule,4
134552,Il est très bien. Reste juste à voir la résistance avec le temps.,4
146321,Article conforme o descriptif parfaiT je le conseil. Le son est corect bien pour des soiree ou autres pratique pour la transporter.,4
137859,je l'est achetez suite au jeux is it love j'ai adoré bien sur je trouve juste qu'il y a trop de changement par rapport au jeux ce qui fais finalement une histoire a part entière,4
143390,le film est assez fin. assez solide mais dès qu'il ya une petite déchirure attention! enfin ça reste pour un usage ponctuel donc ça va. tiens très peu de place pliée.,4
145114,"La qualité du son m’a surprise! Voire le pris, pas mal du tout! Par contre, pas la peine d’essayer de le connecter à un Mac. En tous cas, sur l’iPhone ça marche bien.",4
153367,"Je suis très satisfaite de mon achat. Très esthétique, elle est également très pratique, le son est bon. A recommander.",4
146279,Bien utiles pour avoir toujours sous la main des sodas maison Saveurs identiques aux originaux et on peut gérer la quantité de sirops donc de sucre dans les sodas,4
138794,Colis reçu en 2 jours. Plus qu'a tester les semelles,4
123495,"Actuellement, aucune source primaire d'énergie renouvelable ne peut remplacer le nucléaire en quantité. Toute production d'énergie engendre obligatoirement des déchets. Il faut choisir ceux qui sont les moins nocifs pour la planète et que l'Homme maîtrise le mieux.",4
126838,"Le kit est bien conforme : lampe, chargeur, pile 18650 et kit vélo. A savoir s'il est bien a 2000 lumens je ne sais pas mais en tout cas il éclaire bien. Le défaut du kit est la pile qui est seulement a 2200mah et que le chargeur est uniquement a brancher a un adaptateur USB et qu'il n'y a pas de voyant du niveau de la charge. Mais bon vue le prix du Kit, je pense que c'est une bonne affaire.",4
121244,Bon produit qui toutefois taille un peu trop grand. Dommage,4
141312,"Il remplit bien sa fonction, est de bonne dimension mais la couleur tend plus sur le verre vase que sur le"" vieillis"" de la photo",4
122529,Le contre-pied des histoires habituelles de couples blancs ayant un enfant noir,4
147696,Tres sympa la petite a adore mais je trouve la couleur un peu trop criarde en comparaison a la photo,4
129028,"Coque et verre trempé dans un même produit très pratique Utilisé depuis quelques mois très bien bonne tenue sensibilité correcte à l exception des côtés Protection solide et assez jolie, ne dénature pas trop le s9 Je recommande",4
159377,Bon produit dans l’ensemble.,4
142051,"Un produit simple et pratique pour brancher plusieurs appareils en meme temps en voiture. Livré rapidement, bien emballé. Recommande sans hésiter.",4
152038,J’ ai bien aimé ce livre. Agréable à lire.,4
120595,Les cartes sont très petites ( la taille de jeux de carte classique). Pas mal des idées intéressantes.,4
141969,Pragmatisme dans la gestion quotidienne. Slalom dans les difficultés pour garder la bonne ligne,4
155349,"Parfait, bonne qualité",4
140993,"Mon mari venant de subir une opération, nous avons installé ces rehausseur pour le lit. Installation facile, très solide , ne glisse pas. Parfait",4
140570,Très bien tous les sens y sont un peu coûteux quand même mais tout y est,4
121773,C'est leger et pratique. Du chinois mais ca fait ce qu'on lui demande. Pas cher en plus. Satisfait sans regrets,4
152848,"Aucun problème avec le vendeur, colis arrivé dans un état impeccable! c'est avec le livreur que j'ai eu des soucis... les contacter une vraie galère ça m'a coûté 4€ de plus pour essayer de les avoir par téléphone...",4
134683,"Bien pratique pour nettoyer l'aéro, ensemble correct, je recommande",4
149023,Pour photos association,4
141647,"Jolie coque mais ne couvre pas énormément, a l'air solide, a voir sur le long terme.",4
126670,Batterie conforme à la description. Dimensions ok. Cependant outils plastique trop fragile. Il c'est cassée au premier coup de levier... Démontage/remontage assez fastidieu il faut être très méticuleux et avoir des petites mains. Heureusement les tutos vidéos m'ont permis d'être plus tranquille sur la marche à suivre,4
147138,Que dire de plus que street Fighter! Perso je trouve ça dommage les combats d'ou le 4/5,4
138412,J'ai vraiment aimé ce livre. Il est prenant. Bonne lecture,4
129241,"je n'ai pas mis 5 étoiles car je viens juste de le recevoir, pour l'instant il correspond tout à fait à mon attente.",4
155995,"Le rapport qualité prix est bon. Ni haut de gamme ni bas de gamme, le produit est fonctionnel et pratique et suffit à une utilisation amateur.",4
146735,"Jolies étiquettes, tout à fait conformes. Je suis satisfaite de mon achat",4
155058,"Correspond à mes attentes, couleur fun, inscription en français. J'en ai pris 4 pour faire le mois. Je conseille ce produit.",4
155395,Très contente de mon achat,4
149807,Parfait seulement l'un des DVD ne marche pas.... bien dommage une saison non complete se qui gâche un peu le coffret,4
157289,"Sac acheté en cadeau de naissance. 5 mois après il n'a pas bougé, les coutures et fermetures sont comme neuves. Le sac dispose de nombreux rangements, un produit très pratique pour une maman. Je recommande.",4
128657,on verra dans le temps pour l’instant je regrettes pas mon achat livrée très vite dans un très bon emballage,4
134853,Ce que nous voulions. Rien a redire. Très Efficace.,4
142262,"Sapin facile à monter, léger et très pratique !",4
130936,"Très contente du tapis , spacieux, épais comme il faut, 2 faces ; 1 lisse et 1 rugueuse ( on utilise celle ci elle accroche mieux pour bb de 7 mois en apprentissage de déplacement ! ), coloré. On peut mélanger les dalles et écrire le prénom de ses enfants pour s amuser à condition d avoir qu 1 lettre de chaque ! Ce qui amuse bien les grands frères ! qui m ont aider à l installer. Seul petit inconvénient , il y a une odeur de plastique mais en aérant 2 fois la chambre par jour , cela s 'atténue rapidement. Livré rapidement, les dalles a même le carton sans de suremballage ( un déballage rapide ) dans l ordre de l alphabet et des chiffres, super pour un montage super rapide.Le carton dans un autre carton amazon bien calé et en parfait état.",4
140064,L'extension permet de réaliser un circuit plus agréable à jouer pour les enfants mais ceci manque de tournant j'ai du racheter un circuit pour le rendre encore plus technique,4
157959,le bouton on /off est mal placé difficile de le trouver le matin le prix est fort par rapport à l'appareil.,4
141982,Je l'ai utilisé dans mon 4×4 transformé en petit mobile home comme range tout fixé au plafond,4
137110,"Le produit est en bon état comme indiqué dans le description et le prix est raisonnable, je suis tout à fait satisfait.",4
143244,"je suis kiné, bon outil didactique pour les patientes. Seul soucis, il n'y a pas de socle",4
142791,"Table à repasser de bonne qualité. La 1ère que j'ai commandé était très bancale, j'ai fait une demande de retour, le transporteur Fedex est venu la rechercher et j'ai recommandé la même qui est parfaitement stable. Comme quoi il faut bien vérifier.",4
138977,"Après hésitation et avis de la personne à qui elle était destinée, je l'ai finalement retournée pour en commander une plus grande. Celle-ci est très bien faite mais trop petite pour une utilisation quotidienne en ville avec : téléphone, porte-cartes, clés, papiers voiture... à limiter à une utilisation sportive à mon avis...",4
150077,Très beau tissu mais légèrement trop longue,4
157925,Reçu rapidement et monté aussi tôt dans ma voiture avec son autoradio tout neuf mais sans radio! Fonctionne parfaitement et facile a installer mais je ne comprend pas pourquoi ce lot de 2 ... j'aurais préféré payer moins cher 1 seul et garder la livraison prime ;),4
136872,J'ai mis 4/5 car je n'ai pas eu la chance de le tester mais je l'ai vu tourner et il est plutôt sympa pour ceux qui aiment le rpg :),4
134506,le livre est arrivé comme convenu. L'emballage est propre,4
123889,Bien mais un peu cher,4
147163,"Très joli, ne s’oxyde pas pour le moment je le porte régulièrement Livraison au top Je suis ravie de mon achat",4
159189,"Métal Plus fin que ce que je pensais, mais supporte quand même le poids de mon pot de fleur. J'ai préféré utiliser mes propres chevilles car celles fournies semblaient être fragiles.",4
156322,"Ampoules puissantes et lumière bien blanche, ca change des lumières chaudes jaunes. Ca donne beaucoup de classe à une pièce mais il ne faut pas en mettre beaucoup car c'est vraiment très fort et bien blanc. C'est vrai que la finition est fragile, il faut donc manipuler avec délicatesse. Je suis quand même satisfait largement car c'est aussi un bon rapport qualité prix pour une grande marque.",4
156957,Un peu grand : trop pour un petit bol. Il faut un bol de grande taille. Bien stable... rien d'autre à dire,4
125749,"plutôt de bonne qualité ma fille l'adore, conforme à la photo et la taille correspond, par contre il faut avoir le temps livré en 1 mois",4
149499,Parfait.. Rien à dire.. Produit de bonne qualité..,4
155601,Parfait pour initier les enfants dans la construction des Lego. Qualité excellente au niveau de la reliure du livre.,4
130176,"Je viens de mettre mes cartes dedans, pour l'instant pas mal , le seul défaut ses les frais d'envoie , que je pensais gratuit en commandant deux articles en méme temps . et frais exagéré vue le prix de l'article. la prochaine fois j'éviterai cela.",4
141513,Un sac de tous les jours,4
133433,"J'ai trouvé ces feutres hyper intéressants car en visionnant (sur YouTube) la façon des les utiliser, en l'occurrence, pour l'aquarelle, j'ai été tentée. Toujours curieuse de ce qui se rapporte à cette activité, j'ai commandé ET PAS DECUE du tout. Ces feutres sont fascinants. On peut faire beaucoup de choses et expérimenter. La précision est assez plaisante et la palette de couleur est superbe. Faites vos expériences, découvrez ce que cela donne, très amusant...",4
151211,Bien mais de temps en temps il plante. Il faut le débrancher puis le rebrancher pour que cela refonctionne,4
146548,Bonjour c est un cadeau pour ma petite fille je suis un peu déçu car il a fallu que je fasse un ourlet car le surfilage ne tener pas merci,4
137822,Bon produit mais saturation de la grille et voudrais savoir pour la garantie?,4
145775,"Ces sachets sont très pratiques pour la conservation du lait maternel, ils sont assez résistants, grands et se conservent très bien au congélateur. Seul bémol: Pour écrire dessus ce n'est pas très facile, il faut soit appuyer soit trouver un stylo adapté.",4
125630,"la sortie se trouve fort haute et donc, faut penché le samovar pour avoir un maximum de tasses. Et la quantité minimum est fort élevé.",4
156791,parfait pour entrainement,4
141160,Je suis satisfaite de cette commande les couleurs exacte que je voulais je recommande,4
154803,"Tout le plus utile est dit dans ce petit livret qui propose des explications claires, accessibles à tous, même aux débutants.Pour les passionnés cela suffit aussi amplement.",4
125854,"Aucun soucis. La Led bleue crache pas mal, dans le noir, mais dans l'ensemble, top",4
120406,Je m'attendais à ce que le chat soit un peu récalcitrant mais il adore et s'amuse à faire tomber les croquettes avec la patte. Cependant même si le capuchon semble de confiance pour un effet sous vide je me doute que la prise d'air du trou où tombe les croquettes rendent celles-ci en partie moins fraîches. Et quand croquettes vieilles et pas fraîche : chat pas content. En tout cas pour le prix c'est parfait,4
149484,Pensez à sauvegarder régulièrement ce jeu a des retours console. Sinon il est fidèle à l'original bien que sur Switch on ne bénéficie pas de tous les DLC...,4
149567,très bon produit j en suis satisfait.,4
149409,"Très belle boîte, mais aussi très grande ! faites attention aux dimensions, j'ai été surprise. 2 grosses bobines ne tiennent pas côte à côte.",4
144645,Fonctionne pour moi !!,4
141273,Tout y est ! Compatible avec makita ! Durée de vie nickel ! Je recommande ce produit . . .,4
153723,"Bon produit, fiable. Service client au top , a l'écoute et très professionnel.",4
140365,Produit correspondant au descriptif,4
136135,"Très bonne accroche. Un peu bruyant sans téléphone (grésillements) mais rien de méchant. Utilisé avec chargeur usb normal, mériterait peut-être un chargeur rapide.",4
136303,Utilisé lors de travaux de ponçage,4
123350,Nombreux rangements bon organisateur.,4
120678,chaine qui s'use trop vite a déjà été remplacée par une chaine de la marque Orégon plus adaptée à usage professionnel,4
156525,Tres bien pour une lampe d'appoint mais pas pour travailler avec : pas assez puissante. Se fixe très bien sur la casquette Très content de mon achat,4
153693,La reve des petites filles meme si la qualité laisse a désiré,4
135912,Bonjour je viens de commander ces airs pods je les conseils ils sont arrivés en 1 semaine et le son est très bien je conseil,4
125329,Très bon produit et les pinceaux sont très beaux. Par contre ajouter une pointe de glue entre le manche et le bout du pinceau ce il s'en va facilement. Je suis également très surprise de la qualité de la boîte. Parfait,4
145960,"fonctionne parfaitement, le couplage est un peu dur mais c'est sans conséquence sur sa fonctionnalité et le rapport qualité-prix est excellent.",4
149469,Pour remplace la batterie de mon ordinateur portable,4
142131,Génial pour les enfants il peuvent faire plusieurs parcours dommage que sa soit pas dans sac de transport,4
151569,Photos des mes chats,4
122504,"Parfait! Sac exactement comme sur les photos. De nombreuses poches utiles pour ranger toutes sortes de choses. A voir dans le temps, je suis délicate avec les tirettes. Du plus bel effet... plusieurs personnes m'ont demandées où je l avais acheté",4
127161,"Très bon produit ! Aspiration très efficace. Assez bruyant quand même mais bon vu que c'est pour le garage / chantier c'est pas bien grave. Le mode soufflerie est assez sympa (il suffit de prendre le tuyau et de le mettre sur l'air expulsé) il peut éviter pour nettoyer l'établi de prendre le compresseur.... Petit point à améliorer : pas de joint entre le bloc du dessus et la cuve inox : quelques pertes du coup. Je vais rajouter un joint plat pour fenêtres ou autre. Un adaptateur pour outillages aurait été un plus aussi... Sinon rapport qualité prix imbattable. Je rajoute après 2 mois d'utilisation qu'un sac est indispensable sinon le filtre attrapera vite cheveux... Où au pire mettre une ""chaussette"" mais bon cela empêchera pas la perte de puissance du coup.",4
138310,Plutôt satisfaite de cet achat. Délai de livraison respecté et emballage adéquat. Qualité de l’inox qui aurait pu être meilleure.,4
152118,Super ça fait ce qu'on en attend mais c'est un impressionnant bouf pile,4
124030,Très bon article Protége très bien l arrière du téléphone mais il faut mettre une protection devant car sinon l écran du téléphone n est pas protégé,4
121615,bon appareil dommage notice en anglais,4
140133,"Super rapport qualité-prix. Ma manucure tient 2/3 semaines faciles ( si vernis à ongle de bonne qualité évidemment). Légères, compactes. Seul bémol l'alimentation : USB. Donc il faut dénicher des adaptateurs (de téléphone portable par exemple) pour faire fonctionner les lampes, ce qui m'agace donc j'enlève une étoile.",4
150561,"Produit conforme à la description, manche en plastique dur.",4
130973,Produit plutôt convaincant vu son prix. Il est clairement au dessus des autres jouets de même type à prix équivalent. Je vous le conseil.,4
156734,Superbes boucles d'oreilles qui sont légères. Très bel effet pour un bijou fantaisie. Je recommande cet article et ce vendeur.,4
126736,Bien pour la ville mais reste plus lourde qu’une petite citadine bon marché et vraiment incompatible avec pavés ou cailloux. Très confortable pour bébé et vraiment très jolie Maniabilité rien a dire et prend peut de place une fois pliée,4
134208,Très pratique et utile,4
135631,"ENVOI DU LIVRE RAPIDE ET PRODUIT EN BON ETAT. BEL OUVRAGE, BELLE LECON DE VIE JE RECOMMANDE VIVEMENT BEL OUVRAGE",4
130641,C'est le genre d'outils qui permet de sauver du temps quand on l'a dans la boite. Bonne qualité.,4
148864,Quelle perte de Wi-Fi de temps en temps pendant 2s mais rien de méchant produit correct. Bon rapport qualité prix !,4
133785,Beau produit après un repassage maison. Malheureusement le produit est sans jupon. Il faut le signaler.,4
152727,"Après deux semaine d'utilisation, je peux émettre un avis positif sur ce téléphone. Il est beau, léger, assez puissant pour l'utilisateur lambda que je suis. Il tient la charge une journée et demi environ avec une utilisation soutenue des données, bluetooth...etc et se charge à 100% en 1h30. Android One est rapide, l'écran est bon, le son pas mal du tout en appel, le GPS et la 3/4G accroche bien : Bref, c'est un bon smartphone ! La qualité photo n'est pas super top mais c'est un TELEPHONE !! Ca convient pour des petits souvenirs... Point positif que je n'avais pas anticipé : l'émetteur/récepteur IR. C'est marrant, on peut se servir de son téléphone comme d'une télécommande :) Le seul point négatif, c'est qu'il est grand et fin (comme moi...) mais du coup, il glisse un peu des mains... (Pas comme moi !) Bref : je le conseille sans soucis",4
124068,"Très jolies bouches d’oreilles. Elles sont bien longues mais légères en même temps, on ne les sent pas. Très satisfaite de mon achat.",4
141084,Passionné d'histoire antique je suis très heureux d'avoir acquis cet ouvrage.,4
30074,Odeur nauséabonde même après lavage. Et ces chaussettes serrent trop a la cheville. Je ne conseille pas du tout ces chaussettes.,1
23677,Très déçue par ce produit la 1e année super et cette année en plus avec la canicule piscine percée trop fragile bon pour un an uniquement après poubelle,1
4082,"Colis non reçu bien qu'indiqué ""déposé dans la boîte aux lettres""",1
9447,Le plastique de cette protection est souple mais ne vaut pas un caoutchouc souple. De plus la protection située au niveau du bouton on/off de la montre exerce une pression permanente ce qui rend impossible l’utilisation de mon Apple Watch 4.,1
30068,Coque de très mauvaise qualité vraiment très déçue. Quelques heures d’utilisation et les yeux du chat se décollent et en quelques jours (3 précisément) le chat se décolle et se fend. Coque à la poubelle après 9 jours d’utilisation et de tentative de recollage. Je vous conseille de ne pas l’acheter.,1
28455,Jamais reçu c est des voleur,1
7816,"Soit je suis nulle soit je n ai rien compris!!! Mon livre a 2 fois les mêmes pages ""décodeur"" et "" révélations"". Je suis bloquée dès le 1er code car je ne trouve pas le code correspondant à ""EXAMINER LA BIBLIOTHEQUE"".....",1
5254,Produit arriver en retard emballage endommagé et même pas la moitié du produit casi vide à l'intérieur du flacon. Déçu,1
9848,"Très déçu, j’ai reçu cette produit et il était défectueux. Maintenant je dois le renvoyer pour recevoir un remboursement, ce qui est assez gênant. Je ne recommanderais pas ce produit.",1
6603,"Se connecte, mais pas vraiment de driver ou de soft pour régler cette clef. Débit médiocre même à courte distance. Pas un débit digne d'un WiFi ac.",1
22725,Produit reçu en très mauvaise état Inutilisable !!!,1
809,"La description initiale du produit ne correspond en rien à la réalité. Le vendeur indique une coque en cuir et on reçoit une imitation cuir bas de gamme. Je ne recommande pas ce site, c'est une supercherie!!",1
37747,Quand je branche une ampoule le fusible grille qualité médiocre,1
19644,Dimensions plus petites que nos fenêtres françaises standards. Mesurez-les bien avant de passer commande. Attention !!! Le vendeur ne répond pas quand on lui réclame le remboursement !!!,1
9197,"Bien arrivé il est joli, mais manque 2 picot a l'arrière ! Je le garde et vais le bricolé par ce que c'est pour offrir et c'est déjà le deuxième que je commande le premier étant arrivé avec la vitre cassé !!!mais je suis très déçu ! Surtout vue le prix !!!",1
21614,Trouée au bout de 2 semaine.,1
10075,Reçu sans les serrages et accessoires mentionnés dans la description.,1
2815,Une honte sérieux je suis énervé comme j’ai rarement été. Première le carton un scotch bizarre qui fait penser que le colis a été ouvert puis une machine avec des bouts de farine collés qui témoignent d’une utilisation donc le produit n’est pas neuf. Sur l’une des vis de la face avant on constate un bout de Téflon et en effet même avec celui ci l’une des deux vis ne permet pas de fermer correctement la face avant. Un véritable scandal fuyez ce produit sur Amazon,1
28290,Pas terible.fragile et les souris passe et repasse sent ce faire prendre!! Ça fini par marcher mais je suis dessus,1
31929,La lampe est arrivée en mille morceaux!!!! Je suis terriblement déçue .Je souhaite en avoir une nouvelle « emballée correctement » ou le remboursement.Merci,1
6682,"Je fais un 36/37 avec un pied très fin et ces chaussettes sont trop petites. Les blanches, noires et grises finissent par glisser et ne tiennent pas :( Il n'y a que les beiges qui restent en place un peu plus longtemps. Dommage j'avais choisis ce modèle pour justement le côté quasi invisible + silicone ! Très déçu car en ayant un petit pied et en lisant les commentaires je pensais que cela m'irait bien. Alors attention uniquement pour les très petit petit pied !",1
9570,"Protection inutilisable, des bulles partout sur l écran malgré une notice simple. Diminution nette du tactile. Arrêtez de mettre un packaging qui coûte plus cher que le produit lui même !",1
33644,"Bonjour, Gros problème sur la plaque dès 1ère utilisation.La plaque est devenue marron au niveau des 3 feus avant cuisson des aliments. Gros travail de nettoyage après fin de cuisson. j'ai pourtant respecter les consignes de jeter de l'eau froide sur la plaque encore chaude pour éliminer les restes d'aliment. il reste encore des traces sur la plaque après une heure de travail.Pour l'instant très déçu du produit. A vous lire.Sincères salutations.",1
2675,"Article de très mauvaise facture : De la colle sur la protection en verre : conséquence : en frottant pour l'enlever, la vitre en verre s'est brisée avant même d'être posée ! Remboursement demandé où envoi de dédommagement !",1
3745,"dommage je me suis aperçu trop tard que ce cadenas pour moto n'était pas Homologué SRA , ceci est demandé par les assurances . J'ai voulu le retourner mais le tarif de retour est de 20€ à ma charge . Par conséquent , autant le garder mais je suis déçu par la politique de retour",1
33838,"cadeau pour mon petit fils à Noël donc pas encore déballé. Par contre très déçue du prix. Jouet 9 euros de moins chez Cdiscount. Je n'ai pas pu annuler la commande car elle était en transit. Et grosse déception à la livraison au relais, le colis n'y était pas, il avait était livré dans un autre relais. Beaucoup de temps perdu.",1
24356,Ce verre trempé ne colle pas sur les cotés de mon téléphone !! Une arnaque !! A éviter absolument !,1
11673,j'ai bien reçu ma commande mai deux morceau de cuir était inutilisable car collé entre eux très déçu de cette achat cest inacceptable,1
14542,"Pas en verre, ne colle que sur les bords du téléphone.... Repousser par la coque, ce décolle, et il faut appuyer très fort sur l'écran sinon rien ne ce passe, on sent l'air entre la protection écran et le téléphone qui fait même du bruit !! Arnaque a éviter, autant payer le double du prix pour avoir une bonne protection ...",1
33362,Collée au gel c’est une arnaque qui m’a couté 34€ pas garantie si ça résiste 2 semaine ça sera pas mal Je suis déçu,1
12408,"Je vient d'aller chercher mon colis qui était dans ma boite au lettre, dans l'état comme sur les photos , j'étais chez moi, c vraiment désagréable.",1
2002,Je voudrais annuler cette commande Kindle. Aidez moi SVP.,1
39479,Très déçu trop compliqué pour avoir le site de téléchargement,1
37469,"Qualité limite. Défaut de montage avec lampe livrée dévissée. Pas de joints toriques, donc pas étanche. Luminosité très inférieure a ce qui était attendu. Pour la pratique du vtt xc de nuit c'est inutilisable car ça n'éclaire pas assez. Par contre pour rouler sur route je pense que c'est suffisant. Autonomie insuffisante car la batterie est clairement sous dimensionnée...",1
31069,Pour ma part le chapeau n'a pas le même rendu que sur la photo. Taille petit contrairement à ce que j'ai pu lire dans les autres commentaires,1
1853,Très mécontente. Apparement le produit a était ouvert et une étiquette est collée dessus avec d’autres ingrédient,1
33042,Bonjour je vous envoie cette email car j 'ai acheté une manette D-Pad Pokemon pour Nintendo Switch elle fonctionne pas alors je voudrai voir avec vous comment pourrai je faire . En attente de votre reponse CORDIALEMENT,1
