147661,"Der Bikini entspricht dem Foto, sowohl in Schnitt als auch in Farbe (ich kann hier nur für die weinrote Variante sprechen). Die Größe stimmt mit der von mir sonst getragenen Größe überein, also S bleibt S und so weiter (keine XL Bestellung nötig, weil Chinaware). Ein Stern Abzug, weil ein bis zwei Fäden gezogen sind, was dem Halt des Bikinis aber keinen Abbruch tut. Außerdem finde ich das Höschen etwas seltsam geschnitten: Der Stoff ist sehr lange, was heißt, dass man entweder zuviel Stoff vorne hat oder hinten, was etwas merkwürdig aussehen kann.",4
139888,Die Kopfhörer sind gut jedoch könnten die Bügel etwas fester sein sonst finde ich sie super .Die Lieferung ging recht schnell,4
139304,"Ganz ok, leider ziemlich steif das Kabel . . . . . . . . . . . . .",4
156720,"Sehr schön, dezenter Aufdruck, passt sehr gut, pflegeleicht und Formbeständig auch nach mehrmaligen waschen.",4
143259,"An sich kein schlechter Kaffee, jedoch für uns geschmacklich schlechter und weniger rund als die letzte Selektion des Jahres. Hat leichte Kakao Aromen und schmeckt etwas weniger Intensiv. Der Geruch und die Qualität sind wie gewohnt ausgezeichnet von Dallmayr. Es werden sich bestimmt Liebhaber auf Grund der Kakao Note finden, uns konnte dieser Kaffee geschmacklich leider nicht überzeugen.",4
133627,"Sehr coole Schuhe! Sehen aus wie Docs aber um das tausendfache bequemer! Das einzige was mich stört ist, das die Zunge immer zur Seite rutscht und es nach langem tragen auf die Socken abfärben, aber sonst eine der besten Stiefeln und mein lieblings Schuh 💙",4
137383,"Wir haben diese Möbel für das babyzimmer unserer Tochter gekauft und es ist wirklich schön. Die Möbel waren einfach aufzubauen und die Qualität ist für den Preis wirklich gut. Leider bekommen wir die Türen der wickelkommode nicht ganz richtig eingestellt, da ist wohl was ein kleines bisschen schief (sagt ein Schreiner der uns geholfen hat). Aber das ist nicht wirklich schlimm für uns. Die Lieferung ging auch super schnell und problemlos.",4
132726,Hatte gar nicht gewusst wie leicht man sich Pilze ein seinem Körper aufnehmen und vermehren kann. Werde gleich einiges umsetzen,4
123445,"Großer und stabiler Regenschrim. Für uns schon fast zu groß 😀 denke aber für etwas schwerere und große Leute optimal. Meine Frau meinte eher nen Sonnenschirm 😀 sonst waren wir mit der Quantität der zufrieden, einzigstes manco das Gewicht aber bei so einer Größe glaub kaum machbar. War für mich bei Wind & regen etwas anstrengend ein halbe Stunde zu halten 🤔",4
158806,Nette Spielerei für kleines Geld,4
138856,Das Set ist eigentlich gut durchdacht. Nur warum enthält das Deo Aluminium Chloride? Das kann gleich in die Tonne. Der Rest ist aber wirklich gut. Daher noch 4 Sterne,4
123264,Als Kinder Spielzeug vollkommen ausreichend super für die mädels zum spielen.,4
153583,"Die Squishys hatten ursprünglich eine Lieferzeit von 10 Tagen, weil sie nicht auf Lager waren, sind aber trotzdem nach 3 Tagen schon angekommen! Super. Die Verpackung ist der Grund für den Punktabzug, weil die Schachtel in der sie gekommen sind leider viiiel zu klein war. Die Squishys sind in einzelnen Tüten verpackt gewesen, damit sie nicht aneinander kleben, aber dadurch dass sie in eine so kleine Schachtel gepresst waren, haben sie von den Plastiktüten leider fast alle Einkerbungen. Nach einem Tag ""Lüften"" (sie waren etwas feucht bei der Ankunft) haben einige die kleinen Fältchen wieder verloren, aber leider nicht alle. Sie sind alle super weich und erfüllen ihren Zweck. Ich finde sie sind auch nette kleine Geschenke :)",4
147108,"Die Einrichtung der Cam ging über die App reibungslos, über den Browser hat es meine WLAN Verschlüsselung falsch erkannt und konnte sich nicht anmelden. Die Bedienung über die App ist top und die Bildqualität bei Tag und Nacht sehr gut. Vielleicht könnte der Hersteller noch etwas am Interface feilen, aber das ist natürlich meckern auf hohem Niveau. Klare Kaufempfehlung.",4
128722,"Schönes Produkt, gut verpackt. Das keine Fernbedienung dabei ist spielt in der Bewertung keine Rolle, dass war von vornherein klar.",4
138890,Könnten mehr mAp haben,4
159154,"Ich bin sehr zufrieden, alle Karten passen rein, das Format ist auch gut. Nur das Münzfach war nach kurzer zeit beschädigt, lässt sich mit 1 gutem Klebeband reparieren. 4 Sterne.",4
132226,Richt zwar einwenig aber ein preislich gutes produnk,4
135044,"Fußsack entspricht den Abbildungen, etwas kompliziert anzubringen, wenn es keine Anleitung gibt, jedoch erfüllt er voll und ganz den Sinn und Zweck und das ist ""Warmhalten"" und optisch zum Kinderwagen passen. Gut verpackt und schnell geliefert wurde auch noch.",4
143262,"Guter Film, sehr gute Besetzung, gute Schauspieler, aber für mich war der Film zu langatmig, daher haben wir das letzte Drittel gespart. Irgendwie fehlte dann plötzlich die Spannung, neugierde wie es weitergeht, man hätte hier etwas Info. streuen können damit man dran bleibt, aber ein guter Film.",4
142472,"Sieht schön aus, modern. Das einzige was nicht so gut ist, ist das man alle karten rausnehmen muss wenn man irgendeine braucht. Deswegen ein punktabzug.",4
126615,Von der Verarbeitung und Qualität ist sehr gut. Von der Größe für mein 13 Jahre Sohn gerademal also bis 140cm ist noch okay. Für Erwachsene Kinder definitiv zu klein.,4
124320,Habe die Batterien eingesetzt und die Fernbedienung hat sofort funktioniert. Nur das verwendete Material (Der Kunststoff) und die Verarbeitung sind kein Vergleich zum Original. Aber für den Preis muss man wohl damit rechnen,4
136425,"tolle Motive, macht gute Laune am Frühstückstisch",4
144610,"Nehme jeden Tag zwei Gummibärchen (Morgens und Abends) meine Haare sind dicker und kräftiger geworden. Für den Preis ziehe ich einen Stern ab, da ich sie recht teuer finde und bei zwei pro Tag hält die Packung leider nicht so lange",4
121392,"Die Lampen ließen sich mit den Klebepads gut befestigen und es sind auch wirklich ausreichend vorhanden. Ich glaube doppelt so viele wie Lampen. Das Aufrollen des Kabels, damit so wenig wie möglich sichtbar ist, bedurfte etwas Kraft und zwischen den beiden letzten steht auch etwas raus, aber das stört mich persönlich nicht (wollte nicht alles vor vorn machen^^). Es gibt 5 Lichtstufen, wobei die letzten beiden dem Tageslicht wohl am nächsten kommen. Allerdings ist mir, wenn ich mich morgens 5.30 Uhr fertig mache, schon Stufe 1 zu hell. Da hätte ich mir eine noch stärkere Abstufung gewünscht, wenn auch nur auf der 1. Stufe. Mit den anderen 4 könnte man ja dann noch hell genug werden.",4
149824,"Recht spannend, mit allerdings recht unglaubwürdigem Motiv bzw. Täter und dem einen oder andern logischen Mangel, deshalb einen Stern Abzug.",4
141001,"Habe den Wasserkocher im Angebot für 30 Euro gekauft und bin echt zufreiden damit. Es sollte kein Wasserkocher aus Plastik sein, um mögliche Plastikrückstände im kochenden Wasser zu reduzieren. Das Design ist aufgrund der blauen Beleuchtung sehr ansprechend. Einziger Kritikpunkt ist der Deckel vom Wasserkocher. Bei zu schnellem Gießen wird dieser undicht. Wenn man dies aber weiss, gießt man etwas langsamer und alles funktioniert einwandfrei :)",4
130326,"Ich benutze die Rundbürste jetzt schon einige Zeit und bin ganz zufrieden bis auf eine Sache, die mich stört. Und zwar ist der Griff mit einem Ring unterbrochen, was evtl. für's optische extra so angefertigt wurde, jedoch hier des öfteren beim eindrehen der Haare, sich diese darin verfangen und ich somit schon einige Male, Haare so rausgerissen habe.",4
131091,"Schlicht, schön, Preisleistung super.",4
139710,"Die Dashcam erfüllt ihren Zweck, ist kompakt und gut zu befestigen. Den eingebauten GPS-Empfänger halte ich für sehr praktisch. Zum Lieferumfang hätte ich wohl eine SD-Karte erwartet. Die beigefügte cd liess sich nicht abspielen.",4
134879,Im großen und ganzen sind die sehr gut bin zufrieden. Jedoch hätten die seiten eine zumindest leichte schärfe gebraucht aber das kann man ja noch ändern,4
147839,Schöne große wickeltasche. Bin soweit zufrieden mit dem Artikel,4
121306,Sehr einfach in der Handhabung. Guter Liegekomfort. Preis - Leistungsverhältnis angemessen.,4
156752,"Der Gürtel an sich ist super, sieht gut aus und erfüllt seinen Zweck. Ich trage ihn zu einem Karnevalskostüm, leider ist er für meine Kleidergröße etwas zu groß. Ich trage 34-36 und durch eingearbeitete Pappe an den Stellen wo ich den Knick bräuchte leider nur durch zerstören zu knicken. Dennoch ein super Accessoire:)",4
125640,Für diesen Preis ist es in ordnung. Wer was preisgünstiges sucht ist es zu empfehlen.,4
138228,"Hallo, die Uhr sieht schick aus und funktioniert. (Man kann die Uhrzeit ablesen) Ich habe sie eher als Accessoire gekauft und bin sehr zufrieden. Für den Preis fast unschlagbar. Einzig das Lederarmband sieht schnell ""benutzt"" aus. Bereits nach dem ersten tragen sind Spuren erkennbar. Mich stört es nicht, aber daher nur 4 Sterne.",4
159460,"Genau das was ich gesucht hatte. Ich habe schon lange nach einem passenden fitness tracker gesucht, der mir max uhrzeit und schritte anzeigt und nicht so Protzig ist.",4
144547,"Die Blumen kamen bei mir leider ebenfalls zerknautscht an, lässt sich wohl nicht vermeiden. Angeblich kann man das mit Föhnen beheben, hab ich nicht probiert da mir die Blumen zu groß waren und ich sie zurückgeschickt habe. Mit etwas Abstand erkennt man nicht sofort dass es Kunstblumen sind, es wirkt alles gut verklebt und stabil. Innen ist ein Draht verarbeitet, sodass der Kranz beliebig angepasst werden kann. Farben sind wie am originalgetreu wie am Foto.",4
133386,"Die Hülle ist wirklich sehr sehr schön. Allerdings musste ich sie erstmal einen Tag nach draussen legen, da sie wirklich sehr doll gestunken hat. Nun ist aber alles gut :)",4
149690,Produkt wurde als Geschenk vergeben. Weitere Bewertung nicht möglich.,4
149052,"War alles wie beschrieben, alles in Ordnung",4
121610,"Gutes Produkt, aber Fingerabdrücke sind zu sehen.",4
154031,"Riecht lecker, gar nicht so wie ein WC-Reiniger, sondern eher nach einem coolen Sommer-Cocktail :D Auf jeden Fall zu empfehlen!",4
129619,Gut zum Basteln geeignet,4
156328,"ist nicht schlimm, aber Kvalität könnte besser sein. Aber wie gesagt, nicht schlimmes. Sollte für ganze Leben sowieso nicht dauern. Es lohnt sich zu kaufen.",4
130218,Gute Funk Kerzen. Relativ günstig und schön verabreitet. Allerdings könnten sie für dünnere Zweige zu schwer werden! Ich habe zum Glück einen Kunstbaum und auf diesem wirken sie wunderbar :),4
137891,"ist stabil, dicht und funktioniert",4
138981,Preis und Leistung stimmen überein,4
128358,Halterung für Kamera an falscher Stelle -zu hoch,4
139391,"Mir gefallen die 3 externen Sender, funktionieren auf 2 Etagen verteilt im Haus mit Stahlbeton Wänden gut+ . Anzeige Display etwas zu klein und dunkel .",4
153999,Alles sowei gut und ok .. nur leider habe ich zu spät bemerkt das ich vier Euro Versandkosten zahlen musste und das ist wirklich sehr ärgerlich und steht nicht zum Verhältnis.. schade !,4
137192,Farbe genau wie im Foto. (Jeansblau) Qualität gerade so OK. Ich habe ähnliche Kleider mit besserer Qualität für weniger Geld in Spanien in Boutiquen gekauft.,4
149251,"So sind die Schuhe ganz gut aber Reißverschluss nach 5 mal benutzen kaputt, Reißverschluss ist Mist.",4
137175,Super schnelle Lieferung und unkomplizierte Bestellung! Diese Wasserflasche ist wie in der Form und vom Volumeninhalt super abgestimmt. Preisleistung ist auch in Ordnung.,4
121065,Einfach zu installieren und funktioniert wie es soll.,4
146960,Ich finde es sehr schön und das Armband trägt sich auch sehr gut. Die Größe ist sehr gut und auch die Verpackung war sehr ansprechend.,4
149702,"Schnelle Lieferung, gute Qualität.",4
156878,"Alles wie erwartet! Gute Qualität, Passform bestens! Würde ich jederzeit wieder kaufen",4
159227,"problemloser Versand recht gute Coils, die jedoch ihren stolzen Preis haben bisher halten sie bei mir ca 12 Wochen durch bis sie schwächeln",4
149040,"Gut erklärt, tolle Fotos auf denen die Steine gut zu erkennen sind. Umfangreich. Da kann man schnell mal reinschauen wenn Bedarf ist. Die Erläuterungen sind stichwortartig aufgeführt. So soll es für ein Nachschlagewerk sein.",4
158193,"Man bekommt einen ordentlichen Holztisch für knapp 20 EUR, da kann man nichts sagen. Es gibt auch eine kleine Schublade an der Seite und die Beine sind Höhenverstellbar. Einen Stern abzug da die Beine nicht einrasten - dadurch ist das ganze recht wackelig. Werde mir da aber selbst eine Lösung einfallen lassen. Bin ansonsten super zufrieden.",4
156084,"Was soll man zu so einem Ding viel sagen? Es tut, was es tun soll, und das ist schon mal gut! Der Lieferant war exzellent. Was soll man zu so einem Ding viel sagen? Es tut, was es tun soll, und das ist schon mal gut! Der Lieferant war exzellent. Und wenn Amazon noch mehr Wörter haben will, dann bekommen sie diese eben auf diese Weise!",4
135264,gibt's aber inzwischen auch bei Aldi - und da natürlich für den halben Preis... Aber diese hier benutze ich gern.,4
139014,"Guter Booster, Wirkung gut, Geschmack gut. Kann ich empfehlen.",4
155997,sehr handlich läuft gut und schnell geholt und aufgeräumt sehr zu empfehlen,4
125911,"Sehr schöner Schuh, ist aber für mich eine Nummer zu klein ausgefallen. Ich habe aber auch einen breiten Fuß",4
150922,"Die Software lässt sich prima Installieren und erklärt sich von selbst der Drucker schafft anständige Mengen und Qualitäten aufs Papier zu bringen, einziger Mangel, die Toner sind schnell leer jedoch um den Preis den der Drucker kostet und die Menge die ich Drucke passt das dann schon wieder",4
125581,Ware passt genau und Kamm wie angegeben,4
122960,"Meine Wellis sind total begeistert! Wird ausgiebig zum klettern, sitzen und schlafen benutzt. Ist auch schön stabil. Finde nur den Preis ganz schön hoch für ein paar Stückchen Holz. Aber ansonsten nix zu meckern!",4
136466,Bilderrahmen ist für den Preis in Ordnung. Nicht so hochwertig. Habe daraus ein Hochzeitsgeschenk gebastelt und dafür war es vollkommen in Ordnung.,4
142667,"Ich habe mir das Bohrerset gekauft um meine Feinsteinzeugfliesen zu Bohren In Summe musste ich ca 10 Löcher bohren Dabei habe ich immer mit einen kleinen vorgebohrt und mit dem großen nachgebohrt So habe ich auch die kleinen Bohrer im Einsatz und konnte mit dem Set die 10 Löcher bohren Ohne vorbohren wären die Löcher in 8mm nicht möglich gewesen. Nach diesen Einsatz sind die Bohrer auch zum wegwerfen und nicht mehr zu gebrauchen. Für den Heimgebrauch um ein paar Löcher zu bohren ist das Set mehr als ausreichend Sollte man was dauerhaftes Suchen das länger hält muss ich von diesen Set abraten Wenn ihnen meine Rezension geholfen hat, würde ich mich über ein „nützlich“ sehr freuen. Dankeschön",4
153407,"Gute aber nicht absolute Lichtundurchlässigkeit, daher 1 Stern Abzug. Gut fallender Stoff und tolle Qualität, Preis/Leistung hervorragend!",4
130875,Meine Tochter fand das so toll das die Farben sich änderten.,4
130459,"Die letzte Zeit habe ich viel zu Luftbefeuchtern recherchiert und mich nun für dieses Produkt entschieden. Beim Auspacken ist mir zuerst die simple Handhabung aufgefallen und dass das Gerät von der Qualität vernünftig zu sein scheint. Den Wassertank zu befüllen dauert ein wenig, wenn man wie ich einen Brita Wasser Filter benutzt. Nun einen Platz suchen. In einer Dachgeschosswohnung, in der die Schrägen dem Boden recht nahe sind, war nicht ganz so einfach. Eingesteckt und eingeschaltet konnte man oben - was ich sehr positiv finde!!! - die Richtung einstellen, in die der Wasserdampf ausgestoßen werden soll. Die LED Anzeige ist auch ganz hübsch und verständlich gemacht. Nach den Rezensionen hier verlasse ich mich aber nicht auf die Daten, die darauf angezeigt werden. Mir bleibt nur die Frage, ob die lange Laufzeit unbedenklich ist, was Bakterien und Keime betrifft. Da ich das Produkt erst kurz habe, werde ich meine Rezension in ein paar Tagen/Wochen updaten. Mal sehen...",4
132129,Ich nutze den Filter als Objektivschutz und werde mir demnächst noch einen holen weil ich ein weiteres Objektiv mit dem Durchmesser 77mm habe,4
142197,Preis-Leistungsverhältnis entspricht dem Artikel Leider etwas fehlerhaft geliert Ich würde wieder bei diesem Verkäufer bestellen.,4
132722,In den üblichen Baumärkten finde ich diesen Adapter nicht mehr. Dabei sind die Kombination und Anordnung vielseitig einsetzbar. Leider ist das Teil völlig überteuert ...,4
128650,Leider sind die Steckverbindungen für den Boden gleich verbogen.,4
131447,Angucken lohnt sich.,4
131114,Ich bekomme nun mein Grillfleisch auf den Punkt hin. Die Messung ist super. Wenn jetzt noch per Bluetooth eine Verbindung mit dem Smartphone hergestellt werden könnte - ein Traum. Die Funktion wann sich der Saft im Fleisch perfekt verteilt ist ebenfalls Super. Klare Kaufempfehlung!,4
145681,Man kann das obere Teil abnehmen und hat quasi zwei Adapter,4
150711,Positiv: + Schneller Versand + Erfüllt sein dienst wie es soll Negativ. - Es ist zwar etwas klein aber dennoch okay,4
145768,"Die Hacken sind sehr Stabil, wir hängen nicht nur Wintermäntel sondern auch viele Hosen im Bad, Handtücher etc daran auf, nach einer Weile hängen sie ein wenig durch, aber man biegt es zurück und es sieht aus wie neu. TOP!",4
135660,"Bisher hatte ich eine sehr flache Bauchtasche in die aber wirklich nur das nötigste rein passte. Diese hier ist etwas auffälliger, dafür ersetzt sie aber fast schon einen kleinen Rucksack. Man kann locker Geldbeutel, Handy, Tempos, Schlüssel, Kaugummis und was man sonst noch so mit sich rum schleppt rein tun, ohne dass das Ding aus allen Nähten platzt. Den Falschenhalter hab ich allerdings direkt abgemacht. Wenn ich länger unterwegs bin, brauche ich meinen Liter Sprudel und muss daher auf den Rucksack umswitchen. Allerdings habe ich mich so daran gewöhnt mit einem Griff alles wichtige parat zu haben, dass ich selbst wenn ich den Rucksack mitnehme, das Teil trotzdem meistens zusätzlich um habe, alleine schon um den Geldbeutel zu schützen.",4
130040,"War ein Geschenk für meine Nichte. Sie strahlt, also Ziel erreicht!",4
135866,Preis Leistung super. Die Hälfte der Schnur hätte es auch getan.,4
141806,Passt und scheint zu funtionieren,4
154659,Verdunkeln tun die vorhänge etwas. Blickdicht sind sie nicht und ich dachte auch das die Verdunkelung besser wäre,4
127466,Gut hergestellt aber nur die Haare fallen immer noch runter.,4
115248,".. wie der Titel schon sagt - der Inhalt war total in Ordnung, aber die Packung total kaputt und unansehnlich! Deshalb 2 Sterne Abzug! (Ja, ich bin pingelig bei sowas!)",3
104630,"Klang ist spitze!!! Aber leider stört das Rauschen des noise cancelling. Mein größtes Problem war die elektromagnetische Spannung. Und dieser Druck. Das wurde bei längerem Tragen leider nicht besser. Schade, denn der Klang und die technischen Spielereien mit der app sind außergewöhnlich gut!!",3
110316,"Das Produkt ist gut aber ich kann nicht so gut mit die Kontrolle spielen, deshalb ich das zurück geschickt habe",3
97860,"Erfüllt seinen Zweck (Reinigung von kleineren Elektrogeräten bzw. deren mit dem Tuch unzugänglichen Stellen), allerdings löst sich die vordere Röhre bei zu hohem Druck. Auch lässt sie sich mit Klebestreifen nur umständlich fixieren",3
109746,"Viel zu eintönig. Fast alles war mit Nougat und wenn man vom Originalpreis ausgeht natürlich viel zu teuer, aber das sind fast alle Adventskalender.",3
107813,Billige Verarbeitung. War nach 2 Tagen kaputt,3
91757,"Leider stinkt das Täschchen heftig beißend.. Die nieten sind aus Plastik, das Emblem in der Mitte scheint aus Blech zu sein, es ist glänzend und wirkt dadurch zusätzlich günstig.",3
117219,"Sitzt sehr stramm, dadurch eher unangenehm. Hält die Haare aber perfekt trocken.",3
85356,"es ist schwer, sich notizen auf dem Block zu machen, da dieser schnell einklappt, und man bei einmaliger Nutzung den Block nicht mehr nutzen kann, deshalb nur drei Sterne, an sich aber ganz lustige Idee.",3
95722,"Die Ohropax sind wirklich sehr weich, aber sie passen einfach nicht. Trotz Befolgen der Anleitung rutschen sie immer wieder raus und tun daher auch nicht das was sie sollen: Stille erzeugen. Schade. Ich werde nun die für Kinder testen.",3
88455,"Habe inzwischen 40 AAA- Batterien gekauft, nur die Kerzen sind nicht die, welche ich ursprünglich wollte. es wurde extra- mini -geschrieben und als ich die Batterien einsetzen wollte, waren sie leider zu klein. Da ich weiß, das es zwei Größen gibt bin ich schon endtäuscht, da ich immer einen kleinen Tannenbaum habe.",3
82238,"Das Armband psst optisch sehr gut zum Fitbit Charge 2 und ist sehr angenehm im Tragekomfort. Im Gegensatz zum serienmäßigen Armand schwitzt man deutlich weniger, was bei sportlicher Aktivität nicht unwichtig ist. Leider ist das Magnetarmband nicht in der Lage, den Tracker ausreichend stramm am Handgelenk zu fixieren, so dass die Messwerte (Pulsschlag) deutlich beeinflusst werden.",3
101885,"Sehr gutes vernebeln der Flüssigkeit. Leider wird in der Produkbeschreibung nicht darauf hingewiesen, dass es sich bei der Maske um eine Kindermaske handelt. Schlauch und Vernebeler sind aber universell und passt auf die vorhandenen gängigen Geräte.",3
97292,"Ein sehr gutes Sommerkleid, leider gehen bei mir die Nähte an der Seite vom oberen Teil auf, (reißen etwas ein und ergibt Löcher) ich bestelle es mir nochmal und hoffe das es da besser ist.",3
83966,Funktioniert leider nicht so wie gehofft. Es muss viel Kraft angewendet werden und das Ergebnis ist gerade mal befriedigend. Sehr schade,3
90234,genau das richtige für den Winter,3
112986,"der Stoff ist zu dünn. Die nähte halten nicht, gehen auf. Die Finger sind zu kurz, bei Finger Arthrose. Werde sie nicht mehr kaufen",3
83687,"Grundsätzlich gute Strümpfe. Für die Person jedoch zu klein, da geschwollene Füße. Ich würde sagen ansonsten normale Passform.",3
80358,"Mit diesen Patronen hatte ich leider Pech, sie funktionierten nicht alle bei meinem Drucker, auch nach mehreren Wechsel nicht, leider.",3
102300,Richt und wirkt anders als aus der Drogerie.,3
102523,Hilft nicht wirklich bei rotem klee,3
86662,Ist ok denke mal wenn jemand damit richtig umgehen kann klappt das besser bei mir nicht. Wobei man damit nur kleine kuchenböden schneiden kann,3
104263,Schon nach kurzer Zeit am Ablösen,3
113634,"Da unser alter Britafilter brach, bestellte ich sofort einen neuen. Im Grunde ist er wie das voherige Modell, welches wir hatten. Was mir jedoch schon mehrmals passierte und mich stets ärgert, ist dass die weiße Abdeckung/der Deckel z.B. beim Befüllen einer Flasche wegrutscht (obwohl es richtig verschlossen war) und die Küche unter Wasser setzt. Außerdem funktionierte die Anzeige nicht gerade lange.",3
113361,"Nach 5-monatiger Nutzung- Die positiven Eigenschaften hebt ja schon der Hersteller hervor. Ich zähle mal die Mankos auf: Die Reibetrommel ist nicht durchgängig als Reibe abgelegt. Das ergibt eine sehr hakelige Kurbel- bzw. Drehbewegung. Das fühlt sich einfach unbeholfen an. Der Verschluss zum Entnehmen der Reibetrommel ist so glatt und mitunter sehr rutschig, dass man viel Kraft benötigt um ihn zu öffnen. Für eine gute Reinigung ist das aber zwingend erforderlich. Wer mit diesen Minuspunkten leben kann, sollte die Reibe mal ausprobieren.",3
107010,An sich eine tolle Hülle. Leider passt die Aussparung für das Ladekabel nicht ganz. Man muss leider die Hülle zum laden abnehmen.,3
92534,"Mir hat es leider überhaupt nicht geschmeckt und es kam eigentlich gleich wieder hoch. Es scheint aber anderen zu schmecken, Geschmäcker sind bekanntlich verschieden.",3
109393,"Schade, dass die Ösen der Warntafel schon nach einer Regenfahrt zu rosten beginnen. Ansonsten hätte das Produkt 4-5 Sterne verdient. Vor allem, weil es deutlich günstiger ist als im Fachhandel.",3
104505,Ich kann es noch nicht beurteilen. Der erste Eindruck ist in Ordnung. Werde sehen ob es schnell Verkalkung. Ist erst ein paar Wochen montiert,3
89520,"Das Produkt erfüllt zwar seinen Zweck und sieht dabei noch recht gut aus, allerdings sind die Hüllen zum Einen recht dick, zum Anderen durch den nach innen gefaltenen Kartong so eng, das man beim Einschieben der Karte regelmäßig hängen bleibt/anstößt. Man muss dann mit sanfter Gewalt nachhelfen, was vermutlich auf Dauer dazu führt, dass die Hülle beschädigt wird wenn man die Karte öfter benutz.",3
111425,Riecht gut fällt aber sehr leicht ab und war deswegen nicht sehr hilfreich.,3
109514,"Gut, allerdings zu kurz.",3
107965,Ja nur für schmerzfrei Menschen. Anwendung ziemlich aufwendig. Ergebnis nicht sehr befriedigend.,3
86307,"Die Armatur ist schnell geliefert worden. Sie macht einen wertigen Eindruck und funktioniert einwandfrei. Wie schon in einer der Bewertungen geschrieben ist es wirklich schwierig die Armatur mit dem Gewindeteil unterhalb des Waschbeckens so zu befestigen, dass sie nicht mehr wackelt. Mit den üblichen Werkzeugen ist das nicht möglich. Ich habe das Gewindestück mit der Hand (Handschuhe) so fest gezogen wie es ging. Mit der Festigkeit kann man leben, ist aber nichg perfekt. Also für die Armatur 4 Sterne, für die Art der Befestigung max. 2 Sterne. An der Armatur und auch in der Montageanleitung ist kein Hinweis darauf, wo jeweils der Flexschlauch für warm und kalt befestigt wird.",3
80472,"Mein grosser (5) ist begeistert, für meine kleine (2) ist die Sitzposition nicht angenehm.",3
119376,Für den Preis ganz ok. Allerdings keine lange Lebensdauer,3
116281,"Für den Preis ganz ok. Hält Staub, Schmutz und Sonne ab, ist jedoch nicht zu 100% Wasserdicht (nach dem Regen ist die Plane innen nass).",3
