178985,"Lieferung pünktlich, Produkt OK. Einfach nur weiter zu empfehlen. Preis - Leistungsverhältnis sehr gut. Produkt genau wie beschrieben. Sehr gut !",5
199759,Sitzt Perfekt und leicht wie eine Feder . Schnell trocken !!!,5
162776,Innerhalb von 1h 30 min sortiert und aufgebaut zu empfehlen. Als Geschenk eine gute idee,5
197323,"Super Geschichte, kann ich nur empfehlen!!!",5
186056,Sehr gut. Wie neu. Immer wieder.,5
190476,"Funktioniert sehr gut. Ist auf Stufe 3 schon etwas laut, aber die läuft ja nicht ewig. Wir benutzen das Gerät vorwiegend auf dem Automatik Modus. Zum Schlafen kann man auf den Nachtmodus schalten, dann ist die Anzeige aus und das Gerät läuft auf Stufe 1, die man kaum hört. Im Gegensatz zu unserem alten Luftbefeuchter der von einem bekannten Hersteller war und nach dem Ultraschall Prinzip funktioniert hat, ist dieser Luftbefeuchter sehr leicht zu reinigen. Das war auch einer der Hauptgründe den alten zu entsorgen.",5
180305,"Super schöner und vor allem stylischer Tragerucksack von der Marke Fjällräven. Gerade der Preis war für mich ausschlaggebend, da meistens die Rucksäcke im Laden deutlich teurer sind. Auch der Unterschied zu den anderen Modellen mit den Ledergriffen, sowie das festere Material haben sich definitiv gelohnt und machen den Rucksack im VErgleich sehr wertig! Super Kauf bzw. super Geschenk, kam sehr gut an!",5
167612,Super Tasche. Passt überall dazu,5
186051,"kann man nicht viel sagen, ausser, dass sie ihren zweck wie erwartet erfüllen",5
193350,Ich finde den Bartwachs ganz gut. Bändigt den Bart ganz ok eigentlich und riecht super.,5
179201,Ich habe diese Schlüssel als Deko für unsere Hochzeit gekauft. Außerdem werden sie an die Hochzeits-Einladungen außen gebunden. Sie haben die ideale Größe und wirken durch die Verschiedenheit der Schlüssel individuell und edel. Sie gefallen mir wirklich richtig gut. Sie werden sich bestimmt super an unseren Windlichtern mit Spitzenband machen. Absolut empfehlenswert!,5
192035,alles prima. schneller Versand ist zu empfehlen,5
164582,"Der dritte Teil ist sogar noch spannender und härter als die beiden Vorgänger. Ich habe 'Gefährliches Vertrauen' verschlungen und manches mal die Luft angehalten, weil eine überraschende Wendung oder wieder eine packende Szene kam. Das Cover ist wirklich gelungen und gefällt mir super! Klare Leseempfehlung, deswegen 5 Sterne.",5
195524,"Produkt wie beschrieben und von guter Qualität, sehr schneller Versand, äußerst freundlicher Kontakt mit dem Verkäufer!",5
190763,"Ich habe mir für mein erstes Kind ein großes Stillkissen von Theraline zugelegt, das schon sehr vielseitig einsetzbar war. Als Nestchen im Krankenhaus und Zuhause, bis es mit dem anlegen alles geklappt hat und als Puffer zwischen Babybett und Bett war dieses super. Doch irgendwann war mir das große zu unhandlich und ich stieß auf dieses kleine in Tropfenform. Ich bin froh, es gekauft zu haben, weil es mir das Stillen sehr erleichtert, ich es überall im Haus einsetzen und überallhin mitnehmen kann. Desshalb gibt es von mir in allen Bereichen die volle Punktzahl.",5
164388,Für diesen Preis habe ich selten bessere Qualität gesehen. Dieses Objektiv ist jeden € wert.Und mach in kombination mit der EOS R richtig viel spaß. Das Handling ist auf Grund der geringen Größe perfekt und außerdem für so ziemlich jede Situation geeignet.,5
164837,.....sehr schöne Etagere ohne Mängel. Lieferung schneller als vorhergesagt. Bestens verpackt. Aufgebaut und mit Obst und Früchten befüllt. Sieht toll aus und macht richtig etwas her wo sie steht.,5
188349,Für den Preis ist die Qualität spitze. T-Shirts sitzen gut und sind nicht aus billigem Material. Vorallem beim Waschen gehen sie nicht gleich ein.,5
188430,"wollte ein Schoss für mein billiges Fahrrad, das Ding kann alles und mit ein wenig Sprühfett im Schloss hat es weichen Gang und weniger klappern gelernt. Sehr gutes Preis/ Leistungsverhältnis.",5
195434,"Das Kabel ist ungewöhnlich und schön. Eigentlich dachte ich mir, daß bei 100 % über Aufladung des Gerätes das fließende LED Licht ausgeht. Aber das ist nicht der Fall. Aber so ist es auch schön. Ein Hingucker eben.",5
185725,"funktoniert, mehr will man ja nicht :-)",5
165841,"Was ein Mann so alles braucht. Hier ein Gerät welches man in jedem Haushalt finden sollte. Das Gerät ist sehr hochwertig verarbeitet und zeigt meiner Meinung nach keine Schwächen. Wir haben es für die erste größere Baustelle in der Wohnung eingesetzt und hat echt tadellos funktioniert. Es werden Holzleisten sowie jede Art von Metall in der Wand gefunden. Das Gerät zeigt sogar die Tiefe an in denen es die jeweilige Leitung findet. Diese Funktion konnte ich allerdings nicht überprüfen, weil ich es dann vermeide an einer solche Stelle zu bohren, evtl. ist das aber auch wichtig. Ich bin mit dem Gerät sehr zufrieden auch wenn man es nicht jeden Tag gebrauchen kann. Das Gerät sollte aber langsam über die Wand geführt werden und dann funktioniert es sehr gut. Ich bin mehr als zufrieden. Toll.",5
182592,"Gefällt mir sehr gut. Hochwertig verarbeitet und 10€ wert. Lauter heller Klang und gutes Design. Dabei sind ein Imbus, ein Gummi-Klebestreifen als Unterlage und 2 längen Befestigungsriemen (der kleinere reicht für einen normal Lenker völlig aus, der größere könnte auch an einen dünnen Rahmen passen). Alles ist aus Metall gemacht, es kann also nichts abbrechen.",5
187194,"super Spielzeug, stabil, leicht zu befüllen und zu entleeren!",5
197508,"Schneller Versand - super Produkt! Hatte letztes Jahr auch die Samen gekauft und habe eine klasse Ernte!!! Tolle, ausgefallene schmackhafte Tomate",5
175745,Es ist ein top gerät. Kann es nur empfehlen.,5
182937,Alles Top und schnelle Lieferung.,5
190129,Ich hab mir die Hüllen für die Uni bestellt und da die CD's entweder in der Tasche rumfliegen reichen die Hüllen komplett aus.,5
194420,Funktioniert wie ein ganz normaler Arduino Nano und kann mit der Arduino IDE programmiert werden. Angesteckt und losgelegt,5
182692,"Kann zum Aroma noch nichts sagen, muss erst wachsen. Sonst Zustand sehr gut...",5
177685,"Ich kann die Hülle nur empfehlen für das A70. Die Hülle ist fest am Handy, lässt sich auch gut anbringen. Alle Aussparungen sind zu 100%ig passend über den Anschlüssen. Die Hülle ist estwas rauh, fühlt sich aber trotzdem gut an. Die Oberfläche schützt sehr gut davor dass das Handy aus der Hand rutscht. Bei der Lieferzeit hat sich Amazon wieder deutlich übertroffen, war vor dem genannten Datum da.",5
175610,"Sehr gut, wie erwartet.",5
183684,"Ich liebe die Tees von buntfink! ich trinke keinen Kaffee sondern jeden morgen diesen Tee, super lecker und macht wach und fit.",5
176622,Funktioniert super gute Qualität und sehr schnelle Lieferung,5
186694,habe die Matte für meinen Hyundai i40 gekauft und sie passt perfekt. Die Lieferung war schnell und die Matte war sehr gut verpackt. Beim täglichen Gebrauch ist mir in 3 Monaten noch nichts Negatives aufgefallen.,5
196786,Tolles Produkt! Gute Verarbeitung!,5
178514,Habe Poolnudel Zweckentfremdet. Brauchte sie schon für Weihnachten als Außendekoration. Habe daraus Zuckerstangen gemacht. Preis/Leistung super. Schnelle Lieferung. 2 habe ich aber für die Enkel gelassen als gute Schwimmhilfe. Funktioniert gut. Alles bestens.,5
198184,"Das erste Slim Wallet hatte leider optische Mängel mit denen ich es nicht verschenken wollte. Nach nur einer Mail wurde mir ein neues geschickt und das nicht so schöne nutze ich mittlerweile begeistert selber. Kleinigkeiten meinerseits: - Echtleder - fühlt sich sehr wertig an - Nutze es täglich für 8 Karten + etwas Bargeld - Karten lassen sich Kinderleicht durch ein Ziehen an der Lasche herausholen - Geldscheine 2x falten und schon sind sie in dem dafür vorgesehenen Fach verschwunden Das kleine Wunder lässt sich in jeder Tasche verstauen ohne dass es stört. Ich ertappe mich manchmal dabei wie ich panisch nach meiner Geldbörse in der Hosentasche suche weil ich sie nicht auf Anhieb ""fühle"" Kann das Teil nur empfehlen und 5 Sterne dafür vergeben. Vielen Dank auch nochmal für den netten Support",5
174434,"Passt perfekt, sehr gute Qualität. Wir sind sehr zufrieden",5
176729,"Ich habe vor einigen Jahren die nützlichen Eigenschaften von Oregano Öl für mich bei einer Infektion entdeckt und seitdem benutze ich es regelmäßig zur Vorbeugung von Krankheiten, zum Beispiel Erkältungen. Ich wusste sehr wenig über vielen nützlichen Eigenschaften von Oregano Öl, ich hatte überhaupt keine Ahnung, dass es so viele wissenschaftlichen Studien gibt, die erstaunliche Ergebnisse zeigen, bei wie vielen gesundheitlichen Beschwerden das Oregano Öl uns unterstützen kann. Ich war beeindruckt die echten Rezensionen zu lesen, wo unglaubliche Erfahrungen beschrieben, wie dieses pflanzliches Mittel deren geholfen hat, sogar wenn es die traditionell Medikament keine Wirkung mehr hatten. Ich bin dankbar, diese Informationen und Meinungen zu erfahren, weil ich versuche immer mehr selbst am meisten nur die natürlichen Heilmittel zu verwenden. Insbesondere möchte ich den Autor erwähnen, der in sehr herzlichen menschlichen Art und Weise beschreibt, wie er selbst von mehreren nützlichen Eigenschaften von Oregano-Öl überzeugt war, und hat sich deswegen gewidmet, diese Informationen über das Oregano Öl an vielen Menschen zu vermitteln. Für mich ist jeder Wort von dem Autor und anderen Menschen im Buch sehr glaubhaft, weil ich selbst von der Wirkung des Oregano-Öl schon vorher überzeugt war. Es ist tatsächlich bedauerlich, dass wir sehr wenig über solche alternativen natürlichen Heilmittel erfahren, die uns parallel zu der traditionellen Medikamenten unterstützen könnten.",5
183846,Alles Top schnelle Lieferung,5
190186,Ein schöner kleiner Rucksack perfekt für die Arbeit oder zum wandern. Gute Qualität.,5
199418,"Made in Germania, danke HERMKO ,dem Familienunternehmen für diese Qualität ! Ich werde bei Bedarf immer wieder nachbestellen!",5
165314,"Als diese Campinglampe an kam, dachte ich mir nur: Was ein kleines Ding, hmmm.... . Erstmal ausgepackt und angeschaut, die Verarbeitung ist für den Preis super und lässt keine Kritik zu. Jetzt aber mal schauen ob und wie sie leuchtet. Gesagt, getan, Boden auf geschraubt und drei AA-Batterien (nicht im Lieferumfang enthalten) eingelegt, Boden wieder zu und WOW was ein Licht. Ein Freund meinte noch die wäre heller als seine Gaslampe. Funktionsweise ist auch ganz einfach, Lampe auseinander ziehen und sie geht an, Lampe zusammen drücken und aus ist sie. Was ich aber super finde ist, dass sie mit normalen Batterien läuft, diese hat man auf Trekkingtouren eher zur Hand als eine Steckdose um Lampen mit Akku aufzuladen. Einfach alte Batterien raus, neue rein und weiter geht's. Viel Lampe für wenig Geld, Super.",5
170907,"Schöner Bildgewaltiger historienfilm im Stile von ""Tudors"" und Co.",5
163168,"Der CD Spieler ist sehr gut, leicht zu bediehnen ( mein 3 jähriger Sohn kann es ) und ist sehr robust. Nur zu empfehlen",5
165934,bin sehr zufrieden! versand super schnell und verpackung ausgezeichnet! kann ich nur weiter empfehlen!!! gerne wieder! 1a 1a 1a 1a,5
173680,Was soll man groß dazu sagen. Das Produkt entspricht genau der Beschreibung und ist für den vorhergesehen Zweck geeignet. Nichts zu beanstanden.,5
190583,Gute Qualität und schöne Grösse. Montageanleitung war gut. Die Hausnummer ist pulverbeschichtet und macht einen guten Eindruck. Wir sind zufrieden.,5
190970,"Nehme 2.Stück am Abend und Schlafe wunderbar !Gute Zusammensetzung der Kapseln ! Bin sehr zufrieden , auch mit dem Kundendienst des Verkäufers ! Kann ich uneingeschränkt weiter empfehlen !",5
173860,"wie gesagt, ansprechende Aufnahme eine Themas über das zu selten offen gesprochen wird. tut gut.",5
184332,Ich nehme sie immer bei kleinen Erkrankungen wie schnupfen usw...ist alles ratzi fatzi weg.,5
188315,Die Strümpfe haben meine Erwartungen absolut übertroffen.Sie passen wie angegossen sind strapazierfähig und halten zudem noch die Füße warm.Was will man noch mehr? Das ganze noch zu einen absolut unschlagbaren Preis.*Klasse*,5
185336,Beider super Spiele!,5
188706,Die Kette ist heute angekommen (schnelle Lieferung) und sie ist wunderschön. Habe mich darauf sehr gefreut. Weder zu groß noch zu klein. Sieht nicht billig aus (ganz im gegenteil). Vielen lieben Dank,5
167959,Machen ein angenehmes Licht,5
192606,"Natürlich sind Kopfhörer nicht von hoher Qualität, aber Sie können keinen besseren Preis finden. Besonders in dieser Preisklasse ist der Bass sehr gut. Obwohl ich bereits teurere Kopfhörer habe, überzeugt mich das hier nicht.",5
197019,Haben diese Kissen für unsere Kids gekauft damit sie auf langen Auto Touren ein Nickerchen machen können. Sie sind voll zufrieden und schliefen wunderbar im Auto. Der Kopf knickte nicht weg und sie ersparten uns die Mitnahme von zusätzlichen Kissen. Sind leicht aufzubauen. Der Bezug ist sehr angenehm weich. Der erste Geruch verflog sehr schnell. Ich habe sie bei Nichtbenutzung im Kofferraumboden. Sie nehmen keinen Stauraum weg. Ich selbst nutze sie auch im Gartenstuhl. Man kann richtig angenehm damit im Sitzen schlafen und wenn man aufwacht tut der Hals nicht weh. Lassen sich schön im mitgelieferten Packsäckchen verstauen. Hoffe das sie lange halten.,5
176042,"Die Lieferung entspricht der Bestellung. Wie die Kapazität der Ersatz-Batterien erhalten bleibt, muss abgewartet werden.",5
182090,"Praktisches Tool für unterwes ob Fahrrad, Motorrad oder nur für alle Fälle!",5
178428,funktioniert sehr gut.,5
177584,"Tolles, kleines Gerät. Kapazität ausreichend. Schnelle Lieferung. Da ich es für jemanden bestellt habe kann ich leider sonst keine Angaben machen",5
197679,Guter Überblick zu den Festen aller Weltreligionen und ein sehr kreatives Design!,5
172386,"Das Motiv fand ich total klasse, da einige Mitarbeiter für ihren Einsatz ein kleines Dankeschön erhalten sollten.",5
193855,Uns gefällt der Wagen sehr gut.Stauraum prima.Wir benutzen den Wagen zum angeln.und einkaufen.,5
188189,"Für mich meine absolute Lieblingsmascara! Die Wimpern werden super voluminös. Mich haben schon mehrere Leute angesprochen, ob ich falsche Wimpern dran habe. Wenn man die Wimpern zwei, dreimal hintereinander damit schmiert, ist der Effekt sogar noch größer! Auch das Abschminken ist kein Problem. Manchmal wünschte ich mir, die Mascara noch in Wasserfest, aber unabhängig davon, ist sie perfekt für mich. Einziges Manko ist der Preis. Zu teuer. Aber von Lancome sind alle Wimperntusche in dieser Preisklasse und wenn das Ergebnis dann passt dann zahle ich auch gern etwas mehr. Ich nutze die Tusche schon seit mehreren Monaten und sie ist immer noch nicht leer. Sie hält sich also auch deutlich länger als manch andere (die vielleicht auch günstiger ist).",5
198439,"Ich habe jetzt das 2mal Pflanzen bei diesem Lieferanten Bestellt. Ich kannte Ihn vorher nicht und kann nur sagen Top. Schnelle Lieferung und Top Ware, immer wieder gerne von mir gibt es 5 Sterne. Danke",5
172154,"Nach fehlerhafter Erstlieferung, Zweitlieferung in Ordnung und sehr schnell, aber zu einem teurerem Preis.",5
175255,"Besonders Gute Qualität, die Farben sind sehr positiv, und auch der Preis ist gut, günstige preise nicht Teuer. Der Hauptvorteil, es ist sehr leicht, So wird es Sie nicht belasten. Es gibt keinen unangenehmen Geruch aus der Tasche. Also, es ist sehr nützlich für Schulkinder und Büroangestellte. Ich würde es weiter empfehlen.",5
181582,Swirl-Produkte sind immer gut. Die Preis-Leistung fand ich hier besonders. Sehr zu empfehlen.,5
165913,Die Figuren sind gut verpackt und sind beim beschenkten Fan super angekommen! Die Verarbeitung ist auch fehlerfrei. Jeder Sammler sollte hier zuschlagen. Preis-Leistung passen :),5
180378,"Ich habe diesen Lautsprecher für ein paar Monate gehabt und ich liebe es, ich habe das weiße und es ist wunderschön, die Tasten leuchten, die Farbe ist super hübsch und der Sound ist toll, auch die Akkulaufzeit ist viel länger Als ich es gewohnt bin, kann ich diesen Redner an zwei Nächten in einer Reihe halten, ohne aufzuladen, was verrückt ist. Das einzige Negative ist, dass es keine Möglichkeit gibt zu sehen, wie es auf den eigentlichen Sprecher geladen ist, aber du kannst es einmal sehen Verbinde es mit deinem Telefon. Das ist wirklich das einzig Negative.",5
183562,hallo leute es ist eine iso whey und deutsche hersteller einfach lecker gut auflösend und günstig würde weiter empfählen .,5
191692,"Das erste ""Sing mal"" haben wir unserer kleinen Emily aus Deutschland nach England mitgebracht, wo wir wohnen. Emily (damals 2 Jahre alt) hat ihre Lieder im Buch so oft gespielt dass nur noch ein Lied ging und wollte es unbedingt ""repariert"" haben. Wir, und unsere liebe Emily, waren sehr gluecklich dass wir nochmal das gleiche Buch bei ""AMAZON"" gefunden haben.",5
180304,"Schöne, einfache Schere. Von der Größe her, passt sie genau ins vorgesehene Schubfach bei uns. danke für die schnelle Lieferung.",5
197893,"Sehr zufrieden mit dem Artikel Bontoy Kaustange, mein Hund ist begeistert.",5
196927,"Im Winter stelle ich es auf seinen Ständer. im Sommer bastele ich es mir ohne Ständer auf die Balkonumrandung, damit es weniger Platz weg nimmt. Geht beides.",5
173173,Rund um begeistert und zufrieden. Als Raucher perfekt. Kleine Warnung beim reinigen aufpassen. Der Stromschlag ist nicht schmerzhaft aber sehr unangenehm.,5
198059,6 Geräte zur gleichen Zeit laden was will mann mehr? mit den passenden Ladekabel ist eine schnelle Ladung gewährleistet.,5
178136,Finde ich sehr super und einfach zum aufbauen der Hamster hat sich gefreut,5
177217,"Absolute Kundenorientierung! Super Produkt. Gerne Wieder. Die Handhabung ist einfach, ließ sich problemlos anbringen, Hält sehr gut, Zufrieden mit Kauf und Abwicklung",5
176272,"Die Uhr ist schlicht und schön. Gefällt mir sehr gut. Bestes Feature ist das man mit einem Tastendruck die Uhr zum leuchten bringt, ist gut in der Nacht wenn man wissen will wie lange noch zu Schlafen bleibt :-). Das Gummiband ist auch sehr angenehm. Alles in allem eine runde Sache.",5
182995,"Schwere Tastatur, hochwertig mit Metallrahmen. Die Tasten gehen sehr gut, kein Vergleich zu meiner alten Tastatur.. Ich bin sehr zufrieden. Ich finde sie normal leise, Tippgeräusche stören mich nicht. :))",5
198338,"Habe dieses Gerät im April 2015 gekauft. Läuft seit dem ohne jegliche Beanstandungen. Ob mit Fingerprint, Code oder mit dem Drücker. Uneingeschränkte Kaufempfehlung!!!",5
190242,"Das erste Hähnchen vom Grill mit Spieß war ein Traum, kann einen Grillspieß einfach nur wärmstens empfehlen und ich bin sehr zufrieden mit diesem hier.",5
185589,"Schöne Stümpfe, wie auf den Fotos abgebildet und passen perfekt",5
177623,Der erste Karton hat leider nie den Weg zu mir gefunden. Scheinbar konnte der Typ vom dpa das selber gut gebrauchen. Wie ich gehört habe nicht zum ersten mal Die Hüllen sind super. Lediglich das neue Live Album von BAP passt da nicht rein,5
168993,"Es macht wirklich Spaß das Leuchtmittel zu nutzen. Die Bedienung über die App klappt super, Elgato passt diese regelmäßig an Updates an. Derzeit nutze ich das Leuchtmittel in einer spritzwassergeschützten Außenleuchte, ohne Probleme. Meine Empfehlung.",5
160482,Perfekt...mehr muss man nicht sagen.,5
194108,Schnelle Lieferung Stabile und gute Verarbeitung,5
191334,Die Beschenkte hat sich mega gefreut. Für Fans der Serie ein Muss. Lieferung pünktlich. Habe ich über die Jahre schon häufiger verschenkt. Gerne wieder.,5
169720,"Bin schon seit längerem Hobbyfotograf mit einigen Schwächen, daher habe ich mir dieses Buch genommen. Alle Infos und die richtige Handhabung sind im Buch beschrieben ebenso die Bildbearbeitungsprogramme, echt spitze!",5
189277,Tolle Handschuhe werden für den hundespaziergang benutzt. Halten was die versprechen und die Leine rutscht auch bei nassen Wetter nicht durch!,5
188448,"Schnelle Lieferung, Das Tuch ist echt groß, und auch recht dick. Dadurch auch die hohe Saugkraft/Wasseraufnahme... Nur weiterempfehlen.",5
181238,Sehr schön verarbeitet.Cooles Disign und sehr angenehmer Tragecomfor.Lässt sich zu vielen Anlässen tragen.Bleibt auch nach der Wäsche in Form und Farbe.,5
189629,"Ich habe bis jetzt mehrere Produkte von LHI gekauft und kann sagen: Deren Qualität überzeugt mich voll und ganz. Ob Frame oder Motor/ESC Combo, alles tip top und nicht allzu teuer. Einer der besten Frames die ich bis jetzt getestet habe. Macht einen super stabilen Eindruck. Alle Komponenten sind sauber verarbeitet und passen. Auf jeden Fall zu empfehlen, selbst nach mehreren Crashes ist nichts dran. Nichtmal an den Armen blättert das carbon ab.",5
187585,"Der Beauty-Dish macht einen wertigen Eindruck und ist schnell aufgebaut. Das Licht ist wie erwartet nicht zu hart und nicht zu weich, wie von einem Beauty-Dish zu erwarten. Dadurch, dass man den Reflektor sehr schnell auseinander bauen kann (Regenschirm-Prinzip) sind Shootings on Location einfacher, als mit den üblichen Blechteilen. Eine gute Erfindung!",5
189151,"Das Regal kam gut verpackt bei uns an. Eine Anleitung (die man eigentlich nicht mal braucht) lag bei und ist sehr leicht zu verstehen. Die beiden größten Blöcke werden zusammen geschraubt und danach müssen nur noch die Füße montiert werden. Den kleinsten Block schraubt man nicht an, so bleibt das Regal flexibel und ist, wie auf den Bildern zu sehen, flexibel zu gestalten. Da das Regal sehr massiv und schwer ist, rutscht der kleine Block auch nicht runter. Das Regal sieht wirklich toll aus und ist ein absoluter Hingucker. Wir können es nur empfehlen.",5
176196,"Hatte mich nochmal dazu entschlossen meinen Bart länger werden zu lassen. Mit der gekauften Bürste kann ich morgens nach dem Duschen meinen Bart perfekt in eine Richtung kämmen. Die Bürste kratzt nicht, fühlt sich bei der Anwendung gut an. Für den Preis unschlagbar. Kann sie daher nur weiterempfehlen.",5
183180,"Bin sehr zufrieden! Super viel Platz, viele Fächer und die Qualität ist auch super! Musste nur die Träger festnähen (2 min Arbeit, paar Stiche) so das diese nicht immer aus den Ösen rutschen, da ich die auf längst möglich trage",5
160672,"Es tut meinem Gesicht sehr gut, es spendet feuchtigkeit und mildert die kleinen Fältchen. Ich fühle mich einfach wohl damit .",5
173763,schnell und gut verpackt geliefert.,5
168773,"Bekannt gute Qualität, preis leistung top",5
180914,Unheimlich süß und kuschelig auch nach dem Waschen!,5
187835,"Für meine Reiterinnen. Guter Griff, gute Handhabung.",5
189761,Unsere Kleine hat die CD zum Nikolaus bekommen. 7 Jahre Sie liebt ist begeistert. Super Ton Qualität. Lieder alle aus dem Film. Sind wie immer begeistert und würde Sie immer wieder kaufen. Preis-Leistung ist auch okay!,5
197706,"...von der Bestellung üder Abwicklung bis Lieferung und zahlreiche Tipps zur Nutzung und Pflege fühle ich mich als Kunde rundrum gut betreut. Ich bin von dem Gesamtpaket begeistert, gute Qualität, dafür dann ein top Preis / Leistungsverhältnis...",5
160415,Wir haben ein Mobile damit gebaut und es funktioniert super,5
162734,"Hallo, ich hoffe das es bald Hüllen für Samsung s9 plus und für das Note 9 gibt... Ich finde diese Hüllen von allem am besten... Ich ich benötige dringend 2 Hüllen, und warte schon so lange....",5
198070,Salate und was man sonst noch so tun kann,5
183164,Bin sehr zufrieden mit dem Backofen. Wird sehr schnell Heiss. Das einzige Manko das man die Temperaturen der Kochplatten nicht separat einstellen kann.,5
164778,"Ich bin ganz verliebt. Die Schals wirken so Toll, sind einfach und schlicht. Sieht aus wie auf dem Foto. Natürlich ist es einfach verarbeitet und an sich auch nur ein Stück zusammen genähter Stoff - na und? Soll ein dünner schal denn noch viel anderes können? :) ich bin ganz verliebt und will nicht mehr ohne.",5
183407,kann ich empfehlen Super !,5
170303,"Die sind so super, man sieht sie kaum, bei mir halten sie bestens. Beim stehen oder sitzen hat man super halt.",5
193734,"Kuscheliges Kerlchen, mein Sohn liebt ihn!",5
164078,"Kurz bestellt, schnell bekommen und top verarbeitet. Kann man nur positiv bewerten! Wenn es doch immer nur so wäre. Bin super zufrieden.",5
167086,"Ich liebe Sie! Ich koche so gerne mit ihr und geb sie auch nicht mehr her. Es funktioniert alles Top, so wie es soll und für den Preis ist es echt eine gute Qualität",5
192708,Mega den Spaß damit :) Klasse Teile. Mein Sohn ist 8. Wir sind zufrieden,5
186145,"Super Teile, Geht einfach auf die Dose und auch wieder runter. Zum reinigen mach ich sie einfach in den Geschirrspüler.",5
183665,Der Rucksack tut wofür ich ihn gekauft habe. Hab ihn täglich mit zur Arbeit und es passen noch meine Sport- und Schwimmsachen mit rein. Über die Haltbarkeit kann ich noch nicjts sagen und werde dies nach ein paar Monaten ergänzen. Bis jetzt totale Kaufempfehlung!!,5
186362,Top super verarbeitet optimale Qualität die erste Tasche die Top ist,5
181585,Es ist ein sehr interessantes Kochbuch.. Sehr gut beschrieben viele schöne Rezepte das schöne aus vielen schönen Ländern es ist zwar neu für mich vegan aber man kann ja immer viel ausprobieren da ich super gerne koch es ist auch super für Anfänger geeignet... Da es super beschrieben ist👍,5
195450,Dieses Besteck wertet einen gedeckten Tisch einfach auf. Außerdem schneiden die Messer sehr gut.,5
186905,Die Glühbirnen erzeugen einen schönen Retro Look und sehr sattes gelbes Licht. Es bringt Wärme in den Raum. Durch die LED-Technologie ist sie enorm sparsam beim Stromverbrauch.,5
195014,"Liest einwandfrei alles aus, Problem jedoch ist, dass keine Empfehlung für eine App gegeben wird. Man sucht und sucht und die meisten Apps sind einfach M... ! bzw untauglich. Wäre toll wenn hier ein Hinweis stattfinden würde.",5
