14708,最初に開けた時に短いなと思い測ってみると、説明では、踵から上の長さが25センチと書いてあるのに20センチしかなかった。 25センチの物が欲しかったので残念です。,1
5047,★5を投稿してとか、Amazonポイント1000を獲得とか、訳の分からない紙が入っていて、怪しく思い、再度レビュー見てみたら、★5ばかりで内容は同じ文章ばっかり！！！数人の名前？で数個の文章。完全にサクラレビューやん。私はあえて★1で投稿してみます。 ★5で投稿してって何？ 肝心な商品は、ON/OFFのボタンがなくてoffにする時、コンセントを抜くしかなくて怖いな。でもサラサラになる。,1
8415,購入して何日間で壊れて、調べてみたら不良品だと言われました。 返品や返金をお願いしたら、外箱など付属品が一つでもなければ対応できないそうです。（泣） 外箱を捨てたのに。。結局対応してもらえませんでした。納得いかない。。。（泣）,1
21700,プレートが熱くならない。1もつけたくないくらいです。,1
24547,プリンターのカスレが出てドキッとさせられた 今は回復しているが。,1
20755,購入2か月未満で温度調整出来なくなりました。表示も55度とおかしい,1
573,6畳間にて使用。 フルパワーで使っても信じられないくらいに暖かくなりません。 そのくせ電気代がとてつもないです。 まぁあれだけ熱くならないなら布団等が長時間当たっていても火災の心配はなさそうですね。,1
9492,まず充電ができず返品となりました。同様の評価が多かったのですが、これまでアマゾンで不良品に当たったことがなかったので、商売敵の書き込みだろうと軽くみたのは誤りでした。,1
12783,手にした感触は自分の小さな手に馴染んで良かったのですが 電池がキツキツで入りにくく入っても頻繁に接触不良をおこし いざという時に本当に使い物にならず廃棄。 懲りずに続けてもう一度買いましたがやはり接触不良。 実は別のエレコムマウスも同時に購入しましたが そちらは電池がゆるゆるで接触不良。 エレコムのマウスなんて買うほうがアホでしょと笑われましたが 電池の接触不良なんて普通あるのかな？ 想定外です。 これに凝りてマウスは常に2個以上スペアを用意。 有線マウスも常に常備を心がけるようになりました。,1
34905,終わってます レンズの中に汚れがあります はっきり言って100均の方がまし,1
8169,高い純正かったのにブラシ毛が抜ける。 しかも旧製品純正の交換時期のブラシと硬さが新品なのに同じくらい。 互換品でもいい気がします。,1
31142,片側が浮いていてスタンドが水平になりません。 直ぐ返品しました。,1
12592,大きいサイズを選んだのに、小さくて着れませんでした。 残念です。,1
15602,毎回１本ずつ買うのが面倒で、割高だが3本セットを買った。写真は同じだがメーカーが違うのか、今まで使えたMG6230で障害発生、2本目も同じ現象だったが従来のメーカー品で復旧した。純正品よりも安いので３本全て破棄しても実害は少ない。 オレンジのカバーが従来品(ノーブランド)と違うが、問題ないだろうと思ったが、理由は不明だがMG6230で認識せず、３本破棄となった。初めはプリンター故障かと思ったが、試験として購入、交換した従来品で問題なく動作しているので本品の障害と判断した。,1
22571,開封次第返品手続きしました。 到着予定から一日遅れて、全く別物が届きました。 レシーバも無いので話になりません。 他の方が同じ思いをしないよう共有します。 ★はマイナス５ですが必須なので１としました(３日の待ち時間➕返品手続き＝手元に何も無し),1
31228,セット注文したのに届いたら本体だけ...... 連休なるから居ないのに発送忘れたやろ！！！ビックリしました～～～～,1
29189,アマゾン何を考える要るのやら！ 不良品が配達された。箱は、開封の形跡あり？商品は4個とも不良品。全滅！ 即座に返品した。この出品者は、まずいかも・・・,1
33400,正直期待してただけに、読んでみたら期待外れ感が半端なかったです。 イラストも見にくいし、靴の選び方なんてそんなんどこにあんねんってつっこみたくなる内容でした。,1
13259,商品説明ではあたかも普通にテレビが観れるという風な説明しかないのに、実際はソフトバンクは契約がないと使い物にならない。 テレビが観れる。録画が観れるとだけ記載があり、契約うんぬんとは一切記載がなかった。 Amazonはシンプルな説明しか載せておらず、販売業者はあくまで配送、支払い方法の手配をしただけとの説明、責任の所在がはっきりしない。,1
32528,音はこもるし、音質は悪いし、耳は締め付けるし、全くいいところがない。耳の締め付けがきつく、閉塞感があって、長時間の使用には耐えられない。仕方がないので返品手続きをした。代わりに別なものを注文した。,1
4859,安価なので練習用に購入いたしましたが、ボールに歪みが感じられました。,1
13089,コイズミのしかもある特定の照明器具しか使えなかった。 ちゃんと説明が欲しかった。,1
17471,片耳仕様のヘッドセットが欲しくて購入 使用方法はdiscordでのボイスチャットでアンドロイドタブレットにて使用。 結果、マイクがまず反応しない、スピーカーも機能せずでした。 着け心地はそんなに悪くないですが、音質の良し悪しも確認できませんでしたので星一つすらどうなの？といった感想です。 あと箱には説明書は入っておりません、ご購入を検討中の方は当たりが引けるようお祈り致します。,1
30256,20000mAh表記は明らかに嘘。iphone充電1回程度（別の12000mAhの物より明らかに容量が少ない）。 テスト出来ないが、ジャンプスターターとしては、使用出来ないと思われる。 何度か充電してしまったが、返品したい商品です。 皆さん気を付けて！！,1
5758,履いて、すぐにゴムの部分から、ほつれだした。糸を引っ張ると電線のように下にほつれが止まらなかった。,1
17362,家電量販店で純正でない商品を購入して操作がうまくできなくて今回は純正を購入しましたが、操作がスムーズなのか不安でしたが問題なく安心しました。,1
11587,この本こそでっちあげの可能性があります。教育資料庫というサイトの福岡市立小学校教諭人種差別的児童いじめ事件を読んでから購入することをお勧めします。,1
37831,買って1ヶ月も立たない内に壊れました。 １本は充電出来ないし、もう１本は先端が折れるしで最悪です。 ４本買って２本が使えない。,1
30094,定期購買にしていたら、今月28年産が届いた。 新米が食べられると、わくわくしていたのに・・・。 定期購買やめます。,1
23683,リキッドが液漏れで包装してた緩衝材がビタビタでした。容器をプラスチックボトルにするか、スポイトを別にするか 対策は必要だと思う。まだ未使用❗,1
15199,旅行行く前に不良品であっては困るので 説明書通りにして使ってみたが モバイルバッテリーの消費残量は物凄い速さで無くなっていくのに対しiPad Airへの充電は数％と商品説明の数字が誇大でなければ少し理解しがたい状況が起きている。 誇大、粗悪品の可能性もある。 追記 レビューを買っている恐れもある位ここの人達の感想が信じられない,1
15053,すぐ錆びるし、ほかのプレートとくっついて離れなくなります。少しがっかりしました。,1
15832,注文から２週間ほどで到着しました。 中国からの直送便です。 ビニール状の梱包でしたので、外箱がへこんでいました。 おまけに開封シールも既に切ってありました。 レビューを見て、だいぶ期待したのですが、 これでは、とても気持ち悪くて使えません。 チューブには英語の説明書きがありますが、素人には理解できないと思います。 日本語訳の取扱説明書が必要だと思います。,1
23661,CDをいれると、何度やっても作動しないし、 気まぐれなのかわかりませんが、一度作動しました。 しかし、録音を押しても全く反応しませんでした。 きちんと機能すれば、簡単でやりやすいと思いますが、出来たりできなかったりで不具合が生じすぎるので、返品しました,1
17494,2個のうち1個が不良品。出荷検査も出来ていないのか。ものとしては便利だが不良率が高過ぎ。,1
25643,保証購入後、不必要になったので返品リクエストしましたが、直ぐには対応してくれません。何度も返品リクエストしても保証メールを送ってきます。,1
23069,購入して約二週間ほどでスマホと繋がらなくなり、全く使いものにならなくなりました。やはり偽物は買うべきではありませんでした。最悪です。,1
37835,ふりがなが日本語でビックリしました。 cat→キャット だから日本人は発音が下手なんですね… 日本語のふりがなを油性のマジックで消して使用してます。,1
11541,ショップバック付きとなっていたので購入しましたが本体コットンのみでした。 ほかの方のレビューどおり、商品単体で到着するのでバックも欲しい方は買わない方がいいと思います。,1
16540,リクライニングレバーが壊れていて動かない 楽しみにしていたので最低最悪です。,1
39478,プレゼント用に購入しましたが、届いたのは他人の名入りのものでした。贈れません。,1
2627,消去ボタンを押しても消去されない商品でした。電池やLOCKボタンなども確認しましたがダメです。別の物を買いたいと思います。,1
12518,この手のガラスフィルムは過去に何種類か購入した全てが辺縁の浮きだとか最初からヒビが入っていたりとかいい印象が無かったのですがこの商品は星５つだったしベストセラーということで購入してみました。 一枚目は貼り付けるも辺縁部の数か所に浮き上がり現象が起こりさらにはほこりが噛んだような円形の浮き上がり箇所があったので一旦剥がしてその部分にセロテープを貼って異物を除去しようとしましたがどうしても取れず仕方なく注意深く爪の先で引っ掻いて取ろうとしたところそれは異物ではなく形成不良による突起でした。 これでは使用できないので残念ながら捨てました。 もう一枚は可もなく不可もなく張り付きましたがこの商品の説明にある辺縁のエッジが丸くなっているというのはどう見てもそうは見えません。 スパっと切られたようなガサツな状態ですぐにこのエッジにほこりが付着してきてしまいます。 さらにはこの商品には貼付に関する説明書きが全くありません。 ただ、モノが入っているだけです。 付属の位置決め用シールやほこり除去用シール、小さな清掃用ウエットティッシュ＆ドライティッシュ等はすべて英語表記です。 なんかお粗末な商品だなという感想です。,1
15354,まともにゲームが出来無い物を売り付けて金稼ぐ店,1
8442,2個の商品でしたが、届いた荷物は1個しか入っておらず、返品しました。,1
37920,商品の箱に茶色のガムテープで開かないように封をして送られてきました 見たときは中古品を掴まされたかと思いましたがどうやら新品のよう 箱詰めしろとは言わないがせめてビニルでラッピングくらいはしてほしい,1
35966,Galaxy S9＋に合うとタイトルにあったので取り寄せたが、接続部がゴソゴソ。隙間有りで通電しない。 まさか合わないとは思っていなかったので、商品の袋は破棄してしまった。返品手続きも面倒この上なし。このレビューを見て、交換品を送ってきてくれないだろうか。,1
14279,寝るときの充電用に使っていたのですが、二か月で一つ使えなくなりました,1
101,iPad mini3にサイズが合わないので、使用できません。購入したが、使えません。,1
4604,気に入って使っていたが、すぐジッパー部分が破損した,1
5989,期待して買ったけれど、濃厚過ぎて飲みにくい目が回ってしまい死ぬかと思った。,1
9123,なんでこんなものがレビューの評価が高いのだろうか？まったく使い物にならない。できれば返品したい。すぐに他のものを買いました。痛い出費になった。,1
6528,簡単に壊れました。ローラーの取付け部がマッチしていないため最初から十分な回転が得られていませんでした。,1
24712,かれこれ15年近くいろんなモデルを使い続けてきたビタントニオ。赤い色が気に入って購入。使用10回程度で通電しなくなり連絡したところ保証期間内という事ですぐに新品が送られてきました。保証期間も1年付けてくれて喜んで使っていたところやはり半年経たずに同じ故障。で、新品交換。すぐに新品が届きましたが今度は2、3回の使用で故障。サービス対応は最高なのですが、もう要りません！使いたい(忙しい朝)時に使えないのは困ります。長い間お世話になりましたビタントニオ。次はデロンギのを買おうと思います。,1
25660,ベスパ100Vに使用しました。 装着時には点灯していましたが、2回目にエンジンを掛けた瞬間に一瞬点灯の後切れました。以後は点きません。おまけでテールランプ球が切れて(溶けて)いました。 以前購入した12VH4タイプは丈夫で2代のバイクに引き継いでもまだ切れずに頑張ってることを思うと、今回のは外れだったのかなぁと思います。 ヘッドライトの暗い6Vベスパでこそ使用したかったので残念です。,1
38124,口コミを見て美味しいとのことで購入しましたが私の口には合いませんでした。,1
36251,全く使えないものが送られてきました。 ありえないです。,1
2264,サイズが小さかったです 互換性があると書いてありましたが 横サイズが短くセットしにくかったです 爪がかからない,1
3072,交換しても5分ぐらいでバッテリーが切れました,1
1790,風が非常に弱く電源のタッチの反応も悪い 静音性のみ偽りなし 使い物にならないのでお蔵入り,1
14314,B型です。 自分勝手で、わがままで。 だから言っておこう。 気に入ることはなかった。,1
4752,電池を入れ替えたり色々試しましたが使えませんでした。ほぼ同じものを かの国から直接購入したら、問題なく動きました。 当たりハズレがあるのかなと思います。 値段を考えると仕方がないか・・・,1
36270,購入して1週間足らずで電池が切れました。 見た目は可愛いし、ナース服からも浮かないので使いやすいです。,1
28883,子供の林間学校用に。 ファスナーが１日で壊れました。 あと、想像異常に小さく残念な買い物でした。,1
34192,新品で注文したのに、開封済み商品が届きました。未開封品なら必ず張られているはずのテープが箱に張られていませんでした。不審に思いつつ商品を確認すると、指紋だらけ、手指の油だらけの品物、前方には、こすったような傷跡がありました。おそらく展示品ではないでしょうか。展示品のような、開封済み商品を販売するなら、事前に断った上でそれなりの価格で販売してください。気持ちが悪く、返品も考えましたが、急ぎで使う必要があったため、アルコール綿で充分に消毒したうえで、がまんして使用しました。長年AMAZONさんを利用させていただいていますが、このような不快な思いは初めてです。購入前に読んだレビューの中には、同様のものがありましたが、半信半疑でした。AMAZONさんを信用していたため、あり得ない事と思っていました。ネガティブなレビューも信用するものですね。なにより納得いかないのは、同様のレビューがだいぶ前に出ているにもかかわらず、なんら改善されず、繰り返していることです。ネガティブなレビューについて精査し、問題があれば、改善し、経営に反映するということが行われていないことです。信用は、がた落ちです。新品として売っておいて、開封済みの、汚れた品を送ってくるというのは、とんでもない話です。ありえません！,1
549,ソケットの深さが浅いので奥まで刺さらず、断続的に通電して発熱し、ソケットが溶けてショートし、白煙が出て火が出た後、ヒューズが飛んだ。ヒューズが飛ばなかったら車両火災になるとこだった。オス側の商品が原因と思ってイエローハットに持ち込んだら、原因はAmazonで買ったコイツが原因だった。メーカーはリコール出して回収すべき。,1
35871,体重は全く変わりません。でも便通は改善されると思います。結局ダイエットしたいなら運動だと思いました。,1
20952,商品が届かなく、連絡も中々滞ってしまい諦めました。対応が悪い為、ここから買わない方が良いです。,1
11475,最悪！ 何だこれ！ みそ汁か！って感じ。,1
3299,本当に普通に使え、充電スピードも早くお買い得です。 おススメできます。 追伸 評価を変更します。 理由は、iPad 同時に2台充電したら外側プラスチックが溶け出し、火事がいくところでした。,1
30433,穴の位置が違い過ぎてお香が枠内に収まらない のであまりオススメはできない,1
36737,バックの底の部分が破れていました。 見た目は良かっただけに残念です。,1
18886,開封してみると至る所に傷があり、、、、、 楽しみにしていたので残念でした(;_;) 返品交換検討しようかと思います(;_;),1
39514,やっぱりアルファード10は使用出来ませんでした。違うの買えばよかったかも。,1
28627,これはだめ。 作りが雑。 付けたくない。 予想を上回るひどさ。 買って大後悔。,1
4190,USBが認証できません。と出ます。 USB-Aへの変換は規格外って、何のためにこれ使うんですか。返品希望です,1
6705,期待はずれ‼️入れ方が悪いのか？100円のと変わらない、残念です‼️ 評価が高いようなので 購入しましたが。他の人は 耳栓としての役割を果たしていたのでしょうか,1
795,横から力が加わるとすぐ折りたたまれてしまってと書いていた方が居たのを確認せず購入してしまい… 軽い力でまんまと脚が倒れ飲み物をこぼしてしまいました。 実用向きではないです。 買って失敗しました。,1
23420,両方の端が浮きます 確かに気泡は入らず気に入りましたが端が浮くので意味がありません 最悪です 二度と買いません,1
3161,上記のコーヒーメーカーは人気商品の一つで、私も「よく一緒に買われてるもの」として出てきたので購入してしまったのですが、互換性はないと思ってください。やけに粉砕した豆の粉の混入が多いなと思っていたら、NC-A56/NC-A57純正のフィルターと比べてやや小さいようでした。,1
38363,とても危ないです。 これを使った後で家の中を歩いたら靴下がすべるように！ 家中、他の人も滑るとの訴えが上がりだし、使用しだいて１週間？さっき階段で足が滑り転倒、腕を怪我しました。 滑るので気を付けていましたが、クッション性を求めて使い続けましたが、益より害の方が大きく、もっと早く使用を中止しておけば良かった。 怪我をしたのが子供達 じゃなくて本当に良かった,1
16353,今日届きました。 まだ食べていないので、効果の程は分かりません。 けど、賞味期限が6月までとなっており、不快感しかありません。,1
39444,電波受信を５～６回試し、受信しないので１日以上放置しましたが駄目、タイマーモードでStartボタンを押したら表示が全て消え、その後復帰せず。 ゴミです。,1
30677,左は聞こえない、右はこもった音が遠くで聞こえる程度。 レビューを見て大丈夫だと思ったのに、買うんじゃなかった。,1
38810,直ぐに次作がでたため、あまりハマらなかったです。,1
25518,何だこの漫画。どれだけページが進んでも登場人物や世界が少しも魅力的に描かれないんだけど。 単に変な見た目のおっさんキャラと女の子に見えない男の子っぽい感じの女の子キャラがうろうろしてるだけ。 何の意味があるのこの漫画。なんもなさすぎて途中で読むの止めたよ。 終始つまらないという感想が湧く以外に何もない漫画だね。,1
31944,新品を注文しましたが、届いたDVDのケースにひどい破損があります。残念だったです。,1
3365,雑誌の付録レベル、もしくはそれ以下でした 質感が悪過ぎ,1
29561,軽いしコンパクトですが全然乾かない。 ヒーター部分がせまい。風だけが強いがそれだけでは夏場ならまだしも冬場は厚地の物は乾きません。,1
20088,付属のストラップがないため、星を一つにしました。ストラップも可愛いと思い、買う事を決めたのですが、返品は面倒なので,1
31684,写真と違うメーカー商品が届き、即返品しました。,1
4568,何度も問い合わせをしました。一週間くらいすると返事が来ますから、ここまでの約一月。現象としては途絶と再接続を繰り返して、使えたり使えなかったり。使い物にならないので問い合わせました。結局、ワイヤレスマウスは使えないそうです。当然、有線マウスも試して同じ現象なのですが、メーカーいわくインテルの仕様だそうです。ちなみにPCは（型番伝えたが）AMDプロセッサ。訂正しても、どうせAMDもその仕様ですって帰ってくるだけなので、諦めました。メーカーは不具合ではないと言い続けるので、返品もできず6000円のゴミです。チャイナメーカーの本領発揮です。会社も含めてここの製品は購買禁止にしました。,1
20218,9月8日レビューを確認すると私が投稿したはずのレビューがどこを探しても見当たらず、再投稿致します。 悪いレビューを消す。これがあちらのやり方なのでしょう。皆様お気をつけください。 以下、前回投稿したはずのレビューとなります。 ほかのレビューを見ると明らかに同じ内容を違う名前の人物が投稿しています。おそらく、ほかの似たような価格帯の除湿機のレビューを出品者、またはサクラがコピペして名前を適当に変えて投稿しているのでしょう。 私はこの商品を買ったのですがサイズが異なるにもかかわらずそれは誤差だ、と一点張りです。 返品したいと申し込んでも送料がかかる、払うのは購入者だ。 とおそらく翻訳ソフトを使った文章が送られてきます。 全くおすすめしません。,1
1398,この商品を購入し、初期不良でキーが入力しっぱなしになったため交換してもらいましたが、またしても同様の症状が出て使い物にならなくなりました。3ヶ月もてばいい方だと思いますので、性能は当てになりません。最悪のキーボードです。,1
