119737,ハロウィン用に購入しました。ピンがついたふかふかの耳でかわいいけれど、つけた時に安定感がなく難しい。付属のカチューシャにピンを差し込んで併用してもどこか明後日を向いてしまう感じ。使いづらいけれど、かわいいので何とか工夫して使っていきたいです。,3
84660,他の商品よりも安いので、試しに購入。高いのは可動部分が二か所だが、これは一か所で安い。とりあえず、つけてみたい人には入門用としていいのではないか,3
117167,ドローンは初めてでしたが、操作はしやすいと思いました。以前、小型のラジコンヘリを購入したことがありましたが、安定させるのが難しく、本ドローンはそれに比較すると断然安定していると思います。 今の技術はすごいものだな。。と感心しました。 搭載のカメラは残念ながら期待はずれの画質でしたが、「もっといいドローンが欲しい」と思わせてくれる商品でした。 小2のこどもは、喜んで使っています。,3
110852,とても良いセットですが、こんな色々はやっぱり使いませんでした＾＾； そしてボタンの品質は他コメントにもある通り不良品も混ざっているので要注意です。,3
105000,思ってたよりよかった。写真で見るよりデザインがイマイチでしたが、値段が安いので。,3
113503,柄はイメージ通りで、可愛かった。サイズがやや大きめだったのが少し残念。,3
90858,短くて滑らか。酷暑の夏に向いてるかどうかはこれからです。,3
112316,激的に早く解凍できるのかと思い購入しましたが プレートに当たる部分が面だと確かに溶ける時間は早いです。 ただ、肉等は平らな状態で凍ってないので面でなく点でプレートに接するので 激的な解凍はできませんでした。（自然解凍よりは早くなりますが） メインはタコ焼き用の冷凍タコの激的解凍が目的でしたが タコは点での接地が多いので時間的には期待過多でした テレビショッピング等でよくやるように氷を置けば あっという間に溶けていきますよ。 詐欺みたいなもの(笑) 解凍汁は確かに少ないのかなという感じです。 汁が少ないというのは旨味が抜けないという事なので利用価値はあると思います 他のレビューにありますが2枚購入して上下ではさめば早く解凍できると思います,3
89986,ワンタッチ開閉の折りたたみ傘の使用は初めてでしたが、開く時便利でした。耐久性はまだ分からないので星3つです。,3
101072,迅速な対応していただき、梱包も問題無かったのですが…開けたら以前のデザインで現在のではなくてどうしようかなとちょっと困ってます💦,3
106473,失礼は承知ですが値段相応といったところでしょうか。 店頭で600円程で売っていたものと比べて見るとBNC側を機材に接続したときにややグラグラしてしまう感じです。,3
112234,ライザップの純正品は高すぎるので、これを使ってます。ななめに貼ると何とか使えます。4ヶ月ぐらい使ってますが、問題無いです（たぶん）。ちなみに、sixpadには使えません。ひとまわり小さいです。,3
98625,この台の上に空気清浄機（SHARPのKC-G50-W）を乗せ、その下をルンバが走れるようにしています。 台の幅も丁度、ルンバが入り込めるようになっており、空気清浄機がルンバの邪魔をせずリビングを掃除できるようになりました。 最初、ルンバに何度もガンガンとぶつかられることで、空気清浄機が転倒しないか心配していましたが、その様な事態もなく安定しています。台・脚共に滑らかな木の手触りで、ナチュラルな感じの家具になら合うと思います。 1点問題点として、脚の底に滑り止め用に黒いゴムが付いているのですが、これが剥がれやすいです。私の場合は接着剤でくっつけ、今のところは問題なく機能しています。この部分の強度を改善して頂けたらと思います。,3
112812,使ってみるとまあ意外に綺麗な青を使っており気に入ってはいる。ただ少し手で持つ時、滑りやすいのが欠点。リング無しだと落としそうだ。,3
92596,硬いっすね。ちょっと柔らかいコンクリの上に寝るような感じです。 ヨガポールは他に買ったことがないので、いいのか悪いのかなんともいえないです。,3
100163,もう少し低いところからお湯を注ぎたいのだけど、首の形状のせいか102サイズのドリッパーでも真ん中に低く注ぐのが難しいです。 個人的にはもっと細く出したいので、このあたりは自己責任でカスタマイズする必要がありそうです。 金属臭は全く気になりません。,3
112903,予想よりも古さを感じさせられました。昔観たものですが懐かしかったです。,3
88986,保湿力はさほど無いと感じました。乾燥肌の方にはオススメできません。私も夏のみにして、冬は変えます。 ただ、ピリピリする感じは一切なく、敏感肌には良いと思いました。,3
96761,革が硬すぎて折り曲げても戻る力が強いのでスタンドとしては機能しない。,3
80569,権利とかの関係ですぐに前巻電子化ってのも難しいかもしれませんが、紙版のように完結まで30年ってのは勘弁してください。 電子版は完結まで1～2年くらいで何とかなりませんか？,3
107074,手軽に使えるがペンカバーの先の内部がインクでよごれる。仕事で１本ポケットに入れている。便利,3
85450,サイズは厚手のソックスを履くならワンサイズ大きいほうが良いと思いますが、作りがしっかりしていて履くとホールド感が良いです。 ただアイスバーンの上は異常に滑ります。ソールのゴム質が固いせいだと思います 雪国の人は購入を考えたほうが無難です 作りもデザインも良いだけに残念です,3
107681,他のレビューの通り，音が大きく，閑静な住宅街で使うのはためらう 機能的には問題ないし，ストレートと拡散を切り替えられるノズルは便利,3
113760,期待はずれか？飽きてるのか？さらっと読め過ぎて、物足りない感もありました。,3
100677,一作目が面白かったわりにという感じ。 設定に無理がない？ この手の作品に、必然性を求めてはいけないか........,3
107244,ガソリンランタンのスタンドで使ってみました。片側だけの使用でしたが、 重みでポールが曲がります。 強度的に少し不安です。 ただ、風が強めの2日間では倒れる事も折れ曲がることも無かったです！ 付属の(スクリュー)ペグは使いづらかったです。,3
115626,縫製が少し甘いように思う。右肩の前後2箇所が到着から2週間足らずで敗れた。,3
113697,交換も簡単だし、サイズの微調節が可能でとても使いやすく、お気に入りです。 でも、調節場所がズレやすいと思っていたら、使い始めてたった3日目に磁石が外れました。うまく接着されていなかったのかな？ 自分で接着剤を使ってくっつけました。 他の方のレビューにはそのような記載がなかったので、当たり外れがあるのかも。,3
101935,写真だとカッコいいと思ったのですが実際は女性向けだと思います。またボタンが押しずらい。,3
101238,チンチラ用に購入 網よりはいいかと思いますが枠の隙間に色々たまってしまうのでやや掃除の際面倒に……,3
117568,攻略本で、モンスターの解説を読んだあと、わくわくしてプレイしました。プレイ中は、目先にわたわたして、キャラの背景への思いいれも何も、追いつきませんな。,3
108864,一人暮らしでも、気軽に1合炊きの手巻き寿司が楽しめる,3
103758,雨ｎ中ででの利用は未経験。雨にぬれたあとでも帽子の役目をはたしてくれるか？,3
93810,ずっと欲しいと思っていたものが安くなっていたので即買いました。 ブラウンのケースに入って見た目は悪くない感じです。 切れ味は文房具のハサミに劣ります。髪は滑らず切れました。 以降、何度かカットをしてみて、段々使いやすさに気づきつつあります。 所定の位置に指を置いて、上達もしますし、素人に親切な仕様だと思います。,3
84370,気に入った点は、バッグの色合いとサイズとコストパフォーマンスです。 収納も結構入りますが、手持ちでない為とても便利です。 但し、色々な物を入れて持ち歩きたいので、以下の点を改良願えれば嬉しいです・・・ポケット（仕切り）類が、バッグの下側に位置していることと、その数が少ないことで、収納物のバランス良い整理がし難く、取出しにも少々不便を感じます。,3
97861,お札の二つ折りがはみ出す。カード専用か。」,3
93378,冷凍用に使うには便利だけど、丈夫ではないので知らないうちに破れていた。,3
99577,シリコンの為、ほこりがつきやすい。それ以外は使いやすくてよい。,3
104044,水や砂を入れる様に記載があり、水にて使ってみた。風等にも持っていかれる事無く必要十分である。 だが、製造の問題か角の部分が薄い様で移動して置く際に少し荒く置いたら角が割れて水が漏れてきてしまった。(投げたとかではない）当方はそれ以降両手でそっと置く様にしている。,3
108228,素早い対応で助かりました。純正バッテリーが膨らみ諦めていましたが試しにお取り寄せさせて頂きました。すぐ起動いたしました。,3
87441,商品は気に入ったのですが、使い捨てライターの使用が煙草を買うともらえるサービスライターも使えると思っていたのに使えなかったので残念でした。,3
118764,はじめてケーブルバイトをかいました。こういうものとは思うのですが、iPhoneケースによっては、充電する時に邪魔になり結局コードの間でぶら下がっています。,3
93429,オゾン効果??もう少し遣わないとわかりませんが??良さそうです｡,3
96288,最近では店頭のワゴンセールとかの方がお安い場合が多々あります。 やっぱ紙パックは便利です。,3
107695,可もなく不可もなく 毎日履いて年に数足消費する人にはちょうどいいコスパ的にちょうどいいです。 デザイン 古臭さはなくよい 履き心地 悪くありません 耐久性 不明 サイズ 少し小さめ これまでは履いていたものと比較すると若干小さかったので 次回購入時はもう1サイズ大きい物を購入します。,3
83227,直射日光で長時間充電できないと数時間で消えてしまいます。 なので曇りの日は夕方点灯しても23時ころには消えていることも。 上の部分だけ取り外して陽の当たるところで充電も出来ますが、すこし陰になっているところに設置したい場合は要注意。,3
96796,大きくて暖かいのですが素材のせいか、肌触りが少しコワゴワしています。もう少し触り心地が良いといいと思いました。,3
96423,かわいいです ただ、ご飯入れにくいかな… ご飯つぶが上の方についてしまいます,3
109057,納得して読みました。おっしゃる通りだと思います。気を楽にして日々、日常の事に誠実に対応していくことが大事だと感じました。,3
106638,【気に入った所】 ぷにぷに曲がる。 【気に入らなかった所】 ちんちんの大きさだけど、初めてのディルドで4cmは太すぎると思う。 ガバガバな人向け。先っぽを入れたらちょっと痛かった。,3
106524,個人的にはそこまではまりませんでした。 ミカンジュースっぽい何か、という感じです。 ミカンを期待すると、あれなんかちがうぞ と思われるかと思います。 駄菓子のミカン味が好きな方には良いかもしれませんね。,3
104094,扇風機としての性能はまあまあ良い。 コンパクトの割に風力もあるし、静かだし、リモコンで首ふりまで出来てべんりです。 ただ、届いた製品がまるで中古品に見えてしまいがっかりでした。 カバーには傷やすりきれたような跡などが沢山あり、モータカバー付近には沢山の鉄粉が付着していました。 まるで、展示品か何かを分解して送ってきたのかと思える商品でした。 製品の性能が気に入っただけに非常に残念です。,3
101160,ゆでたまごを持ち歩くのに使っています。とても良いです。 変な匂いがありましたが安いので我慢でしょう。,3
115988,値段的に正確性はダメかなぁ、ぐらいで購入してみましたがテスターとほぼ同じ数値を表示します。 ハードルが低かった分、いい買い物でした。 角度によっては全く見えなくなる画面でしたので残念でした。 取付場所を検討することをお勧めします。,3
90906,知人のための代理購入のため、特に商品レビューのコメントはありません。,3
88858,使い勝手は非常に良かったのですが… 2ヶ月位で細かなクラックが多数入りました。使用は別段問題ないのですが、なんか壊れそうで嫌なんで違うのと付け替えました。,3
81918,5個中、正常なのは3個でした。 黒はまったく認識せず、青は読み書きには問題ありませんが光らない。 赤、紫、緑は正常。,3
104231,つけやすく、そのままベースで使ってもよさそう。固まり具合もちょうどよい,3
96369,ガタつきがあったがチョッとねじったら直りました。 細かい事を気にしなければ普通に使えて良いスタンドで安定感はあります。,3
95720,たまにはこういうのもいいかなぁ……と思って買ってみました。 髪の毛が中途半端に伸びてくるとサイドが邪魔になるので……と思ったんですけれども、美容師さんがびっくりするほど毛量が多いので、本当に少ししか止められません＾＾； とはいえ、可愛いのとそれなりにしっかり止まるのでよしとします。,3
99804,ポロポロでてきます。 ですが使った後鏡見たら角質取れてません ですが、肌はワントーン明るくなります。,3
103686,とりだしたらとてもタバコのようなくささでした。 まあ、今はほとんど臭いませんが最初が本当にくさかった。,3
89107,ピンセットの作りは良い。 角栓取り用のアイテムは微妙,3
82308,純正ストラップがくたびれてしまったので買い換えました。良くできていますが、悪くいうと値段なり、薄っぺらくチープさを感じます。,3
96912,α6500用のがそこそこ良かったのでセール価格を利用して購入。全体的には悪くないがジョイント用のネジ穴の径にバラつきがあります。端の方のネジ穴が小さ過ぎて1/4ネジがはまらない。交換して欲しい所だがアマゾンのシステムだと換えても解消される保証はなく躊躇しています。,3
88581,記載の写真を見ててっきりリモコンが付いていると思った 手動式だったのでびっくり 押し入れに入れました,3
104678,フィット(2017～)のセンターに使えるかと思ったのですが、スペース的に無理がありました。 色々位置を動かして確認していた際にパネルに傷が付いてしまったので取り付け後に色々調整する場合はご注意下さい。 ドリンクホルダーが１つだけのタイプだったら使えるのではないでしょうか？ とりあえず自分の車には使えないのが分かったので誰かにあげようかと思います。,3
101941,昔っぽくて気にいってます。 軽いので移動もしやすく、独り暮らしにはピッタリだと思いますが、下にネットが付いている為足を入れる事が出来ないので、ネットが付いていないのを選べば良かったです。,3
82710,来客用のシングル布団の収納にと購入しました。 サイズが小さかったです… ちゃんと読んでなかった私がいけないので ★3ですが シングルロングサイズならそうと もう少しハッキリ書いて欲しいです… シングルの布団だとどっちかしか収納できないので 諦めて布団を買った時についてきたカバー使うことにしました。 使い道もなく、使ってないので 良い感想もいえないので－2にさせていただきました。 2つも買ってしまってショックです…,3
90418,3回購入済み 見た目はかっこいいんだけど、2ヶ月ほど使っているとリング部分がギコギコ言い出して、根元から折れる 2〜3ヶ月程の耐久度と思った方が良い,3
82019,デザインも良く、素敵な傘で値段的も安価ですが、 少し重たいので、再度購入しますかと聞かれたら？？？軽量のものを購入します。,3
114627,選んだ理由は【シリコンで外し易そう】【洗いやすそう】【４つもお得】 使用目的は、【ソースの冷凍保存】など。 全部シリコンのものは、仕切りが垂直で角ばって油が落ちないので洗いやすいシャープな物を探していた。 使ってみて気付いたことは、角がシャープなので【洗いやすい】。 本体は、写真みたく【柔らかくない】。 白のプラスチックが薄くて割れそうなので外すときも【力ずくでは外せない】。 裏面を濡らすか、少し時間を置くかして蓋をしたまま→ひっくり返し→シリコン部分を両親指で押して使用。 弱そうな白いプラスチック部分が割れそうなこと以外は特に問題なし。,3
106451,ケースは、ソフトで使いやすい。透明感はクリアでは無いがまあまあです。,3
83978,価格のわりに、留め具のネジ穴が雑に付いてるのが残念でした。クッション棉がネジ穴に入り込んでいて、返品しようとアタマヲよぎりましたが、途中まで作ってましたし、面倒なのでそのまま使ってます。 ただ、頑張って出来上がった椅子なので、完成した商品としては、快適です。,3
94225,亀山キャンドルホルダー４つめです。他の３つはすごく気にってます。 これは4方向につなぎ目のようなものがうっすら見えますが、ま、個人的には暗いところで使うのだし気になりません。クリアでロックアイス的な感じの作りなのもあって、手持ちの他のより揺らめきは少ないです。が、より明るく炎は綺麗に見えます。その点はいいです。高さは他のシリーズと比べ低めなので、ヤンキーキャンドル サンプラーははみ出しますので書かれてある「ティーライトにおすすめ」っていうよりティーライト専用かと思います。 問題なのは内部底面です。水平じゃない。手持ちの他の３つも多少は凸凹はあるけどほぼ水平、ですけどこれは水平じゃない。おかげでティーライトが斜めにセットされ、ロウが斜めに溶けていき最後まで燃焼させられませんでした。不良個体なのか、もともとそういうものなのか定かではありせんが、不良だとしたらそれがそのまま出荷される品質管理に疑問がのこりますね・・・。 交換も面倒なのでこのまま使いますが、ちょっと腑に落ちない感じです。,3
108887,CHAGE3本体を保護するカバーケースを探して値段も手頃で保護力もあり、耐久性も良さそうという事で最初に購入した商品がコレ！ 届いてみて確かにナイロン製でEVA素材の保護カバーで外側は硬質で出来ており、万が一落下させた場合でも本体は守ってくれるだけの丈夫な作り。中は本体をキッチリ収納出来て、固定バンドでシッカリ固定出来るので外出の場合でもズレたりすることは無い。 なかなか良く出来た製品だと思った！ ただ１つ残念なのは……真ん中の継ぎ目の所が貧弱で弱々しい所。ペラペラしていて長年の使用となると耐久性はどうかな？という感じ。 中華製の商品ですが、製品自体は作りは比較的良い。 購入して同社の製品を調べていると、このチャージ3のケースカバーは他にも発売されており、別の商品は同じ価格で作り自体は全く同じだがこちらはショルダーストラップ付きで、中の色合いは外側と同じ黒。まあ、好みの問題でしょうが……自分はこちらの方が好みなのでこの商品を返品させて頂いて同じ価格で中がブラック色のタイプを購入しました。ストラップ付きでした。作り自体は一緒ですが。。。 中の色合いがシルバーですと、長年の使用で汚れが目立ってくるような感じはします。外出先に持ち出す場合でもショルダーストラップ付きが良いですし…… 今後、購入される皆さんの参考になればと思います。,3
87865,バンカーリング、保護カバー、車載用マグネット対応と機能がまとめられており期待通りなのですが、バンカーリングが決まったポジションに戻さないと収納されません。それが面倒くさい。,3
86979,それなりに涼しいが、首に巻いてもすぐ温たまるので・・・・・・,3
114965,ひとり暮らしなので、洗濯は週一回まとめて。その都度交換している。 それでも、毎回ハサミでカットする必要があるのはめんどくさい。 それぞれの洗濯機用の形のものを販売して欲しい。 他に良いものが見当たらないので使用してる感じ。,3
106920,2015年に購入して使っていたが、先日故障して使い物にならなくなりました。歯はよく磨けるので有り難いが、３年弱で故障するのは残念であります。今回購入した歯ブラシは本体が前のものと同じものであり、電源も使えるので、本体だけ購入できるとありがたいですね。あるのかもしれませんが、分かりませんでした。,3
107035,もう少し長さがあると全体を覆うことができたかなと、思います。 商品自体は良かったです。,3
114357,小学四年生の娘の誕生日プレゼントとして購入しました。 最初は喜びながら触っていたのですが、難しいというかあまりにも面倒くさい作業工程のため1日で触らなくなりました。 まず液体がなかなか固まらない ペンの個体差によって液の出が違いすぎる 思い通りの形状にするには器用さが必要 そしてなによりも 使用した場所のまわりがベトベトになる 拭いてもなかなかベトベト取れない為、親としてももうやらんでくれと思うような状態でした。 これは大人が趣味で使う分には良いかもしれないですが、子供には扱いが難しいオモチャかと思います。,3
81659,持ち運びやすく良いが、充電は思っていたより持たない。,3
81504,値段につられて買ったけどＴ６は無いと思う、最近買ったＴ5でももっと明るい。２個で１個の値段で買ったのでまあまあかなー。,3
115002,５月購入、２週間に一度の使用でした。 5ヶ月でこんな感じです。,3
101942,箱つぶれで届きました。中身は問題なくで良かったです。思ったよりサイズは、小さめで、長財布だと出し入れ厳しい感じです。母のBDプレに購入しましたが、喜んでもらえたので良かったです。,3
82976,謎のプリンス上巻が本編の文字にまで汚れが激しく着いてるやつだった… セット売りで汚れがないと書いてあるのにも関わらず、これはないと思う。 他は新品に近かったけど、一品不良品に当たったので、質の良さそうな中古の謎のプリンス上下巻を買い直す事にした。,3
