49978,CDは新曲も入っていてとても良かったです。 気になったのは特典の梱包方法、状態が悪いことです。 初回版で高価なCDを封筒で送ってきた事に驚き、チケットホルダーが擦り傷だらけで中古品かと思いました。 チケットホルダーをむき出し状態でダンボールとCDの間に入れ、マスキングテープで固定しているだけなので封筒の中で付いた傷だと思われます。 特典目当てで予約したのでガッカリしました。 他企業のように、特典をビニール袋に入れる等の配慮をしていただきたかったです。 チケットホルダー付を購入する方は、酷い状態で届くかもしれないので覚悟しておいた方がいいと思います。,2
52548,まず最初から色々な形にカットされてる部分が半分以上あって（正直これは要らない）、自分で自由にカットできる部分が少ない。それから、貼る箇所に曲面がある場合、シートの角が曲面にあたると長持ちせずに、すぐ剥がれてしまいました。,2
58805,実際にヨーロッパに行く友達にあげましたが、すぐに曲がって役に立たなかったそうです。,2
76802,いい大人になった今でも「あの時の自分は正しかった」という独りよがりの告白が目立った。プロ意識の問題ではなく人間的に未熟な人ばかり。がっかりな人たちです。,2
45465,先日本商品を購入し約1ヶ月iPhoneXでマイクラをプレイしています。 しかしL2R2ボタンの反応が絶望的に悪いです。普通の感覚でボタンを押して止まる位置では反応せず、更に力を入れて押し込みやっと反応します。これはかなりストレスで疲れます。（ファームアップ済みです。）L2R2ボタンはマイクラでは使用頻度の高いボタンなので、快適にプレイするには致命的です。 コントローラーのサイズは想像より小さく（あくまで私個人の感想です）携帯性にとても優れています。小さい分一般的なコントローラーと比較すると使いにくいのは当然ですが、慣れれば特に問題はなく、操作性が悪いとは感じません。それだけにL2R2ボタンの反応の悪さはとても残念です。一事が万事で他の良い部分がすべて帳消しとなってしまい悪い印象が強いです。 なお、それ以外のボタンについては問題なく使用出来ています。,2
69531,まぁ値段なり、というには少々足りないけど実用性には足る、といったところ。 というのも、そもそも加工精度が酷すぎて付属品ではまともに組み立てが不可能なケースがあるようだ。ぼくが買った商品がそうだった。ネジ受けが逆に取り付けられていて、付属のネジでは長さが足りずボルト留めが出来ないｗハメ込みの部分も精度が低すぎて隙間がパックリ空いてしまってネジがそもそも差し込めない、とか。 多少ヤスったり、別途ネジを購入したりしてなんとか組み立てる事ができたが、流石にこれは万人向けとは言えなかろうｗ そうは言ってもこの値段。酷いのは紛れもなく酷いのだが、多少DIYに慣れているとか、工作が好きなら「まぁこんなもんかｗ」と笑って済ませられる人も中にはいるだろう。 組み立てあげてしまえば、商品はそれなりだ。むしろ、少々イケてるのでは？と言えるほど。 スノコになっていて多少は通気性も良さそうだ。ただし強度については価格なりの怪しさが漂うので、カタログスペックを鵜呑みにせず、それなりの厚さをもったマットレスなどを敷いて負荷分散してやったほうが無難であろう。 この手の「おいおい本気か？ｗ」と笑ってしまうような粗相が許容し難い御仁は倍額出してでも（それでも2万もしないのだ）信用できそうな商品をチョイスするのが無難であろう。 ざっくりとGOOD/BADでまとめると以下の通り。 GOOD！ ・安い。この価格であれば外見だけでも体を保っているなら文句言えないレベルだろう。 ・梱包がコンパクト。よくこのサイズに収めたもの。 ・組み立て難度が低い。 BAD！ ・加工精度がゴミｗ ・付属のヘックスレンチが色々ゴミ。ボールポイントのあるヘックスレンチがあると飛躍的に楽が出来る。,2
54585,フックの間隔が狭く、手持ちのトリンプとは合いませんでした。 結局国産の犬印のものを買い直しました。こちらはピッタリでした。 写真を参考にして、間隔が合うならお得だと思います。,2
72199,先日、ケースの角が欠けました。 鞄の中でノートとノートの間に挟まって圧力がかかっていたせいかもしれません。 読んでいる最中にポロッと破片が落ちてきました。使用に支障はないのですが、落下時の耐久性はあまりないのかもしれません。 ということで☆2です。,2
55910,手書きメッセージ付きで送られて来て、嬉しかったです。 しかし、サイドのボタンが硬くてすぐに外しちゃいました。 フィルムも貼り方が悪かったのか、端っこから徐々に空気が入って、剥がれかけてます。,2
46949,写真のケースとは違うケースでUSBのジャックなどはパネル上面にあり、ほこりなどが入りやすい作りになっています。自作派なので、とりあえず拡張性を見ようと中を開けてみましたが、光学ドライブの取り付けねじがバカになっているものもありました。丁寧に組まれているわけではなさそうです,2
43679,指定日に届き 写真もビデオも撮れました。 付属の説明書は英語と中国語でしたので amazonのホームページを見ながら 操作を確認しました。 写真 映像は証拠になる物がないよりまし 録音もクリアにと言う程ではありません。 まさにスパイレベル。 ちゃんとした映像や録音を望む人には残念感が強い商品です。 あまり期待しない人には良いでしょうが 私には期待はずれ感が強い商品でした。,2
58281,大人になってからの自堕落な生活について行けなくて、途中で読むのをやめました。 手書きのセリフの文字が小さくて崩れていて電子書籍では読みづらいです。,2
48583,全体的にメタルで作られているので頑丈だとは思いますが、マウントとパッドを固定する軸の部分が円形なので使っているうちに甘くなり固定した位置を維持しないようになりました。購入後、１週間程度です。 固定が甘くなればネジを増し締めする必要があります。時間のある時にでも画像をアップします。,2
46711,とても良い商品だと思います。ただ、こちらの12口金に使うにはは、眩し過ぎた。,2
45815,成型の型の会わせ目が縦方向にぐるりとあって、耳に当たって痛いです。着いた耳垢が、螺旋の溝に入って取りにくい。ふつうの形の耳掻きの方が良いですね。,2
50843,実物は厚みが薄くベタっとした感じ。文字も小さくてがっかりです。返品するか検討中。,2
54661,サーフィン中の使用目的で購入しました。 防水機能ありとのことですが、ケースの 蓋が食品容器の様な構造で、ものの10分程度で 海水が入りました。 釣りやボート遊び、直接濡らしたくない程度の 利用なら可。アクティブなマリーンスポーツに は向きません。値段に対して作りが安っぽいです。,2
76601,お値打ちなので、作りもそれなり。 何回洗濯できるかしんぱいです。,2
71398,マグネットがアマいのですぐ外れる。 もうちょっと長さがあるといいんだけど。,2
73441,マグネット式のバンドから乗り換え。 軽くて付け心地は良くてとても満足しています。 ただ気になるのは、バネ棒の部分が商品写真と違っていたこと。 手元に届いたものの方が取り扱いしやすい形状のようですが、バネの強さが弱くなっているのじゃないかと感じました。 実際、使っていて３度程外れてしまい、不良品かな？と疑ってしまうレベルです。 それから、時計にプラスチックのカバーを付けているのですが、片方の金具と干渉します。 ただし、使用には支障ありません。 追記 やはり、リュックを下ろすときに引っ掛かって金具とナイロンが外れたり(なんとか修復)、とうとう昨日は地面に落としてしまい、時計本体を破損してしまいました。 バネが強ければ一体型でも問題なかったのですが、商品写真の通りのバネ棒を交換できるタイプが良かったです。,2
69105,充電して使用してみたら、重さはあるが、強弱、パターンを変えられ、肩マッサージ感はなかなか良い、もの、のはずでした。 １０〜１５分使用、４回目でピタっと止まり、はい充電を差し込む、赤ランプ点灯から、２、３時間経って、緑点灯。 スイッチON！ ？動きません。もういちど、充電差込、赤ランプ点灯、すぐに緑点灯。充電は完了しているらしい。 スイッチ？動きません。やっと、よいマッサージに巡り会えた、と思ったのに残念です。マッサージ器としてはよいもの、だったのでしょう。充電できても稼動しなければ使えません。返品して再度、同じものを購入するか検討中です。,2
57411,劣化がとても早いです。 1ヶ月使っただけで、1年使ったのかな？てくらい痛みました。 磁力も購入時から弱いです。iPhone落としてしまう時、いつも手帳が開いてしまい、画面がそのまま落ちてしまいます。 失敗した買い物だったかなあと思います。,2
52805,充電されません。 付属のアダプターをつなげても ランプは点灯しません。 不良品なのでしょうか,2
46744,付け根部分が緩い本体とピッタリフィットとは言えない。 そして付け根部分の塗装がはげてくる。 磁力は強いのは認めるから星二個,2
47559,5個中3個使用しました。 1つは2週間持ちました。その後交換したら即イガりました。メンソールリキッド注入後30分は置いておきましたが 5吸いでお亡くなりに… 3つ目は3日前に交換しましたがちょっと焦げ臭くなってきた。 手軽だし安いし気に入っているけれど、個体差ありすぎて使い続けるか悩む,2
48124,CDの音楽聴くのはいいですが テレビには1mの長さでは使えない 最低3mなければ。 到着して1回だけで、次の日ダイソーで ２２０円のありますから購入しました。 長さ、何に使うか説明不足,2
66982,使用出来る期間がとても短い/効果に対しての価格も満足とは言えない,2
64788,しっかり梱包されて届きましたが、 1枚ヒビが最初から入ってました。。 とりあえず2枚入りで買ったので、予備の1枚を使いm貼りました。。残念すぎました。,2
78428,ちば先生の原作では，雄弁なキャラクターは一人もいなかった。個人のキャラクターは，それぞれの行動によって描写されてきたように思う。能書きをたれたがっていたのは，丸井くらいではなかったか。延長18回の打席に立つ，満身創痍の丸井から発された「俺は何の能もないキャプテンだったけど，みんなが見せてくれたように……」この台詞ですら，かなり長い方だった。18回の表を抑えて，ベンチに戻るナインに「ほら立たねーか，こんなときこそ，イキがってみせるもんだ」 男気（当時の）があり，熱血漢の丸井だったが，地区予選第一線の初回から「谷口さんの最後の夏なんだ」という意気込みで打席に入ったりしないと思う。 「イガラシ，ムダにしないぞ」「続くぞっ，イガラシ」……本来の登場人物は吹き出しの中ではその程度しか発言していない。ストーリーもだが，一番変わってしまったのは，この部分なのかもしれない。 本の帯に付いていた「アンチもノンアンチも巻き込んで早くも30万部」というコピーも，気分をぶち壊すのに，そうとう一役買っている。大切にしてきたものを踏みにじられて，それでも淡い期待を抱きつつ律儀に金を落としている往年のファンに対して，あまりに失礼な編集者ではないのかと，抗議したくなる勢いだ。 私は谷口君の口から，「甲子園に行く」とは言ってもらいたくなかった。中学時代に「青葉に勝つ」とは言っていたものの，「優勝する」とは一言も言わなかった谷口君。みんながついてこなくても，一人でムキになって，気がついたらみんなが動いていた……そんな谷口君はどこに行ってしまったのだろう。,2
64389,他の人のレビューにもあった通り、甘味は無いです。そこは気にならなかったのですが、食感が…。某メーカーのを食べ慣れているせいか、サクサク感は無し。私の好みではありませんでした。,2
50043,想像以上に音が一定ではなく非常に大きくなる事が ある。誤差動かと心配になる。,2
46871,思ったより大きく、重かった。装着するとさらに重く感じますので最悪です。その分確りガードはしてくれるとは思いますが、、、。,2
43572,形状、明るさ、防水には満足していました。 しかし、LEDの照射面が柔らかくなり、形状が崩れてきました。 LEDの熱にただれた感じです。 いつまでもつことやら・・・,2
68183,セレナにはジャストフィットとはいかず、 少し緩い感じがある。,2
60880,通常の販売価格より3倍 欲しいがっていたけど高いからと姪が迷ってたので買ってあげたけど自分のなら買わない,2
69233,この設定はないわ。在りえないでしょ。 第1話を読みながら、ゆるキャンの1話が頭に浮かんできました。,2
43757,ダイヤモンド砥石の方は全く使えません ザラザラどころかツルツルって感じで、ナイフが滑ってダメでした。 白の仕上げ砥石は両端が、ザラザラしてて、他の砥石研ぎで表面を慣らさないと使えませんでした。,2
73345,少し小さかったが使用できない事はない。糸のほつれが多く中国製だけの事はある。もう少しメッシュ部分が大きければ涼しく感じるのではないだろうか。,2
63923,非常に小さめなのが気になりますが、モダンな感じがいいかなぁ？プレゼント🎁用に購入しましたが相手が気に入ってくれればいいですね！,2
50395,やり方が分からない。 同時二台のペアリングが出来ない。 最初から、日本語説明書付けて欲しい。,2
62163,ZenFone 3にガラスフィルム貼り付けた ツムツム用に購入 ペンの使い心地はよいのですが 接触不要で線が途切れたり いきなり電源が落ちたり最悪でした 再度電源を入れてもつかなくなった場合は 蓋を外し電池の固定位置を変えたり蓋の締め付け度合いを 変えてやれば（調整は結構シビア）電源が回復するがまた急に落ちるので はっきり言って使い物にならないです スコア更新できそうな時や フルアイテムで突然落ちた時はペンをへし折りそうになりました とりあえず交換再購入でまたゴミが来たら二つ分返金してもらって 二度とこの商品は買いません,2
64473,ノーズワイヤーが硬くて痛いです。わたしにはサイズが大きいのか、ワイヤーが頬骨耳に近いところに当たり、他社のと材質がちがうのかなぁと思います。,2
72678,カメラの穴の位置がちょっとズレてる。 カード2枚入るとサイコーです,2
40621,とても使いやすかったのですが、1ヶ月で指先が破れしまいました…,2
75721,ギフトにと思い購入！届いたら箱がかなりボロボロで中に補習なのかテープが貼ってあり汚い。 中古かと思った！残業。 中を開けてみたら汚れいたので返品させていただきます。,2
65398,内容は大変素晴らしのてすが 普通の文字の本なのに、なんで体裁を 漫画とか、カラー図解の本と同じ体裁に為たんだろう。 お陰で、線も引けないし、音声での読み返しも出来ない。 Webを扱ってるならその辺も理解為て欲しかった。 Webデザイナー、ライター系の人が本を出版為てるが その辺りも考えてあまりグラフィカルに為ないで 普通の体裁で出して欲しい。 これだとKindleで買う意味が無い,2
72543,愛用しているリュックの裏地が黒でリュックの中のものを取り出すのに分かりづらかったのでこちらを購入。明るくてきれいな黄色でよかったのですが、長財布が横に入らず…このフェルトバックだけをランチタイムに持ち歩くことを想定していたのでかなり残念。 サイズ確認を怠ったわたしのミスなので仕方ありません。,2
65593,iPhone純正のイヤホン対応、再生や音量調節等も可能とありますが、 音量調節が出来ない・やたら音が大きい等、期待していた程ではなく残念でした。 再生や早送り等は出来ますし、充電をしながら音楽を聴くという一点に関しては一応使えてます。,2
50754,そもそもずれるし、外れるから使えない。サイズが合ってると思うが、一回の散歩で４－５回ずれて、直さなきゃいけないからFuckって感じ,2
43268,とても暖かく履きやすいです、 風の強い日は やはり股引のような少しゆとりがあったほうが直接風があたらなくていいかな 室内などでは 最高に暖かいと思います,2
64468,５足（１０枚）中１枚だけ足首をカバーする部分が後ろ側ではなく横側についていた。裏返してみると縫製が雑。,2
50518,小学生の子供用に買ったのですが、漢字にふりがなが振られていない為、それが障害となって全く読もうとしませんでした。 使えそうだったのに・・やっぱり書店で手にしなきゃわからないですね。,2
77330,足裏が疲れやすいため購入してみました。 が、思ったより分厚くて圧迫されて痛くて使用するのをやめてしまいました。 私の足は土踏まずが人より少し低いかなという程度なので、ハイアーチの方に向いているのではないかと思いました。,2
52262,650cなんてニッチな規格でこの値段なんで品質は期待しないほうが良いかと。 購入後半年でサイドの縫い目が破れてパンクしたので、先週新しく同じタイヤを購入しましたが今度は1週間(５ｋｍ圏内2回乗車)でサイドの縫い目が破れました。 もちろん空気圧は守っていました。 別の方のレビューでもサイドが破れやすいとの指摘がありましたので、これはこのタイヤの仕様なのだと思います。 同商品を使っている前タイヤは全然破れないので品質にバラつきがあるのかもしれません。,2
45136,３年間くらい使用しての感想ですが 虫歯になりにくくなった感じは無し研磨剤なしのせいなのか歯も黄色くなるし 歯周病も全然防げないし 評価が高かったので使用していましたがやめます,2
65372,最低でも60cm水槽でないと、大きすぎます。 できれば90cmくらいの水槽がいいと思います。 高さもあるので、まっすぐ入れたい人は30cmくらいの水槽じゃないと、頭が出てしまうでしょう。 石のおもりがついていますが軽く、浮いてしまうので砂にちゃんと埋めたほうがいいですね。,2
55145,今回届いた靴は右と左でつま先や土踏まずの反り具合、横幅がばらばらでした。 以前注文したものは問題なかったので残念。,2
44994,充電は試していないですが、イヤホンを差し込んで音楽を聞こうと思うとノイズ音がします,2
79136,匂いがひどく、頭が痛くなるくらい。 猫が気持ち悪くなってゲロをはいた。 デザインは良いのに残念。,2
74946,熱々の白湯を入れて会社に持って行っていますが、昼食時までは冷めていません。しかし、パッキンの独特な匂いが白湯にも付いており、ヘンな味がします。試しにお茶も入れてみましたが、やはり同じように味が変わってしまいました。熱い飲み物には使用しない方がいいかもしれませんね。ちなみに白湯やお茶に使用している水は水道水ではなく、天然水です。,2
70693,気に入って使っていましたが、皆さん同様ファスナーが剥がれ、終わりました。海外出張中に壊れたので、非常に困りました。いつどこで崩壊しても７千円なら御の字、と言う人限定ですな。,2
61932,油が付く糸の周りの部分がフライパンに当たって周辺まで油が付きません。,2
64255,常にノイズが鳴り続けています 非常に気になってストレスとなります コントローラー部も画像では分からないように撮ってありますが厚みがあってかなり大きいです,2
69575,うまく言葉で説明はできないけど、普通のゼリー飲料と比較して変な後味の気持ち悪さがある。,2
74788,細かいところが気になります。所々で音が途切れ途切れになりますし。 なにより箱がチープ 自身をもってお勧めということはできませんね。 イヤホンの誤タッチがおおいです。もう少し物理ボタンに近い形にしてくれたら。。,2
77968,従前のパソコンのインターネットのつながりが遅くて、たまらず購入しました。。当初は快適につながって、買い替えてよかったですが、１年３か月たちまして、ネットが重くなったり、エクセルやワードがうまく動きません。チンタラでいいんなら使えますが、このところ皆、重くなってしまい、買い替えにしました。,2
58570,一言でいうと、Amazon、eBayなどから買って、日本のAmazonで売る方法について、何にもわからない人向けに、やり方をまとめた本。お金をたくさん儲けるところまでは、まだまだはるかに遠い道のりが必要。自分で、ぽちぽちでも、外国のAmazonや、eBayまたは、外国サイトで買い物をしたことがある、又は、している人にとっては、買う必要のない内容と思う。日本のAmazonでの販売についても、別に本を読まなくてもできる範囲内のことがまとめられている。近年は、この程度の超初歩入門内容なのに、儲かるとか大げさな釣り本が多い。やれると儲けられるは全然違う。やり方をまとめて本なので、すでに、やれる人は、購入すると損をします。,2
62317,ノズルの角度が浅いに尽きる。90度位がいい,2
58500,携帯テレビ用に買ったけど 全部差し込むと音は聞こえない 電波は良好,2
50208,過去2回購入し使用しました。 いずれも付けた当初はちゃんと動きましたが、2回とも1年半くらいで駄目になりました。 GSユアサのバッテリーが安定して5~6年持ったことを考えると決してコスパは良くありません。 5000円で購入し1年半の使用で計算すると、帰ってACデルコの方が割高になる気がします。,2
62264,軽いのですが、20㎝型では短いので 刃先が暴れてしまうので、初回以来使っていません,2
59062,木製の取っ手が可愛いです。沸かせた後に触れても熱くないです。 見本画像にあるロゴはどこにも入ってませんでした。 300ccの水をいれて沸騰させたところ、細口から勢いよく吹きこぼれてしまいました。 しっかり監視してないといけないかもしれないです。,2
