152118,KG型に適合するかは情報が無かったので、CX-8用にするかどうか迷ったのですが、そっちはデュアルモニター用の機能が存在しているので、回路設計が微妙に異なりそうでこっちにしました。 人気で欠品していたようですが、当初の予定（4/6以降予定）より1週間早く到着しました。 添付の取り付け説明だけでは不十分だったので、ネットを見ながら作業しました。1時間弱で終了しましたが、エアコンパネルを外す際、メーターパネルが干渉し、モニター組み付け時も再度干渉（嵌合を一度外さなければいけない）点を書いておいて欲しかったです。 取り付け後その辺を一回りしてきましたが、無事に作動しているようです。問題が出るかどうかはもう少し検証必要ですが、どちら買うか迷っている人はとりあえずKF用で大丈夫そうです。 4/14追記 問題は出ていません。i-DMへの影響は興味が無いので見ていません。燃費計やナビには何の影響も無いです。 一度作動させると再始動してもキャンセルが効いている状態です。こういう仕様なのですね。 これならキャンセルスイッチを見えないところへ設置しても良いのではと思います。,4
124030,普通の三脚だと 自撮りするときとか 平地にしか立てれないけど この曲がる足だと 平地は もちろん 壁に挟んだり パイプに巻き付けたり どこでもＯＫ！ めっちゃ便利！(*^▽^*) あと 机の上に置いた時も 微妙な角度調整もできて良い感じ コンパクトだからバッグに入れてても 邪魔にならないです,4
121615,電源は、切っているのにUSBには、電気が来ている。ファンは、回っていないので、いいが、USBの方も切れてほしい。,4
140133,iPhoneにつなぐとすぐアプリを取る指示が出て、とても使いやすかったです。,4
150561,頻繁にスマホを落とすのでこちらも使いましたが、値段に対して不満点はありません。 気泡が入ることもなく、操作性を損なうこともないです。 少し反射が気になるところと、付属のアルコールシートが乾燥していて使い物にならなかったところで☆ひとつ減らしました。,4
130973,今はもう売っているところがないようで購入出来て良かったです。,4
156734,設置してからゴキブリを見なくなりました。もともと夏シーズンに３回くらいしか見ないうえに、設置して１か月なので評価が難しいですが・・。人間の耳にはなにも聞こえず、二匹の猫も変わらず過ごしているのでおそらく猫にも聞こえないようですね。効果がはっきりしないので星マイナス1。来年、虫がでたら星さげます。,4
126736,ホットもやしに比べて、ややマイルド。物足りないですが、子供には満足な様でした。,4
134208,Bluetooth対応のヘッドホンが欲しくて購入しました。音質も文句なんて言えなくなるほど完璧です！,4
135631,VIOワックスの後、2週間くらいつかいました。 徐々にチクチクしてくるものですが、今回は大丈夫でした。 流石です。 ついでに、もう少し使いたかったのですが、使い切ってしまいました。 もっと、安くして頂ければ、ずっと使うのに 高すぎますので星ひとつ減点です。,4
130641,コスパは最高!この値段なら納得。全く問題ない。こういうのでよく見かける辛口コメントしたい人は買わないで。,4
148864,３０数年前ですが、レコードを買ってよく車の中で聞いていました。いい歌が多いので個人的には下手なベストアルバムより好きです。,4
133785,バッテリーの能力、稼働の音、吸引力等申し分ないです。ヘットが若干高くベットの下やソファの下に届きづらい。 延長ホースがあればよりベターの感じがしました。,4
152727,手網でコーヒーを焙煎するのが好きなのですが、焙煎具合を安定させたくなり 比較的手頃なこちらの製品を試してみました。 レビューを読んでいて溶接の品質など不安があったのですが、2018年6月に届いたものは それほど品質が悪くなく、少しずつ改善されているのかもしれません。 これまで10回近く焙煎してきましたが、今のところ不具合は起きていません。 ただ、ドアのレール部分に熱が加わると膨張して扉が動きにくくなり、使い初めに調節する必要がありました。 レール部分をニッパー等で開いて余裕を持たせると、熱が加わっても開きやすくなり、 焙煎途中や直後に扉を開くことができるようになりました（やけど注意、ミトン必須です）。 自己責任で手が掛かる製品なのですが、そうした工夫を凝らすことで使いやすくなりました。 （シャフトの歪みやベアリングの具合は、自分のものは許容範囲内でした） 参考までに焙煎の仕方なのですが、”カセットコンロ25分”で十分いけてます。 水で豆を洗いつつ薄皮をもみ落としてザルに上げ、乾燥を兼ねた弱火で5分回転、 カゴに火があたるくらいで15分回転、はぜてきたら少し強くして25分以内に仕上げという流れでやってます。 途中で休ませるなど工夫の余地もありますが、上記の流れで美味しく飲めるレベルになってくれたので、 買って良かったなと思ってます。 焙煎の匂いこそするものの、煙を出さずに焙煎できる方法として気に入ってます。 （豆の薄皮がかなり落ちるので、火が付いたり部屋を汚さないように注意しています。あと換気も） 好みにあうかはわかりませんが、そういう方法もあるということで…。 手のかかる製品でリスクもありますが、手をかければきちんと機能してくれる感じです。,4
124068,雑な使用で使い古したアセテートのメガネフレームが白く曇り、拭き取れないザラザラした凹凸まである状況でしたが、根気良く磨き続けることである程度艶を戻すことができました。 ただ、本当に長く何時間も磨き続ける必要がありますし、力を入れ難い場所は難しいかもしれません。取り外しによる破損も怖く、レンズを付けたまま作業をしましたがレンズに触れないように気を使うのも疲れました。(今思いましたが、レンズ部にマスキングすれば良かったですね…) 余計な艶出しワックスなどは入っていない方が良いと思いますが用途によると思いますのでどうなんでしょう。,4
141084,品質にすぐれた良い商品です。 ながく使っていますが、いまだに満足できる商品です。,4
150154,木製の安い木を使用しているのか、ささくれが目立ちました。少しグラグラします。 製品は部屋にピッタリとコーディネート出来て、オシャレです。,4
146741,梱包問題なく、快適に使用できてます。必要十分な品です。 多少待ちますが（10日程度）・・・,4
130289,サイズ感はピタピタです。ですので購入を検討の方には大き目サイズをお勧めします。生地は薄くて自分の希望通りでした。 写真を見てわかる通り腰のラインに有名ブランドに似せたロゴが入っていますが、こだわりないので私は気になりません。 500円/枚と考えると満足できる品質だと思います。,4
122710,音質はクリアでした。トランスミッターの音量が最高でもFMラジオの音量をだいぶ上げないと音量が小さいように思いました。,4
137118,何年か前から飲用しています。自分では効き目はわかりませんが、周りからは若く見られます。肌も実年齢よりもシワも乾燥もありません。飲み続けているからかなと思います。 私は毎朝コーヒーに入れて飲んでいます。,4
131209,延期に次ぐ延期で発売前から海賊版が出回るなど もはや幻の商品なのでは？と思ってしまった当アイテム。 想像はしていましたが箱はミドルタワーPCケース以上の体積があります。 全体的に黒くシックで重厚感ある質感なので白いお肌のアイプリが若干安っぽいかな という印象もありましたが飾ってみたら大して気にならなく デコマスと相違無いクオリティと言えます。 まぁアルターですしね… バカでっかい旗が重く、軟質なので長期間飾っているとヘタって来る懸念があります。 旗を支える支柱も付属しますが安定性は皆無であって無いようなものです（笑） カースや壁によりかからせる形で飾るのが無難だと思います。,4
133046,最近カードのスキミングをされ、カード会社のお陰で事なきを得て。電波遮断ポーチを購入しました、以前購入された方のレビューを参考に購入し、「電波遮断」確実でした。ただ腰に、ぶら下げ等では時としてホックが直ぐ外れてしまう事が有ります、もう少し改良の余地があるのではと思います。ただし、私はそのためポーチに入れて使用しています。,4
140006,強度やレバー動きに付いてレビューを見て気にしていましたが、金額にひかれて子供の運動会や式典を高い位置からのビデオ撮影に購入しました。ホームビデオサイズで使用ならば強度・レバーの動きに付いても充分なものです。,4
154861,今のところ快適に使用しています。ビジネスバッグでありながら背中に背負えるのがいいです。,4
156467,コンパクトでしまい場所に困らないこと。かんたんなケースが有ること。,4
131746,サンプル写真の青いとこが光るようだ 音としては結構静かで風量も強め 簡易水冷ファンの交換にもおすすめ ファンによってはファンのブレードがラジエーターに当たって異音がするものもあるがコルセアのH60と合わせて使っているが特にファンが擦れる音はしない サブ機の空冷ファン用にもう1個買うか迷っている,4
152824,近所に販売している所が中々無いので、こちらで見かけて早速購入しました。 ミルでひくと香りがたって料理のアクセントとなって私は気に入っています。 同じシリーズの山椒も使用しておりますが、こちらもその都度ミルでひくので香りが良いです。鰻を食べる時以外にも、麻婆豆腐を食べる時にも使用しております。,4
151058,最近近所で見かけなくなり、こちらで購入。第3ものでは癖が少なく飲みやすいと思います。少量で酔えるお得感は半端ないです。今日見るとクーポン利用で2200円に…フォーナインに流れてるのかな。,4
125166,息子の結婚式の時に姉の子(孫用)に購入しました。 ３ヶ月の時に着用。孫は若干小さめの標準サイズで、少しゆとりがありましたが、出席者に可愛いいねといっていただきました。 値段的にリーズナブルでお買い得だったと思います。 ただ、後で気づいたのですが、白いオーバーパンツ(できればフリル付き)と白い靴下をを同時に購入しておけばよかったと思いました。それほど長さがないので、オムツが見えてしまいます。靴下はうちの孫も嫌がって脱ぐので、不要かもしれません。 頭飾りはうまく着用できませんでしたので、少し値段は上がっても、頭飾りの代わりにオーバーパンツがセットの方がいいかもしれません。 そのため、星一つ減らしました。 よい買い物ができたと思います。ありがとうございました。,4
158509,ザックにピッタリ取り付けができ、色も良いのでこれから使用するのに楽しみにしています。,4
144460,壁や仕切りがあると電波の届く範囲はカタログ性能より6割ぐらい落ちるようです。場所によって画像送信が途切れることが頻繁にあり、アンテナをいろいろ変えたりしましたが改善されず、アマゾンを通してメーカーに相談したところ素早く誠実に対応してくれて中継器を送ってもらいました。それ以来画像も途切れることなく、機械は正常に動いています。屋外に設置していますが、中継器があれば木造住宅内でモニター使用の場合20数メートルぐらいならいけるようです。,4
145873,ピッタリ密着しているので操作に支障なく使えて助かります,4
144074,説明書が翻訳ミスなのか少しわかりにくかったですが、とても便利です。 テレビにつないだ時に、最初全然聞こえなくて使えないかと思いました。 でも、テレビの設定でイヤホンの音量が小さくなっていたと分かりました。 テレビから離れて洗い物をしながらでも快適に音が聞こえて家事がはかどります。,4
156398,最終的にはメテオに落ち着きました。 硬さと大きさを選べていいですね。 それぞれ遮音性が違うと思いますが、良い眠りをするためには、きちんと潰して、きちんと奥まで入れること。 きちんと奥まで入ってないと、すぐに外れるし、音を遮断できません。 付け方は図解されていますが耳を上に引っ張りながらつけるのがコツです。 みなさん、良い眠りを^^,4
124440,小銭入れが、少し小さいというか、量が余り思ってた程入らない。でも、形や色、ファスナーまで写真通りでした。来るまでは少し不安でしたが満足です,4
133434,少しきついですが、パットがスリットが入っているから肘の曲げ伸ばしが、楽でいい商品です。,4
153851,タンクの容量が大きいので補給回数が少なくて楽,4
159911,使用し初めて１ヶ月経ちましたが何の故障もなく問題なく使えています この値段でこのレベルの物が手に入るのなら買って損はないと思います iPhone7で使用、 配送も早くて満足です、 操作もペアリングも簡単ですし、特にこだわりをもたずに使用される分には何も不安点はありません。,4
157830,もの自体は使いやすいと思います。 商品には問題もありませんが、ただ匂いが・・・すっぱいというか・・・なんでしょう だから☆4つ,4
124333,配線不要で取り付けも簡単で気に入ってます。,4
131206,紙パック式で、自走式、価格も最近の高級掃除機に比べると、格安。 普通に使用する分には、これで十分で、ほどほど軽いから取り回しもよいです。,4
136778,厚さ４ミリの竹に長方形の窓を開けるのに使用しましたが問題なく切れました。 述べ１５センチ程度の使用ですので耐久性はわかりませんが良い商品だと思います。,4
129510,写真で見るより薄い茶色だったのと、ブラックも同時に同サイズを購入しましたが、このブラウンの方がやや小さめでした。 でも気になるのはその程度で、履きやすくお手頃価格でおすすめできます。 テクシーリュクスは今回で３回目の買い替えですが、次回買い替えのときもテクシーリュクスにします。,4
148326,すこ離れただけで本当の線香に見えます。ただ、少し触れただけで刺した線香が抜けることがあるので星4にしました。,4
159567,腰痛の原因は寝具では？と思い、こちらを購入。最初違和感がありましたが、暫くすると冬から続いていた腰痛がなくなりました。,4
149100,年の瀬 迅速な対応ありがとうございました 孫の誕生日、喜んでました。,4
124219,ほぼ毎日使用ですがcrocsより柔らかめのせいか中央が薄くなり一部穴が開いてしまった。もっと磨耗に強いPVC材質に変更してほしい。シリコンコーキングではやわらかいので補修用ゴムもうってほしいです。,4
141499,純正バッテリーに比べて若干長持ちしない感はありますが 普段使用にもってこいです。,4
121687,派手すぎずシンプルでつけていて嫌味のない時計。,4
130065,商品説明の通り、真ん中が浅くなっているため、結構入れてもあまり膨らまずにスッキリしている。ただ、ファスナーが少し引っかかるのでそこはマイナスポイントですね。,4
149337,純正品が異常に高く、本品を購入しました。 機能は十分で価格も1/10程度で購入出来ました。,4
126483,3本目、ケース要らずでバツグンの携帯性。,4
156911,十分使えます。 コストを抑えたい方向け。,4
156754,最近TENGAのハード系以外のモノを物色してるのですが、気になったので購入してみました。 数回使用してみたのですが、中のストリングスが面白い刺激です。ホールを90度、180度と変えると擦れたり、引っかかる部分が変わるのでそこがイイですね。 ストリングスをカットすると刺激が変わるよるですが、もう少しこのまま堪能してからにします。 ホール自体は、想像してた程ハードでは無いですね＾＾； ただ、TENGAのハードで20分くらい動かしてるとキツくて痛く感じてきたりしたので、まったり楽しむのに向いているのかもしてれません。,4
124893,トートバッグはA4の書類を入れるには小さいけれど、普段使いするには充分な大きさ。ショルダーバッグはストラップがもう少し短くても良かったかな。トートバッグは私が、ショルダーバッグは娘が使ってます。クラッチバッグは、バッグと言うにはちょっと…なので、銀行通帳入れにしました。クラッチバッグのストラップは外れるのでキーホルダーにしちゃいました。結果フルで使えているのでコスパ的にバッチリですね。,4
140045,05センシュアルブラウン、06ウォームブラウンどちらにするか迷って結局両方を購入です。まず06ですが、オレンジが濃すぎたら…と心配でしたが、実際はごく薄い発色でした。物足りない感はあるものの、派手顔でちょっとアイメイクをするとケバく見えるのが悩みなので、このくらいの発色ならさりげなくオレンジを楽しめます。下の２色もとても好きな発色でした。 05センシュアルブラウンは思っていたより濃い発色でしたが、パールがギラギラしていないのでケバくはならず女性らしい雰囲気で秋冬に特に使えそう。粉の粒子が細かくとても肌馴染みがよいので、この使い心地はクセになりますね(笑)。次はスモーキーブラウン欲しいです。,4
159420,防犯カメラのモニター用に購入。 １０インチでも良かったが、コンパクトなのでこれでオッケー。 特別 不具合はないです。 コスパは良いと思います。,4
130882,本来は自動車用との事ですが、事務机の椅子に使用しています。1.5ヶ月経過して、いよいよ静電気が発生する時期になりました。 効果は顕著で、バチッと感じた事は今のところ皆無です。いい買い物をしたと思います。,4
123540,介護が必要になった愛犬のために購入しました。仕事の都合で日中留守にすることが多いのですが、外から様子をうかがえます。 左右のカメラ移動はスムースに動いてくれます。上下も問題なく動きます。静止画および動画の撮影も簡単に行えますので基本的には文句はないのですが、使いやすさの点で、設定が少しややこしいかもしれません。とはいえトリセツどおりに行えば、まず設定は成功するでしょう。 （突然、認識しなくなり再設定が必要になることがあります。カメラ側の問題なのか、wifiネットワーク側の問題なのかよくわかりませんが... 再設定は再インストールからすることが二回ほどありました）,4
142849,日頃乗馬を学んでいます。少しでも上達できるように参考にさせていただきたいと思いますが、もう少し詳しく書いてあると助かりました。満足はしています。,4
144859,購入後数ヶ月で壊れる可能性を秘めているためなんとも言えないが、物としては素晴らしいとおもいます。 ただ、高い。 スプラトゥーン好きにはこのカラーはたまりませんね(o'罒`o),4
125447,磁石で止め金具がないのを探していて、なおかつ画面が見れるようになっているのでぴったりの商品でした。レビューにストラップがすぐ駄目になったと書いてありましたが、一年以上使っているのに全然大丈夫です。柄も色もかわいいですし、お気に入りです。,4
151925,色も好みだし、耳も疲れない感じだし購入して良かった。まだ録音はしていませんが、きっといい感じではないと楽しくています。,4
137038,リテールクーラーに比べ起動音など常時音が小さくなり満足できた買い物になった。,4
142485,ご飯の味は美味しいです。以外と使いやすいし、手入れも簡単です。外見もカラーも高級感がありお上品でした。価格は少し高い気がします。,4
121056,大きなプレートを別に持っているのですが、出し入れが大変なため、追加で買いました。 片付けが簡単で、使いやすいです。,4
142739,PCで再生している音楽やニュース系動画音声を少し離れた場所でも聞きたい。 新たにBluetooth外部スピーカを購入したくない。 手持ちのアンプ内蔵スピーカを無線化したい。 そんなニーズに答えた商品ですね。 ACアダプタ(DC出力5V)が付属していますが、 個人的には「USB出力式ACアダプタ＋USB給電ケーブル」にしてほしかったです。 音質についてはもともと気にしない人間なので特に評価はしません。 音切れ無く聞こえるので問題なく動作しています。 自前のCDラジカセにUSBポートが1個あったので、後でUSB給電ケーブルを別途購入しました。 DCプラグのサイズですが、外径4.0mm(-)、内径1.7mm(+)です。,4
141290,お値段は安くはないですが 美味しいです。,4
136465,サイズは小さめですが、それでも砂の飛び散りが大分減ったと思います。 肉球型の方は特に小さいので、半円型の方を使用しています。 商品に問題は無かったですが、プチプチや袋には入っておらず、商品を丸めてそのまま封筒に入れただけの状態で送られてきました。 また、既に届いている商品ですが、注文履歴上の配送ステータスが赤文字でずっと「11月5日までにお届け予定」のままとなっていて紛らわしいです。 Amazonに問い合わせたところ、出品者が伝票番号の入力をしなかったことが原因のようで、変更は不可能とのことです。 出品者【ベストで言えばー】さんから購入しましたが、もうこの出品者からは購入したくないです。 数日前に出品者への評価を投稿しましたが削除されてしまいました。,4
124645,マヨネーズの値段としては少々割高だが、アマニ油の効能と期待値をこめて購入。味わいに違和感もなくクセは感じなかったので、健康に気を使うならアリだと思う。,4
138696,kindleは画面が樹脂のような素材で、傷がつきやすいので念の為購入しました。 kindle独特のザラザラとした紙のような手触りが気に入っていたのですが、それがツルツルとしたipadのような感覚に変わるが残念。 位置合わせして真ん中から貼るというマニュアル通りの貼り方は難しそうな印象でしたが、やってみたら難なく貼れました。,4
125731,デジタル温湿度計は、文字盤が大きく、見やすくて、時間も入っていて、とても便利です。毎朝、室内の温度、湿度を確認しております。その上、目覚ましもあり、大変助かります。,4
150366,サイズ、履いた感覚は申し分ありません。 ひとつだけ不満があるとしたら革の匂いがキツいこと。,4
