123183,设计很好，做工粗犷，缝隙感人，材质容易沾灰和留下划痕。,4
120664,包是正品，乐摄宝的质量还是有保障的，一分价一分货吧，这个价值了,4
126205,"穿上去大了点，不过穿上袜子应该合适了,色差比较大",4
130219,好用，关键是容量够大，电池用得久。。。。 耳机是垃圾，换成森海塞尔的耳机效果不赖。。,4
128477,内容里面许多古发音不会啊，应该现代拼音标注一下哒,4
156083,我还是那句话，要买正版书到文轩，我是再也不会在亚马逊买书了。,4
132869,说好的快递上门呢，以后能不能不用这个快递，专门挑别人午休的时间送，送的地方，我得过桥，她还只等15分钟。,4
151791,视角独特的，有启发性，希望研究庄子的人以后有更多的视角,4
137042,东西还不错，赞一个东西还不错，赞一个东西还不错，赞一个,4
153970,故事很吸引人，画风简单明了。那女主角吧，还算比较有辨识度，男主稍逊。总体好评。挺好看的。,4
141650,原来温控牛奶壶就是打奶泡的容器啊，还以为是保存牛奶的降温冷藏壶，怪不得图片上当时看的时候没有电线插头,4
148994,袖子长了一点，衣长短了一点点，其他到还好，中规中矩的毛衣，到手价约不到100，随便穿穿，颜色确实青色，可以接受,4
157581,有红豆和芸小豆，从材质上来说比其他豆沙口感好 但和自己煮的豆比起来齁甜，差距非常大 有条件还是自己煮 没条件豆沙类推荐厨大妈的 如果我的评论对您有用，请点个赞吧~,4
143336,书皮有些软，不过东西包装不错，很齐全，值得购买哦！！,4
157061,"这本书图像清晰，讲解、病变概括详细,很不错…",4
129469,不错，每个部分随后都有真题讲解，就是地图有些不详细,4
159929,还没看，书香味有，至于是否盗版，还不清楚。,4
136814,以前从不去评价，不知道浪费了多少积分，现在知道积分可以换钱，就要好好评价了，后来我就把这段话复制走了，既能赚积分，还省事，走到哪复制到哪，最重要的是，不用认真的评论了，不用想还差多少字，直接发出就可以了，推荐给大家！！,4
149582,价格便宜，虽然比海淘稍贵，但是海淘不好掌握尺寸。,4
140738,平时穿mexico66的42码，这款也合适。如果脚偏胖，脚趾头大的最好买大一点，因为这款有鞋垫了，减震要厚实一些了。吐槽的只是亚马逊四川内的合作物流，为啥不合作些大的公司呢，这方面体验很不好。,4
128384,其它都不错，就是内容还没仔细看，看完再来评论。,4
141180,没注意码数，不过没关系，等宝宝大些再用。喜欢好奇的产品，但是才刚买就发现本地超市卖得比网站还便宜，郁闷～,4
146619,整体感觉不错，就是收到书后发现书背侧的一角因为包装或运输过程出现折痕，大概有几十页。稍有遗憾。,4
134848,要是防水就完美了。买了两个颜色，一个蓝色一个绿色，一个180一个185，到手后竟然一个大小。做工不错，但是不是很防水，毛毛雨没问题。三四十元的价格算是很划算了。,4
139867,给妈买的，号码合适但不适合宽脚，宽脚需要买大一码。鞋底比较舒服，现在穿有些热。,4
127181,鞋子还不错，帮老爸买的价格实惠，一双休闲一双正装，不知道他喜不喜欢，亚马逊要比实体店便宜，,4
156092,国内没有这一款，穿着好看亚马逊的价格给力。,4
141855,穿起来舒服，卖家发货慢，可能是因为我要的颜色没有了，态度很好，165/45kg，34b现在，小号刚好,4
122375,书上的日元标价折合成RMB只要90块，售价188。。。。,4
133883,滋润是滋润，可对我来说油有点浮着，不吸收～不喜欢这种感觉,4
127594,质量保证，高效送货上门，免费安装服务好，很好购物体验,4
126621,满意啊。因为喜欢作者，英伦才子所以看他的作品。,4
144505,卷发不伤发，灯不亮的但不太影响使用。懒得退,4
125721,36码的鞋买的4m us big kid 正合适，右脚内侧穿进去时稍有不舒服，鞋子内皮有点蹭到脚皮肤很疼，穿进去之后大小正好。,4
122609,主要是举例子，理论性的东西不多，逻辑性也一般，不过内容还是挺有用，说起来自信心主要还是一个思维方式或者说心态的问题，社交技能看完没什么印象，哈哈有点心灵鸡汤的意思，易读，也易忘,4
134098,东西呢应该是还好的，就是这玩意价格上下跳水太严重，去年双11买的2900不到一点，现在最低2200，差700.无良商家。,4
149259,家里本来有个18cm的了，想买个大点的，结果2.2夸脱的页面上标的尺寸22cm是错的，实际只有20cm，害得我要重新买～～,4
149662,看到那么多真空包装漏气的评论，我还有一点担心……但是拿到手上是完好的。 不足的是：生产日期为14年6月，实在算不上新鲜吧，虽然我一个月内肯定就喝完了。 以上属于对亚马逊的评价。 但就咖啡而言，比不上illy。这一款闻上去有种甜甜的气味，冲出来口感和香气都比illy重烘焙的要单薄很多。 毕竟，一分钱一分货……！,4
136793,首先质量不错，手感很好，图案也好看，也比较灵敏，不过没想到是这种全包的，充电提示灯都包住了，每次充电还有掰开一点才看到，还有翻盖的边边是比较软的,4
122380,买这本书，主要是看了里面有些想法和我的一样，然后买了给男朋友看哈哈,4
153337,"一本小孩子也能读懂的美国历史书,语言轻快活泼,不像大多数历史书的乏味,和我一样对美国缺乏常识的和对大国崛起感兴趣的值得一读。 顺便 觉得有些太过简明的地方其实可以随时手机查做延伸 很有趣",4
152373,初时看时觉得不好，甚至有点乱，摸不着头绪，耐着性子看到中段发现开始有点入味，但也只能说犹如鸡肋，再到后段才真正觉得妙。要说情节概况就是错过了轰轰烈烈的前男友，等来了细水长流的现男友。看过大多文越是到后面，越是无味，反而这文越往后越味道。个人比较欣赏喜欢余墨的性格。还是不错的，值得一看。,4
145745,煎蛋煎鱼煎牛排都试了，煎鱼最粘，其次鸡蛋，牛排油多反而不怎么粘。加热水比较好洗，怕不粘锅涂层掉了不健康，这个结实好打理。做意大利面也没问题。,4
131246,这本书字数不多，大概8万字吧，一两个晚上就读完了。此书介绍了一些很重要的基本概念并有例子来说明，不枯燥，不故作高深，值得初入职场者一读。PS，后记写得很有水平。,4
147295,扎实的一盒，味道依旧， 到货后看了下日期，2016.7.11过期，尼玛 这也太近了，一直放冰箱，现在都还没吃完。,4
154390,这种风格真是不太习惯，只看了三分之一就放到书架上了，等没书看的时候再拿出来看看吧。,4
129838,前面励志部分看的明白，后面深情部分看的柔情，暗藏里面的意义只有读过才知道,4
152040,好大。。。。。。没看到是双人伞，不过质量蛮好~,4
139171,很清爽的防晒，拿来放单位涂胳膊了，涂多了或者蹭到胳膊就会有白色的渣，感觉不太持久。包装很好。,4
123624,好，以前从不去评价，不知道浪费了多少积分，现在知道积分可以换钱，就要好好评价了，后来我就把这段话复制走了，既能赚积分，还省事，走到哪复制到哪，最重要的是，不用认真的评论了，不用想还差多少字，直接发出就可以了，推荐给大家！,4
136423,程序员必须经典。知道自己应该被怎样的正确对待也好啊。,4
137577,快递来电话叫去拿的时候，目测了一下，被子不是特别大。然后拿到手上，感觉有那么沉，6、7斤应该是有的，也不知道是刚拿到的时候有塑料袋装着，还是天不够冷，摸上去感觉很暖和。看到很多评论说吊牌上写的是电商专用，我仔细看了看我的，不是。798元，用了60元Z券，738元到手，是否划算，各位自己衡量。,4
158064,买到的时候书有褶了 因为包装就是装在塑料袋 一开始读书的内容总感觉有些断裂。。。 最后我才知道，这本书已经有删改了 于是迅速拿下古典时代疯狂史,4
151435,东西正宗，好用，就是贵了，京东商城140，王氏125。,4
159437,明明是中国制造，为毛还要搞个全英文界面，，，，，不方便,4
121005,意大利产，低腰，到手后洗了一次，颜色质量都不错，就是长了点。亚马逊的价格两天一变，800多拍的，过两天就只要700多！,4
149098,内容一般，偏处方，未把诊断、治疗相结合。,4
137883,作者总结的6个原则实用性很强，非常推荐。,4
127290,书挺好，是正版，快递速度也特别快，一天就到了！特别赞！,4
129034,很厚的一本书，粗略的翻了一下内容很全，印刷的质量也不错，具体的作用还是要等整本书读完以后才知道呀。,4
141599,看书虽说看个内容，不过这印刷包装真的有点不好。,4
129081,长知识了，对人体阴阳健康理论有进一步了解。,4
135404,黑色，而且是比较亮的黑丝绸。搭配白衬衣、黑色西装的话，不会有低沉的感觉。加上价格确实便宜，性价比相当不错。,4
145174,和我前面买的不一样，我是在韩国免税店买的，不知道是不是正品,4
151865,电台一个都收不到，其他的还好。就是不知道是否耐用。,4
126928,本书是之前就看过，喜欢才买的，书的内容很好，但是买的时候没有看版本，感觉这本封面设计一般，纸张质量也一般，感觉有点薄，没有在店里买的好。,4
133690,教人学习方法的。在同学那看到的，果断来买了。如果能真正实践书中的学习方法，成绩应该是可以提高的。,4
135990,本书以文言文为主，对古文不了解的看着有点费劲。对一些生僻字有注音。,4
138059,装订方式实在是第一次见，太奇葩了，甚至担心还没看完，就要散架了。,4
130762,内容看着有点累，质量挺好的，，，快递也很快,4
130852,已看完。我承认叙事有点啰嗦，但是是不错的书。,4
136552,淡淡的香味还比较喜欢，洗完也有变白，只是并没有太惊艳的效果，能保持3天左右，耳朵就会再度开始变黄。直接用原液洗的，因为说明上没有标注稀释比例。论性价比，还是PP人参胜出,4
151940,看评论说很轻，买来送老人的。实物有点小，分量也不轻。凑合用。,4
153334,乳胶枕，质量不错，软硬度合适，不是很软，舒服，比原来的枕头低，要适应下,4
137978,中年男人成长记。。。 和菜头写作就像是把文字变成了菜肴，道道口味不同。这博客集子印出来应该是“心愿”一样。我买了它也类似。,4
124045,性价比不错，就是表镜、表带能用更好一点的材料那就完美了！,4
130047,质量不错，应该是真品，但是颜色发错了，退货很麻烦好忧伤~,4
157930,值得一看的经典！这个版本插图也算是很有特色啊，从“吃”切入的生活与历史,4
142227,刚收到货，拿在手里分量很大啊，男的倒无所谓了，女的就有点汉子气概了，质量暂时还不好说，中国产的。,4
142429,这些是为了考试买了这个书，感觉质量还是不错的，快递也刚杠杠的，第二天就到手了,4
159303,挺不错的，学校操场上开音乐会，在教室里戴着它基本没啥特殊感觉,4
134515,用在浴室里，目前表现还不错，防滑不积垢。期待后续表现,4
121242,这套书非常厚，但总感觉不如另外那本教程来的那么实际，对于初学者也是不那么友好的，推荐有一定基础之后再来研究这本书。可以把这本书当作工具书来参考。,4
134773,整体内容的安排和编程训练的难度是挺合适的，而且是循序渐进，通过逐步的训练来培养编程的思维。不过书中的代码有时候会存在一些问题，尤其是在参数的设置和变量的名称上面。这些问题经常导致录入一大串代码之后，程序发生错误，还得一行一行的去看代码到底有什么问题。对于初学者来说，由于编程的思维训练不足，出现这种问题在短时间内很难找到正确的解决方式。希望再版的时候能够对这些细节把关更严格一些。,4
142853,还木有用过 看起来还行 快递很给力...,4
128013,总体来说这本书是自己喜欢的，其它的不做评价，感兴趣的朋友可以看看试读版再做决定。体会还有感受每个人是不同的，也不便讲太多,4
133456,3岁左右买的，当时孩子不是很懂，4岁后经常自己一个人拿着这本书走迷宫,4
143889,书本质量还是不错的就是包装太简单的了，书本都漏出来了，希望Amazon 在包装上改善改善。多向京东学习学习！,4
136300,特意用了一段时间才来，不错，就是有一点掉色,4
131429,鞋子还是不错的，可能不耐脏，但挺好看的，建议脚瘦的订小一码，我就是吃亏了，第一次买的太长了穿不了。脚宽的没有关系。质量方面待穿着中验证,4
155093,鞋子质量很好，大小合适，穿着舒服，款式很好，好评,4
130687,做工不错 脚感舒服 不过感觉鞋子偏大一点点 平时穿运动鞋36 穿这个3.5 还是大了一点点,4
142775,保质期让我无语...到明年七月...买给猫吃的 一天才吃半粒 根本就妥妥的过期一大堆 不太愉快的一次购物 希望能把保质期标注 这个东西以后不敢在亚马逊买了,4
155623,还不错，快递很快，但是快递质量没有保障，书籍有点磨损，希望店家可以多加点封套保护。,4
142275,写作分数提高了20分，还是蛮有用的。好好练习的话肯定能提高分数,4
143058,内容很好，就是书的质量太差。今天刚到刚打开看，前几页就掉了,4
134209,第三次买了，因为还是在4S保养要三个月一换，放出来的油还很靓，有点舍不得呀，这油静音效果真的挺好的，静音好，对发动机保护就好。,4
144069,陈坤的确很有才华，喜欢最后一个故事，是本不错的书，插画作者也挺厉害的，能画出陈坤脑海中这么光怪陆离的思想,4
136262,何为自由，不是一家之言，而是百花齐放才是自由！,4
138955,商品可以但中通快递不行！货送到小区大门口让自己下去拿。这也不是送货到家呀！建议厂家换一家快递！！！,4
132671,做工很好，很大。颜色没有图片上的那么亮那么美，不过这个价钱还是很值得买的，收到货有轻微划痕。但毕竟海外购，还是不错了。,4
143768,还行~不过貌似比我三年前买的另外一个飞利浦耳机线要细一点，用了一个多月后有杂音，,4
151651,入口的东西我比较信赖欧美或者日本的产品，用着放心,4
159146,就是一本教科书，想学习税的朋友可以看一看,4
121688,不好用，时间长了手疼。谨慎购买surface。多一星给亚马逊的价格,4
155060,给夫人买的，128入手，标注型号和页面型号不对，取消了订单重新下单，以为买对了，结果发货回来还是不对，晕死了！感觉差距不大，也就算了，日本原产的也没吹得那么神，自发热也就是个卖点吧,4
143757,【内容】这本书从四个方面入手：基础护肤常识、三种皮肤类型（干性皮肤+油性皮肤+敏感性皮肤）、医疗美容、身体其他部位护理（比如脱发问题）。对于入门来说是一个很好的选择，浅显易懂，也解释了常见的迷思。其中有关自制护肤品的内容实在欠妥，但内容极少。 【质量】印刷清晰，字体大小适中，质量很好。,4
154248,我拿到的时候进行了清洗，很明显是用过了，也不再追究，退货后再发的商品能不能清洗干净再发，抱怨。,4
120045,这本书不错，内容比较新，对微博微信的使用有比较好的使用价值。值得一读。,4
142308,料子是不错的，但都是这个牌子，上衣是偏大的，本来以为这个裤子也会大些，可到手一看，根本一点都不大，小腿还有些瘦，说实话，没有图片漂亮，不过整体还可以，穿着很舒服，随便穿一下还是可以的！,4
141837,买了一个多月了，洗了几次衣服有点起球不知道是什么原因衣服穿在身上老是感觉扎的慌。是面料的问题吗,4
129001,味道还行，也不知道乳香味是什么味，但是不难闻。过于柔软了，有点怀疑对颈椎起到效果，拭目以待,4
130772,不为攻略，只为人文情怀。看了这本书还真想去台湾看看,4
130275,切合主题实价格实惠 附赠卡还没用不知道怎么样,4
126914,很好用，不过说好的222片，但是只要一百多片。,4
153164,较精致，就是拍之前没看清，这款手机壳是2种颜色，其中金色的线条较为张扬，个人不是太喜欢。,4
153786,适合科普用 里面的细节经得了推敲 虽然都是浅知识但很吸引人,4
121644,正品，质量很好，可是还是喜欢答案在后面的,4
131330,"电煮锅嘛。。也没什么特别好说的。。用了几次感觉没什么问题，就是金属的锅体煮过东西之后容易留下stain,另外因为没有不沾涂层如果煮牛奶或者什么会粘锅的东西洗起来是比较麻烦的。",4
149798,东西到达准时；内容实用，是我想要的物品！,4
143498,前面珍珠和花片是缝上去的，还挺精致的，面料很软，是长款的，就是没有小号，买大了，就肥了！另外胳膊圆的人慎入，这种袖子显胖的。,4
155140,东西很好，可是包装太简陋，薄膜印刷贴合布袋的东西，没有硬壳包装只有一个塑料袋。货运过程中，薄膜活生生就被折了许多不可回復的伤痕，完美者慎之。,4
135435,孟非的文字是不错的，只是内容是当时的时事,4
150319,身高172厘米体重62公斤L号，穿着稍微大一点,4
122869,立志于国外各种考试、需要积累词汇的学生可以看看，里面的方法还是挺有效的。 里面没有单词表，而一本是告诉你如何规划背单词的书。 非英语专业的同学可以多看看，照着做会有收获的。,4
158040,书名是乾隆时代，但更多的是讲了乾隆前半生的事情，都较为简短，晚年的内容较少。更多的是讲述了乾隆时代的社会背景与天朝的整体情况而不是乾隆的个人传记。,4
156105,书的中后部分有没裁剪开的部分，不过比较好自己撕开,4
121485,看评论都说翻译的很差，但我还是买了，然后我知道了，真的翻译出了一坨翔。。。虽然有很多错误，加上翻译有种用软件翻译的感觉，但是耐心读下来，内容还是不错的，比国内一些上来先教你配置集群的书好多了，推荐像我这样英语不太好，读原版压力略大的新手购买，作为入门书不错。,4
141350,有一个挂杆不合格安不上，所以就不是很完美，因为这点瑕疵真也不忍心退货，希望卖家不要再出现这样的失误！,4
149802,发货速度挺快的，我是用了几天来评价的，觉得很好用，适合我的肌肤,4
123185,335的价格比较有竞争力，希望可以提供更加优惠的价格。 无法提供安装非常让人失望。,4
121459,除了印刷有点不太好，纸张太薄，字体太小，其他都好,4
120363,质量很好，只是像我月跑100公里，配速5分的用户而言，用处其实没那么大，而且确实太硬了。可能用泡沫轴更合适吧,4
155208,书内容不错，就是配送包装不好，一次买的五本书都折了,4
158159,书还可以，不过背后书单里一水儿皇帝里就一个大臣……然后康熙帝大帝？出版社犯这个错可不应该,4
133950,适合瘦脚，我中等的脚，觉得鞋稍偏窄一点点。国内36码，这个买36码感觉小了挤了，穿了几分钟，有人需要就便宜转啦，有人需要可以联系我便宜转给你,4
141157,7个原则总结的不做。 尤其喜欢对确定性和不确定性的区分。 有些章节和例子与原则衔接的并非很近。 但是瑕不掩瑜， 总体还是很喜欢这本书， 受益匪浅。,4
159292,充满活力的清香味，很适合年轻男士！大碗儿便宜，用起来方便实惠。,4
132794,昨天拿到书时睡觉时给宝宝念的，她很喜欢里面亲亲的动作和画面呵呵,4
147190,很漂亮，底是有点硬。不过新鞋还是能接受的。,4
121101,厚款薄款都买过，还是厚款结实，薄款太软，一捏就变形，跟一次性打包盒厚度差不多。,4
152676,"沉甸甸的感觉,很厚重，适合男生使用，适合长途旅行。",4
121123,之前比专柜稍便宜点点，现在已无价格优势。,4
122507,底部的胶水用久了之后外壳就脱落下来了。还要让自己再重新用胶水粘起来。,4
147616,买来玩王者荣耀的结果控制人物方向有点飘 很不好控制，音效也不怎么样，一开应用耳机里就响声，性能方面还是不错的~,4
120624,现代风格，适合每一间卧室，质量很好，点个赞。,4
154448,与其说是一本书，不如说是一篇论文，全篇一百多页，后面很多参考文献，正文只有90多页，即使看得很头疼，强忍着看一天也能搞定的，个人觉得写得很好，论证的观点也比较赞同，最重要的是本书分析问题的方式方法，非常值得借鉴。,4
148692,没有保修卡不过之前已经说明“亚马逊保修”，其他还行，但是感觉还不爽……待续……,4
134338,性价比很高，反应很快，拍照比荣耀4X清晰,4
139338,书与照片有色差，人物表装订相对于整本书有略微歪了,4
123402,东西满意，送货的快递不好，开车拿棒棒机，自己的刷卡机用不起，还让我去借现金.自己不懂我支付宝付款，你垫付嘛，严重坑,4
146196,买这套书的读者比较少，看不到更多的评论，所以我只选了其中的四本。每册都附赠智慧游戏本和亲子手册，性价比还可以吧，就是没有宣传的那么好，和普通科学书籍相比，优势不明显。,4
156876,应该是正品，水比较稠，冬天用刚好，也不会太粘,4
125203,非常透气非常透气非常透气！ 鞋底稍微有点硬，有时候走很硬的路面会有感觉。,4
143859,排版与笔误不少，对初学者来说还是会有帮助,4
127080,好像颜色有些许变了，但线条什么的没什么问题,4
148337,几个月前买的，一直没怎么用，这一周开始去健身房跑步才正式使用，充电次数不超过5次，已经没有任何反应了，用usb线连接电脑指示灯也没有亮。这样的质量不知道说什么好，有保修没有？？？而且没有单曲循环，空有8G的容量了。。。 PS. 看了客服给别的顾客的回复，戳了一下耳机上的小孔又复活了。。。希望没有问题了，还是很喜欢这个耳机的~~故特意回来修改评分。,4
122272,书的印刷很清晰，如果纸质再好些就更好了。,4
130007,物流简直了，快递小哥也是醉了，亚马逊客服访问今天给打了两个电话，这是知道服务不周的意思嘛哈哈哈哈哈。,4
148836,买了多半都是放 在那里没人用。声音很大。,4
124023,今天试穿的皮鞋，右脚有点磨脚。总体感觉没有爱步的舒服，只是价钱比较低。如果过几天不磨脚还是比较实惠。,4
131908,1.使用所需， 2.内容方面还需要更多地注意对一些专用名词的解释,4
139484,上选修课用的教材，质量方面挺好的，和好几位同学一起买了。只不过觉得意识流小说看原著可能更好一点。,4
156947,无论书中观点是对或错，许多大家都拜读过此书,4
141652,试过了，防雾的，这个价格非常划算，物美价廉,4
152612,书写很流畅，笔头收缩很灵活卡位清晰。唯一有点不适应就是原装笔芯容易折断，可能0.7mm笔芯就会好一些。建议买粗一些作为日常书写。,4
151790,小红的书还是那么充满烟火气，回到家的感觉,4
124789,正品是正品，可包装太含糊了，放在盒子里晃来晃去导致面霜洒出来一些，希望以后改进,4
155499,大小到时差不多，就是不知道怎么保养一下。看到网上都说就是穿，总体还不错。但是有些薄，不太适合北方的冬季。,4
122582,为新家囤货，赶上搞活动799买的很划算。质量没的说，赠品也超棒。双立人16cm的炖锅做1、2人份早餐很实用。把温度调到最高档烧了一壶水与家中2000W的电磁炉用时差不多。余温保持很久至少30分钟以上余温指示灯才熄灭。,4
152632,买的时候没看清楚。吃到嘴巴才发现是辣的。拌饭吃比不上拌面吃。虽说辣，但程度很低，味道也很香~~很符合它的名字！香辣！,4
148995,身高180cm，体重75kg，L码长度刚好，但宽度偏大，上下衣都没有紧身效果，保暖性很差，该产品有些滑（类似丝袜）穿起来很舒服。建议购买小一码的，紧身保暖性效果较好。kao……内衣怎么退货？？？,4
152319,去年9月份亲眼看到过原作，照片充满了可以触摸的温情，喜欢。原作买不起，而画册当时恰好卖光了。一直等到现在才买到。感觉画册印刷质量差的不是一点点。,4
