180481,颜色蛮好看的，做工也很好，这个价钱，算是超值了！,5
160748,挺不错的，一直信赖亚马逊，包质量很好，不过买给4岁的小朋友有点小，应该给更小的孩子用。,5
169394,AK系列和GB系列剪裁不一样，布料还是一样的有弹性，AK更加修身，172cm69kg 修身显身材,5
199658,很棒的真题，每套试卷都是分册装订的，很方便使用。15套真题+5套新题型，做起题来都很顺，新题型都是比较少见新颖的题。还有2000词汇周计划。在练真题的同时记单词。整体都很好的一套题，值得推荐给大家用。,5
191343,这个书就好在上下班路上，随手翻。看到哪里都无所谓,5
162265,东西没问题全新未拆封梦幻也领了，而且到货速度也比我想象中的要快，比淘宝奸商不知道好多少倍了,5
167293,学英语提高层次必备，有一定英语基础的适用,5
171172,很喜欢，使用过一段时间才来评论的，产品真的很不错，做工精致，按摩力度很舒适，还有加热功能，发货速度也快，很满意，送礼是个很好的东西。,5
170538,很漂亮、很喜欢、色泽很好、做工很精致、很喜欢。,5
171346,犹豫了很久终于下手，味道真的很好喝。一袋的量很大，可以冲一大杯。,5
196593,让人看的着魔的书，不管是情节描述，事情发生的节奏，心理活动描述等都很牵引人,5
163933,很好的一次购物体验，第二天就到货了速度很快。,5
161786,虽然还是没拿到想要的小卡，但是特别收录什么的，真的很不错~期待后续~☆,5
178838,穿在身上挺合适的，衣服料子很舒服，没有色差，质量很好，非常修身,5
180221,非常好的一本书，对我的帮助很大。当然，背景是外企会比较适合看。那些说书的内容不太好的人，我觉得他们是没用心看或是没看懂。,5
195331,鞋子尺码正常，不必买大一码，如有需要，大半码合适。 穿着轻盈，日常走路，慢跑都够用。 外观漂亮，实物比照片更靓。总之，满意！,5
174698,用温柔拥抱你与生俱来的孤独，用陪伴帮你抵御一切生活的侵袭。当我不能代替你去痛，我唯一能做的，就是陪在你身边。一本充满爱与正能量的小说！,5
194368,和《丑的历史》一起买的，必须要一起买嘛。全彩。挺好,5
189276,真正实盘操作者写的好书，完全不同于评论家的书。书的印刷质量很好，送货也很快，价格还便宜，很满意。,5
190637,亚马逊在倾销快过期的产品吧，都是些日期很早的，建议超市去买。,5
175146,孩子很喜欢，我个人感觉质量真心的好，赞一个。,5
178218,内容比较接地气 但有重复的地方 整体不错 推荐,5
178736,易先生的中华史，总是抓住那个核心的点然后打开，引人入胜，我个人这种非历史学专业的人读起来总是津津有味~,5
171197,真是速度，一起到的还，书的质量很好，包装一般吧,5
165940,一口气看完了！觉得剧情的推进方法刚开始很有趣吸引人看，但越看越没味儿，因为后来剧情大致都能猜到了。。不过还是蛮好看的，好评。,5
185624,到2020年10月到期。不到300比京东便宜。相信亚马逊自营的东西。用后一点不油腻。,5
193502,宝贝特别棒 精致 爱不释手 强烈推荐购买,5
197782,为了上班穿的白衬衣买的，送货比较及时 ，包装不错，连插头脚上都有带套，浅蓝色看来比图片还漂亮，棒棒哒~送的量杯装一杯水，选棉质和小蒸汽档位，我熨了三件衬衣还没有用完水，没有发现漏水情况。因为着急用，就在玻璃桌面直接熨的，下次再配个熨衣板吧。总之，为厂家和亚马逊点个赞~,5
179450,"外观看起来很漂亮，也很好用,就是快递太慢了",5
198932,不错，送货准确，及时。书的质量应该不错送人的。,5
177652,硬皮，包装很好，印刷清晰，每一本都像字典，最后一本罗列了美国的一些法条,5
162863,临时抱佛脚，去日本前买的三本书之一。印刷很好，正因为追求品质，所以书有些重，但我还是带在身边了。内容偏重体验。,5
190483,真心非常好！收到以后外观很美.比微波炉的口感要好很多，热的饭不发干也不会在碗底积很多水，确实能最大限度的保持饭的原味，而且加热的速度也很快，赞一个。,5
195103,这几天通过阅读《路遥传》又再次回到了路遥的世界中，阅读的过程中数次落泪，为路遥那既坚强又善良、脆弱的心。记得大学时代读过了路遥出版的所有文集，给予了青年时代的我丰富和美好的精神滋养，成为我最喜爱的当代作家。也感谢作者厚夫，使得读者对路遥有了更为全面的了解，也更深爱这位伟大的中国当代作家，也更为路遥的精神所影响和激励！,5
177792,高压萃取咖啡机，做出的咖啡与滴漏式咖啡机果然不同，香浓美味。,5
173553,稍微有点大，鞋子看起来还不错，就是有点重，适应几天就好了，物流还可以。,5
195627,给侄子买的，他看了非常喜欢，图文并茂，对于少儿的智力开发大有帮助，就是价格小贵,5
170459,是正品，物流超级快这次，真的，第二天就到了，很赞,5
160426,相当满意，发货快，质量好，能够激发孩子的创造力！,5
193174,100%好书，叙述详实，信息丰富，没有任何问题,5
196611,包装非常不满意！直接摔碎一个角，亚马逊现在穷的一个纸盒和抗震气泡袋都没了！,5
176372,而且有中文，虽然中文翻译略显生硬，但总体而言值得购买。,5
169183,书上的云南很美可现实的就很难讲了，去了一趟体验，很糟糕。,5
173179,很好，以前从不去评价，不知道浪费了多少积分，现在知道积分可以换钱，就要好好评价了，后来我就把这段话复制走了，既能赚积分，还省事，走到哪复制到哪，最重要的是，不用认真的评论了，不用想还差多少字，直接发出就可以了，推荐给大家！！,5
189298,挺全的之前很多项目都在这本书上完整体现，虽然不是建筑专业出身做当代的，不过也值得入。,5
188959,z实惠真心好啊！ 快递有些啊给力！手机到手，基本没有划痕！ 手机非常好用,5
175901,品相真的 非常非常好！偏大0.5到1码，本来还担心这个便宜几百的价格会买到瑕疵品，没想到打开包装以后真的非常完美，鞋面和衔接的地方都检查了一遍，很棒。 I luv amazon~thank you,5
198158,恒殊从初中开始喜欢她 和之前完全不同的故事 但是每本都是吸血鬼 尽管她本人是信仰无神论的。。书里面有大量的欧洲文化 巧合的结合 忠粉必备啦,5
188555,已经看完了，很好，黄永年老师的语言很平实，册子不厚，但内容丰富。,5
175128,刚刚仔细扫视了一遍，后面果然有原文。。至于翻译怎么样我不知道，没兴趣看！原著六万字，书本居然多出了这么多。想钱想疯了！！,5
196583,版型比较修身，177cm 80kg L码大小正好。,5
182459,质量非常好，大气漂亮，穿着舒服。非常喜欢,5
160565,婴儿游泳圈，不错，是自己喜欢的。送货速度也快,5
177620,衣服收到了，款式大方，面料柔软，穿着很显气质也很舒服，很满意的，而且价格还很实惠,5
175230,和kindle一起寄回来的 我同学有一个秘密日记？【是那个吧】这个颜色比较耐脏 而且图案也很………奇怪的吧 反正我喜欢,5
193771,酒质很平衡，品质不算高，但价格确实很低，绝对值这个价钱,5
193919,没有比较过其他牌子的，但是看豆人的质感很棒！但是不够防滑，像一本书摊开来看老怕掉，卷起来就好了！ 另外这个牌子封面选择太少了。,5
191813,第一次大批量的在亚马逊购买书籍，拿到货后，迫不及待的看了一下，感觉还不错，图书质量有保障，和网页上的基本一致。赞！,5
162915,文筆流暢，爆笑，節奏明快， 情節清晰。作為一個讀者能找到一個值得追蹤的作者是一件值得高興事。誠意推介,5
181231,买给4岁小侄女的，小丫头非常喜欢，尤其是里面会变颜色的小灯。,5
195497,1个星期货已收到，看到实物后第一印象质量好，明天早上实际用一下煎蛋，应该没问题。小巧玲珑推荐购买。,5
188972,精密的历史，要看这样的战史，虽然略显枯燥。,5
180576,超级满意的说 很好穿啊！！！底是软的软的！！！很有型 又酷 黑五到手400块 一共用了八天半的时间 国内转的顺丰 划算哭了,5
195393,商品实物还没见到，不知道质量如何，因为我外地出差。老婆收到还是比较喜欢，刻字这点我非常喜欢。,5
176631,闺女超级喜欢的书，尤其喜欢后面的问号，百读不厌的,5
183936,这本书比想象中的要厚好多。里面都是小故事，全是古文原文，但中学水平完全能读懂。十分有趣。,5
161530,脚感爆炸，踩屎感果然名不虚传，鞋底虽然硬，但是真正跑起来就感觉不到了，只能感觉到踩屎感，鞋底硬只是加强了支撑性，支撑缓震两不误，非常舒服，值得购买。六八五入手！,5
193987,古早的课本，图文并茂，繁体和简体都能学习，成人读来也觉得很有趣。,5
179647,音质确实很赞！而且还能在普通的CD机里放，真是太赞了！,5
181459,以往的官场小说或商战小说，总有奇迹发生。唯有这本书没有奇迹，只有坎坷的经历，虽然也有柳暗花明之时，但跟随主人公战战兢兢地拼搏在商海中，其真实感，其生活气息，扑面而来。尤其是做建筑的老公看过来，说上部跟他老板经历非常相似。看来作者写得很用心，并未闭门造车。,5
184718,效果真的特别赞，拉肚子的时候吃了两粒，真的就好了，一点儿不夸张，以后就在这里买了，,5
171469,不错的商品！！！！！！！！！！！！！！！,5
178095,鞋子收到了，鞋子非常漂亮穿起来也舒服，祝老板生意兴隆！,5
181921,不错，但是没有想象中的那么厚，每本都挺薄的,5
186617,很不错，质量很好，很漂亮，再也没有蚊子的骚扰，可以洗的存储也方便。,5
172181,是真正的充电电池，正品，放心购买，谢谢亚马逊介绍的好产品。,5
185347,"音质还ok,配对简单连接还是挺好的，不容易掉线",5
166675,鞋是不错的。告诉大家这个牌子的鞋号大，买大半号或大一号的就行,5
167882,包很漂亮，质感觉包很好，高大上，质量比较好，很有型，上档次,5
162920,孩子是沈老师的超级粉丝，沈老师的书几乎家里都有。书很不错，店家发货也很快。五分。,5
169730,自己以前买过一只，戴着不错，这只买了送给妈妈的，镜片颜色很好。,5
196973,宝宝现在正好在幼儿园里学这些，图片色彩鲜艳，今天刚拿到手，宝宝就看得入神了，她特别喜欢,5
161131,看看灵长类的行为，再想想我们人类自身，真的是很有意思的一件事。,5
165610,镇店之宝价买的，效果非常好，普通家用足够了，而且还省空间，比买低价的家庭影院好太多。发烧友估计嫌便宜。,5
163066,比较柔软舒适，里面有格子抓绒保暖透气，但重量也增加了，适合南方的冬天或深秋穿。,5
197121,书的质量非常棒，价格合适，孩子们很喜欢。,5
166295,大部头，里面很多经典，特别《论美国的民主》《宽容》等书很好，值得慢慢看。,5
162592,很看重这版是因为这里面不但又尼采，还有周老师的感悟，两个都是我十分敬仰的人。 这书一直是我的圣经 感谢,5
179663,衣服的质量真心的不错，做工很好，细致，很漂亮，是标准的尺码，穿上大小正合适，跟图 片一样，没有色差，,5
186515,第一次购买小米手机，超级喜欢，性价挺高的，京东没有抢到，多花了点钱在亚马逊买了。,5
180223,物流很快，质量也还不错，火力也很大，烤东西很快就好，值得推荐一下,5
178074,用起来挺舒服，还得等用一段时间检验下质量,5
161482,宝贝收到了，图像很清晰，颜色也很漂亮，个头小，能随身携带，挺不错的,5
191731,彩色铅笔收到了，非常好，颜色齐全，种类多。很满意的一款铅笔，等宝贝长大了给他用。下次有需要还会再来。这么好的东西可以推荐给朋友如果有需要可以放心购买哦～～～,5
178282,这款手机膜与我的手机很配，贴合得很完美，值得购买。,5
185416,具体详实的美国金融历史，特别是对比了同时期的东西方发生的历史大事。,5
196396,宝宝一岁一个月大了，非常非常喜欢这套书*^_^*，昨天拿回家，宝宝翻了一遍又一遍，真是难得。,5
175370,朋友推荐买的，很不错，很厚的一本，知识点比较全面,5
188389,“精神电影”这一办法可以应用在很多地方。譬如，一名即将上考场的学生，可以在看了考场后，每天花几分钟时间想象自己如何在考场上答题，越细致越好，这会非常有效地消除考试焦虑。,5
165387,请Kindle软件支持平板电脑分屏多任务功能，因为觉得手写电子笔记更有助于读书理解、记忆及查阅。现在许多软件都支持分屏功能了，触控笔也很普及，如果不可以在Kindle电子书内圈点批划，那么请支持用one note 之类第三方软件作笔记吧！不习惯Kindle自带的笔记方式，不能手写是遗憾。我会多呼吁，对污染大家视听表示歉意……,5
187647,图书馆借过，有收获，还是买了，认为比不少同类型的书要扎实,5
166932,非常好的放大镜，看东西真清晰，名不虚传，我非常满意,5
160163,之前买过一件，好穿得不得了，后来一直缺货，现在有货了，马上买了两件,5
183046,比平时穿的大了半个码，挺合适，虽然是入门级，但跑步确实挺舒服，对我来讲足够啦,5
169864,之前在香港的书店见过，虽然都是英文，但是玩法很简单，设计的很精妙，希望国内能多出一些这样用心的游戏类玩具,5
162969,挺保湿的，沙漠皮用着很合适，刚抹有一点刺痛…皮肤吸收也很快,5
184232,挺好的 书软软的 为什么评论还有字数要求？,5
164966,非常喜欢欧拉这位数学家，非常高产的数学家，值得收藏和研读，大力推荐,5
178427,1：厚厚的一大本，内容也丰富多彩，没有以图充版面。 2：全面介绍了南红的来历，种类，产地，等级标准，挑选和鉴定，保养和佩戴。 3：最棒的是其等级价值评估，送了一张分级挂图，让人对如何识别和评判南红等级有了一套知识体系，这是别的书没有的。,5
178756,品质很好，印刷精美，里边的图也非常喜欢，孩子最爱的是那些贴图,5
160671,终于下定决心买了这套设定集。内容应该不用说了，都是实打实的干货。 我就说说包装。包装很用心，边角都用泡沫包着的。一点都没有坏，超开心！ 发货速度也很快,5
182708,纯棉，不薄，比Nano T厚一点，有一定保暖性。还算舒适，基本满意。,5
193703,我认为能影响人的书就可以称之为好书，而flow正是这样，它的确改变我的人生，它让我重新发现工作的乐趣，我从未发现世界像如今这样美好。,5
174244,每次读书都是和作者的一次交流。这本书以山姆.沃尔顿的第一人称，像一个亲切的长辈向你娓娓道来他的生活，他如何看待他的工作。值得从事销售领域的人士一看。,5
163290,送货速度是很快，不过出库还是没京东快，等了两天才出库，又花了两天送达，总共花了4天才收到，但是这价格对得起这碟子！,5
198252,鞋子有点硬，其余各方面均好，夏秋款的，网面。,5
183255,很好，以前从不去评价，不知道浪费了多少积分，现在知道积分可以换钱，就要好好评价了，后来我就把这段话复制走了，既能赚积分，还省事，走到哪复制到哪，最重要的是，不用认真的评论了，不用想还差多少字，直接发出就可以了，推荐给大家！,5
187745,看完了桃花才下载的枕上书，内容和故事情节更加喜欢，篇幅长，也看得更加过瘾！,5
171186,文章章节有文言文、图画、现代译文组成，通俗易懂，看着很有趣,5
191579,"效果真不错，很舒服的老板椅，非常大气，同事都说的不错,是正品，服务好，整体很满意",5
195078,完美，没有一点破损，只是可惜1没有卖的了，唉，心酸。,5
183519,我自己也拿来试用了，电脑时间长了腰酸，用了一次感觉舒服多了，以后会继续用下去。,5
190405,很好，同时在天猫和亚马逊买的，一样的价格，一样的生产日期。,5
180859,加绒的衬衫，穿上就是暖和，百搭啊，好喜欢,5
199142,收到U盘，就进行了试验，感觉很不错，确实比USB2.0快不少，感觉很值得,5
196012,买了好多条LEE的裤子了，尺码都比较准，这条的特点是腰部是松紧款的，比较有意思,5
182397,微单真的体积和重量小很多，但塑料感会比较强，按键不怎么敢太用力掰，富士的画质非常不错，对焦比较准速度快，虚化效果不错。首发赠品都挺好的，相机出去旅游应该是很方便的，不会像被单反那样背的脖子痛，今天刚入手，一些特殊效果有待发掘,5
188632,家里的箱子都是爱丽思的，数数已经十来个了，很好。不过如果在设计上能在横面的两边再加两个安全扣，就更完美了。,5
173753,活动购买的，收车简单，轮子也比较顺滑，无异味，宝宝很喜欢坐车车。,5
182902,他们带着偏见认识了，又带着误解分离了。分开的期间里，他们两个各自经历了极大的悲痛，悲伤中并没有来自对方的安慰，但悲伤却让他们更加理解了对方。没有见面，没有通信，似乎永无交集的日子里，他们却相爱了。,5
196731,书很好，印刷很清楚，中英对照，赏析很棒。,5
195324,还是可以 质量不错 语速也合适 题有点难,5
168261,以前从未在英亚买过鞋子，这次是实在喜欢geox的这款皮鞋，而且库存只剩一双7.5UK的，我是跟天猫上的旗舰店的尺码表对照之后决定买的，本人平时42码，穿这个号刚刚好，以后可以再买其他geox鞋啦！,5
193819,本来11号一直在淘宝上面看东西， 准备给没有出生的宝宝购买纸尿裤，看的头都花了，没有想到360居然弹出一个窗户，点进来看见这价格，一看还是亚马逊，觉得最起码比淘宝那种个体经销商要正规吧，而且价格还便宜。最后要说一下 我老婆本身就是妇产科的护士，她说这个很好，那就很好喽！！快用完了，准备在买，但是价格比之前的要贵了。好揪心！！！,5
199879,虽然在包装和纸质上有点不尽人意，但其他方面都很不错。还没看内容，先给个好评吧。,5
185403,内容上比较充实，但不知道现在有没有什么变化,5
185641,书很精致 第二天就看完了 这本书是我最期待的,5
189559,虽然软 但也是用这还好。颜色也还好，空间也还好,5
186896,质量不错，设计合理，价格小贵淘宝贵100,5
194953,174 68买的s，紧身，上面标签写着165的,5
192726,用完后牙齿滑滑的，从来没有这个感受，而且白很多,5
171881,白色的好看，而且真的很好用的，感应很灵敏,5
190574,我看过的最好英文原著之一 这个价格能做到这个样子很不错了,5
165880,直接寄回家里了，买给妹妹的，她们说很喜欢,5
168029,只要有交流就应该有的一种思维方式 需要反复练习、形成思维习惯,5
187131,是老师为了指导孩子比赛要求买的书，里面图片清晰，简明易懂。认识作者郑老师，为人也是非常实在，有才之人。,5
186443,很好，以前从不去评价，不知道浪费了多少积分，现在知道积分可以换钱，就要好好评价了，后来我就把这段话复制走了，既能赚积分，还省事，走到哪复制到哪，最重要的是，不用认真的评论了，不用想还差多少字，直接发出就可以了，推荐给大家！！,5
182112,超级喜欢的一本书。 辉姑娘的上一本书《一切都是最好的安排》就买了，觉得超！好！看！她写东西太抓人了。这本新书感觉残酷了一点点，但是更成熟，个人觉得更适合自己这种工作了一段时间的人读，心领神会里面的很多梗和妙处。 有时候真是以小见大，如果成天讲生离死别爱恨情仇啊可能并没那么多感同身受，觉得谁还不死一死啊。反倒就是这种身边的小故事特别戳人，觉得就是实打实发生的。 以前没有过这种感觉，这本书让人觉得，读完以后人生是可以通过文字升华的……,5
171463,虽然只看了前十几页，还有很多生词儿，但内容真的不错。推荐对这方面感兴趣的朋友看，对自己对家人都有好处吧。,5
169863,很好，是正版，物流很快，2天就到货了！服务态度很好！,5
192747,这是文学课的教材，在亚马逊买更便宜，质量有保证。,5
172069,非常好的产品，值得信赖，这几年一直在用。2011款福克斯走起。2011款福克斯走起。,5
183745,还不错的东西，很多东西基本知道，但是有些小观点还是很让人信服的。好书,5
182494,作为老一辈的经验 个人觉得有部分好东西。值得学习。,5
167847,买了好多次东西了很少评论，今天破个例，这根线做工和质量都很好，苹果安卓通杀，给充电宝充电也很方便，比苹果原装线还实用 搞不懂其他差评的，害得当时买的时候心里还嘀咕了一下下,5
183292,美国现在是，将来是，一直是我们学习的榜样！,5
160647,货已收到，感觉不错，包装很干净，睡着也比较舒服。,5
198510,拿到手后比想象中的短个一截，但用起来也没有想象中的那么费~挺滋润的，很适合冬天用！,5
177995,打开包装是国内进口商经销的。其中白色的杯子是磨砂表面，使用的时候爱脏。不是情侣的话还是单买吧。,5
188023,每天回来作业不做，要先看这书，怎么破呢哈哈。,5
170541,东西己收到很久，只是出差在外地，今天才见面。,5
186264,就一个大箱子，还没装客服说里面东西不用管，等以后安装时师傅拆箱就可以,5
184022,仔细的阅读了下，发现对c++这些template更加熟悉了，里面的一些构造也知道的更多,5
170848,很好用，价格和效果都和一直在专柜买的一样,5
189766,还没有，六瓶应该够用一段时间的，相信亚马逊没有假货,5
174808,用了二十多天，皮肤真的有变好，化妆眼角也不会卡粉了，买的很值。,5
177293,在市面上的笔记本中选了一遍，便携性好的也就Thinkpad x1、XPS和苹果air，但XPS的返修率高，苹果air的键盘手感差，而我用笔记本的主要用途是打字键盘，另外以前买过T系列，及其耐用。开箱使用后，果然没有辜负我的选择啊！极薄极轻，键盘舒适，满意！,5
172359,这么大一袋，里面才十来包。一包的量太少了，每次都是两包，一个星期就吃完了，而且比较甜。小时候是吃不起，长大了再尝尝，也就那样了。,5
173529,快递很快，第二天就送到了。鞋子穿上刚好合脚，鞋底很软，穿上很舒适。穿了一下午感觉透气效果蛮不错的，也不出汗。颜色好看，鞋子很喜欢,5
190335,出油减少，头发变蓬松。使用还算比较方便，一次十五分钟。看起来没那么秃了，不知道实际上头发有没有变多,5
170647,很不错，书完好无损，而且还没有运费，良心商家,5
183334,这个很方便，很多用处，最大用处直接拿来做辅食机了,5
191094,物美价廉，很实惠，这款宝贝与描述相符，非常满意,5
169991,师姐推荐的书，快递到了，迫不及待的翻看，果然，是一本值得一读的好书，华研外语不愧是同一品类的领头羊。,5
192698,科学化的运动，乐趣化的生活，有目标有方法，这种青春令人羡慕不已，希望更多的人关注本书，聆听大自然和内心的召唤,5
176610,很稀有很复古的森林人系列，国内某宝五百往上上的价格…适合手腕细的人，这个价格能买到很中意的手表很开心，快递也很快,5
174588,平时穿42的，在商场试穿41的。买41的正好合适。正品无疑。,5
167220,是正品。儿子喝惯了澳洲爱他美和丹麦arla 一开始不适应 正在慢慢替换,5
192681,快递包装很好 书也是全新的 质量很好 客服给力 好的购书经历,5
192118,外型清雅，高档。保温效果非常好，头天下午装的开水，第二天早上还很热。很喜欢。,5
195484,１、建议发货时最好发带塑料膜包装的新书，因为有很多书是送人或者需要收藏的； ２：包装一定要靠，杜绝发一本就简陋包装的情况，很多单本发的书出现质量问题都是因为包装简陋的原因，谁也不愿意二次退货，麻烦。,5
170797,买了很长时间了，才来评论。我很喜欢麻将面的味道！要报酱料包都放上味道才够，哈哈！,5
