76770,"Le plus : joli, assez grand pour ne pas courir dans le fond du jardin tous les jours, le moins :sceau intérieur en plastique avec une anse qui permet de l'emmener à votre compost, ma fille a trébuché en revenant, le sceau est tombé et là un morceau du fond du sceau est cassé (plastique très fin) alors que je suis allée au compost trois fois ! Pas solide, une autre chose me dérange, lorsque on met le couvercle en place il ne s'emboîte pas, il est juste posé et cela bouge dans tous les sens, je n'ai pas regardée si je pouvais acheter un sceau supplémentaire pour remplacer celui qui est cassé. Je regrette mon achat... Dommage car il est assez joli",2
44512,Très jolie collier mais le fermoir a cassé au bout de 2 jours ...,2
68213,"Efficacité encore à prouver, très long à sécher",2
76199,"Acheté pour un cadeau. Très déçue car une une des notes de la mélodie ne fonctionne pas et fait un bruit de métal.. C'est juste une note, mais elle se répète plusieurs fois lors de la mélodie",2
72190,"Les sandales sont vraiment jolies et sont arrivées rapidement, mais l'élastique de maintient derrière la cheville est vraiment inconfortable et irrite le pied ... je ne les mets plus du tout c'est bien dommage ..",2
53037,non je ne suis pas satisfaite du tout car il y a toujours des mouches des araignées chez moi et les puces donc je trouve que le matériel ultrason ne fonctionne pas très bien et au bout de 2 jours il y en avait un sur les quatre qui ne fonctionnait plus,2
65360,Pas pratique du tout à monter et à utiliser,2
45831,Je suis vraiment déçu les tétines du biberon n'était pas bien protégé. La boîte d'une tétine était ouverte. Mon bébé à 6 mois et n'a pas réussi à boire son lait sans s'étouffer.,2
77840,Le produit est envoyé sans l'emballage photographié-,2
71222,"pratique le fait que le pot tourne, de bonne taille. Design sympa. Petit bémol lorsque j'ai enlevé l'autocollant sur le pot il y avait un choc dessus !",2
76217,"D'une part on ne peut mettre qu'un seul câble s'il est un peu gros ou 2 petits . Et ça ne tient pas beaucoup et uniquement sur du bois. Sur les murs , peintures ou autres matériaux ça se décolle 2 jours après Du coup je me retrouve avec beaucoup de pièces en rab et qui ne me sont d'aucune utilité",2
58104,deux livres sont manquants,2
49730,J'ai achété 2 lampes. Le détecteur du premier est tombé en panne au bout de quelques mois et celui de la deuxième après un an et demi. Elles sont donc devenus inutilisables car une ne s'allume plus du tout et l'autre s'allume en permanence... Il vaut mieux choisir un modèle avec interrupteur au cas où le détecteur tombe en panne.,2
45417,J'ai acheter cet épilateur pour changer du rasage au traditionnel rasoir et il est actuellement toujours dans son emballage au fond d'un placard. trop douloureux pour ce que c'est et n’enlève pas tout les poils en plus il manquais des accessoires dans la boite. Assez déçu donc mais pour celle qui sont des habituées de l’épilateur pourquoi pas mais il y a surement mieux,2
45056,"Je suis déçue du produit , moins joli que sur l'image. Je voulais la couleur bleue,j'ai reçue un bleu/vert. La qualité n'est pas au rendez-vous. Une pacotille que l'on trouverai facilement sur un stand de marché. Mais ce n'est pas grave car le prix est minime. On ne pas être content à chaque achat.",2
47177,"Les barres sont bien, mais colis reçu avec barres rayées et endommagées. Comme je ne l'ai pas ouvert de suite, il est trop tard pour le retourner. Mais je suis très déçu de ce service d'Amazon !",2
70914,Ne convient pas pour des zones courbées peut être faudrait il le chauffer! Je ne le recommande pas .il est préférable de les faire soit même,2
61500,"Ce petit sac répond à mes attentes, mais la fermeture éclair, se découd, après quelques jours d’utilisation",2
72696,"... le jack 3,5 ne tient pas en place solidement. Essayé avec plusieurs smartphones et tablettes même résultat",2
73881,Extrêmement bruyant et n'aspire pas super bien. Déçu...,2
42794,Pratique mais poignée cassée en moins de 6 mois. Donc pas solide et devenu inutilisable.,2
45292,"Nageur confirmé, j’ai utilisé pour faire quelques exercices de musculation dans l’eau. Le concept est interessant mais les bandes sont arrivées déjà déchirées. Peut-être un coup de malchance.",2
41848,"Colis livré explosé. Obligation de trouver des vis maison. Structure du chariot trop faible pour des buches de 50cm. Déplacement du chariot bruyant, des pneus auraient été préférables. Le poid global est trop élevé. L'étagères est plutot genante. Difficile à reprendre lorsque ce chariot est placé de face plein. Finalement prix trop élevé compte tenu des inconvénients.",2
76915,Bonne qualités mais ne s'adapte pas du tout à mon téléphone. Pourtant je suis sur que dans la description c'était possible. Du coup je me retrouve avec ce câble qui me sert à rien.,2
50402,"Le piege a l'air costaud, mais je n'ai toujours pas compris comment l'utiliser !!! Faut-y que je sois bête !!! En tous cas une petite notice pour les novices, cela n'aurait pas été du vice !!!",2
57004,arrivé cassé (2 boites) malgré un emballage qui semblait intact..,2
48253,utilisation dans un diffuseur électrique a froid pas d'odeur dommage,2
50089,"Au bout d' 1 mois, panne de micro > mauvaise qualité. Trés deçu par ce prodruit, je demande un remboursement !",2
72389,"Décodeur déjà utilisé, revendu défectueux !",2
52945,"J'attendais mon tire-lait avec beaucoup d'impatience, malheureusement celui-ci ne s'est jamais allumé, que ça soit sur secteur ou avec des piles. Comment faire pour récupérer un nouvel appareil en état de fonctionnement ?",2
69703,N'a senti réellement qu'une petite semaine. Cher pour ce que c'est ...,2
58686,Pas très résistant au bout de 1 semaine déjà casser ! en meme temps vus le prix je comprend pourquoi il est pas très resistant je vous le déconseille fortement,2
48117,"Je l'utilise principalement chez moi, il est un peu rigide. Il s'est cassé au bout de 6 mois.",2
47277,"La combinaison est juste pas du tout conforme à la photo ... C est une combinaison que l'on peut trouver a quelques euros toute fine , même matière que les charlottes ( pour protéger la tête ) néanmoins le masque est de très bonne qualité.",2
71776,Pas tres solide c est cassé en quelques jours,2
50841,Trop petit pour un lustre plafonnier mais pas déçu,2
120533,Petit meuble sympa et pratique . Attention les étagères ne sont pas hyper robuste.,4
130342,"Quatre étoiles pour le prix , ça essuie , mais un essuie glass est bruyant (le plus court ) , pas des plus agréable ; gomme peut être un peu dur , a voir dans le temps.....",4
157658,"Ravie par le fait de retrouver une vérité : l'argent ne fait pas le Bonheur... J'ai aimé l'histoire , le contenu facile à lire et les personnages. Je le recommande vivement..",4
130330,"Acheté pour un mariage, le résultat est fabuleux. Le produit est conforme à sa description et contient le nécessaire pour le poser dans les cheveux mais je retire une étoile pour la pause que j'ai effectuée chez un coiffeur car toute seule la manoeuvre est un petit peu compliquée.",4
150000,Trrs bonne trousse piur stocker les 120 crayons de couleurs qie j ai. Manque une place gomme et taille crayon pour être parfaite,4
154485,Très légère parfait très content,4
124385,Des gants de bonne qualité mais la taille est du côté petit. J’ai commandé la taille L (comme mes Nike d’avant) mais les gants sont un peu serrés.,4
140405,"Pleinement satisfait de mes achats sur amazon.fr Ils correspondent à mes attentes, d'autant que c 'est pratique de les recevoir à la maison et dans un délai rapide.",4
137589,"bonjour, je l utilise pour mon paramoteur je vois quand ma voile est gonflée au dessus de ma tète .",4
131184,J’ai offert ce CD à ma mère pour Noël. Elle était ravie.,4
153591,"Satisfaite de ce produit fonctionnel, très grand correspond à la description je recommande",4
121657,C'est un bon étui pour qui veut emmener sa tablette avec lui en permanence sans risquer la casse. J'ai mis un peu de temps à choisir ce modème mais je ne regrette pas.,4
142611,Très bien bonne qualité,4
136987,"Prix abordable. Livraison rapide. Il ne faut pas s'attendre au 10ème près de degrés mais indique bien si fièvre ou non. Intérêt majeur, pas besoin de toucher l'enfant ou l'adulte.",4
148230,"Facile à mettre mais difficile à enlever, je pense qu'en cas de chute le S10+ sera protégé. Sinon par rapport à la façade avant, je pensais qui était semi tactile. Au moins il est compatible avec la charge sans fil. Je peux regarder mes vidéos tranquillement avec le rabat spécial ou bien les regarder avec discrétion par la façade avant. Tout est variable, c'est très intéressant. Mon Smartphone est Protégé, merci .",4
133995,"Ma fille l’aime beaucoup elle a mis son panda et ses livre, J’ai eu un peu de mal à le monter",4
152982,"J'ai du attendre très longtemps, mais comme il n'y avait pas urgence, mon imprimante marche encore. Prévoir du stock !",4
154683,Très bonne qualité d’images mais compliqué à installer. A distance l’appli bug faudrait l’améliorer. Sinon à domicile c’est nickel.,4
127551,je n avais pas l intention de l acheter mais ma sœur m a convaincue.. Depuis quatre personnes de mon entourage ont acheté echo alexa. je trouve cela pratique pour les recettes de cuisine elle calcule par rapport au nombre de personnes. les playlist de musique de tout les genres et aussi les quiz; Je ne regrette pas mon achat.,4
142625,UN PEU MAIGRICHONNE MAIS RESTE TRES JOLIE PLAIT A MON FILS QUI LES COLLECTIONNE.EN PLUS INTERACTIVE; RAVI DE MON ACHAT.,4
149857,fixation un peu légère mais très bon produit autrement.,4
141083,"Joli design, petit, peu encombrant. Les boutons ne sont pas forcement très facile à manipuler sur tout pour le réglage du son mais cela reste correct dans l'ensemble.",4
134936,Bande adhérente bien mais adhère moins au bout de 3 utilisations mais pour le prix vaux le coup.,4
132626,Coorespond à la description. Livraison rapide. Le 1 er envoie avais un souci et aussitôt signalé c était réglé aussi rapidement. J apprécie. Et cette marque ne déçois jamais,4
154264,Pour moi c'est meilleur de prendre celle de tournesol plutôt que celle de soja ! Le soja contient des hormones qui ne sont pas recommandés pour la santé,4
136328,"Très bon produit, déjà testé, à part un petit coup de main à prendre, mais vraiment on a enfin une technique pour ce faire les ongles sois même sans se prendre la tête, je recommande vivement ! Petit retard de livraison de 1 jour, un détail... 😁",4
157375,"Cet article m'a été recommandé par mon dentiste, je ne suis pas déçu et l'utilise plusieurs fois par jour. Je le recommande.",4
157813,Manque de piquant sinon très bien,4
125792,"Produit reçu dans les plus brefs délais, une équipe qui semble se soucier de la satisfaction client au vu des mails reçus (ce qui est rare). Produit conforme à la description, il y a qu'au niveau de la touche espace que la coque ne se fond pas à 100% mais rien de bien dérangeant. J'avais déjà un clavier transparent mais en noir ça fait bien plus propre. Très satisfaite, je recommande.",4
130689,"Je l'utilise depuis 3 jours. En même pas 5 mn (à condition de l'avoir fait préchauffer avant d'y entrer) on transpire vraiment beaucoup ! La chaleur est forte mais supportable sauf sous les pieds en ce qui me concerne, j'ai donc déplacé le panneau. Il apaise aussi très bien les douleurs musculaires. Par contre, ne conviendra pas à quelqu'un de très grand à moins de trouver un siège plus bas qu'un tabouret par exemple. Prévoir un drap de bain à mettre sous votre humble postérieur pour ne pas inonder le fond du sauna et ne pas glisser en sortant. Le cordon d'alimentation est un peu court. Prévoir une rallonge ou placer votre sauna pas loin de la prise. En résumé, je suis ravie de mon achat et le vendeur est très agréable et réactif à la moindre question. Renseignement important donné par ce dernier : La télécommande n'affichant pas les températures mais des niveaux, le premier est de 40 ° C et chaque niveau supplémentaire est augmenté de 5 ° C A voir sur la durée.",4
130751,"Un peu déçue de la qualité car le téléphone ne tient pas en mode paysage, la housse a tendance à se plier. Mais dans l’en Ça reste un bon produit, surtout pour le prix.",4
142057,Bonne bouteille qui évite d'utiliser les bouteilles plastiques. La version 1l est suffisante est bien. Seul reproche le prix que je trouve excessif,4
138980,"J'ai été surprise par la grosseur de la brosse. Heureusement, le fait qu'elle soit ovale la rend facile à manipuler. Je l'utilise en finition sur cheveux séchés pour mettre en forme la coiffure et cela donne de bons résultats. Attention, elle est adaptée aux cheveux mi longs et longs. Elle a un bon rapport qualité prix. Le point négatif est qu'elle est très bruyante.",4
146677,Nul pas de mode solo,4
145504,"Très pratique, dommage qu'on sente autant la protubérance en tenant le téléphone a une main, mais contrairement a la version usbC ça reste acceptable",4
129533,bon maintien du poignet pendant mes séances de sport même si ce n'est pas excellent mais vu le prix faut pas trop en demander. Suffit pour ce que je m'en sert (tous les jours),4
129023,"Prix très convenable par rapport à ce que l'on peut trouver. Pas encore utilisé, mais taille idéal pour clôturer pour des chevaux !",4
151818,"J’avais regarder la série puis maintenant je lis le livre. Très bien quand je lis je revois les images que j’avais vu dans la série. Bien mis à part la page de couverture qui est très rayé, ce n’est pas grave pour moi mais je préfère le préciser.",4
159370,pas beaucoup utilisé mais très silencieux,4
146566,"Le produit est entièrement satisfaisant et exactement comme sur la photo et comme décrit. Les flacons ne fuient pas et la vaporisation est bonne. Par contre, il ne faut pas être pressé, la livraison est extrêmement lente - 5 à 6 semaines.",4
154080,"Produit qui n'a pas encore été testé, car acheté pour faire le chemin de St Jacques de Compostelle. Semble actuellement convenir à son usage.",4
143793,Son de qualité. Facile d'utilisation. Léger.,4
140624,Je ne peux pas marquer un commentaire étant donné que je n'ai jamais reçu le produit . Par contre je vous remercie pour le suivi et l efficacité à répondre aux emails,4
128075,"Super, nous en avons acheté deux pour la déco de la chambre de bébé et les deux fonctionnent avec la même télécommande. Le petit adore le rendu sur le mur.",4
151270,"un tres beau livre, de qualité et très complet dans ses explications , chaque lame est décortiquée et les méthodes sont interessantes!",4
120651,Correspond a la description semble fragile.jeux de lumières fidèles à la description.bon achat pour le prix.produit recommandable pour qualité moyenne,4
126520,"Reçue avec les attaches plastiques cassées, mais cela ne m'a pas dérangé car j'attache les élastiques à mes jantes alu. Convient parfaitement à une twingo 3.",4
145788,Reçu rapidement produit conforme pas encore utilisé mais parfait à première vu,4
124751,"Ce livre permet de se recentrer sur l'essentiel nécessaire au passage du code théorique. Le livret annexe permet de s'entrainer sur quelques tests 'type'. Le point positif de ce livre étant qu'il est synthétique, c'est également son point négatif avec un manque de détails sur certains sujets",4
147843,"Bonjour, cette lampe suspendue est très jolie et de bonne qualité. L'éclairage est faible mais très décoratif dans mon saule pleureur.",4
125135,"Marre d'avoir mon reflex en bandoulière ou baladant à la sangle, j'ai opté pour ce bidule très pratique. On ne sent presque plus l'appareil. Attention toute fois à la plaque en métal qui viendra entre la partie supérieure et inférieure du bandeau de sac à dos, qui pourra potentiellement être gênant selon les morphologies de chacun avec des vêtements légers. La platine est à serrer avec un outil de préfère afin d'avoir un serrage optimal. La ""languette"" est difficilement vissable à la main. Sinon rien à redire, on a un sentiment de robustesse et de qualité de construction, mais portant pas loin de 1000€ à l'épaule, je garde tout de même la sangle autour du cou par précaution.",4
154216,Coupe bien mais s'use vite. Normal vu l'épaisseur. Ça reste un disque de coupe donc rien à redire pour le prix,4
123212,"Si ces produits sont toujours un peu chers. La qualité est au rendez-vous et mes enfants en sont très contents. En tant qu'adulte, je confirme que la finition est bonne et que les produits durent dans le temps.",4
134679,Super contente! Chaises très belles!! Ça été vite livrée. Faciles à monter mais il manquait la pièce pour viser correctement,4
129021,Tres bon spa pour le prix,4
120532,petits caractères mais bien,4
123183,produit conforme à la commande,4
120664,Pratique de bonne longueur,4
126205,"Tondeuse puissante, peu bruyante, bien finie et agréable. Je recommande pour des petits jardins. Produit assez cher mais comparable aux prix de la concurrence. L'achat d'un lame de remplacement est peu excessive.",4
130219,"Article conforme à la description. Bien transparent, malgré certains avis qui disent le contraire. Peut-être avaient-ils reçu un modèle différent ? Peut-être un peu lourd niveau poids.",4
128477,C’est ce que j’attendais,4
156083,Pratique en dernière minute! Simple à utiliser,4
132869,"J'ai acheté cette lampe, suite aux commentaires, pour nos ballades nocturnes en hiver dans un quartier où l'éclairage public fait défaut. Nous ne sommes pas déçus, elle éclaire vraiment très loin, est pratique, s'accroche correctement sur le guidon d'un vélo. Petit bémol, elle tient à peine une heure... il faut donc la recharger souvent. C'est pour cette raison que je mets 4 étoiles.",4
151791,Ce produit correspond totalement à ce que j'attendais. Très pratique en ce qui concerne la rotation.,4
102951,Très bon service après vente,3
84606,Toutes les couleurs ne sont pas jolies.,3
97283,À voir à long terme. Mes chiens perdent toujours autant de poils après quelques semaines d utilisation. Livraison rapide .,3
103912,Avec un tel prix je savais que la qualité serait moyenne mais produits conforme à ce que je voulais et m'attendais. Seul point noir certains verres sont flous donc difficile de les faire porter longtemps à des enfants,3
86874,"Un roman « mignon » à lire mais avec trop de cliché. Un héros beau, jeune, riche et une héroïne naïve et qui ne s affirme pas au début. Enfin bref aussitôt lu aussitôt oublié !!!",3
92209,"C’est cool, mais maintenant tous les portes feuilles bloquent les ondes radio. Y compris celui ci qui oblige à extirper sa carte de transport navigo de son emplacement pour pouvoir valider son trajet.",3
109411,"Qualité ordinaire, mais ça passe !",3
104359,Je n'apprécie pas le manque de rigidité du fil métallique de la brossette manque de tenu,3
118793,L'étui est conforme. Il s'emboîte bien et protège correctement la tablette. Après l'usure de la toile et du dessin disparaît rapidement. Dommage car l'argument ici est justement le dessin.,3
82357,"Pour le prix, elle est sympa. Effectivement les mousses qui servent pour l’effet 3D ne sont pas bien centrées sur les chiffres mais avec un peu de patience on s’en sort largement. Les aiguilles sont fragiles (comme une horloge!). Pour moi, le seul inconvénient c’est de devoir décrocher le moteur pour pouvoir la mettre à l’heure ( du coup, plus de repères ) C’est pas du Suisse Mais ça fonctionne très bien et c’est pas chère!!!",3
85212,"Mitigé. La qualité est là, les ventouses tiennent bien. Cependant a l’usage je les trouve finalement trop petites, bebe est par moment trop au soleil. Pour info, j’ai une berline compacte donc pas énorme carreaux",3
82218,La machine à slime fonctionne bien mais le contenu varie suivant les paquets. Je l'ai offert à mon neveu qui a eu la mauvaise surprise de ne pas trouver un des éléments qu'il souhaitait absolument : un petit cerveau. A la place il a trouvé une oreille... C'est inscrit sur la boîte mais pas dans la description d'amazon. Sinon la fabrication de slime est facile et le résultat dégoûtant... Parfait pour un enfant de 6ans,3
81532,pas mal pour le prix mais le pied est un peut petit attention quand on monte dessu il bascule facilement un peut dommage,3
111314,"Les plus: léger, facile à utiliser, accessoires. Le moins: vis pas solides. Une vis cassée au mauvais endroit et l'organiseur de clés n'est plus utilisable. Dommage.",3
104487,"Un peu déçue quand même... D'habitude, je garde mesure sur les commentaires, mais là, j'aurais dû en tenir compte. Dans une petite pièce, le moteur chauffe la pièce, et avec l'eau augmente l'humidité de façon importante. Dans une grande pièce, bah.... c'est une grande pièce...donc, il ne baisse pas la température. EN revanche, c'est un excellent ventilateur si on le dirige sur nous. Je ne conseille pas.",3
102619,Déjà cassé ... retour à l’envoyeur !!,3
82648,"Cette robe est assez grande mais elle est magnifique. Le prix est dérisoire par rapport au bonheur qu'elle apporte aux petites filles. En revanche,je me suis rapidement débarrassé des épingles à nourrisse qui tiennent les papillons c'est beaucoup trop dangereux. Faire un petit point de couture à la place..",3
114594,"Le contenant DVD est correct, par contre le film en lui-même déçoit. Autant j avais apprécié le premier film, autant celui-ci m'a décu. Des fois, un concept original n'a pas besoin de suite. La note imdb est de 5.6 donc effectivement bien moyen.",3
105534,"Je suis un peu déçue car il ne s'adapte pas tout à fait à mon toilette. Cependant mon fils est bien quand il est dessus, ça ne le gène pas.",3
86323,Ce n'est pas mon besoin. Cela ne semble pas valoir la peine de l'argent que j'ai dépensé pour cela. Pas une bonne expérience.,3
80731,Je suis déçu par la qualité du tissu que je trouve trop fin.,3
81954,"Je pense à rectifier mon commentaire après plusieurs utilisation mon critérium de 0,3 son ressort c’est cassée je suis déçu mais bon,",3
91025,Cette pompe est très utile mais il ne faut pas avoir 15 vélos à gonfler. Le tuyau est petit et pas facile à manipuler.,3
107481,"Pour un lit d'appoint, c'est bien, qui justifie le prix.",3
83499,Taille très petit pour les femmes fortes ne vous aventurez pas,3
118965,bon produit problème il me serre a rien je les garder on ne c'est jamais,3
107767,Tres bien mais trop bruyant. Le son est vraiment tres fort.,3
114035,"Il est OK mais pas la même couleur sable que le 19cm que je ne trouve plus, il est plus gris c'est dommage",3
113245,Sympa et facile à mettre mais pas super solide. Des impacts ou des fissures se forment au moindre petit choc et il est très difficile de retirer la coque une fois cassée. Un peu déçu,3
118957,Pratique mais inconfortable en main. Pour ma part son utilisation reste exceptionnelle suite à l'inconfort ressenti. On verra sur le long terme.,3
91300,"la prise fonctionne parfaitement en revanche la portée n'est pas excellente probleme également dans le timer, on programme une heure de déclenchement et ça ne fonctionne pas à tout les coup il existe des modèles plus efficaces",3
90413,"Il est très bien pratique, mais le bol est déja fendu sans être tombé par terre, le plastique est très fragile",3
83090,"Je l'utilise pour piéger les moustiques,il est trop lumineux pour le laisser dans la chambre, il faut le mettre dans une autre pièce.",3
92674,"Bon produit pour le prix. Le wifi n est pas spécialement performant, ne le capte pas très bien. Visibilité dans le noir nul. Pour surveiller mon chien la journée C est top mais sans plus.",3
104113,Pourquoi le support de plafond n'intègre-t-il pas le fil d'alimentation électrique. Que font les ingénieurs qui travaillent sur ces produits ? Ont-ils un jour testé le produit ? On dira qu'ils vivent au temps de la bougie !!!,3
90435,Pour faire une serre je pensais qu elle serai plus solide mais je suis déçu.,3
104203,À l'ouverture une rose noire celle du milieu est décollée... Sinon assez grand pour adulte... Et la dentelle jolie...,3
113646,bon article pourquoi faire des commentaires aussi long ses chiant a force faire au plus court serait mieux ok ses bon,3
80956,Sans plus la qualité n'est pas top mais ça fait l'affaire. Par contre très légère et de corpulence mince donc pas très pratique pour certaines tailles de vêtements.,3
113199,Article conforme à la photo. Néanmoins ne ramasse pas si bien les miettes. Un peu déçu de cet article qui est d'une tres bonne utilité!,3
115411,"Après un essai sur 24h, sur les 3 voltmètres achetés, 1 est totalement HS. Plus d'affichage. Mais dans les 2 autres restent OK.",3
101755,Commande réceptionné avec des rayures à l'arrière de la coque et deux impacts sur la tranche du téléphone. Mais sinon se téléphone est génial,3
82029,Fonctions bien avec les oiseaux,3
112607,La corde fléchi beaucoup sous la charge .,3
104692,Ce kit permet de faire des pompons assez facilement. Au bout de plusieurs utilisations: je contacte que l appareil se démonte! Je le recommande a moitie,3
115828,Cette tondeuse roule très mal dans l'herbe car il y a une pièce(de couleur rouge) qui est trop basse.,3
