180481,Très belles assiettes. J'aime beaucoup la couleur. Beaucoup plus jolies que des assiettes en plastique classiques. Elles me servent encore.,5
160748,Acheté pour mon fils de 3 ans. On aime beaucoup car il y a les photos en papier pour le faire sur ça. C’est bien pour commencer à faire des puzzles et il adore car c’est des personnages préférés.,5
169394,La protection est super efficace. Très bonne qualité. Je suis content de mon achat. C'est un ami qui me l'a recommandé.,5
199658,"J'ai utilisé ce styler pour la première fois aujourd'hui et j'en suis absolument ravi, ainsi que le petit canon idéal pour les cheveux plus courts comme le mien. Tellement satisfait que j'en ai commandé un autre. Je le recommande vivement.",5
191343,J'ai acheter pour mon.bebe mais tellement utile et complet. Satisfaite de mon achat j'ai pris pour ma soeur qui attend un bébé aussi,5
162265,Très pratique et bonne qualité.,5
167293,"Protéger les coins d’un tableau veleda suspendu à une porte. Après quelques semaines d’utilisation, les coins sont toujours bien adhésifs et évitent les chocs et le balancement sur la porte.",5
171172,"Le produit correspond parfaitement, utilisation remplie toutes ses fonctions. Attention juste a être correctement outillé pour le changement de la pane, la goupille fait un peu de résistance.",5
170538,"Ma fille adore toujours sa veilleuse nina. Les chansons sont mignonnes, je recommande.",5
171346,Pour la pluie petite fille de 4 ans rien à dire correct,5
196593,très beau livre vu par hasard sur les réseaux sociaux très belle surprise en tout cas j'ai beaucoup de plaisir a le mettre en couleur les dessins de femmes sont très fin. les pages ne sont pas épaisses mais bon ce n'est pour ma part pas trop grave vu que je colorie la plupart du temps aux crayons et c'est un dessin par page.,5
163933,Très belle qualité. Livraison sous 48h. Parfait.,5
161786,Livré en temps et en heure. Correspond parfaitement. C'est vraiment des Converse et pas une vulgaire copie.Recommande l'article.Mérite les 5 étoiles.,5
178838,Elle est génial. Sur mon lit c'est le top. Regrette pas mon achat,5
180221,"Les Bruder sont solides et réalistes. Je peux que recommander cette marque. Par contre, à savoir, cette remorque se met que sur le tracteur bruder mais pas sur les camions.",5
195331,"Excellent produit ! Effet naturel, facile à passer avec le gant, sent bon , ne fait pas de tâches . Trés satisfaite de cet achat. Dommage que le prix est augmenté depuis .",5
174698,Je l'ai acheté car j'aime cette marque et les coloris sont jolis,5
194368,"Un ""jeu"" simple, mais qui peut réellement avoir un effet positif sur votre couple, permettant d'exprimer des émotions relationnelles au quotidien.",5
189276,Arrivé dans les temps en bon état,5
190637,Satisfait du produit,5
175146,Ce produit est utile pour une douche avec murs revêtus de céramique et permet de ne pas percer. L'adhésif est super et le panier chargé sans penser à sa chute!...,5
178218,Magnifique rien a dire bonne qualité beau rendu,5
178736,"Je mets une notes de 5/5 car le produit est arrivé rapidement, car le produit est en parfait état et rempli sa fonction : il colle très bien. Je recommande ce produit à toutes les personnes qui ont besoin de coller des photos ou des documents rapidement et sans humidifier leurs papier",5
171197,Parfait comme d’habitude sur la pâte et produits de cette marque... expédition rapide et couleur toujours conforme Recommande à 100%,5
165940,"Je cherchais un dérouleur de papier wc sans avoir à percer des trous, je l'ai trouvé sur amazon, très pratique, solide, et esthétique et il a été très facile à poser. RAVIE DE MON ACHAT",5
185624,"J'ai été très surpris de la réception de la marchandise. L'emballage des produits était très raffiné et les accessoires étaient très bons, avec des bretelles et des instructions. J'ai hâte de l'utiliser, l'effet est très bon. Comparé à la clé à chocs que j'ai achetée auparavant, ce JUEMEL a un couple important et est confortable à utiliser, ce qui m'aide à mener à bien une variété de petites opérations mécaniques. Très bon prix, je vous suggère d'acheter! ! !",5
193502,Très joli! Les couleurs et la matière super,5
197782,"j'avais une douleur musculaire persistante biceps aux 2 bras, style tendinite, je suis allée voir les médecins (prescription de volta---, sans aucun effet, échographie--rien..bref aucune solution) J'ai alors fait des recherches sur le net et j'ai acheté cette crème, et là...enfin quelle efficacité! mes douleurs disparaissent. J'en mets avant chaque entraînement de sport moi qui pensais que je ne pourrais plus en faire... mille mercis!!!",5
179450,"envoi rapide, recu apres 3 semaines (rapide pour envoi d'Asie); moules pratiques assez grands",5
198932,"Impeccable, facile à mettre en place et à retirer!",5
177652,"très bon produit, très costaux pour le prix et surtout suffisant pour nettoyer les poêles, longueur suffisante pour chez nous je recommande",5
162863,bien reçu très rapidement. Très bien emballé. Mon fils est ravi et attend avec impatience les autres qui sont signalés quand même rapidement. Merci,5
190483,Super mignon. Lumière un peu forte pour la nuit mais mon fils de 3 ans adore et peu l'allumer ou l'éteindre tout seul !,5
195103,"J'ai remplacé les pads de ma PS4 pro, très satisfait",5
177792,"je recommande cet achat, arrivé à l'heure prévue je suis satisfaite pratique pour faire partir en voyage semble solide pour le prix",5
173553,"Après avoir toujours utilisé les grandes tours j'ai voulu essayer un mini pc afin de le mettre sur la télé du salon. Je suis très agréablement surpris de cette machine totalement silencieuse. Elle est livrée avec un cordon hdmi et l'adaptateur secteur. Un mini clavier sans fil avec trackpad et la machine est complète. Le premier démarrage permet de faire la configuration de windows 10. Il est bien en français et la licence s'active sans problème. Ensuite les démarrages sont rapides. Ces 4 petits GB de ram sont amplement suffisant pour une utilisation bureautique. Il est reste fluide malgré plusieurs onglets de navigation internet activés. L'application netflix fonctionne très bien également, pour les amoureux comme moi des séries TV. C'est un petit PC idéal pour rendre une télévision de salon en une espèce de smart-TV. Il peut se fixer à l'arrière et il ne fait aucun bruit. Je l'utiliserai aussi pour montrer a des amis des photos de vacances par exemple, c'est tellement plus simple de brancher la carte SD plutôt que d’emmener sa tour du bureau dans le salon. C'est un très bon achat, je le recommande vivement pour une utilisation comme moi, ou pour des enfants par exemple.",5
195627,Conforme à mon vehicule,5
170459,Idéal pour ranger les sous vêtement et mes chaussette,5
160426,"Lecture facile, claire et efficace. Une approche rigoureuse de chaque expérience soumise au médium interrogé. C'est un livre qui bouscule, bouleverse et fait du bien en même temps aux personnes qui viennent de perdre un être cher. Très très bien",5
193174,Pour porte de sortie,5
196611,"Excellent jeu, la pub n'est plus à faire pour jeu. Bonne histoire, bonne ambiance, jouabilité correct. RAS",5
176372,produit conforme à la description. semble très pratique et facile d'entretien. hâte de pouvoir l'utiliser pour les balades et voyages avec bébé.,5
169183,"je n'est rien a redire sur ce fond de teint , parfait pour ma carnation de peaux (claire) , effet naturel personnellement il n'as pas une très grande recouvrance ou alors c'est moi qui n'en mais pas asse. mais cela me convient parfaitement . la livraison et l'emballage au top . je recommanderais.",5
173179,Très belles chaussures très confortables.,5
189298,j'ai mis cette housse de couette dans un lit ancien et le rendu est super. La qualité du textile est excellente.,5
188959,"Belle valise, pratique, bien pensée et solide. Correspond en tous points au descriptif et à la photo. Belle couleur grise claire légèrement chiné.",5
175901,Senteur au rendez vous mon amie a apprécié,5
198158,reduire la vitesse d un ventilateur,5
188555,produit neuf et commande complète merci.,5
175128,"Tube fragile, qui plie dès qu'il y a une brise. Dommage que la structure des tubes soit sous dimensionner car le reste est correct.",5
196583,"L'ensemble est exactement comme sur la photo, le bandeau est bien élastique et ne serre pas, le rendu est magnifique, je conseil vivement cet article.",5
182459,Très bonne relation qualité prix. Ce n'est pas la première fois que nous commandons des articles sans jamais avoir été déçus.,5
160565,Prix un peu élevé mais de très bonne qualité,5
177620,super produit-rapport-qualité-prix.,5
175230,"Acheté pour l'anniversaire d'une petite fille de 10 ans, elle l'a adoré, c'est très bien expliqué et cela permet aux enfants de faire des dessins très réalistes. Je le recommande!",5
193771,Jeu de détective très bien construit. Contenant 10 parties différentes. Attention une partie estimée dure un peu plus longtemps que mentionné. Textes bien écrits. Les enquêtes vous tiennent en haleine.,5
193919,Les colliers sont très beaux. Je n ai que des remarques sympathiques quand je les porte,5
191813,"Conforme à la description et aux photos, produit bien emballé,et délai de livraison respecte. Je recommande le produit sans problème.",5
162915,"Belle horloge, c'est pour offrir pour un anniversaire, Colis bien reçu en bon état et délais respectés. Je recommande ce vendeur",5
181231,Rien a dire ce produit est impeccable,5
195497,Très bien...conforme à la demande,5
188972,Coque de bon rapport qualité prix. Conforme à ce que j'attendais.,5
180576,"pas de surprise , conforme à tous les tuto sur ce produit. efficace, simple , l'application fonctionne bien, l'autonomie est impressionnante. un coup de main a prendre quand meme et l'absence de joystick pour orienté est parfois frustrant mais les images sont top (avec iphone 6 et 8)",5
195393,très contente .bien emballée,5
8971,Impossible de la connectée,1
21656,Produit pas reçu depuis la commande,1
4496,"j'ai reçu l'album abimé : la fixation en bas ne tenait plus ... vu les frais de port, je ne le renvoie pas mais je suis vraiment déçue de devoir rafistoler un produit acheté neuf ...",1
7184,"livraison en retard envoi dans une simple enveloppe en plastique, aucune protection Produit défectueux, les plumes arrivent décollées plus petit qu'il n'a l'air en photo article vraiment médiocre",1
26186,Catastrophique... L'ampoule a cassé dès la première tentative d'insertion. À fuir...,1
31964,"Colis jamais reçu,décevant,réponse du vendeur incompréhensible fait par un ordinateur avec traduction médiocre",1
12155,J'ai reçu la souri sans la clé wifi,1
6310,La housse de couette et la taie d'oreiller sont en 100% polyester ! Je n'avais pas fait attention en passant la commande et suis donc obligée de renvoyer l'article. Dommage car le dessin était très joli.,1
36816,Ce livre devait etre un cadeau et il n'est arrivé a destination. Aucun livre 120 lieux secrets etait dans le colis,1
22705,"Ce produit n'est pas du tout solide. Je suis déçue. Il a fonctionnné quelques jours puis les touches (volume, micro) se sont bloquées et impossible de remettre le son. Un adaptateur simple suffit et c'est moins cher !",1
30399,Je n'ai pas pu l'utiliser puisque je ne l'ai jamais reçu.,1
9733,"J'ai reçu le mauvais pack, il manque la plume ainsi que les pinces tetons.",1
16382,Un bruit horrible et mes rats toujours la J'ai opté pour la mort aux rats beaucoup plus efface. Plus de rats maintenant,1
27295,Cet appareil a très bien fonctionné pendant quelques semaine et d’un coup plus de son... alors que les boutons restaient actifs et l’appareil connecté au téléphone Après contact avec le sav on m’en a envoyé un nouveau (belle réactivité du service bravo) mais le nouvel appareil a fonctionné deux jours et à nouveau le même problème. Est ce un problème de série ? En tout cas je déconseille fortement,1
37717,La tondeuse aura fonctionné 5 minutes avant d'être inutilisable. C'est une honte!,1
7844,Le rose deja parti au bout d unz journée,1
19722,mauvaise expérience car n'est pas le même que sur la photo de l'écran ordinateur donc site d’Amazon,1
5685,Le produit n'a pas duré une année scolaire: une bretelle s'est décousue. Le sac n'a pas supporté le poids des cahiers de 6e.,1
29395,"L'appareil ne convient pas du tout, et impossible de le retourner. vraiment très déçu de cet achat qui s'avère inutile.",1
30774,Temps de livraison non respecté meme avec l'abonnement Prime. plastique de mauvaise qualité...la regle est arrivée tordue. cher par rapport à la qualité.,1
37991,Je n’ai jamais reçu ce produit mais on m’a pris les sous. Aucun moyen de ce faire rembourser ....,1
12226,Bonjour Impossible de recevoir ce produit 4 mails envoyés sans réponse intervention d’amazon Sans succès ARNAQUE,1
21765,renvoyé et remboursé,1
12120,"Tres compliquées d'utilisation, 1 sur 20 qui fonctionne",1
24353,pas bien pour différente chaussettes vue la pub sa marche pas aussi bien,1
24016,Je m'en suis servis une seul fois et elle ne fonctionne déjà plus pour la deuxième utilisation . Une fuite que je ne trouve pas donc plus d'air ne sors de l'embout !!!!!,1
28281,"Je n'ai pas reçu l'article, et on me dit que j'ai été livré....",1
13902,impossible a utiliser pas de notice en francais,1
13889,j aurai du être livré le 8 juin et le 20 toujours pas reçu ma commande.!!! Pas de nouvelle de ma réclamation au vendeur... a éviter si possible.,1
15854,objet de mauvaise qualité. la poche d'eau contenant l'oeuf a été tout de suite percée. je ne conseille pas cet achat,1
33385,Je n’ai pas reçu le crayon,1
16490,Je n'est jamais reçu larticle esque c'est normal ? Je trouve sa inadmicible ! Je veux être remboursé ou envoyer moi cet article,1
22241,"Erreur, l'article ne correspond pas à la commande passée ! Dommage !",1
17531,"Utiliser une semaine car le bruit était insupportable, de plus côté horaires, absolument pas précis.",1
5362,Ne se monte pas sur mon appareil donc (pas universelle) ARGENT PERDU,1
26561,"Vu la note j'ai commandé ce produit sans me poser de question, j'ai quand même lu quelques commentaires mais plutôt confiant. Par contre lors de l'installation de ce verre trempé...quelle déception !!! Le verre n'est pas à 2mm du bord du téléphone mais 2 mm du bord de l'écran... En gros l'affichage est déformé par le bord du verre !!! Super désagréable. Je déconseille ce verre trempé à tous les utilisateurs de Samsung A5 2017 !",1
32469,C’est casé au bout de 1 mois,1
12437,"Nul ! Se collé uniquement par les deux côtés arrondis, donc pas bien appliqué. Hyper fragile, se casse déjà sans pour autant tomber (et bien que protégé en plus par un clapet). Et se salit très rapidement par les traces de doigt.",1
27135,"Cette ampoule est totalement inefficace. Les insectes sont attirés par la grosse lumière mais ne vont pas à côté sur la lumière bleue pour être tués. En 3 heures seulement 3 moucherons. La description du produit précise que les insectes tombent tout seuls après avoir été brûlés. C'est faux, ils restent comme collés sur l'ampoule (dans mon cas elle était tournée vers le bas). Apparemment on peut aussi changer la mode de fonctionnement de l'ampoule, comme éteindre la lumière pour ne laisser que le tueur d'insectes. Je n'ai pas trouvé comment faire. En bref une ampoule totalement inefficace contre les insectes. Passez votre chemin.",1
17161,cet article est tombé en panne au bout de 2 heures,1
24582,Une étoile car le produit arrivé était percé. Le SAV (top) m’en a renvoyé un autre mais le 2ème reçu s’est percé ou déchiré après quelques semaines. Ne dure pas dans le temps et pourtant mon enfant a joué très peu avec.,1
30608,"Une fille qui accepte d'épouser un militaire agent secret sans connaître son visage en mettant sa vie privé de côté pour garder le secret ( même sa famille ne doit pas le savoir ). Elle fait l'amour avec lui qui garde sa cagoule pendant les rapports, je trouve ça vraiment trop glauque!!! Surtout qu'il a commencé à lui plaire parce qu'elle avait vu son torse...Sabine décide bien vite de partager sa vie de manière définitive avec un homme qu'elle connaît à peine...",1
12158,Impossible de coller sur un SPA coté extérieur cela ne tien pas.,1
20028,Jamais rien reçu et aucun remboursement Amazon me fait comprendre que c'est à moi de me débrouiller alors que si j'achète chez eux c'est pour la sécurité.. Vraiment déçu 👎👎👎,1
18202,Réception en retard de la commande pas de message de la part du fournisseur,1
21981,"Produit de très mauvaise qualité, percé en plusieurs endroits. Monté sur une pompe pour un usage de jardin ordinaire (arrosage) Durée de vie 2H !! Plastique de structure interne, cassant et ne résistant pas à la pression ! 50 Euros à la poubelle, Merci...! Bien à vous",1
3412,"Trop petit pour un bac XL et les sacs sont trop fin. Ce qui ne sert à rien, le sac se déchire avant que l’on puisse le nouer.",1
23035,2 produit ivoler . et 2e qui ne tient pas la durée. prix intéressant mais : fonctionne tres bien au début. 6 mois plus tard la charge rapide est out. .. donc au bout du compte le contrat est loin d être équitable.,1
35048,Je nai pas reçu cette article dans ma boîte au lettre,1
11741,"je ne sais où vous joindre mais je vais devoir à nouveau commander ce livre, vos chauffeurs sont au moins priés d'essayer un minimum d'effectuer la livraison ou je ne commanderais plus chez vous! Que de temps et d'argent perdu! Même pas un appel, je suis toujours présente... Extrèmement déçue...",1
20411,"Bonjour , je j ai pas reçu la commande alors que j étais chez moi , le vendeur n a même pas sonné !!!",1
32291,Bjr veuillez me rembourser mon produit merci,1
25562,Après un mois d utilisation elle ne démarre plus direction poubelle !!!!! C est la deuxième avec le même problème !!!,1
36735,"Très très forte odeur chimique quand on le sort du packaging, avec des finitions moyenne, et la doublage orange à l'intérieur ne correspond pas à la photo .",1
1743,"Bonjour, après utilisation, le revêtement interne montre des signes de dégradation pourtant je n y mets que de l eau, des tâches noires sont apparue au fond de la cuve comme des traces d oxydation du coup je ne l utilise plus, je ne recommande pas du tout cet article pour cause de problème évident de la matière utilisée a intérieur",1
7426,pas eu ce dvd dans ma boit a letre,1
7338,Je n'ai malheureusement pas reçu ma commande merci encore une fois à chronopost encore une fois les seuls et uniques incapables de livré un colis chez moi ! Bien dommage,1
5995,"Je ne sais pas quelle société à livré mon colis mais c'est pas des bons ! je reçois une notification colis livré dans ma boite aux lettres, j'ouvre donc et là rien de rien ! Donc livré mais pas chez moi ! merci pour l'incompétence du livreur, je l'invite à partir à la recherche de mon colis jamais reçu ! En colère...",1
36991,Merci Amazon de laisser mon commentaire. La batterie après 164 kilomètres n'est plus capables de faire plus de 10 kilomètres. La vitesse est passée de 30 à 27 kilomètres par heure en une semaine. Je ne recommande pas ce produit,1
20535,Rien pour faire les branchements. Vous devez réaliser vous même les cables. Et bien sur pas de notice dans l'emballage pour expliquer comment faire. Pas du tout satisfait.,1
15121,"Produit non conforme au marché français, livré avec une prise anglaise et un adaptateur non compatible pour la france. Le vendeur nous a remboursé partiellement pour pouvoir payer un transfo conforme mais une fois mis en route l'appareil fonctionne à moitié donc impossible de s'en servir. Le vendeur vous envoie des mails pour vous supplier de ne pas faire fonctionner la garantie pour ne pas être embêter par Amazon, à éviter",1
21420,"J'adore ce jeu mais, sur le Kindle Fire, impossible de le connecter avec Facebook pour retrouver mon historique de jeu. 😠",1
19111,"Tout simplement de la camelote ! De plus, les coloris ne correspondent aux couleurs de la photo. Les torchons sont affreux.",1
34562,j'ai eu de gros problèmes avec cette montre. Le bracelet s'est cassé. Impossible de réparer. J'ai acheté un bracelet de remplacement . Actuellement elle retarde malgré un changement de pile. Comment faire pour la retourner chez vous? merci de répondre à mon adresse,1
77027,j'ai reçu les écouteurs dans un très bon emballages mais l'oreillette droite est casser et retour payant donc je ne recommande pas ce produit !!!,2
58303,Pour mon déménagement...pour de petits cartons..il n'est pas très stable,2
49399,"produit au top , trop mignon mais par contre pour la livraison 4 mois de retard , je ne suis pas contente de la livraison, je ne recommande pas",2
58169,2eme commande en 6mois chez le meme marchand. Les nouvelles cartouches ne sont pas compatibles avec les anciennes. Il est nécessaire de tous les remplacer en même temps !,2
60188,"La base de savon fond vite au micro ondes. Une fois dans le moule ça durci vite. Malheureusement le savon ne mousse pas et à la touché c'est gras. Simple à utiliser pour faire des savons avec les enfants, mais la qualité n'est pas la....",2
65554,montre facile d'utilisation mais ne dure pas longtemps pourtant le son est bien ce n'est pas de chance dommage dommage,2
48149,Il sont pas mal mais très déçus après 2 utilisation certain ne fonctionne déjà plus,2
67741,"Coque integrale, avant et arrière ,couvrant le tactile qui rend celui-ci beaucoup moins sensible. En plein soleil l’ecran devient illisible.... Je ne recommande pas",2
61317,Pas cher mais dommage que je l ai reçu pliée en 2 en espérant que ça ne se voit pas une fois collé,2
54712,En remplacement de H4 d'origine je pensais gagner un peu en intensité mais il en est rien.Aucun intérêt.,2
43244,En deux jours plus de panier.,2
63480,Très ludique et adapté à notre enfant de dix ans. Cependant à la première utilisation l’arbre central a cassé net. j'espère trouver facilement une pièce de remplacement,2
77059,"Qualité médiocre, produit rayé en de nombreux endroits.",2
50373,Pas terrible comme lentille !,2
46922,"Je me suis fié aux commentaires, mais je n'aurais pas dù. Le plastique n'ai pas d'une qualité exemplaire (j'ai l'habitude d'utiliser de vrai casque de chantier et c'est le jour et la nuit coté qualité). Les fixations pour les éléments du casque ne sont pas solide, de même pour la grille et la mentonnière. La grille n'est pas métallique mais en plastique et pas très solide (une petite branche d'arbre devrait la faire éclater sans trop de problème.",2
70454,C’est pas de la bonne qualité,2
66584,"Encore dans l attente de mon produit donc difficile à évaluer mais en tout cas très déçue du retard de livraison prévu au plus tard le 6 Mai on m envoie un sms le jour même pour me le repousser au 7 Mai pour finir rien à 17h, j appelle GLS et il me dise que la livraison est prévu pour le 9 Mai car ils n ont toujours pas le produit. Hâte d être à Jeudi pour connaître la suite de l histoire.",2
55363,"Le piquage des fibres est clairsemé, on voit le tissus blanc à la base. ils auraient du mettre un tissu noir en support. déçu !",2
66870,"Très jolie coque. Au départ j'étais ravie, elle etait très jolie, se clipsait. Elle semblait solide. Mais 6 mois après, un des clips s'est cassé et du coup la coque se tient plus. Je suis decue car elle a une très jolie couleur et me plaisait beaucoup..",2
76796,"Commande livrée rapidement , un peu déçue du bois qui est humide et légèrement moisi, mais surtout en montant le produit je me suis aperçue qu'il manquait 2 planches de bois de petites tailles et je n'ai pas la possibilité de contacter le vendeur dans mon interface client... comment faire??",2
63374,Dommage que les dimensions soient trop petites pour un double matelas d'épaisseur 30 cm.,2
71050,Piquets trop flexibles se tordent trop vite! Filet qui ne tient pas ! Nous avons du tout ajuster ! Envoi parfait,2
40418,Pour information cette tablette est géniale au niveau du vidéoprojecteur par contre surchauffe du chargeur et la batterie se vide très rapidement. C'est dommage compte tenu du prix.,2
74249,Cela ne protège rien ne compté pas sur c'est produit pour protégé votre téléphone plastique qui se tort dans tous les sens . Si le téléphone chauffe le plastique deviens élastique ... Ne le prenez surtout pas,2
72894,"Hori pour les accessoires Nintendo est d'habitude gage de qualité. Cette fois-ci je suis déçu de constater qu'après 5 mois, la charge de mon appareil est aléatoire (utilisé tous les jours car en plus de ma Switch, je l'utilise pour mon téléphone dans ma voiture). Suivant la courbure du câble, l'appareil charge ou non. Pas pratique.",2
77335,"Comme beaucoup. Batterie HS en a peine 1 an. Et pour 10€ de plus que le prix d'une batterie de rechange vous avez une nouvelle visseuse avec sa mallette, sa batterie et son chargeur. Efficace quand elle fonctionne. Déception.",2
77161,Colis reçu mais la tête du bouda est coupé.,2
59896,"Nous avons du attendre assez longtemps pour recevoir nos balles de ping-pong. Nous les avons achetes pour amuser nos deux chatons. Malheureusement ces balles ne sautes pas beaucoup et devient creuse assez vite. Je sais qu'elles ne sont pas cheres, mais nous sommes un peu decue. Peut etre qu'elles viennent de la Chine, je ne suis pas sure. Pour amuser les chats ca va, mais elles ne sont pas bonnes pour jouer au ping-pong.",2
