106526,"Bien que j'ai 'ai payé pour un produit non utilisé, j'ai reçu un produit qui venait certainement d'un retour et avec des rayures sur la peinture. Le pire, c’est que sans doute la raison du retour était que le verrou s’était bloqué parce que la goupille du cadenas s’était frottée contre l’anneau (bague) de la base. J'ai réussi à l'ouvrir (pas facile) et j'ai dû fraiser moi-même la bague de la base. D'autre part, bien que l'ensemble soit apparemment très solide, le système de fermeture du cadenas n'est pas aussi solide (je ne dirai pas ici quel est le point faible du système de fermeture). Bref: pas trés content.",3
94206,"Télécommande défectueuse donc remboursement du vendeur sinon le projecteur en lui même est bien, le réglage de l’image est à modifier à chaque fois j’ai l’impression mais en quelques secondes c’est réglé, ne fait pas trop de bruit et ne prend pas trop de place.",3
85341,"Je suis très contente de ce produit, il correspond tout à fait à ce que je m'attendais. Juste dommage qu'il soit déjà abîmé en arrivant... petite éraflure au niveau du nez...",3
94333,"Bon allume feu, mais sert plus de gadget qu'autre chose. Bon à savoir : le produit est livré vide de gaz (normal pour des raisons de sécurité), donc prévoir de quoi le remplir. Mériterait une jauge pour vérifier ce qu'il reste comme gaz à l'intérieur.",3
92637,Très content de l'achat grande capacité sortie audio avec un haut parleur intégré et une bonne autonomie Le hic après un peu moins de 12 mois d'utilisation le MP3 bug et ne s'allume quasiment plus...la fiabilité n'est donc pas au rdv d'où les 3*,3
103250,"Au niveau de l'histoire il n'y a pas à dire c'est un très bon Marvel. Coté support, le Bluray 4K n'est pas extraordinaire. Au niveau de l'image on fait beaucoup mieux (déçu pour pour du 4K). Pendant une cinquantaine de seconde, dans le film, j'ai même le droit à des gros carrés et une image déformée. A l'inverse le son est correct.",3
116490,Conforme à la commande très solide . Dommage que la taille soit si petite il faudrait peut être les faire un peu plus grande .,3
106537,"Ayant reçu la licence par mail, je ne l'ai installée que 4 jours après. Est-ce cela qui a perturbé son installation? Le fait est que l'activation en WEB n'a pas fonctionné et il m'a fallu réaliser l'activation par téléphone. Il s'agissait de mon dernier recours car la Sté n'a jamais répondu à mes messages.",3
110203,"Trois étoiles pour ce jeu, bcp de petits jeux me prend bcp de surprises! Mais pour le tambour, je ne peux pas le donne même une étoile pour le mauvais sensibilité!!!!! Le qualité de le tambour n’a pas de valeur de environ 70€. Moi je pour ça c’est très très découragé.",3
82538,J'utilise ce produit pour épiler mes sourcils. Le produit est passable. Je pensais qu'il était plus précis et qu'il prenait bien le poil.,3
119097,"Bof, mon chat n’a pas aimé, ils eu du mal à rentrer, le trou n’est pas assez large et le bac un peu trop profond, dommage.",3
113782,"La photo du produit commandé ne correspondant pas au produit reçu et la commande étant un cadeau d'anniversaire pour mon petit-fils, je n'ai pas pu vérifier si le contenu de la boite était conforme à la commande. je pense qu'à l'avenir j'éviterai ce sous-traitant d'Amazon.",3
87193,"je suis moyennement contente, pour le prix je ne m'attendais pas à quelque chose d'extraordinaire, mais il s'avère que retirer la couleur sur la plume pose un réel soucis... dommage...",3
91332,Produits reçu rapidement conforme très agréable la couleur et un plus clair que sur les photos,3
103697,"Pages un peu fines, il manque un peu de rigidité à l'ensemble, mais à part ça, fait très bien l'affaire.",3
80804,conforme à la photo. pas une super bonne qualité mais pour le prix ça passe. dommage que l'intérieur soit blanc ça se voit si on fait pas attention de bien les mettre.,3
86739,"deux jours après avoir reçu les agendas, le code est bloqué. Nous ne pouvons plus ouvrir les agendas.",3
110726,Très pratique mais livraison interminable... Notre chat aime bien. Je ne sais pas si ce sera très solide mais je garderai le patron !,3
