143691,"Covers well, does not match exact, but impressive still!",4
158685,"This wallet is amazing. The only reason I don’t leave a 5-star review is that the keychain was not made for a small amount of keys, it’s either you have 4 keys or you have over 8, the bolts weren’t built for for example 5 or 6 keys. Otherwise, this product is a must have for all men! Definitely recommended, sturdy, solid, overall great! Go buy it.",4
135351,I use these clips to put half of my hair back at work. They even hold fine hair.,4
120552,No complaints of as of yet. Received the case in good condition. Fits iPad Pro 9.7 well. Not too heavy. Aesthetically pleasing while offering protection without adding much weight. My only gripe would be that I can’t fold the cover completely behind the iPad if needed. Recommended otherwise!,4
123721,"This is a short read, and in case you're occupied with investigating what reflection brings to the table you, this is a decent place to begin. The creator gives a speedy establishing in the history and the many advantages, and rapidly proceeds onward to the different sorts of contemplation hone. There are many tips gave on the best way to give yourself a decent possibility of accomplishment in building a durable and advantageous propensity. It's entirely fundamental data, yet that is the plan.",4
129333,I like re case very much.I liked the fact that it fit my phone well.,4
126792,"It took some getting used to, but is a good choice.",4
158413,"Smells funny, but looks good!",4
130313,"But it’s a genuine subaru part, which can be (expensive). Much better than anything you’ll buy at a auto parts store, so there’s that. It’s sturdy, the glossy emblem looks great and comes with all the hardware. Plus I like the fact it actually has the plate slide in and is held by the frame itself. Not to pick nits. Just wish the frame itself was a bit darker and shinier. Would really make it pop for the money. That’s all.",4
155950,The bottoms fit perfectly but the top does not cover my breast the way I want it to(I expected that),4
130054,"Great price good product, but lost a star for the extended amount of time to deliver",4
132046,I’ve had this for about a month and it’s holding up pretty good. I haven’t used the spoons the came with it yet but the bowl is my go-to for my infant’s meals. The only thing that’s worrying me is the color is somewhat fading and i have been washing the bowl by hand without using any abrasive cleansers. Definitely better than plastic bowls (toxic) though. Will repurchase if needed.,4
132883,"More zombie madness, what's not to like? If you've read this far you probably won't need a review just saying.",4
157558,"The backpack is vibrant in color, durable and inexpensive. My 5 year old daughter uses it for camp and its perfect. Might be a tad too small for school because of the binders they have to carry but its great for camp and travel.",4
151586,"This product is sleek and I like that it fits in my pocket. The fingerprint works but most often I have to scan twice. That being said, I have to scan twice when its out of the case as well. I can't give a rating on durability because I have not had the case very long (about a month) It seems to be durable. I have had similar cases that have lasted a long time. The phone does not fall out of the case and I like the raised edge around the face of the phone to prevent screen cracking. I like the color of my phone and the clear case was a great choice as it fully displays the phone. Overall I am happy with this purchase.",4
132242,Good product just a faded black. Use them to work out in. Will buy them again,4
149734,"they appear well built, and i was fearful to wash them in the dishwasher at first, but after 10-15 cycles they still appear brand new. i've had some other brand utensils fall apart because of the heat.",4
133749,It is the third time to buy it. It is good,4
158622,"Decent quality tools, and good selection of useful items. The hammer is a good weight and not flimsy like in other kits. The bag is very nice and has extra room. Put together dresser, desk, nightstand and other apt items no problem. Cons: needs a multi blade small hand saw had to buy one separately. Also doesn’t come with basic screws/nails for hanging pictures or any electrical or duct tape. Adjustable wrench would also be a plus. All in all a decent set for the price. Just know what you need when comparing - no one needs a 100 piece set where they count items you will never use.",4
157049,"This is a lovely set of 10 fancy fashion doll dresses for 11.5 inch dolls. The dresses are handmade with Velcro closures, and in random colors and styles. I like that they fit both newer and older style barbie dolls, and that the Velcro closures make them easy to put on and remove. They are of decent quality and the assortment I received is very nice, without any repeats, although four dresses do have the same bottom lace. I had to trim a couple of threads that were sticking out but nothing major, and the Velcro closures feel quite strong. I received the following dresses in my set: 1 red dress with lots of lace and a bow with hearts on the top, 1 dress with a white top and layered ruffles in purple, pink, and blue, 3 blue dresses, 1 with multi-colored metallic droplets covering the dress, 1 with a bow around the waist and pink dotted lace, 1 with a neck ruffle and pink and white floral lace, 1 white dress with silver butterfly wings on the top, 2 purple dresses with different styles of lace trim on the top, and pink and white floral lace on the bottom, and lastly 2 pink dresses, 1 with lace and darker pink on the top, and pink and white floral lace on the bottom, and 1 with sequined ruffles. I like this set of dresses a lot, and I would definitely recommend it to others.",4
152311,Item served it’s purpose and good price for the quantity. I don’t think I would describe these as heavy duty.,4
131359,"I love these for their warmth and the waterproof, they are solid. I have been wearing them everyday for months, no signs of wear. The only problem I have with them is the hooks at the top for the lace. I caught myself a couple times and fell flat on the ground. I prefer holes for the lace all the way to the top.",4
145926,Very easy to assemble.,4
152580,Great to have a book that focuses less on the financials and more on how to enrich your retirement. There are certainly some techniques I will use to help me in my transition to retirement.,4
139825,Not very much product in the can.,4
134883,"The product itself is very good. The only thing is the smell on the shampoo can be overpowering sometimes and smell really musky after you shower. I love the pump it comes with, easy to ration your use of shampoo and conditioner.",4
153362,"This has been great for my kids - they are willing to do the sprays several times a day without too much complaining. They do like a drink after to rinse it down, but it's worth it knowing the protection they are getting from using it daily.",4
151032,The size was good for two and for camping,4
122794,"Note: Changed this review from 1 star to 4 stars after the seller reached out to me and issued a full refund (I did not even have to return the unused portion). This is good seller and you have nothing to lose by trying this product. If it works, then that's awesome. If not, you can get a refund. That being said, this product did not help our dog. We have a 14 year old female shepherd-hound mix who has developed separation anxiety. We were hoping these would help, but, although she enjoys eating them, she still barks constantly and gets very agitated when left alone.",4
135780,"Fit a 2007 Honda Civic LX, got the A/C running. The two snap rings included didn't fit, the included shims were a different size than the existing parts. I used the old snap rings, shim, and nut. The splash guards inside the wheel well and the front of the engine needed to be removed, to get at the compressor from below. A number of the plastic clips broke and needed replacing. The A/C Compressor didn't need to be removed, but needed to be unbolted from the engine to create space to remove the pulley and coil. Needed a fairly narrow set of 8"" external snap ring pliers to remove the coil. 6"" didn't get deep enough, adjustable square nose pliers didn't have enough space to open. The new pulley was a tight fit, engine assembly lube helped push it onto the spindle.",4
142258,Large enough to cook pancakes for two all at one time.,4
122066,Good like the detail chain is a bit weak when it get caught on items,4
154175,"Good product, but way to expensive.",4
125386,I can’t mark anything for durability yet bc I’ve only had it a few days. But the case exceeded my expectations when I was searching for a soft jelly like feel type of case. I went with the softer more pastel yellow. Which is incredibly cute but I should have went with more of a mustard for my personal style. The open front case made for easy installation. Previous cases similar in the past are all jelly like silicone through and through. This one caught my attention as soon as I opened the package due to the back part which my phone sits on is lined with a thin layer of suede or a suede like material. This has been the best case I’ve gotten for my iPhone. If you have a tempered screen then the jelly case is the perfect amount of protection. I will look into more colors and variety and will definitely look at this seller first.,4
124001,Seems to be good quality and roomy enough for everything I need to carry.,4
