1020,"....like just about every other page!! I couldn't believe when I started reading this (with Book 1) and around the fifth chapter, things started feeling freaky. Dialog didn't continue, descriptions faltered, and why? Because every other page was missing. When I checked the other books in the bundle, the same thing occurred. Unfortunately, there's no way that I can find to complain about this to anyone at Amazon. I tried re-downloading, but as I 'm in the midst of another bundle (and this is the first time this has happened since I bought the kindle) I haven't checked to see what's what yet. I will edit this review with an update when I have done so.",1
6268,"Cheap and defective. Too late to return. Oh well, I should have known it was too cheap to be reliable.",1
16308,"Leaves a yucky taste in my mouth and the texture is creepy, sending them right back!",1
10721,Bulbs were marketed as purple and I purchased and came in pink. Do not buy if you want purple. Seller never returned my question about rectifying is issue.,1
35707,"The leash broke, container on the side broke, now it's just a flashlight",1
17250,I had read some of the other reviews prior to purchasing but didn’t think much of the ones that stated it smelt like gasoline. However those were the ones I should have paid attention to. It was so strong I had to return it. My wife even asked why there was the smell of gas in the house.,1
2418,My American Bulldog chewed this toy for aggressive chewers apart in 10 minutes ☹️,1
31510,Wouldn’t fit in my iPhone,1
15048,The sleeves are very thin and it's difficult to get my card in and out of them. The sleeves aren't roomy. You have to work to get the card in them to begin with. Please save your money.,1
26024,sneakers were advertised as extra wide - not even close. I need to return / exchange or get a refund,1
19508,I order this item beginning of January and did not received this yet. Was suppose to be delivery on January 10th and today is February 25th and still nothing .,1
39873,I’ve not even actually worn this headband for an extended period of time; only tried it on a few times and it’s already broken. Now I have to go through the hassle to return it. Garbage costume jewelry.,1
28830,Ordered 8 bottles. No consideration was given to the expiration date. Fresh mayo is 6 to 9 months out. These barely 3 months. I'll wind up throwing out at least half. Won't use Amazon pantry again. Beware is expiration date matters expiration date,1
8278,Useless.. dog continued to bark.,1
30266,One battery after few usage got bulge.,1
34637,Poor customer service. Battery has week power,1
22610,Used on my airbags for my truck suspension. Worked great until a load of stone was put in the bed. Blew it to pieces. Ordered piston style valve from grainger. This may be okay for air horns but nothing with air bags. Not recommended.,1
3972,"Product never arrived, and the company didn't respond to repeated messages. Amazon refunded me.",1
22499,"W removed and then installed this replacement fuel pump, and it doesn't work!!!! They have a note in the box to not returned it to them. The old fuel pump will start the vehicle but it will not continue to pump gas to the carburetor. This new one will not do that. I need a refund!!!",1
8049,"Paid for the subscription, but never received the magazine!",1
23434,I didn’t even get what I ordered.,1
39587,The blind person who packaged my order owes me an apology. Genuinely curious how this even happens?,1
19369,Unit didn't work. Too cheap to bother with replacement or refund.,1
20634,I have been very disappointed to not be able to find the American Crew Classic fragrance anymore seems It's been discontinued. I decided to try this one and while it lasts a long time it's a very very strong and just doesn't compare to the original. Wish I could have returned it but third-party seller not returnable,1
10265,I believe both of these lasted under 20 minutes with my boys. They ripped the squeaker out within that time and the rest of the toy fell apart. Shocked as most Kong items last with tough chewers but these did not. Would not buy my boys these again.,1
10897,"This was purchased as a gift. The first time the cutter was finally used was after any return period, and the extender measuring arm was glued at its base, so it could not be opened without breaking the connecting plastic. The cutter can no longer be used to make accurate measurements over the small size of the base piece. Very disappointed as this poor quality, especially from a Cricut product.",1
17061,Ordered black color and received red. Assembler from Amazon Home. Assembled for propane instead if natural gas and then refused to do it correctly saying “ call Amazon”,1
2705,"Normally I buy thistle from Walmart but they were out of stock for a few weeks so I ordered this product. I use socks and finches in my yard typically devour thistle like crazy until I bought this product. Cleaned socks and refilled and also tried using in a flat bird feeder and they still would not eat it. Once Walmart obtained inventory I bought it, dumped the Pennington seed and replaced with Walmart product. Birds are again happy feeders Pennington seed now in garbage.",1
33902,I ordered this item and received something completely different!! And I have no way to contact anyone to fix it. Product might work just never received the correct one.,1
6404,Dont buy them!!! They work for a couple of days only!!!! Waste of money!!,1
18222,Cheap for buying but initial use showed fraying of the wires in the belt!,1
8834,Very cheaply made! The pendant fell off the first time she wore it!!,1
386,"Ummm, no.....the ends of the rings are sharp, once you open the ring a little to put it in it's a major pain in the *** to squeeze it back closed, and the color on the colored ones is like a film of some sort that peels off (while I am wearing it!) if I wear it for more than about 24 hours (this was very embarrassing!). The one, and only one, plus for them is no skin reaction of any kind. Hence the 1 star. So again, NO....sorry, don't waste your time or money unless of course you like doing that sort of thing (NOT!).",1
5790,I was disappointed. You can see the colors and designs on the mat and they become more vivid with water. Doesn’t last 10 minutes either. Maybe 10 seconds.,1
16894,"I found it odd upon opening that the suction cup was smeared with a type of glue... 3 months later, under the hot California sun, the glue melted. I cleaned it off and realized that the suction cup was not made of the usual rubbery material but just soft plastic and could never have provided complete seal for suction. So some body must have screwed up in the design or manufacturing process and decided to work around it with glue! Well, look at the picture and you can see the result. It is a piece of trash now.",1
8977,I put it on last night and haven't dropped or mishandled my phone once yet somehow it's already got a fine crack in the glass. plus the very edges of the protector won't lie flat on the screen.,1
8894,"These are both too short, too sheer and have a funny gusset in the crotch. The waistband just sort of ends with no actual elastic so they don't stay up. Sadly, I wore them to work but will run out to buy a new pair cause it's too cold to go without tights. Don't buy these. I am 5' 10"" and 170 so a L/XXL should be fine but these are crap. I may send them back or ask for a refund because they suck.",1
35849,This did not work at all. Very disappointed!!!,1
29871,These are not BRIGHT AT ALL. In fact you have to really look at them to see they are lit at all. For the price I am very disappointed and would not recommend them.,1
5502,I bought two of these. Neither would program for use with my car. Do not buy this item.,1
36745,Clearly not packaged correctly and after sending a message asking how I’m supposed to return it looking like this I still haven’t heard back. I am usually never one to complain but I had to share. Very disappointed,1
43423,"I hate to leave a bad review because I really like how this works and using it to relieve stress. However, after just a few normal uses, the seam broke and spilled out the rice. I’m not sure if I got a defective product or if it is made poorly, but it’s really frustrating that it broke just a few days after the 30 day return window. It’s not like this is a super expensive item but I definitely would expect it to last more than 1 month for the price. I’m giving it a 2 because it worked well before it broke.",2
62557,"Pretty useless for anything other Than standard Folgers ground coffee. Forget trying to grind whole beans to use in this. The second anything other than a drug store Blend is in this filter, the machine freaks out and starts to overflow.",2
68767,Not very bright at all.,2
71771,"The first two boxes of these seemed good. Slightly thin, but good. The last box I received however is completely unusable. They stink like sulfur, and leave the smell on your hands also. Completely unusable for anything medical.",2
79125,It's a nice ring but colors are not as shown. I wanted a blue ring but that's not what I got,2
66654,"The product is slow and quirky, locks up and poor touch screen. I have geek squad on it many times still happening. Wish I could send it back but we took it on an extended trip and it was nit possible.",2
71397,Not for me. I tried to get ingredients list before buying - I was allergic to some ingredients. I gave it to a neighbor,2
49613,"The picture and description of the item is misleading. They are paint makers, not good for glass or stone. Very misleading",2
79518,They are hard plastic and I feel that once they are on. Putting them on is a hassle. I cannot reach around and put them on once the bra is on and it is almost impossible to put them on first and turn the bra around. I live alone and needed someone to help me with them. Not for me but maybe okay for others.,2
60372,I ordered the correct part but when I tried to line the holes up they didn't match. The holes in the rail were about 1/32 of an inch off. The screws were also the wrong ones. Wrong thread. I sent it back. It looked good. Seemed to be well made and if it fit probably would have been excellent.,2
43701,Some items were of better quality than others.. some items only lasted 5 mins with my dog who isn't an active chewer.,2
60923,It will cover the case but that's it. It's not a snug fit and adds a lot of bulk to the case. It needs to be thinner and tighter.,2
73050,"Two day shipping meant five days to start off with then when I installed the fixture today, both ends were bent, the light bulb receptacles had to be bent and manipulated to make them appear straight and one of the cages that hangs down is broken. After all of the rigging I had to do to it to make it work, it’s not worth it to return the light but I could have gotten better quality for this price at a big box store. Disappointed..",2
68332,"My hair feels dry after using ,plus so much dye (purple) comes out it gets all over My blonde doesn’t seem any brighter",2
58937,Look nice but start peeling in area where magnet strap is,2
61580,Followed instructions but still leaking badly.,2
72319,"After using just a little of the bottle, the pump broke on one bottle and on the other bottle the entire pump broke off spilling the entire contents, what a wast, cheap design.",2
69163,Bought this for the interval timer and heart rate monitor. Very disappointed to find out there is no heart rate monitor as shown in the photos. Interval timer works as needed.,2
63322,"Does not quite fit, as it does not cover the screen entirely, so it creates a weird line on both long sides of the screen.",2
75734,Doesn't have very long range and needs kinect to do tv,2
41477,"OK. I am officially done buying cheap garden hoses. Seriously. This thing burst in 32 days. Yes, I left the hose spigot on, but we didn't even break 90 degrees a single day during the month that I had this hose. It burst and was useless in literally 32 days. Amazon, thankfully, accepted my exchange on this hose, even though it was outside of the return window. But now, I am about 15 days into my second hose, and I just can't take the kinks! Literally kinks just by pulling it out. I am returning this hose and buying a hose that is more than twice the price of this one - and 30' shorter! Hoping that 'more money' doesn't equal 'more problems' in this scenario. I, for one, am completely done buying these multi-ply hoses. I am going to invest more in heavy duty, all rubber hoses, and hope that they last longer than a month! Any hose brand that claims ""never kink"" - either in the product title or product description, is a liar - and most likely, their hose kinks worse than any hose you've ever owned! Who would have thought that I would start critiquing garden hoses! I guess they are right - your interests change greatly as you age.",2
52097,Works but camera is pretty blurry. Would not recommend.,2
45795,"The picture shows 2 jars which I expected to receive. The fine print says 1 pc. Its quite deceiving and wrong. If i had known it was only One, I would've gotten something else. Its quite irritating.",2
61134,This product doesn't last long.. It was fine for 1-2 months. later it's not working at all.,2
78286,on the plus side this is the longest I've had a kettle last... are they all so cheap?,2
63253,"I usually buy these from Whole Foods stores, so I tried the convenience of Amazon to my doorstep. What a mistake. Half of the noodle packages contained awful, defective, scrawny, chewy gross noodles which I had to throw out.",2
47299,"Not useable. The vertical bar was clearly cut at a slight angle at the bottom. Upon tightening the screws, the bar goes totally crooked, meaning that the tv would be crooked. Seems like pretty solid build quality and weight, it’s just sloppy... Returning unless the new vertical piece can be sent.",2
58432,Came with only one case and a dozen plugs. Nonsense.,2
55441,Roller keeps falling off most of these bottles. So disappointed as I use these for items that I sell.,2
64993,Can't really get an accurate reading.,2
70257,Really needed orange for thanksgiving project and got a tea/green colored “yellow” which doesn’t coordinate with anything. Two stars for speedy delivery.,2
40450,Item came in excellent packaging and in a timely manner. The reason for the 2 stars is because it contains high fructose corn syrup and it was purchased for my disabled husband and he can't eat food with this ingredient and I wouldn't have purchased if known otherwise.,2
46186,The hat did not fit my head. Looked weird. Also the logo wasn't horizontal,2
78025,Was disappointed with this shirt. It was very heavy spandex type fabric that is a fitted size. Not the loose flowy style in the picture.,2
41300,"It is very gentle on your head and works if you get it positioned just right. It's pretty easy to knock it off, though. Could be more snug - my head is not small at all. After wearing one regularly for a month, the inside padding started peeling apart.",2
47647,"They aren’t sealed, none of them are. So how do I know if they are actually new? I read reviews before purchasing and they said each one was sealed - not accurate. Missing the regular label you would see if you purchased a normal one. I took a picture of what a new sealed one looks like (vanilla one in picture)",2
78635,Box damaged and ripped open.,2
70224,"It arrived properly sealed. It had no smell to it, I tried to smell it, it was a very weak vanilla smell. I started my vanilla extract on March 28, 2019. I'll see how the extract turns it in June when is completed.",2
79382,It arrived on time. The beads are not 8 mm they are more like 6 mm.,2
42810,Was really bummed when this didn’t fit. Love the color and the cut was just too small in the bust.,2
61801,"My daughter is 11 and catches. The bag was the perfect color for her team and fit all her catching gear. It would have been great but after 2 uses the bottom is getting holes in it. SUPER disappointed, so is my daughter.",2
52658,Cat had no interest. Not fault of the product.,2
75822,I am dissatisfied with the durag since it doesn't fit properly on my son's head. It doesn't compress the waves on his hair. So the purchase was a total waste of money.,2
49565,All items werent not in the pack. I only received 6 slap bracelets and several items were not as described. Now I have to run out and buy more from party supply store to finish party favor bags. not worth it.,2
43956,I liked this case when I first got it but about a year later it has began to fall apart. Pieces have chipped off leaving sharp edges and exposed areas. I will be ordering something different to replace it.,2
50308,"I started playing with my daughter and she absolutely loved it, but I didn't realize That you get almost no words included, and unfortunately I do not have $30 to spend on an app. I have never even seen an app cost that much before.",2
58514,ok came with the dropper glass broken,2
44765,"Yuck! These chocolate coconut bars are the worst I've ever tasted. Waxy with a distinctive protein taste that I have not experienced in any other bar. I'll choke them down since I paid for them, but I'm glad I got the small pack. So far the Costco Kirkland signature bars are the best and they even have a lot of fiber.",2
58485,"These smell really gross — kinda like men’s shaving cream, and the mask doesn’t work very well.",2
51995,"Had it in my pocket most of the time, didnt use it too much at all and it just fell apart",2
51676,This is not a good quality paper. Let the kids have this paper and spend a bit more for Arches or Strathmore paper,2
50644,Turntable didn't turn. Looks nice but doesn't feel like a quality turntable. I bought this for my husband and had to return it. I will shop in person for the next one.,2
69213,"The sound quality is ehh, the buds dont stay in your ears, and they’re uncomfortable.",2
44805,The color is not the color in the picture too bright of a pink,2
77217,Not an accurate thermometer,2
45618,"The positive is that it looks great (we stained the outer bit of the wood to be a bit darker) and works for our purposes. However, I am just not happy with the QC for this product. One of the long panels was cut with two female ends rather than a male and female as the other 3 sides were, so it wouldn't go together securely. The thing was very heavy and I was not about to attempt to find a box to put it in to return (as the box it came in had to be completely destroyed to get this out as they had taped and stapled all the pieces to the inside of the box) so we just put that corner in the back and used some extra long deck screws to try to pull them together as best we could. I emailed Suncast and have yet to hear a response after over 2 months so that was not a mark in their favor either. We went with a different company for the second deck box we needed for by our pool instead of getting the same one (this one) we got for the deck because of this.",2
74782,This is not 1200 lm more like 800,2
60642,This cable keeps disconnecting from my iPhone 8 plus. The sound quality is horrible. I highly advise the next person buying it reads this comment. But cool color!,2
47923,"Amazingly bright! Lights up the area with daylight brightness. Once you are 3 feet from the motion detector. I had to wired my old motion / daylight detector in to the circuit. I found you get what you pay for! A Very Bright Light, very poor motion detection. Would not recommend especially if you are wanting to use it for security lighting",2
53588,Why is the main female character wearing heels the whole time?!? You CANNOT wear heels running through mus in the jungle. Also just pretty terrible in general,2
41285,Product peeled off of my nails in 2 days. Went on easy and looked great initially.,2
42943,"These are soft pillows, but not super soft or fluffy. And, not really supportive soft, like I've found hotel pillows. The description and reviews indicated that the pillow is ""hotel quality, soft and supportive"". It comes with instructions that explain to give them time to fluff after being opened (they are vacuum sealed), and, fluff by hand. I did both, and still they aren't that fluffy. I also contacted the company before I wrote this review, as they send those emails because they care about their customers, and I never heard back. Anyway, hope this review helps someone who needs it. Blessings.",2
46128,Side pockets too small for anything significant.,2
42819,"I received the 70 calorie Brownie, Mint Fudge. It is nice that there are fewer calories, but unfortunately along with those 20 calories a lot of the flavor was also lost. The original 90 calorie recipe was moist and tasty. The 70 calorie variety is somewhat dry and less flavorful. I will no longer be purchasing these.",2
130316,Product was as described but it just didn't work for me. I was really big when I ordered so it didn't provide much relief. Still was a good product.,4
140316,Finding a good server is difficult and i cant make my own to play with friends but the campaign is fun.,4
152823,They are very cute. The only issue is they are so tiny and the screw backing takes a few tries to put on a wiggly one year old.,4
145059,"I wish they still had the one without aspartame. They had it for a short while, everywhere, but then suddenly you can't find it anywhere.",4
155550,It was very pretty but breaks easy,4
140803,I wish I'd gotten one with a warm dial and a light to show it's on.,4
127016,I always use a little of this and a little flouride paste together and I love it. I prefer the powder version of this but I’ve used the paste several times and it’s cool too.,4
132142,"A Little light, but as advertized and function well",4
141688,"These do indeed appear to reduce the vibration noise generated by our large freezer-on-the-bottom fridge. But here's the thing to be aware of... The thought that you can put the pads under the rear rollers and slide back into position (as per the instructions) is a farce. Between the weight of the fridge, and the rubber of the pads, they simply do not slide on the floor. At all. They sit put and the rollers simply roll right over the small top lip of the pad. I even tried to oil the floor, hoping they would glide on a slick surface. No, Ended up having to place the fridge in place, and with the aid of a helper, tilt it forward and push the rear pads into place with a stick while looking under the fridge with a flashlight. Then (much easier), tilting the fridge backwards and placing the front pads in place. Bottom line is this... they do seem to work well, but installing them was a pain in the neck. Almost too much so.",4
139517,Nice skirt! Material is light! Just A little snug and a little shorter with heels on.,4
158657,Shoes fit well but were very heavy,4
135255,"I like it, but I would rather it didn't peel off so readily. It takes a lot to work and it comes off my tools and gloves too easily.",4
154480,Grand daughter love them.,4
146354,"Bought for a friend to give as a gift, reviewing to get it out of my feed.",4
132425,Small enough to fit in my makeup bag. They do a good job.,4
159794,"My wife loves this stuff. Personally, I think it smells as though Cheech and Chong just stopped by for a visit whenever she uses it.",4
133118,"I bought this product to target my stubborn closed comedones on my chin. A little goes a long way, I use it at night because it’s photosensitive. I saw a small improvement in my closed comedones. I liked the product so much I encouraged my sister to use this product to and she saw a quick reduction in her active hormonal acne in about two weeks using it one nightly.",4
146603,"Ran a little big on me, but I would rather it be loose than tight. I may put it in the dryer and try to shrink it a little if it bothers me while wearing it. In fairness, I bought a 2x and I probably needed the lx. I thought it might run small because of the price.",4
139054,Love this product for getting extra protein and curbing appetite. It is good for diabetics (type 2). Has no chalky aftertaste.,4
145290,"These tights are durable, soft, and very comfortable! They are rather thick though so they haven't been great for summer wear.",4
121716,"Not like the box matters as long as the items inside are there but the box was torn completely apart, other than that it is great!",4
133515,"After buying one for my wife and getting a ""smart watch for my self and it not doing the things that I wanted it to do. I wanted to get something that would track my sleep and activity with longer then 1 day battery life and my wife had said that she really liked it . I like the fact that I can get a different color of band to keep them separate. the down side is when my phone and tracker are synced and i am trying to sleep it keeps waking me up with every notification my phone gets",4
156390,These are xmas gifts so have not opened them . Very fast delivery and well packed though,4
135992,I live behind a cornfield so field mice are an issue on my block. We have traps down but I felt like this could work as a nice deterrent as well. I last saw a mouse in the upstairs of our rancher last week and since plugging these in I haven’t seen him. So far so good!,4
124625,Looks good and solid construction. Should do just fine!,4
134031,"What I liked is, my dog loved it she came back for more, and it works pretty well. Dislike, And maybe it just me but there is so much static that the hair sticks to the entire glove and it’s a pain to remove.",4
121755,All the warming beads? are on the bottom. Nothing on top. Works pretty ok,4
124713,"Great mystery, successful twist, engaging characters. I thoroughly enjoyed this book. I need to get my hands on the next one soon.",4
141585,"It's OK; Like other customers replied, only the inner part of the links (pivoting part) is missing the black paint.",4
