85784,Glad the girl didn't die. The story line was too long. Some parts kept repeating itself. The book should have been shorter. Kept on dragging.,3
98749,"Works well, but takes up more space than I was expecting. Photo makes it look smaller than it is.",3
87578,"You get what you pay for I guess. It was quite large. I measured my son and ordered a size smaller than what he would usually wear, the jacket was so big around the waste and the material was not very nice. I did return it and ordered a different one.",3
112066,I don't care for the dropper. I bought this for my car to keep mice away hard to get in tight places,3
96394,"Bought for my husband, he's a size large. Unfortunately, the fit around the arm is pretty tight. The rest fits true to size. He still wears it hoping it will stretch. Its a nice shirt, feels soft, I'd recommend buying a size up just in case.",3
93624,I absolutely love this high chair. The print is adorable and it is so lightweight it's perfect for a small house. My only complaint was the cover was not removable so when my son's diaper leaked on the non wipeable part of the fabric I had to cut and sew the cover to ensure that it was removable. Safety belts still come through and my son is still secure and I don't have to worry about gross stains where he eats. I'm not sure who thought non removable was a good idea for a high chair.,3
106525,Easy read. It dragged.I skimmed a lot. HEA.,3
108218,"Disappointed! I have a Cat and on the test strips, the code I can only see is for a dog. the cat code is wiped off!! i have to buy more strips",3
104626,"I bought this for my mom who had vision problems. I thought this would be the same as the 4 compartment one. This one has a lip separator for each pill box which is a lot more difficult for my mom. The other box allowed you to slide the pill box in place. It is okay for the normal person, but not if vision impaired. Also the lid doesn't close down flat unless you click it closed.",3
102434,"It's exactly what I excepted it to be. However, I just want to state a suggestion/improvement to the product. It would be nice if you have a quantity of 4 sets of legs. That way you could use an extra set to raise your stand a little higher. So I will have 2 spare plastic platforms and 2 outfitted with all the legs. I needed to raise my monitor just a tad more than what was provided. So, I ordered another one just so I can raise my other stand.",3
92390,"Ok read... fun little book, and easy to read. Not sure I can give it more than 3 stars simply because those attracted to its message will have come to it for a purpose of sorts. It is pleasant and even teases to spark the imagination, but I would need something... else. It points, ha, to something but leaves us in the end wanting more.",3
100737,"The first one I bought didn’t fit right so I purchased another, still no luck. The material is fine and they are the cutest thing ever. The problem is the leg area was too big. My dogs back legs would come out and it was actually a bit dangerous because they would get stuck in the clothing.",3
103352,I like the product so far. Packaged came with product oozed out all over container box. Fault of Amazon I think as it was mailed in an envelope (get a clue) Smell is light and husband says it smells like tea. I will update,3
114677,Liked the lights and hooking up wasnt that hard . I dont like ive only had on for 2 weeks and 3 of the led bulbs stopped working .,3
107969,"Product is great, but i cannot pour it out of the bottle without it leaking everywhere!",3
108464,"Great if you reload jacketed Bullets , just wish it had more load data for lead reloading.",3
80936,"Cute concept, but the cat inside the mug is seriously off-center. Quality control dropped the ball on this one.",3
97262,"It stuck well (be careful about alignment) and holds well, but it sure does makes some mild noise on top left corner when pressed. Overall pretty good. Edit: my phone fell and the screen protector cracked immediately and glue seems to have disappeared. I kept 3 stars because it saved my screen from cracking.",3
102408,"Takes two hands to assemble, but it is a good bargain greenhouse for my orchid.",3
83715,The color is more orangey than I expected from the picture. I use a very little of it under another color.,3
81445,"Purchased for the price of a full story but only received 1/4 of a story... Great introduction, but no meat or satisfaction.",3
90467,Didn't really do anything for my eyes.,3
80582,"The inspire HR fits fine, but the clip takes away the HR function and it also doesn’t track correctly. Many times I have tried wearing them while shopping and they tracked me as swimming!",3
97946,"These can be difficult to pull off the packaging, and often I leave a crease making it not stick as well. They also cannot be reused, they fall off after the 2nd try.",3
94554,I've worn Saucony's before. Size is always too small and I found that the quality is not as good as it used to be.,3
117947,"Love the ombré. The hair is similar to dolls hair, but just warn you’re braided prior to and you’ll still have good results. Dip with extremely hot water and dip for as long as you can stand. Hair is very stubborn.",3
102381,Did not fit window sill,3
99971,I like the layout of the days in the board and it fits my refrigerator fine. Those are the good points. The bad points are that only 2 of the round magnets actually function. The markers write but won't stay in the board with their magnets (plus they don't mark very well). Overall I'm happy with the board but the accesories are fairly useless. My advice is that if you need accessories don't count on these and be prepared to get some from another source.,3
94263,"It is not working for supposed be My dog is sleeping there. This is not looking like a grass. Even it we put the pad there, still not working like dogs bathroom",3
113079,"Perfect fit, but defective inside the lens",3
99630,They're smaller than what i was expecting. Maybe it's my fault for not really looking at the size. The bottles are good. The hooks like all others - don't work well.,3
89531,As described.. seems to be working.,3
106273,It was not sturdy enough,3
113440,"Thicker than I would like, but it does the job and a better (thinner) option doesn't seem to exist.",3
92173,"The seller was very responsive and pleasant. The mouthpiece was very large, uncomfortable for me, and molding it was difficult; I found that the molded piece disconnected from the plastic body after heating it up and molding; I was afraid that it would separate completely eventually. I returned it.",3
88652,Stopped squeaking after two days very disappointed little boy,3
87379,"This product would not stick on the shower wall for very long. If you try and use the bottoms it will fall off the wall, I tried a lot of different tactics and it just wouldn’t stay on there.",3
106497,Water in light and only been used a couple times,3
88438,Leaves a white residue and it was very annoying and looked ugly.,3
90945,"I have an iPhone 8 in an ""OUNNE iPhone 7/8 Waterproof Case"" and the lightning end of this cable is too bulky to plug into the phone. Photo is Apple charging cable on the left, Anker USB C to Lightning Cable on the right.",3
105755,Cute but way too small...,3
119022,it didn't get my shower floor as clean as i hoped it would,3
82093,Have to find some reason to put it out of the way,3
94120,I love the product but I’m starting to see how I continue to re order the soap quantity is getting smaller and smaller. Would be 5 stars if the size didn’t keep reducing.,3
108988,"Brandon and his wife decide to start their new life in Asia to experience its cultures and the beauty. Brandon meets Ven, a young prostitute and there begins the love triangle. Eventually he learns that Ven might not be mentally stable and that she would do anything to keep Brandon in her life for financial stability. So, he tries to stay away from her to save his marriage. The story is more focused on bringing the dark side of the Asian culture and in such a way that people who truly appreciate it may feel offended. The continent has a diversified culture and offers a lot of things that can be appreciated about. The story line and the author’s writing skills makes few scenes in the story enjoyable.",3
114521,"is ok product., work w Bluetooth.",3
103391,"I loved the colors, however I wasn’t able to get them off when it came time to change my board. I had to put new chalk paint over it.",3
114403,"At first the package came with variety sizes which is good, and for the price I have no complain. Then when I tried to used on my speaker cable, some tubes shrunk well, but some didn't. Especially the big black tube, they didn't shrink at all, the red were good. My cable are 16 gauge, and I found I have no use for all the small tubes, so before you bought it, make sure you have to use all the size, some is really small. I will order only one size that I use most, it would be safe money for you.",3
97035,Item is functional BUT SHORT. Will need to replace.,3
90901,it is not warm when weather changes but butter suited for mid spring to mid/late fall,3
117080,"Ripped within the first 24 hours she had it on. It was really cute abs they did refund my money without any hassle, so that's why I gave them 3 stars instead of 1 or 2.",3
105813,It offers ideas but need to have really good eye sight to use it.,3
88517,"Very light, cheap plastic and no ballast. Tower design does not work well if there is no weight on the bottom.",3
99447,A little expensive in my opinion but seems to work.,3
89681,"These are pretty thin shirts. If you don't wear anything underneath, they are see through. Like a wet T-shirt.",3
95918,I bought this product and was able to use it 2 times before it stopped working. It won’t turn on it won’t charge nothing. It was a waste of money and I wouldn’t recommend buying it. Update......At first I have this a one star rating. But the manufacture got in touch with me and sent me a replacement and I haven’t had any issues with it. It has been a good backup battery,3
81454,What size are these? These are quite large. Quality and everything is fine just large,3
113113,"Bought this since my kids are constantly losing their charge cords, two out of the four stopped working after a month.",3
104461,If you have thick hair and will be dying all of it one color I'm thinking this will take all day. The brushes aren't very big and the hair clips don't hold a whole lot of hair.,3
84860,So I ordered the ukulele and it slips alot and the tune never stays the same. I was tuning it with a friend and he was suprised how it sounded nothing like what the note was supposed to sound like.,3
102444,"I do like the colors, but the sizes needs to be a little bigger. I can only place these on a shelf. Maybe if they enhance the size, like a ruler stick, it would suffice!!",3
116180,Just wish there was a pocket hidden inside the side of the shorts. Product has two front pockets but too shallow for your phone.,3
85993,Looks nice but cheap quality,3
111278,Did exactly what it was supposed to do.,3
178096,Look awesome. Daughter loves them,5
182827,"My 17 year old cat stopped eating her high quality, speciality cat food. After a few days, I decided to go back to something I gave her as an occasional treat years ago. She is happy and eating again!!",5
194470,I recently planted vines on 90 ft of fence. The brand name drippers would have cost me $35. These work just as well and cost far less...... and I have many left over for the next project. Highly reccomend! Buy a lifetime supply now while they're still cheap !,5
163429,Great series waiting on the next book.,5
178462,Easy for kids to use. Is perfect for my 5 year old.,5
178847,Wow! What a fine product! I love everything about it!,5
177911,"Got this for my bf, he loved it!",5
199561,I can't believe what comes out of your pores even when you frequently wash your face! I'm going to buy my teenage daughter one as well.,5
181601,"fast, you adapt very fast to them, it is equal or even better than one with cables",5
175970,Great product great value to complaints even my friends love then saves you money on a tint and keeps the public from seeing your every move I kept two and gave two to a friend she loves them lol.,5
193744,We had a flamingo party and it was suitable for the party theme.Received many compliments from my guests.All off them liked this idea.Full recommend.,5
199639,"Wow! This pillow is so soft and cuddly, you just melt into it. It is large and takes up as much room as a small person. I bought it for my husband, who is recovering from knee replacement surgery. He found it too large to change positions so I took it since I mainly sleep on my right side. Not sure I’ll want it in the summer but it’s nice to have in the cooler weather.",5
199744,"Love, love, love them. I don’t usually like to buy clothes on line, but this was a very specific item I needed and did not want to search all over town so I took a chance and ordered them online, and thank fully I was not disappointed. Holly cow better than I was expecting. Thank you",5
160995,Used these for the tops of cupcakes they looks cute!,5
179229,Easy gift for the new humans :-) and their parents!,5
163178,"Great for learning about our bodies, which we should have known all along. Get To Know Your Body.",5
197291,This stuff works like a dream! It doesn’t take much at all! It removed paint from a jacket I’ve had for 10+ years!! Great stuff! I recommend it to everyone!,5
161701,Looks good on my watch,5
167832,Nice size great for measuring and cutting,5
165462,Amazing product. Very worth the price. I would recommend this to everyone.,5
182421,Just received this slicer today and we used it to slice vegetables for a kimchi.....all I can say is wow extremely sharp and easy to use. Glad we bought this item as it will save us lots of time for processing vegetables for fermentation and canning!!,5
173021,Great Flavor and I need Sugar Free which is hard to find at times. Tastes great.,5
195474,Fun game for the kids,5
198022,Now I'm really curious if people actually reviewed this item....,5
172613,"Bought to include as part of an Operation Christmas Child shoebox, which ended up being sent to a 10-14 year old boy in the Philippines. I also included a small tire pump and a picture of a bike mechanic so he would hopefully know how to use his gift toward earning some kind of income.",5
176999,"This pair of glasses is cute, although a little bigger than it looks, but it does not affect my favorite pair of glasses. But I bought the glasses in order to stop the damage of blue light to my eye. I have to say that they did a good job in this respect.",5
178408,Was as advertised and the shipping was fast. Have been carrying the holster for the past week and it is a great fit for me.,5
199963,These headphones a solidly made with great sound quality. The noise cancelling function works perfectly.,5
168772,Love this opener. So much easier to use that a regular wine opener. I would recommend this item.,5
180317,So cute! My daughter loves it!,5
166274,Downloading movies and music for traveling!,5
183416,Works well. No leaks!,5
199064,These fit well and will probably last longer than the originals.,5
180377,"This product is made very well and is easy to use. The instructions were clear and helpful. It contains several blades so the options are endless on use. The blades come with a storage unit, but it still is several things to store because it doesn’t all fit into one unit. I would highly recommend it though.",5
173888,I installed belt...ran it about twenty minutes...and ping it broke...I will not order this belt again,5
164144,Fits well in my body size and made from a good quality materials,5
198110,So far it's worked good for me. Held my car on the trailer.,5
173595,"Great for reading,easy to use!",5
180034,"Installed easily, worked flawlessly. Still is working flawlessly, months later. There you go.",5
173125,"The rope comes with a baggie of crimps, making for neat and clean tie ups. I used this to tie a tree together amongst other things. There is plenty of extra cord leftover, it'll be nice to have in the garage.",5
187754,Most amazing book. Couldn’t stop listening. Been telling everyone to read this series.,5
160514,"It was very enjoyable. Am looking forward to the 3rd book, Avenger. So far I haven’t been able to order it.",5
180229,"Perfect fit. They are a pain to install, but got it done. Comes with the metal OEM gaskets. I purchased the stainless steel studs and nuts to replace the old rusty ones. Be careful pulling the old ones out so as not to twist off. Highly recommend!",5
171026,I bought this as a prize for a shower game. They have pretty designs and are not your usual scented candle.,5
199262,I love the clip! The design is pretty too!,5
172725,"The material on this laundry bag is very durable, cut comfortable to carry. The laundry bag holds a lot of clothes. It can also be collapsible into a small compact bag.",5
162306,"This is a great item. I use it with a weight rack for my home gym, and it's incredible how easy it moves around 300lbs. I suggest using a youtube video titled ""HTC 2000 Mobile Base Assembly"", which makes the installation process a breeze. Without the video, it would take about twice as long. You'll thank me later.",5
195613,"its my favorite mug, cause size is perfect for me. This mug really good for warm coffee and for cold too. Every day this mug with me))",5
194201,It’s very secure and strong. I’ve had problems in the past with packs breaking when doing drops and jumps but this one is a lot stronger because of the bracket. It’s storage capacity can fit a tube and a pump so it’s good for most people. I suspect the pack good scrape the tire if you have a full suspension but I haven’t had that problem yet,5
185668,"Epic!! NOTICEABLY decreased recovery times, crazy gains in 5 weeks and lost fat. Lifetime user now after having been on muscle milk for 15 yrs.. 33 year old looking better than my early 20’s. Put the work in (min 1hr, 5 days a week) and drink this within an hour of end of your workout and you’ll see gains no matter what. No bs.",5
172276,Much faster starts than old OEM starter. Always had good luck with this company's products. Great price too.,5
162904,My boy really happy with this ball,5
179708,Clean nice fast shipping,5
198032,These cables are high quality. They work great.,5
182378,I really like this pencil. It goes on easy and stays sharp. It doesn't seem to last as long though. I will have to tray another color as the black is sometimes too dark.,5
168426,"Got these for our in-law's Honda. My father-in-law didn't have any issues installing them, and they look very nice. The finished has not faded. Good product.",5
195622,Fantastic. Exactly what I needed.,5
194718,"Don’t listen to the reviews regarding the rubber frame, you can’t even tell it’s rubber when it’s hanging up! There is a seam where the rubber was fused together, but you can only see it when you’re unboxing. Amazing mirror and I recommend it to anyone on the fence about buying. Just go for it!",5
171039,"Patty here-I loved doing this painting. Lots of detail. Plenty of paint, good quality paint. Still had to paint over some lighter colors but I think that’s true for all pbn. Very satisfied with finished painting.",5
181047,My seven year old has a lot of fun playing with this Jeep. She’s used it indoors & outdoors. No issues at all.,5
190518,We purchased it bigger since reviews stated so. Wear womans size M but purchased a large so it could be baggy. My teenager loved it and I may not get it off of her,5
163482,These work great and are great quality.,5
190143,One of the best c type cables I have purchased on Amazon.,5
165454,"So far, seems to be the best Glock sight tool I've got... and I've tried 3 or 4 now",5
25645,I like the size-but it is not a mini glue gun. It is not the large but it is not the small-medium sized. like the color-but did not realize mini did not accept mini size glue sticks. It has the larger sticks with it and I bought a case of the mini glue sticks. tried a mini and it did not feed,1
5388,Not very good all it does is make a big mess I swear I was very careful it's good for slime but I said just not buying this because if you ever do this in your room when the living room the dining room then all you're going to do is just accidentally make a mess with it,1
33491,"Ordered a large and fits like a small. If you're 5'3"" and 125 lbs, it might fit. Was not allowed to return.",1
527,You sent me a scratched up used unit. I hope it works,1
34229,Never received the order :(,1
23982,"This was a great cord and super cheap so it was perfect for me! It worked great and I loved the long cord so I wasnt stuck to the wall. However a few months after purchasing the cord melted (pictured) resulting in a minor 2nd degree burn on my leg. Wouldn't buy, highly disappointed and would not recommend!",1
16712,"Lasted a few hours longer than most of their toys. Once we put a dog bone in it, our dog destroyed it. Definitely not designed to do as advertised.",1
2012,"Hello, The tracking says it was handed off directly to me, but it was NOT handed to me or left at my door. In fact I wasn't even home on Tue when the system states I was. Assistance is needed please.",1
2431,"The purpose of buying these specific ones was because my daughter and I have a hard time finding the pacifier on the bed at night. I though this would solve the problem, but sure it did not.",1
34868,Absolutely horrible! Will not connect and have repeatedly tried to reset it and it will not reset!,1
15438,"Would not stick to the cars surface. We used the replacement pad to re-adhere it. Went into a restaurant for dinner, came out, and it was down again.",1
5563,Doesnt work. marketing scam,1
35548,"Mega pain to use. After fighting this thing for 8 months, I packed it away and just lay the hose on the ground. A gnat could fart and blow this thing over. Not worth the headache at all.",1
10646,"I just received my tree bags in the mail this weekend. I was excited to finally put my tree away and use these brand new bags. I bought the 2 large storage tree bags to break down my 9' tree and separate it into two bags so there would be no capacity issue. The handles may be heavy duty reinforced, but the remaining stitching of the bag is worthless. My tree comes in 4 parts. I put the middle two sections in one bag, zippered the bag and the seam split. The bottom section (largest and heaviest part of the tree) and the very top of the tree (smallest part) fit nicely in one bag, however when I went to zipper it up, one of the zippers fell off. I was glad there was a zipper on the other end of the bag to close it properly. I was not very happy with the product and I specifically bought two so I would not have this seam rip issue. To have the zipper just fall of the end of the other bag without even trying to close it was very disappointing.",1
22560,"We originally ordered these in Nov 2017. The bags were awesome and we never had one break or tear. So when we started running low in March of this year, I made sure to order the exact same product. We did not need to open the second box until a couple weeks ago. I knew something was wrong when I pulled out the very first bag. The plastic was different and it didn't have any ""give"" to it. Needless to say, every single one of them has ripped so far and over very stupid reasons. The corner of an Oreo bag made a 6 in tear and all I did was pick the trash bag up to move it 5 feet away. We are 10 for 10 on damaged trash bags. The worst part... We have a lot of cats. Several times now the torn bags have spilled dirty cat litter all over the floor.",1
24569,The zipper was broken,1
16733,The item was not packaged securely and was torn open during shipment.,1
26485,"I ordered two of these. One came broken. It was packaged okay, so I believe it was broken due to the mail carrier tossing it onto my porch. The one that did not break, I love. It looks nice on my counter and serves its purpose. Updated review: Ok so the salt cellar that did not break during shipping pretty much shattered at the lightest touch after 3 weeks on my counter. I can no longer recommend this item, clearly they are not very durable at all.",1
22085,"faulty eq, doesn't work at all",1
6388,My order never arrived and I’ve contacted the customer service but never heard from them. I’ve been robbed.,1
2962,"Stamper will not pick up design. I tried different types of polish, different plates, followed manufacturer instructions. It only picked up the design once, but then refused to transfer design to nail. I was really looking forward to a clear stamper and this was a huge disappointment",1
19098,"1 part missing, ( part C ) it Supposed to be seven pieces it was only six.",1
1162,"I order hundreds of items from amazon every year and usually leave no reviews, but I am compelled to write about this item. As other mentioned, the glass is extremely thin and feels like it will crack at any point. The metal cover doesnt sit securely on the glass and it feels like there should be another piece holding the metal to the glass, otherwise if you lift the lid, the entire contraption lifts up. If the teapot is anywhere 3/4 full or more - watch out because it will leak no matter how hard you try. It feels like the good reviews either received another item or are fake.",1
