85784,黒はPrimeになくてここで購入しました。,3
98749,リンゴの香りは、まったくないです。崩れやすい？かも。 コスパどおりかと、思います。3こ有るので娘は、好んでいるみたい。,3
87578,ジェイソンステイサムのイメージが崩れた。コメディーは役は今一つ。全体的には楽しめたが。,3
112066,デジタルの懐中時計は種類が少なく、さらにお安い商品となると珍しいと思うので購入しました。 表示としては、月日時分秒曜日が一目で見渡せるので便利です。 ストップウォッチやタイマーの機能もあります。 普段ポケットにこの時計を入れているのですが、意外と時報が便利です。 機能とお値段のバランスで評価すれば「星5」です。 「星3」の理由は、付属のカラビナが壊れていたからです。 代替のカラビナを探す手間がかかったので、「星3」の評価です。,3
96394,お米市場が分からないのですが、リピしようと思ったら高くなってました 残念、別のに切り替えです,3
93624,GSXR-600 k8に使用しました。 材質はナイロンのナップサックのような感じでしっかりした感じはありませんが、ここ2ヶ月ほど使用していますが劣化はなくしっかりバイクを守ってくれています。 おすすめです。,3
106525,目に見えないので捕獲状況は分かりませんが、効果を期待したいと思います。,3
108218,デザインはいいが動きが渋くスムーズに開閉しずらかった。切れ味はいいです。ストラップかそれを付ける為の穴が欲しかった。,3
104626,サイズが何処のサイズかわからず頼んだら小さかった。使えなくはないので使っていますが、よくある表品写真と→とサイズ数字。良くあるようなものがあれば親切だと。,3
102434,ボタン一つで開閉ができる優れものです。 ただ、大きさは、思ったほどではありませんでした。相合い傘だと、それぞれ外側の腕は濡れるでしょう。折りたたみ傘としては大きいという感じです。私としては、大雨のときは使わないようにする考えです。 太さは一般的なものよりもありますが、長さは短いので、カバンにはしまいやすい。 閉じたときに、折りたたんだ布の部分をひらひらさせて、先だぼだけを閉じるためのバンドがありません。 したがって、閉じたときは、取り出したときと同じ状態（完全にしまう状態）まで畳まないと、しまりがありません。 また、閉じてから中棒を短くする際、やや力がいります。,3
92390,この製品は出始めた頃から使用してますが、１ヶ月用、２ヶ月用と容器の容量は変わらず、薬品量が増減するだけ。 製品事態は効果があるように感じますが、正直分かりません。臭いはかなりしますが、ペットの猫は気にしていない様子です。,3
100737,期間限定で安く売っていたためこちらで購入しましたが、正直失敗しました。 写真では綺麗に見えますが、実物をよく見てみるといたるところに赤茶色の汚れが付着していました。 幸いだったのがウェットティッシュなどで強く拭けばその汚れが取れた事ですかね。 ここからは軽く商品に関するレビューです。 私は今回PS4proを購入したため、proにも対応しているこちらの商品を選びました。 良い点 ・様々なアクセサリやPSVRなどを1箇所にまとめられる ・本体にUSBをつなぐ事で各コントローラーを一気に充電できる 悪い点 ・PS4を置く所にあるUSBコードが商品よりはみ出してしまう(写真参照) コードがはみ出して格好悪いのと、今回商品がかなり汚れていたことからこのような点数になりました。 本当なら新品のはずなのにかなり汚れているという時点で星はつけたくないですが、商品が悪いわけではないので…,3
103352,配達(佐川急便)されてきたら箱の表面に穴があるとかで一緒に確認してくださいって、玄関外で寒いなか、確認しました。幸い、中に傷はなかったものの、冬に外で確認って。また他の方も書いていましたが、ネジの頭がつぶれたり、うまく穴にはまらないとありましたが、なんとかできました。収納力はなかなかですが、腑に落ちないことが多すぎ。,3
114677,皮やクレジットカード類が沢山入るのは素晴らしい、しかし小銭入れのチャックがちゃち、ストッパーが立たない、寝ないで使いにくいですね、まぁ使えない事はないので使いますけど、同じ緑色のの某社の財布が年明け迄欠品でこれに行き着いたのですが、トータルで後悔はないです。,3
107969,私は自分の排泄臭も苦手で、嗅覚が鋭いほうです。ですから夫が排泄したすぐ後にトイレを使用したいときに、即効性のあるものをジプシーしています。スプレータイプが一番なのですが、なんとなく漂う気配を消したくて購入してみました。こちらは開封時こそ、さわやかな香りがするのですが置いておくと鼻が慣れるのか香り成分が揮発するのか、かといってトイレが無臭になる強力な感じはしないし、試しに別の部屋へ移動してみたら、トイレには、あってもなくても意味がないということに。でも見た目が清潔感あるから置いておきます。,3
108464,メイクは確かに崩れませんが、 8時間後ぐらいにメイク直しをしたら、 本当に消しゴムのカスみたいにポロポロと… お粉でポンポンするぐらいが良いかも。,3
80936,美味しく焼ける。焼くだけだからこのくらいの価格で十分。,3
97262,たぶん、いいと思います。 実質無料とありましたが…金額を引き落としされているのは？？ システムに問題ありませんか？？,3
102408,中国から発送のため、なかなか日本に出発しなくて途中キャンセルしようかなと思ったほどでした。 納期は大分遅れて到着しましたが、郵便ポスト投函ではなく、ちゃんと配達員が届けてくれて、かつ品物自体も悪くなかったです。開封時に少しニオイが気になりましたが、すぐ抜けました。コスパの良い商品だと思います。納期遅延のため★３つにします。,3
83715,思っていた以上にパステルピンクでした！（笑）透明なところにボツボツとした加工？がしてあっておしゃれな感じ！ 明日iPhonexを受け取るのが楽しみです！,3
81445,女性一人でも簡単とレビューをよく 見ますが、重くて自分は一人では無理でした。 女性の場合は電動ドライバーを使った方が いいと思います。 自分みたいな取り付けに疎い人もいるので 取説はもう少しわかりやすくしてほしいです。 商品自体は満足です。 オシャレになりましたしペーパー2個も 便利です。,3
90467,まだ使ってないが、スーパーで買うより安い,3
80582,型番などで使えない場合があるので注意が必要。,3
97946,この価格帯では、まずまずの商品だと思います。 スマホと連動すれば、Nike+やruntasticでの心拍計測もでき、ランニング初心者にはもってこいのアイテムだと思います。 バッテリーの持ちと充電時間の長さがガーミンと比較して弱く、ディスプレイも無いので、上級者には物足りないと思います。 ライフログを取るという意味では最高のコスパだと思います。,3
94554,充電ができて便利な商品ですが、角度を固定する時に強く締め込みが必要です。 締め込みが甘いとスイッチの重みに負けてすぐにさがってきます。 指が痛くなるぐらい締め込みが必要です。緩めて収納する時も同じです。 もう少し固定する所が改善されるとよいです。,3
117947,人によるのかもしれませんが トングの開こうとする力が結構あるため 使っていると疲れてきます,3
102381,一羽だけ孵化に成功しました。孵化直前脂肪が一つと孵化しなかった有精卵が一つ、有精卵で無かった卵が三つでした。 自家卵の孵化は有精卵の判別機も欲しくなりますね。 自家卵は大きな卵もあるので、転卵が上手く行かなかった卵もあるようでした。 孵化後の育雛機も必要があるかもしれませんね？,3
99971,バッテリ自体は問題なく使用可能です。 ただ、個体差でしょうが、充電用の配線3本の長さが揃っておらず、交差してることもあり、 まっすぐに配線できず1本長く余った状態になります。,3
94263,ペットボトルも入るけど一年で破れましたw,3
113079,DISK２は山形弁でほぼ収録されていたが、全曲山形弁の収録を期待していたので残念。,3
99630,日本国外でスクーター運転時にかぶるハーフヘルメットと組み合わせ、顔面のホコリ除けとして購入。特に夜間や雨天時にメガネ着用を想定。取扱説明書にメガネはゴーグル側にセットしてから着用されたしとあり、確かにそれなら入る。しかしメインで使用しているメガネがセルフレーム型なので、少々キツい。おそらくゴムが伸びてくると良くなる気がする。,3
89531,本体の造りは結構きちんとしています。ところが、内臓磁石が１枚入っていませんでした。タイムセールで安く購入し、返品も面倒なので、そのまま使っています。冬季の凍結防止だけでなく、夏季のサンシェードとしても使えそう。ドアミラーにかけるゴムバンドの耐久性はまだ不明。この手の商品は多数あり、それぞれ創りや大きさが異なるので、よく調べてから購入するのが無難です。,3
106273,直し面が平らでなく、凸になっていて、すり合わせると平らにならない。 そういうものなのか、不良品なのか、正直わからない,3
113440,録画一覧画面で再生済みか否かが確認出来ない点を除けば使いやすい。 ただ何分にも中古品なのでリモコンのボタン表示が消えてて、早見表必須。 （付属品は全部揃っているので助かった）,3
92173,比較するものがないので、冷蔵庫を運ぶのに使用。取説は欲しい。あまり使いやすいとはおもえなかった。上手くやらないと転倒しそうで、きをつかった。,3
88652,まだ使えてない。ですがぁ先輩方が良いと言われて買いました。でも間違いなくちゃんとしてるとおもいます。,3
87379,手帳型のケースに入れた状態だと通電しない…只のスマホ置きになってしまった。,3
106497,サイズを全く確認せず釣具屋にあるタイプと同じかと思いこんでました。ワインドのワーム内にねじ込むやつくらいに細いです・・・しかもワインド用のはねじ込みやすいよう先端が尖ってますが、こちらは丸いからキリなどで穴をあけてからじゃないとねじ込むのは大変そう。 釣具屋のケミホタルには便利なホルダーが付属してますがこちらはチューブのみで、しかもこのチューブが細すぎてライトを入れようにもキツくてキツくて。ハリスに2つのチューブを通しておき、ライトの上下ををチューブで挟んで装着すればいいんでしょうがまじでチューブ細すぎる。サルカンも通らなそう。こんなにキツキツなんだから、ハリスもあればますますキツいのでは？ ちなみに、10袋中の1袋目を開けてみたところ、6本入ってました。 という事は4本しか入ってない袋もあるのかな？？？ 適当さ満載。が、意外にも明るさはけっこうありました。 ●追記● その後釣具屋で、このサイズのケミはハリスに通すのではなく、夜釣りの際竿先に付けるものだとわかりました。 でも釣具屋のは竿に固定するのに便利なクリップがあるのに、こちらにはクリップがありません。養生テープなどでくっつけると良さそうですけど。そうだとわかっていても悔しいのでハリスにつけたりワインドに無理やりねじこんだりしてみようと思います。たくさんあるんだから・・・,3
88438,AirPods2に適用ではないらしい:-)。,3
90945,物はいいですが、12.9インチのiPad Proを持ち運ぶにはちと狭いです。スリーブなどのインナーケースが必須のような気がしました。,3
105755,裾上げ程度にしか使わないのですが、使い切るまでの何年かかるか・・・ 糸の質は良くないですが、これだけカラーがあれば緊急時にたすかります。,3
119022,サバゲー用で購入。レビューにもメガネでも大丈夫とは書かれてたものも、装着したあと眼鏡の鼻パットが顔に押し付けられて痛かったです。zoffのスポーツタイプの眼鏡で少し大きいです。他の眼鏡も試してもレンズがまぶたに当たりました。 眼鏡なしも試した結果、安定してよかったです。 ですが求めてたものではなかったので返品。,3
82093,コンクリに設置、埋蔵用の設計なので、後から付けるのは難しい。セキュリティワイヤーみたいなので固定出来れば良かった。,3
94120,画像録画のソフトを探していて、やっとみつかり助かりました。 改善点は１．画像が鮮明ならよかった。２．録画に時間がかかる。 システム上、可能なら改善してほしい点です。,3
108988,scan精度が力不足です。音符を入れる際に音符の長さに合わせた個所に挿入する必要がある。使っていたソフトでは、順序立ててランダムの箇所に挿入したり、不足分を必要な個所にクリックすることで解消されるが、このソフトは以前から音符に合わせた個所にクリックする必要がある。従って、二重奏や重音の際には注意が必要。,3
114521,味は最高なのにリピート購入が出来ないのが残念。,3
103391,口臭が気になるときに数回シュッシュしますが、口臭が消えるのはシュッシュした瞬間だけです。数分経つと口臭が復活しました。私は3個セットを買ってしまいましたが迷ってる方は1個だけ買うことをオススメします。。。,3
114403,ヨメの立場からだからか、仕官前だからなのか、このイチャラブ男がもはや孔明である必要性を感じません、孔明に見えませんwwまぁ、展開気になるから、今後も読むと思うけど。。,3
97035,寝具は肌触りだと思うが、届いての感想は微妙。一度洗えば変わるとも思えないのでね。あと各コーナーにホツレがあるので早晩にほどけると思ったのでほつれ止めで固めました。重くはないですね。保温性はそれなり。 耐久性はほつれがあったので期待しません。 寝具は服のように買う訳ではないのでこの質と値段が相応なのかはちょっとわかりませんが、毎日使うので結局西川にしました。,3
90901,簡単なことには対応できるが、テレビなどの独自の機能には対応できない。,3
117080,スリガラスの爪研ぎを探してこちらを購入しました。爪を磨くのは、あまり効果はないです。 体調不良が続き食事が行き届かず、爪に縦の線が入ってしまってから、他の爪磨きも当てにならないのであまり期待してませんでした。 もう少し、爪研ぎが合えば良かったのだけど、少し物足りなさを感じてます。,3
105813,キーボードは小さいながら打鍵感も良く、キー間があまり詰まっていないため誤タイピングもしづらく、使いやすい。 Fnキーでホームに戻る、Undoやコピー/ペースト等の機能も利用できるので、これまで使っていたBluetoothキーボードの不満点が一気に解消された感がある。しかも非常に薄く、携帯性は高い。ちょっと強度が心配ではあるけど。 一方、カバーは思った以上にゴツく、重い。折角小さいminiなのに、このカバー付けると片手に持っているだけでずっしりとした感じがある。キーボードの滑り止めのために仕込まれている金属のせいか。そのせいで厚みはあるし、カバー二つ折り部分の分だけ余分とも言えるので、キーボードを外してiPadだけを持とうとしてもかなり邪魔である。スタイラスペンを使って絵を描いてみようと思ったが、このカバーを付けたままだと正直その気にはならない。無段階スタンドはとても良いのだが。 カバーしたらスリープする機能もなく嵩張るので、カバーはこれまで付けていたものを使い、キーボードには百均で滑り止めゴムでも買って来て取り付けて運用するのが良いような気がする。 何ならキーボードはよく似たウルトラスリムキーボードだけ買えば良かった…みたいに思わなくもない。 ただ、ゴツめのカバーとキーボードセットで3000円しないのは魅力。お絵描きはせず（スタンドさせたままでメモ程度に描くくらいならアリかも）、主に外出先でテキスト入力するみたいな使い方ならとても良いのではないか。いや、それよりアナログ派向けか。写真やタイムラプス動画を撮るのに無段階スタンドがかなり便利そう。,3
88517,嫁と合わせて、1年半で3つ壊れました。 今回は年末に購入して2ヶ月かからず反応しなくなりました。 使い勝手は良いのですが、こんなに頻繁に壊れるのなら、もっと安くして！,3
99447,空気を入れるのはかなり時間がかかる電動空気入れは必要！ また、抜くのも時間がかかります。 片付けやしまうのも一苦労かと。 新たに使用する時にキレイに洗うのも大変。 シンプルな物の方が使いやすい。 耐久性は使い方しだいかと。 子ども達は嬉しいと思う。 かなり大きい。広いスペースが必要。 プールの下にシートを敷いて使いました。,3
89681,中国版の本家を見ていなければおススメ。 見た方は、？？になると思います。,3
95918,場面によってはフォーカスの甘い画質 解像感のないボケボケ画質になるのは元からそうなのかな 値段はさすがに高すぎ ネット配信サービスが海外と同等の価格で上陸してるのに いつまで日本国内のみのぼったくり仕様でディスク売れると思ってるんだろう 異常な価格だけがさらに際立つ形になり大多数の消費者は買うのやめるだろう 適正価格で売らない限り今かろうじて買っている人間も振り落としてディスクメディアは急激な先細りしかない,3
81454,ケースの耐久はありそうですが ケースの厚みにより充電などが しにくいです 端子接続部分が小さいもので ないとできないのが残念です端子接続部分,3
113113,何がの間違いでプライム会員になることがあり１年間の会費を払うことになってしまったものの、利用することで分からないままです。,3
104461,革のかばんなどに使いたいと思い購入。ある程度は綺麗になり、ツヤは出ます。匂いもそれほどなく、重宝しております。,3
84860,サイズは通常履いている靴とほぼ同じ感じでした。,3
102444,真ん中に小銭入れて、免許証なども入れていますが、もう少し真ん中が広く使えると良いのかなって思う。,3
116180,海外旅行用に買ったのですが価格も安く大満足です。,3
85993,赤ちゃんのケガ防止のため、いろいろ選んでこれを買いました。やわからかくて貼り付けも簡単なクッションですが、取れやすくでこの値段でこんな物とは思わなかった。ちょっと期待はずれです。,3
111278,とても良かったのは、オーディオ機器で聴くと臨場感有って良かった。 1枚目の録画時間と2枚目の録画時間の配分を均等にして欲しかった！！,3
178096,とても使いやすい。Apple Pencilに非対応なので購入したが、大満足,5
182827,純正品と見た目や質感は似ています。 違いといえば、Apple Watch本体に嵌めにくい。マジックテープ部分の色が純正品と違うが止めた感じではこちらの方が剥がれにくいのでしっかり感がある。 これらは気にする人にとって大きな問題？となるかも知れませんがむやみに外れない安心感はあります。 しかし純正クオリティーを求めるには値段が値段なので純正品のバンドを汚したくない人や色を試したい人にはおススメです。 評価は購入後数週間使っての感想ですがバンドの折り返し部分の内側が擦れて潰れだしてきてますが切れる程の事はないと思いますがこの辺は使い方次第では純正でも同じかと思うので私はこちらを数本使った方が安上がりかと思います。タイトルでも書きましたが殆ど純正と代わり映えしませんのでお勧めです。,5
194470,一人暮らしの6畳間で稼働です。湿気を取ってくれてびっくりしました。買って良かったです。,5
163429,振動の向き（上下・水平・双方向）が選択できるのは良い。振動は速くて強いが動きの幅は少し狭い気がする。スイッチ(ボタン)の反応が過敏であり操作音がうるさい。直接座って使うとお尻でスイッチを押してしまう。色々と書いたが、揺れが下半身に効き足腰のコリもほぐれる気がするので総合的には満足している。,5
178462,値段以上の価値ありです。前使っていたアイロンよりも断然軽く、サラサラになり、友達にも褒められました。迷っていたり、新しいヘアアイロンが欲しい人は迷わず買うべきです。,5
178847,叩くと良い音がします。かなり響くので夜はやめたほうがいいと思いました( ・∇・),5
177911,ゲーム機自体異常なくらい軽いです。本当に作動するか不安でしたがちゃんと電源も入りボタンの反応もいい感じです。ゲーム機は初期設定で英語表示になっていますが設定で日本語に変えられるので問題なく使用出来ます。ただ説明書が英語記載のみなので使用しながら操作を覚えていかないといけませんがよくゲーム機をプレイされる方には違和感なく受け入れられると思います。ゲーム数は3000となっていますが恐らく同程度入っているとは思いますが多すぎてまだ全部を確認は出来ていないです。たぢ充分な数あるのは確かで子供の頃にゲームセンターでしていた懐かしいゲームが沢山あり子供だけでなく大人も楽しめる内容になっています。画面は4.3インチで大きくて見やすいです。充電に関しては2時間から3時間の間で切れる感じなので遠出する時には充電器を持って行った方が無難ですが充電しながらプレイ出来るので自宅や宿泊先では気にしなくて済みます。まだ使えてはないですが音楽プレイヤーにもなるし電子書籍にも対応しているとの事なのでゲーム機1台で三役してくれると思うと持ち歩くのも楽でとても助かります。この手のゲーム機はそんなに詳しくないですが個人的にはジョイスティックが想像していたより難しく慣れるのに少し時間がかかりました。レトロゲームばかりしていたからかも知れませんが。子供達は特に気にならないみたいです。対応しているゲームフォーマットも11種類と多いのでこれから色々試して遊んでみようと思っているので長く使用出来ると有り難いです。金額を考えるとお得なのでもう一台買って取り合いしないように出来たらと思います。,5
199561,思わぬプレゼント包装に ほくそ笑んでしまいました メッセージカードも 嬉しかったです 機会があれば同じショップで また別のアクセを購入したいです,5
