181601,毎日、健康保持の為に、定期的に購入しています。かれこれ、3年以上飲み続けています。飲みやすいし、リーズナブルなのでこれからも飲み続けていきたいです。,5
175970,"""同じような物はみな高額です。 SurfaceGoできちんとBUFFALOのBRXL-PT6U3を接続してブルーレイ、DVDビデオが見れた。ソフトバンクの急速充電器からも充電ができた。 HDMI経由での出力もまったく問題なし。質感も良い。 4つのポートがあって、すべてのポートを同時に利用すると引っ張って落としにくいです。 作業スペースを広げ、効率を高めます。 耐久性は使ってみて。適当なケースがあればと思う。ともかく安いのが助かった。""",5
193744,サイズもちょうどよく、見た目もかっこいいのでいい買い物でした。,5
199639,購入してから、1ヶ月が経ちます。サロンには行ったことはないのですが、通う面倒くささと値段を考えればこちらの方が良いのかなと思います。,5
199744,さすがは専用のケース、エスビットとライターを入れてシンデレラフィットです。 また普段使いしていたコンドル製のナルゲンボトルポーチのサブスペースにぴったり収まります。 1リットルのナルゲンボトルとクッカー、エスビットがまとめて管理できるで満足しています。,5
160995,"""夜注文して、翌日着。 早速車載で使用。とても優しいミストで音もなく、 自分のいる周辺をしっかり潤してくれました。 小さいながらもしっかりと動いて、お値段以上に良いものを購入できました！""",5
179229,筋トレが日課なので購入しました 思っていたより幅があって、それによってガッチリ固定されます マジックテープが超強力で剥がしにくいけど、逆に強く巻いてもビクともしません！ 効率よく筋トレするために愛用して行きます,5
163178,作業効率が格段に上がります。 バイク整備にはいつもラチェット使っていましたが、Tレンチ使うと3倍のスピードでボルトを外せます。 買って本当によかったです。 ただ取っ手部分は回るは回るが、油が足りてないのか、ベアリング?のシャーシャー音が大きくスムーズに回ってない気がしたので、油指したらさらにスムーズに回りました。,5
197291,ペンダントトップに合う革紐を探していて、こちらの商品を購入しました。 太さも、自然な色が丁度良く、身に着けていても肌色に馴染んで良い感じです。 ただ通しただけなので、2つ分のペンダントトップに通しても長さも充分でした。 良いお買い物ができました。ありがとうございました。,5
161701,シンプルで伸びもよくて通勤用のパスケースにつけて使ってます！,5
167832,新しく配属された部署では海外出張が多くて、飛行機に長期間座ると首周りの筋肉が疲れやすくなった気がしたので、この商品を購入しました。 とても気持ちいいので、映画を楽々観ることができるようになりました。 コンパクトになるので、持ちやすい点も良かったです。,5
165462,洗顔だけでは落ちきれない毛穴の汚れや、ずっと気になっていた鎖骨のザラザラやプツプツした感じもキレイになってきました それにマッサージヘッドで内から外側に向けて数分軽くマッサージしただけでリフトアップするのには驚きです‼あきらかに目尻やほうれい線が上がります マッサージヘッドはおまけ程度に思っていたので、予想外の効果にとても嬉しいです‼ロングブラシ、ショートブラシ、マッサージボールの三つのヘッドが付いて、値段も2500円ぐらい すごくいいです,5
182421,札入れが二つに分かれていると、お札とレシートを別々に入れることができる。 また、小銭入れも間に仕切りがあると、1円・5円とそれ以外の二つに分けて入れることができて、こうしておくと端数のお金を簡単に取り出すことができる。これまでそんな二つ折り財布を使ってきたけれど、長年使ってきてボロボロに。自分のためのお年玉のつもりで同じような財布を買おうと決めていろいろ調べてみたのだけど、こんな風に札入れにも小銭入れにも仕切りがついているものはなかなか見つからない。こうなっていると便利なのに・・・ 二つ折りなので、カードと小銭が多すぎると、財布はパンパンに膨らんで見えますし、開けないうちからカードが顔をのぞかせたりします。取り出した時の見栄えを良くするためには、カードの数を厳選して、小銭をためないように気を配る必要があります。当然ながらの話ですが、購入されるときにはそんなことをご考慮されると良いかと思います。,5
173021,去年の夏で連載止まって作者のツイッターも月1ペースで打ち合わせしてますってツィートするだけでまてど待てど全然次の話が来ない、ストップして9ヶ月だけど1年以内に来るかなぁ…,5
195474,顔を洗うとき、非常に柔らかいシリコン繊維と肌に優しくマッサージすることは大きな喜びの感覚を与えます。にきびや敏感肌を傷つけることなく、肌に非常に優しい。デザインはフルサイズ版よりもはるかに小さいので、同じコーナーでの清掃ははるかに簡単です。ジェル、フォーム、メークアップリムーバーオイルなど、さまざまな種類の洗剤と組み合わせることができます。強くなる）多くの肌タイプに適しています。また、シリコンチップはさまざまな肌タイプ用に特別に設計されています。敏感肌やニキビ肌に使用して、はるかに柔らかい感触をもたらします。,5
198022,珍しいデザインで、単色でも2色づかいもできるので、何回もリピしています。大きさは表記通り、十分な大きさがあります。チクチクせず静電気も起きず暖かさもあります。ふんわり、優しい触感が、肌に良いマフラーとした、この寒い時期に必要品です。,5
172613,運転席につけたホットシートヒーターの電源ケーブルが短くてシガーソケットから宙ぶらりん状態だったので、本製品を購入しました。ケーブルはしっかりしています。シガーソケットから立ち下げて、フロアカーペットの下を通して目立たたないように配線でき満足です。保冷庫とスマホ充電用ですが使えてます。,5
176999,使いやすく、コストパフォーマンスが最高です。注ぎ口から静かに注がれます。,5
178408,仕事用に購入しましたが、今まで使っていた安めの商品より機能がいいです。通信速度も速くて便利です。付属品も多様についており、様々な用途で使えると思います。いろいろ賄えるハブの方が便利だということに気づくことになりますよね。MacBook Proと色目も、合うデザイン良いです。Iphone読み込み素晴らしいです。値段も比較的に安く、かつ対応可能な端子も多かった点とPD機能によりHUBとして使えながら充電もできるようでしたのでこれにしました。見ためもとてもシンプルで、すごく気に入ります。コンパクトなデザインなので、機能が多いほうが便利です。HDMIでスマホの動画をテレビに映せました。安定性も優れます。外観については、おしゃれです。満足です。,5
199963,すごくコンパクトで大満足です。設定が女性の私には難しく感じました。,5
168772,家でヨガをするのですがボールを使うと気持ちいいよと友達に言われたので今回この商品を購入しました。使用してみるとボールを使うことにより今までより気持ちよく体が使えることに気付きました。そして、思ってたより柔らかくで使いやすいので助かりました。,5
180317,リップの下地に物凄く良いです。ガサガサ唇が滑らかに塗れて、手放せません！,5
166274,なぜ純正の状態で装着されていないのか不思議です。重心が若干低く見えるし、 いいアクセントになるので必須アイテムだと思います。,5
183416,ミュートの楽しさ、マルチグループプレイ方法、いつでも一時停止、自動吸い込み、超快適さと衝撃。,5
199064,プロの製作過程を見られるいい本。昔に比べてこういうのが増えてうれしい。やってることの精度が高いので、そのまま真似は出来ないけど、同様の作業をするときの参考にできるのはありがたい。,5
180377,はじめて購入しました。まだ効果はわかりませんが 続けます。,5
173888,保護フィルムを探しており種類もいろいろあるので悩んでいたところ、こちらの商品が価格も手頃なので購入しました。 上手に貼れるか心配だったのですがキレイに貼ることができ使い心地もよかったです。 値段のわりになんてことはなく、コスパよしだと思います！,5
164144,説明書以外の部分は、シンプルで気に入りました。日本語の説明書を作成中との事なので問題ないと思います。,5
198110,一度座ったらわかりますが、座り心地は極楽です。 座ったまま眠れます。 立ったり座ったりには不向きです。,5
173595,地図を見ながら自転車運転する時に必要だなと思い購入しました。 子どもを乗せ電動自転車なので落ちてもさっと拾えないという事からしっかり固定出来るこちらの商品は安定性があっていいです。 取り付けも簡単に出来て女の人でも出来ます。 使い始めて数日ですがコスパ良いなと感じています。,5
180034,ぴったり 取り付け説明書も見やすかった 安心して使えます。是非！,5
173125,今までは、キッチンワゴンの上に27cmフライパンを置きその上（中？）に四角い卵焼き用フライパンなどを置いていましたが、このフライパンスタンドを買ってからはフライパンの分類保管が出来、整理整頓もできました。◎,5
187754,この毛穴吸引器は5階段で細かく吸引力を調整できます。敏感肌、乾燥肌、脂性肌などにもそれぞれお肌の状況に合わせたご使用をしていただけます。,5
160514,まずUSB-DACで電源ボタン付きなのがいいですね。数字のディスプレイ表示も判りやすくていいです。 音も好みでいい感じです。何時になるか分からないけど次に買うとすれば電源ボタン付きでMQAにも対応したDACかな。,5
180229,ネット通販で購入した衣類が折りシワが沢山あり、そのシワを伸ばしたくて購入しました。 届いてみて、説明書は日本語でなかったため、一瞬戸惑いましたが、 まあ大体の雰囲気で使えるだろうと思い使用して見たところ、問題なく使えました。 強さ？か3段階で選べるのもいいです。 気をつける点なども特になく、強いて言うなれは、スチームのために水を入れるのですが、 その水がMAXの水位を超えないように注意することが大切だと思います。 MAXの水位を超えていると動きません。 水を少し減らして見たところ問題なく動き、逆に色々考慮されてそうなっているのだろうと思うと、安心感があります。 シワ伸びは画像を見てもらえばわかると思いますが、スチーム強で綺麗に伸びました！,5
171026,仕事が忙しいですから、従来のハンガーで物干しするなんか苦手です。このピンチハンガーのピンチが多くて、たくさんの小物を干せますので、とっても便利です。 タオルを何枚同時につけてみました。ハンガーがしっかりして、丈夫です。角度を変えることもできますから、歩き回らずに簡単に付けられます。,5
199262,以前使用していたベルトが古くなったので新調しました。 色は黒にしました。スーツや私服に使用していますが、シンプルで大人っぽい感じが出て良かったです。 サイズの調整は穴に止めるタイプではなくバックルでロックするタイプなので微調整が効きとても便利だと感じました。,5
172725,重さは少しあるものの、傘ですので丈夫でないと意味がありません。安い折りたたみ傘は壊れやすいイメージでしたが、長く愛用できそうで気に入っています。 デザインとしてもシンプルで洒落てますので、ビジネスでもプライベート使えます。1つ持っておいて損は無いですね！！,5
162306,UVライトではないということで日焼けの心配もなく妻が安心して使ってます。 タイマー機能も便利！ ボタンを押しただけで簡単に切り替えれるので片手での操作が可能でした。 USBケーブルで充電なので出先でも使えてます！,5
195613,男らしさを取り戻したくてはじめました。手頃なのでこのまま続けやすいところがいいです。,5
194201,とても迅速な対応ありがとうございました。とても助かりました。梱包も丁寧でした。,5
185668,皆さん、超お薦めです。 グロー本体の値段と比較すると割高な感じしますが、この商品は全く感じさせません。喫煙所で他の人が格好いいの一言。レッド買いましたが、他のカラーも良さが想像できます。 また、付属品の巾着も良くて、最近は巾着に入れたまま使用してます。,5
172276,[[VIDEOID:e95b906be8d754cfc799cc60c51ff1c]] 車を運転する時に、スマホを置くところがあったら便利なのになぁ〜っと思っていた矢先にこの商品を発見し購入。 タッチ機能が面白いです！ 説明書には日本語の説明も書いてあったので簡単に取り付けることが出来ました。 両面テープタイプで取り付けしたい位置に貼り付けて固定できます。 車内、自宅やオフィスで色んな場所で使えます。 充電しながら車載ホルダーとしても使えるため、非常に便利です！ 360度回転するボールジョイントを採用しており、スマホを縦でも横でも自由に使え、好みの角度に調整して、見やすい位置にセットできます。 視線を妨げないで、安全に運転できます！,5
162904,薄めなので、縦に並ぶタイプの電源タップに挿しても両隣のソケットに干渉しないのがとても良いです。,5
179708,以前は100円ショップでも売られていたFOMAとソフトバンクのガラケーアダプターですが、すでに過去の産物になってしまったようで、街中では探せませんでした。機能もさることながら、今でも扱ってくれていることに感謝です。,5
198032,耐久性が優れ、このチェア長時間使用の腰痛防止にはとても良いと思いまいた。,5
182378,できることから備えようと思い、突っ張り棒では支えきれるか不安な大きな家具を家の梁ととめた。確実にねじで留めたので安心感がある。,5
168426,主人が説明書見ずに10分ほどで組み立てられました。 トイレットペーパー、タオル、洗剤を乗せていますが今のところ落ちてきません！,5
195622,保湿美白効果がいいです。全面的な保湿です。メイクの上から使用可能です。省エネ、環境にも優しいです。,5
194718,いい買い物しました★ 届いてからすぐ開けましたが、鼻の効く私でも臭いは全く気にならなかった。 一応1週間陰干しはしましたが、全く臭いありません。 ふわふわで軽くて、体があったまったら体温をほどよく調整してくれるので、暑すぎたりしません。 シングルと、ダブルを購入。 うちはシングル２つ並べてキングで、大人2人子供2人で寝てます。シングル掛布団２つだと、どうしても真ん中隙間風が入るので、片方を大きめにしました。ダブル大きすぎて、セミでも良かったかなって思ってます。 子供達が巣立ったら、夫婦2人でダブルを使おうと思います。 ただ、収納袋がちゃっちいです。開けてすぐにファスナーが壊れてしまいました。 そこは残念。 おまけの掛けカバーをシングルとダブルを同じカラーにしていただいて助かりました。,5
171039,プラごみを少しでも減らしたくて購入。 包装が少し雑ですが、商品には問題なしです。 ただ、少しうちにあるコップ達に対しては長いです。 結構本数入ってるので、長さが違うのが入ってても嬉しいなと思いました！,5
181047,このオフィスチェアは耐久性がたかい、、360度の滑らかな回転機能、非常に便利な、非常に良い回転感。,5
190518,思っていたサイズで使い勝手がよさそうです。握った感触も良かったですし、切れ味もいいし、とても良かったです。,5
163482,日焼けを防ぐ為に購入した。購入前に使用していたバイザーはカチューシャタイプだったのですがゆるゆるで風が吹くとずれてしまいとてもストレスになっていました。マジックテープだとしっかり被れて安心です。色もデザインも好きです。,5
190143,車に差しっぱなしではや半年、何事もなく使っています。測っていませんが充電も早いので高速充電出来ていると思います。,5
165454,すごく明るくて夜道も安心して走れます。他の人にも進めようとおもってます,5
25645,時間制限が邪魔で自分には難しく、攻略本を見ながらでもうまくいかなく、クリアできませんでした。 制限なしで発売してほしいです。,1
5388,ナット状の工具のスプラインの凸部が先端までないので、スプロケットのロックナットと噛み合わず使えません。先端部を2ｍｍ程度削り何とか使えるようになりましたがスプラインの精度も良くありません。高価なものではないので純正をお薦めします。,1
33491,こんなアコギな商法をしてるのか？ファンを舐めてるとしか、思えんな。,1
527,アイデア自体はいいですし、あると便利なのですが、きつすぎて入りににくいです。。,1
34229,2017/12/29 Apple Watch3用に買いました。真ん中は指で反応するけれど、隅の方は指で全く反応しなくなりました。Apple Watchは隅の方に「戻る」や「電話」のマークが出るし、パスワードロックのボタンも大きく出るので端が押せなくて困りました。,1
23982,靴の形の底の部分が靴よりも大きいのが気になります。リーボックのファンです。ブーツも買って気に入っています。,1
16712,ピンの直径が違ってた！ よく見て発注しましょう。 返品が面倒で、廃棄しました。,1
2012,指すべりもタッチも問題なかったのですが、汚れ落ちが悪く角に浮きがあり、サイドは覆われずAPPS EDGEの使用時にひっかかりました。虹彩認証に反応せず、センサーが覆われてるとかなんとかで毎回警告が出ます。iFaceのカバーからもはみ出た感じで、1週間足らずで外れてしまいました。とても残念です。,1
2431,ソール部分から音がなる。踏み込むたびに。周りにも聞こえる。音がでないように穴をあけてみたが、ダメ。やっぱりなる。ので別の商品を購入した。,1
34868,1ヶ月使用して早くも断線しました。3本あるとはいえ、耐久性なさすぎです。,1
15438,1ヶ月ほど使用。マイボーム腺炎とまつ毛が伸びたらいいなと思い使用しましたが、どちらも今ひとつ効果が分からず。 もともとアレルギー性敏感肌なので、目元にアレルギーが出やすいのですが、これを使用しても特に改善などは感じられませんでした。使用中は目に沁みませんし、刺激も特になく穏やかな使用感です。,1
5563,全くダメ。 皆さんと同じく貼り付け後の1回目ツーリングで無くなってました。,1
35548,駄目。 8本中4本が容量も電圧も記載より遥かに無い。 使い物にならない。 問い合わせをしても、ちゃんと計測しろとの主旨のカタコトの日本語で返信が来てラチがあかない。 最悪の買い物でした。,1
10646,でかすぎてガバガバ‼️最悪😞⤵️⤵️返品したらよかった。,1
22560,耐久性がなさすぎて収納用品なのにすぐにゴミになります。 芯材はボール紙で不織布を貼り付けただけ。 湿度や曲げ、汚れや重量にとても弱いです。 一方、無印のポリプロピレンケースは1200円送料無料なのに15年以上持ちます。持っています。 3個買っても3600円なので、カラーボックスとこちらを購入した合計金額と変わりません。 この商品の良い部分を強いて挙げるとすれば、すぐに可燃ゴミとして捨てられる点のみ。,1
24569,空気がすぐ抜ける。使い者にならない。買っちゃダメな商品だと思う,1
16733,届かなかったので、連絡したんですが返事は無いです。問題外でした。,1
26485,画面右下のタッチ感圧が足りなくなってしまいました Pixel3なので、他の方も言ってるようにサイズやエッジの加工にも不満です,1
22085,最後まで読めないほど単調で面白くない。絵柄かな？もちろん子供も興味を示さない,1
6388,不足しているアイテムの販売 とても気分が悪い,1
2962,とにかく、時間がずれすぎる、無駄な買い物をしてしまった。,1
19098,使い始めた時はiPadAirを充電出来たが、数日後iPadに「充電していません」のメッセージが出て充電出来なくなった。セットの他のケーブルでも充電出来ない。因みに手持ちのAnkerのケーブルに変えたら、ちゃんと充電出来た。他のレビューコメントでは交換してくれないそうだから、お勧めしない。少し高くてもMFi認定済みのケーブルがお勧め。,1
1162,ここの会社はろくでもないです 7.62mm用の物を6個頼んだはずなのに全部5.56mm用でした なんで星つけないとレビュー出来ないんですかね？ ここでは買わない方がいいです,1
1020,専門店で取り付けしてもらったけど全く作動しません。工賃5000円取られて大赤字です。,1
6268,指紋認証対応と書いてあったのに出来ない！ しかも貼り付け時の説明書も同梱されてない！ これはダメです,1
16308,醤油さしとして使用していますが、使用後の液だれが激しく持ち上げるたびに底に醤油がべっとり輪になっています。 お勧めしません。,1
10721,フィルムを貼ったことで写真写りが悪くなった。すぐに剥がれるし最悪。,1
35707,配送されてきた商品は、反応時間1\15000秒、視野狭い等の商品違いで低級品でした。配送管理問題あり、覚悟の上で発注を。,1
17250,中国製の偽物と思いますので一度調べたらなんと！！！元値段1500円くらいでした！,1
2418,ダックカールの力ごときですぐにちぎれ始めて半年もすると原型をとどめない形になります。何年も使う方は初めから少し高いものを買った方がいいと思います。紐がついているところも壊れやすく、金具も壊れてしまいました。,1
31510,16.5cm(日本サイズ15.5cm相当)って書いてあるけど普通に日本人の子どもの足で16.5cm相当でした。大きすぎ。ちゃんとサイズ記載して欲しいです。面倒なので返品せずもう一度買い直しました。,1
15048,先日、2月7日にそちらでKKmoon パッシブキーレス エントリーカーアラームシステム 2ドア遠隔リモートセンシングロッキングキット ショックセンサー付きを購入したんですがパッケージリストに載ってる 5ワイヤーモーターが箱に入っていませんでした。取り付け出来なくて困っています。至急商品を送って欲しいです。宜しくお願いします。,1
