80358,Appearance. Not packaged well honey all over the outside of the package. Product fell out of the cardboard when I picked it up. Seems awfully thin for honey.,3
102300,"It looks nice. But it took so long for shipping, and its corner is broken.",3
102523,This is my second order but this time I got a lot of liquid instead mineral from the container when use. Did anyone have the same experience? Is it a bad batch?,3
86662,"I was bummed he two tracks didn’t fit together. Be aware that here are he light up tracks as well as other normal tracks, but the two do not work together. I prefer the normal tracks over the light up. They’re more pliable and easier to put together.",3
104263,Nice looking case. It fits well on my phone. Not sure how well it will hold up. It’s a little too slippery for me.,3
113634,"Meh. It works, you get what you pay for.",3
113361,"The lock itself is perfect for my needs, but the mounting bracket is a true disappointment. I had to tighten the mounting screw on every ride, and it is absolutely annoying. In this price range this problem should to eliminated. Now i have to use an extra velcro strap to fix the wobble and keep the lock in the desired position.",3
107010,Not the picture shown. The pic was supposed to be vertically oriented ... and a different photo. What I rec’d is an OK pic but I needed a vertically oriented pic for the place I wanted to hang it. Disappointed.,3
92534,"THIS REVIEW IS FOR THE PRODUCT - NOT THE SELLER. SELLER IS GREAT! This MIGHT be a good product, I purchased it because I thought curcumin would be a good thing to take. However, when I opened the bottle it was SMURF blue! The manufacturer felt the need to add FD&C Blue #1 to the product. First - WHY; and second, if you're adding a DYE, why BLUE? Isn't curcumin orange/yellow? I strongly feel that if it is not necessary to the quality or performance of the product - keep it as pure as possible. I've got to think (and I'll research this) that the DYE is not dangerous, but I question the necessity to add it at all... Not sure if I'm keeping it or not - was just VERY surprised when I opened the bottle!",3
109393,"I'll keep the hat, but it's not what I expected or really wanted. The body of the hat is, indeed, unstructured but the brim is not in the least soft. Instead, it is a stiff material which is sewn in three separate pieces so that the bill can be folded.",3
104505,I thought I ordered it for a IPhone.,3
89520,"If you have to use the extensions, they are worthless. They are so flimsy my puppy had figured he can push hard enough and break through. If you don’t need those it’s perfect .",3
111425,"The construction seems decent, laser works, good ease of use, however I'm not sure how accurate this is. You can turn the bullet a tad and the laser will point slightly differently. It is not perfectly aligned with your barrel, so at 25 yards can be pretty off.",3
109514,"I realize that when you make a forecast you may be wrong,however I watch weather news to see what they think will happen. So far this channel seems very timid in the forecast department. Geez take a chance.",3
