18672,"Akkulaufzeit super ! Jedoch ist der Verdampferkopf nicht allzu gut. Meiner hatte direkt nach einer Woche beim ziehen das ganze liquid in meinen Mund befördert welches natürlich extrem heiß war. Habe dem Kundenservice kontaktiert und dann auch Recht schnell einen Ersatz bekommen. Dieser hatte leider nach zwei Monaten das gleiche Problem ... Das Ding ist wirklich nicht zu gebrauchen. Auch mit neuen Coils und neuem Verdampfer wird sie nicht besser. Die Coils schmecken schon nach zwei Tagen und niedriger Wattstufe verbrannt und das liquid spritzt auch noch oben raus in den Mund rein, was nicht besonders angenehm ist ... Habe sie lange nicht benutzt gehabt, weil ich noch eine andere hatte, wollte sie aber Mal wieder Ausprobieren. Würde am liebsten mein Geld zurück verlangen ist jedoch zu lange her, dass ich sie bestellt habe ...",1
9669,"Hab den Vakuumier meiner Mutter geschenkt. Gefreut hat sie sich, nur leider hat das Gerät nicht so ""stark"" die Luft ausgesaugt, d.h. das Vakuum war eher naja. Danach hab ich ihr ein anderes Gerät geschenkt, war auch teurer und hat dann gut funktioniert. Dank Amazons toller Abwicklung, konnte ich dieses Gerät hier zurück geben.",1
7129,"Leider hat die Sendung überhaupt nicht geklappt. Bei mir ist die Sendung nicht angekommen, trotz anders lautender Information des Verkäufers. Ich bin froh, das Amazon mir den Kaufpreis erstattet hat.",1
17480,"Kann viele der Rezensionen hier bestätigen, bei mir war das Thermostat nach 1 Jahr defekt, die Temperatur lässt sich nach oben hin nicht mehr regelen, es geht nur noch Kälter aber nicht mehr Wärmer. Keine Kaufempfung.",1
19476,Also wenn ich null Sterne geben könnte würde ich null Sterne geben wenn ich - Sterne geben könnte würde ich sogar -5 Sterne geben die Handyhalterung ist für ein Arsch habe heute durch die Handyhalterung mein Handy komplett geschrottet nicht zu empfehlen Halterung hat sich komplett gelöst und hat mein Handy einfach aus der Verankerung raus fallen lassen Samsung Galaxy S8 komplett Schrott,1
4599,Passt ganz schlecht.,1
11396,"Wenn man sich ein wenig weiter weg von der Bluetooth-quelle (Smartphone) weg bewegt, wird die Musik sofort unterbrochen, danach läuft sie verlangsamt weiter, nur um dann enorm an Tempo zuzulegen, bis sich die Verbindung wieder stabilisiert hat. Eine absolute Katastrophe also",1
2167,Dat is jetzt ein Scherz oder was???? Ich würde die Uhr sehr gerne bewerten nur leider ist sie immer noch nicht in meinem Besitz!!! Obwohl bezahlt!!!!!!!!,1
1508,Das Produkt hat leider nicht zu meiner Zahnbürste gepasst.,1
23224,Nach gut einem Jahr funktioniert einer der Spots nicht mehr. Er reagiert nicht mehr beim Drücken auf den on/off Knopf.,1
29913,Die Schuhe sind sehr bequem und angenehm zu tragen. Allerdings hat das Plastik der Sohlen einen nicht sonderlich hochwertigen Eindruck gemacht. Leider hat sich der Eindruck bewahrheitet und nach nur 5 Wochen ist die rechten Sohle durchgelaufen und auf der Höhe der Ballen ist nun ein Loch in der Sohle. Leider auch für den Preis nicht akzeptabel. Geht zurück,1
28000,Kann weit nicht mit einem Original mithalten,1
13439,"Habe mir den Korkenzieher ein zweites Mal gekauft, nachdem der erste kaputtgegangen war. Und siehe da, der neue Korkenzieher ist innerhalb eines Jahres an der gleichen Stelle defekt (Bruch des Plastikrings). Produkte von WMF sind offensichtlich nicht mehr das, was sie einmal waren. Besser nicht kaufen.",1
34750,"Totalschaden nach weniger Benutzung! Würde dieses Produkt Niemanden empfehlen, wer an seinen Daten hängt! Ich würde niemals mehr Western Digital kaufen!",1
29406,Viel zu Groß Viel zu Laut Das wird keine Katze interessant finden Absolut keine Kauf Empfehlung ! Lohnt sich nicht,1
24841,"Verkäufer liefert nicht, warte seit Wochen. Antwortet nicht auf Anfragen. Habe es 3 mal versucht und werde ignoriert. Auf keinen Fall aus China bestellen!",1
534,Lieferung nicht wie ausgemacht und angekündigt was soll das und zum Schluss heißt es kann nicht zugestellt werden echtes Armutszeugnis ein Kunde der wartet und dann diese Antwort da geh ich lieber ins Geschäft und kaufe dort ein,1
27202,"Ich war srhr entäuscht, habe einen ähnlichen Rucksack schon über 10 Jahre. Er ist ein wenig verschließen an den Gurten deswegen wollte ich einen neuen... Aber ich denke das mein jetziger Rucksack diesen überlebt hätte! Ganz schlechte Qualität made in Germany, schämt euch!",1
33058,"Schade ! Sehr schlecht...Glas klebt nur aussen und geht leicht ab, weil es am Rand von beiden Seiten ansteht",1
11507,"Dünnes Material, hielt nicht mal eine Saison.",1
26361,Die Messer sind scharf. Allerdings lässt die Qualität zu wünschen übrig. Nach nur 3 Monaten fingen die Messer an zu rosten.,1
22945,Totaler schrott. Viel zu leise und nicht gut zu bedienen. Ich bin sehr unzufrieden und habe ihn zurück geschickt. Schrott .,1
25932,NIE gekommen...NIE zurück mein Geld bekommt,1
21176,Eigentlich ist dieses Produkt nur ein großer Luftballon und ist absolut nicht für das Beschriebene geeignet.,1
24223,"Das Paket erreichte meinen Briefkasten noch, jedoch geöffnet und leer. Überall geschaut, aber auf dem Boden vor dem Haus lag die Tube nicht, dementsprechend hat der Zusteller einfach eine leere Tüte zugestellt 👍🏻 Liegt hoffentlich nur an dem stressigen Weihnachtsgeschäft, schade, bei den positiven Kritiken hier ist man natürlich umso mehr enttäuscht. Daher nur ein Stern.",1
18125,Leider ist einer der Haken zur Befestigung am Gepäckträger nach weniger als 10 Benutzungen abgebrochen. Sehr enttäuschend.,1
4113,"Von dieser Brat-Pinzette kann ich nur abraten. Obwohl sie pfleglich behandelt und nur selten benutzt wurde, ist sie nun in 2 Teile zerbrochen.",1
6531,"Anfangs war ich von dieser Video-Türklingel begeistert. Leider löst sich das Gehäuse in seine Bestandteile auf. Die Gummierung ist nach 6 Monaten rundum ekelhaft klebrig. Ich hatte diese Türklingel für eine ältere Person gekauft, damit sie sehen kann wer vor der Tür steht. Leider funktioniert die Software nicht mehr korrekt und es ist auch nicht möglich das Gerät auf Werkseinstellungen zurück zu setzen. Schade!",1
2115,Trotz E-Mail wurde falsche Krone geschickt. Zweimalige Anfrage beim Händler blieb unbeantwortet. Schlechter Kundenservice.,1
10679,Kostüm war unvollständig .Würde zurück geschickt .:-(,1
19864,Dieses Set ist das Porto nicht wert. Spitzen brechen sofort ab und die Hefte halten nicht. Eine Frechheit so etwas anzubieten. Selbst für den Preis sollte etwas mehr gehen.,1
6829,Der Hut kam schon kaputt an die Kleidung ist zu klein,1
19566,"Der Artikel wurde bereits das zweite Mal bestellt. Beide Male löste sich an der gleichen Stelle ein Halteband an einem der Handschoner, obwohl ein Sturz nicht die Ursache war. Diese Verarbeitung ist absolut inakzeptabel und stellt für die Kinder ein erhebliches Sicherheitsrisiko dar.",1
10681,Da ich seit über 2 Wochen darauf warte das es bei mir ankommt und ich nur blöde Antworten vom Verkäufer bekomme würde ich am liebsten -5 Sterne geben !!!,1
26569,"Unsere Lichterkette wurde 2014 gekauft und immer sehr sorgfältig behandelt und verstaut. Heute wollten wir den Baum schmücken und sie geht nicht mehr an, obwohl alle Kerzen intakt sind. Keine gute Qualität mehr, würde ich sagen. Schade!",1
25476,"Das Angebot klang gut, auf Empfehlung von außen wurde genau dieses Gerät ausgewählt. Eindruck höchst wertig, schwer im Gewicht, so dass erfolgreiches Entsaften zu erwarten war. Leider lief das Gerät dann nur genau 2 Sekunden, um dann grundsätzlich zu streiken. Schade, dass nirgends ein Hinweis auf Service zu finden war (vielleicht war ich auch zu dumm diesen zu finden). Der Ausbau des Siebes (zum Zwecke der Reinigung, man möchte ja kein schmutziges, gebrauchtes Teil zurück schicken) ließ sich dann nur unter der Gefahr von Schnittverletzung bewerkstelligen. So wurde das Gerät zurückgesandt - Dank an Amazon, dass das so reibungslos läuft - und ein Gerät einer anderen Marke gekauft. Für mich leider keine Kaufempfehlung.",1
26436,Ich sitze gerade in einer Lodge im Krüger NP in Südafrika und kann meine Kamera nicht laden weil der Adapter nicht für die Steckdose passt.,1
1293,stimmt nichts von ist ein scheiß artikel,1
1085,"Also ich war echt enttäuscht..die Hose war nach einer Stunde total geweitet und formlos, somit also nutzlos und ist zurück gegangen. Mein Geld hab ich nach über 2 Wochen noch immer nicht zurück was mich ziemlich sauer macht!!!!",1
15650,"Ich wusste das diese Geldbörse etwas größer ausfällt, was man ja an den Maßen in der Beschreibung auch entnehmen kann. Amazon hat auch wie gewohnt blitzschnell innerhalb von 24 Std. geliefert, umso größer war die Freude beim auspacken. Dann kam der Schock, die Kartenfächer sind alle durchweg schief eingenäht, beim nachmessen hat sich bestätigt das die Kartenfächer eine Differenz von 1cm auf die Länge von links nach rechts aufweisen. Wenn dann die Karten ihren Platz in den Fächern finden, sieht das ganze noch schrecklicher und auffälliger aus. Das bin ich von diesem Hersteller leider nicht gewohnt. Diese Geldbörse ging heute leider zurück und ich bin weiter auf der Suche nach einer mit Reißverschluss.",1
21906,"Das Glas lässt sich einfach anbringen und sieht gut aus. Aber leider funktioniert der Fingerabdruck sensor nicht mehr, somit also unbrauchbar und geht zurück",1
33815,"Die seitlichen Arretierungen des Filters sind zu kurz. Damit wird der Filter nur durch den Deckel des Staubsaugers gehalten. Die Frage ist, was da ggf. an Staub vorbeigeht... Schüttelt man den Filter, hört man den Inhalt (Aktivkohle?) rascheln. Das ist beim Originalfilter nicht der Fall...",1
26260,"Drücken lässt sich das Filament gut, doch was bringt es wenn auf der Rolle Knoten sind und der Druck abbricht. Hatte einen 14 Stunden Druckauftrag, lief alles, bin ins Bett gegangen und als ich morgens schaue, ist auf der Rolle ein dicker Knoten und das Filament am Extruder durchgescheuert. So kann ich dieses Filament nicht empfehlen.",1
1155,Der Artikel war defekt! Und unglaublich schlecht verarbeitet.,1
27001,"ich bin als ""Frau"" schon sehr praktisch veranlagt, aber dieses Uhrmacherwerkzeug für das Auswechseln des Uhrenarmbandes braucht man nicht nur Geschick, sondern auch eine Portion Geduld. Vielleicht können andere mit diesem Werkzeug besser umgehen, Ich nicht. Kann ich nicht weiter empfehlen",1
27435,Leider verfärbt der Piercing sich nach der 2. Dusche . Er ist nicht mehr Silber sondern komplett Kupfer rostig ... Würde ich nicht empfehlen,1
7787,Alle bestellten Lampen waren Defekt. Habe aber alles Rückerstattet bekommen.,1
11000,Leider nur OEM Parts und leider keine Original Samsung Platine - dafür ist mir der Preis viel zu hoch !,1
2554,"tolles Produkt, jedoch nicht die bestellte Nr. 21 Nude Beige erhalten. Gesendet wurde einfach Nr. 48. Wer sich den Ärger ersparen möchte, sollte dieses Produkt nicht bei der Firma bestellen.",1
7043,"Ich habe diese Socken NEU und UNGEWASCHEN mit in den Urlaub genommen, während des 1. Tragens hatten 80% der Socken bereits ein Loch",1
2163,Gekauft am 19.02.18 aber nicht erhalten! Könnte der Verkäufer nicht finden. Will mein Geld und oder das Produkt haben. Wo kann ich der Verkäufer finden?,1
33078,Nicht zu empfehlen. Die lösen nicht aus bei einer normalen Maus. Sie sind ständig nur leer gefressen. Damit kann man Mäuse nur füttern und nicht fangen.,1
19882,"Keine 4 Wochen hat der Türkantenschutz gehalten. Die Ecken standen schon nach knapp einer Woche ab, mittlerweile sind zwei sogar komplett abgefallen.",1
8958,Ich habe den Artikel noch gar nicht erhalten.,1
15272,Das Produkt passt gar nicht für das Handy da kommen knack Geräusche wenn man die Folie drauf macht ich empfehle es nicht,1
27777,"Ich hatte das Produkt bestellt und bezahlt. Geliefert wurde es nie. Angeblich wurde es zurückgesendet. Man hat mir dann Nachlieferung versprochen, auch diese ist niemals angekommen. Man kann auch niemanden erreichen. Weder per Telefon noch per E-Mail. Antwort? Fehlanzeige. Das war es mit Amazon! Marcel Schwab",1
11132,Artikel am 02.12.2018 immer noch nicht erhalten. Es handelt sich um Adventskalender. Die Lieferung sollte zwischen 28.11 u 01.12. stattfinden. Adventskalender nach dem 01.12. machen keinen Sinn. Brauche die Artikel nicht mehr.,1
6281,Der Body hat leider einen Produktfehler.,1
27390,Der M4 Gewindebohrer ist nach der dritten Anwendung auf vorgebohrte Löcher abgebrochen. Absolut keine Weiterempfehlung für diesen Gewindebohrer.,1
5257,Fällt viel zu klein aus.,1
32304,Ansich eine tolle Kamara. Gute Aufnahmen auch bei wenig Licht. Leider nach 2 Jahren und 5 Monaten defekt und die Reparatur ist nicht viel günstiger als ein Neukauf...,1
35755,"Bei der Bestellung der Gartenmöbel haben wir schon gewusst, auf was wir uns einlassen bzgl. des Aufbaus. Dieser soll laut Bewertungen anderer Käufer ja nicht so einfach sein. Aber dass der Aufbau so an den Nerven zehrt hätten wir nicht gedacht. Es ist katastrophal! Wirklich alles krumm und schief. Sogar die Tischbeine mussten wir zum Schluss noch mit Gewalt gerade biegen. Außerdem wurde ein Stuhl defekt geliefert, am Bein ist unten das Plastik abgebrochen. Es ist uns schon klar, dass man für diesen Preis nichts Hochwertiges erwarten kann. Aber diese Sitzgruppe ist eigentlich nur produzierter Müll. Zum Anschauen vielleicht noch gut geeignet. Aber allzu viel kann man auf die Tischplatte nicht stellen, denn dann biegt sie sich durch. Der Neigungswinkel der Rückenlehnen ist absolut zu steil. Es ist total ungemütlich, lange kann man nicht sitzen. Die Sitzgruppe ist nun aber mit viel Mühe aufgebaut und wir werden sie wohl diese Saison nutzen. Aber wir würden jedem davon abraten sie zu kaufen. Auch wenn der Preis noch so verlockend erscheint.",1
15679,"Funktioniert schlichtweg nicht. Verbindung bricht ab, so ist es natürlich vollkommen uninteressant.",1
10284,Die sind nach 15 Tagen kaputt gegangen.,1
151975,Sehr gute Verarbeitung.,4
144997,"Haben die Türstopper seit Mai 2017. Material hält super. Da sie bei uns verwendet werden um nicht mit der Tür an die Wand zu schlagen, erfüllen sie super ihren Zweck. Bin sehr zufrieden.",4
129442,alles wie beschrieben also gut schnelle Lieferung gute Qualität nur lästig wenn man vorgeschrieben bekommt wie viele Wörter man schreiben muß,4
157208,von der Funktion gut tut was er soll benutze ihn zur Herstellung von den shakes von layenberger fit +feelgood klappt perfekt aber 1 Stern Abzug weil nach dem 6ten Shake wo ich gemixt habe das Plastik vom Mixer schon verkratzt ist obwohl ich zum säubern nur klares wasser und ein baumwolltuch verwende,4
122724,"Dekoratives Thermometer. Schöne große Zahlen. Gut lesbar. Leider keine Funkuhr, Uhrzeit muss manuell gestellt werden.",4
120957,"Praktisch und süße Farbe, kam mit Kabel und Tasche an lädt super geht aber schnell kapput (ist zwei mal hingefallen)also 4 Sterne 😉😊",4
156140,"Die Presse hat eine gute Qualität und wird lange halten. Mir ist sie für Kartoffelbrei ( nur dafür habe ich sie bestellt ) allerdings viel zu klein. Ich behalte sie, weil ich zu lange gewartet habe, und eine Rücksendung nicht mehr möglich ist.",4
142884,"Isoliert die Kälte vom Boden bei ca 16°C gut ab. Es fühlt sich zwar nicht an als würde man sehr weich liegen, aber ich hatte keine Rückenschmerzen, Zerrungen oder dergleichen nach ein paar Nächte auf dieser Matte. Ein Stern abzug aufgrund des hohen Preises.",4
153555,"Ich habe die Extensions für Karneval gekauft und war total begeistert, als sie ankamen. Zum einen passt die Haarfarbe wirklich komplett zu meinen Haaren, zum anderen fühlen sie sich hochwertig und echt an. Einen Punkt Abzug, weil es auf jeder Seite nur ein kleines Klämmerchen gibt (eher wie ein kleiner Steck-Kamm), daher muss man die Haare auf Grund des Gewichts auf jeden Fall noch zusätzlich befestigen.",4
121493,Allo OK. Die Keramik Versiegelung ist angekommen.,4
129694,Wirklich schön aufgemacht. Leider fehlen hier und da Tage. UPS....,4
155657,"Verstärkt Stimme zuverlässig, Klang leicht blechern. Für Führungen gut geeignet. Man sollte jedoch kein Handy bei sich tragen (zu hörendes Störsignal) und nicht allzu viel am Kabel spielen während der Nutzung (zT Übersteuern). Dann funktioniert es super.",4
130384,"Sehr Freundliches Personal. Probleme konnten gelöst werden!!! Schade, dass er kaputt geliefert wurde. Die Beschreibung zum Aufbau war nicht ganz einfach. Trotzdem ein sehr schöner Stall. Verkäufer hat mich kontaktiert und es wurde eine Lösung gefunden.",4
137590,"Schnelle Lieferung, wie gewohnt. Schnelle und einfache Montage der Pedale. Kein Wackeln, bisher ruhiger Lauf. Bisher sehr zufrieden mit den Pedalen.",4
155178,"Die Gefäße sind dicht und lassen sich einfach schließen. Jedoch soll man nach gebrauch die gummidichtungsringe wechseln, diese kann man aber gefühlt nirgens kaufen. Es wäre schön,wenn die Firma auch die gummidichtungsringe einzelnd verkauft. Trotzdem würde ich diese Gefäße wieder kaufen ubd sie auch weitet empfehlen.",4
159751,Sehr stabil und flexibel anpassbar. Montage aber eher etwas fummelig.,4
139852,"Hab diese Maus für meine Mutter bestellt, die damit nur Solitaire mit dem Laptop spielt . Sie sagt das die Maus super leicht zu händeln ist ,sich leicht bewegen lässt und ja! die Installation/Inbetriebnahme war kinderleicht USB Teil eingesteckt und los gehts!!!!",4
121449,Ich habe mir mehr Schutz vorm Wassereindringen vorgestellt,4
144257,"Ich finde sie sehr gut, Weichheit ist nicht zu 100% erwünscht, da sie ja gut reinigen sollen. Ich bin sehr zufrieden",4
131530,"enthält reichlich Zucker, allerdings muß das so sein. Gutes Preis/Leistungsverhältnis, Produkt wie versprochen",4
143929,cooler Beutel - meine Mädels lieben ihn! :),4
138328,"Preis und Leistung, gut",4
136007,"Nach ziemlich langer Lieferzeit haben wir den Pavillion erhalten. Leider wurde dieser mit DPD Versandt daher musste man erstmal in der gesamten Stadt nachfragen ob sein Paket da ist (Sendungsnummer erst auf Anfrage spät erhalten). Aber dennoch hat der Pavillion auf dem Festival einen super Dienst erwiesen. Nach einem Festival ist er auch hin, durch starken Regen und Wind sind die Stäbe gebogen. Aber für ein Festival- Wochenende würde ich ihn definitiv nochmal holen",4
147242,Leider nicht ansatzweise die Höhe die angegeben wurde. Und das obwohl das Solarfeld einwandfrei der Sonne angepasst ist. Ansonsten aber schick anzusehen :),4
133417,"Super Kissen, nach der Nacht kommt es sofort wieder in Form, man liegt wirklich bequem drauf!!! Waschen, man nimmt die Füllung raus und gut",4
139979,Im großen und ganzen bin ich zufrieden. Nur riecht die Mappe etwas streng was sich mit der zeit bestimmt gibt(deshalb nur vier Sterne ). Hatte auch keine großen Erwartungen an den stiften umso überraschter war ich das sie echt gut sind.,4
122771,"Für diesen Preis ein guter Schrank. Keine Probleme mit dem Einstellen der Türen. Lediglich die Flucht Schublade/rechte Tür unter Schublade ist nicht exakt (ca. 1-2 mm). Daher optisch nicht einwandfrei. Auch war hinten rechts eine kleine Beschädigung, die man aber nur sieht, wenn man es weiß. Schnell aufgebaut, auch ohne Hilfe.",4
126122,"...und mild wie eigentlich alle diese Whiskys, die mit charcoal chill filtering produziert werden.",4
158089,Sehr schönes Produkt. Zeigt alles Fahrzeugdaten auf das Smartphone an. Funktioniert einwandfrei. Die Bluetooth Verbindung ist super. Im Großen und Ganzen kam man nix falsches machen bei dem Preis.,4
137359,Ich habe mir die Auflage für einen Holzmann Rangierwagenheber als größeren Teller geholt. Sie passt perfekt jedoch hat die Gummiauflage eine eingearbeitete Stahlplatte die sich nach dem Wechsel von 4 Reifen ein wenig verformt hat. Da es aber 3 Einkerbungen gibt drehte ich bei den nächsten Einsätzen die Auflage sodas die Verformung nicht stärker wird und rundum wandert. 1-2 Jahre wird das Ding schon halten schätze ich und das ist es mir wert.,4
120219,"Die Löffel sind bis auf einen leichten Grat sehr gut. Der Grat ist zwar nicht gefährlich, aber dennoch leicht vorhanden. Dieses Problem ist allerdings sehr häufig bei Besteck zu finden und wird unterschiedlich stark wahrgenommen.",4
136912,"Toller Artikel für wenig Geld. Einfache Umprogrammierung der Schaltfunktion möglich. Leider nur ein internes 10A Relais verbaut, allerdings mit Überlastschutz.",4
158848,Gibt's auch billiger.,4
158151,"Bereits das erste Kapitel / der erste Gedanke hat mich zum Nachdenken angeregt und mich zum weiterlesen motiviert. Es geht um die Zeit, die wir mit Dingen verbringen,die uns keinen Spass machen, wir unseren alltag Leben, ohne nachzudenken, was wirklich wichtig ist. Durch die einzelnen kurzen Kapitel ist das Buch leicht und schnell zu lesen. Die meisten Guten Ratschläge und Sprüche/ Lebensweisheiten sind nicht neu- werden hier aber genauer beleuchtet und regen zum überdenken der eigenen Lebens und Denkweise an. Auf jeden Fall lesenswert, wenn man sich und seine Gedanken positiv verändern möchte",4
139445,"ich bin mit dem Öl sehr zufrieden. Es läßt sich einfach auftragen und das Holz wirkt toll danach. Ein Punkt weniger, weil sich der Verschluss nicht öffnen ließ. Ich bin schon mit der Rohrzange daran gegangen, musste aber abbrechen weil sonst das weiche Plastik wohl gerissen wäre. So helfen nun zwei gebohrte Löcher zum Ausschenken.",4
133103,Ein sehr gutes Produkt. Hält was es verspricht. Beim auspolieren muss man sich etwas Mühe geben aber die Versiegelung hält auch gut zwischen 6 - 12 Monate.,4
155404,"Nun als er ankam war ich begeistert, leider hat sich das ganz schnell gelegt. Beim zusammensetzen gab es Probleme, nichts passte so richtig ineinander. Ich hatte eigentlich was besseres für den Preis erwartet. Ich hätte ihn nicht behalten, aber ich brauchte von heute auf morgen sofort eine Box und deshalb blieb mir nichts übrig als sie zu behalten. Ich habe sie einmal benutzt und dabei wird es auch bleiben, sie fühlt sich nicht sicher an. Leider",4
142642,Sehr gut-in kurzer Zeit sind die Fugen wieder in Top-Zustand!!!,4
154649,"Es ist schon einige Monate her, dass ich das Kissen bestellt habe.Bis jetzt bin ich sehr zufrieden damit, da es gemütlich ist und ich sehr gut damit schlafe... jedoch musste ich es schon 4x nähen, da es an den Seiten aufgerissen ist... von daher möchte ich einen Punkt abziehen für die Qualität. Trotzdem würde ich es immer wieder kaufen... schön ist auch, dass man den Bezug waschen kann.",4
124551,"Die Kopfhörer waren so wie ich es erwartet hatte. Die Lieferung war schnell und fristgerecht, das einzige negativ es sind zwei verschiedene Lieferanten gewesen.",4
156042,Habe dieses Produkt als Geburtstagsgeschenk für meinen Partner gekauft. Kam super an und sieht sehr edel aus. Preis/Leistung ist top!,4
126523,Lupine ist basisch und für die Eiweißversorgung optimal. Gibt jedoch auch günstigere Hersteller.,4
139156,Wirklich angenehm und stabil. Er hat tatsächlich bis fast 120 Kg mehrfach getragen und alles ging super. Ich werde ihn weiter empfehlen,4
136566,Klare Kaufempfehlung,4
156160,"Ist meine erste Munddusche, man muss sich erst dran gewöhnen, aber dann ist es wirklich super.",4
124133,Der Versand ging wie immer schnell und die Anhänger sind sehr schön. Die Kette an sich ist eine Geschmackssache. ich habe sie behalten und meinen Partner zu Weihnachten geschenkt... er hat sich drüber gefreut.,4
122539,"Leichtes anbringen. Sehr gut verpackt. Es entstanden überhaupt keine Blasen. Stern Abzug weil seitlich (rechts und links) ca. 0,3cm nicht das Display abdecken.",4
150888,"Für den Preis kann man nicht meckern. Viel Stauraum und superschick. Einziges Manko: Die Reißverschlüsse öffnen sich in der Mitte einfach so. Man muss sie wieder aufmachen und zuziehen, dann geht es wieder für eine Weile. Trotzdem, ich würde sie wieder kaufen.",4
153535,Sehr zufrieden mit Lieferung und Artikel.,4
122050,Empfang ist bei mir nicht optimal. Sonst alles okay!,4
159778,"Der Gürtel passed und wirkt wertig. Über die Haltbarkeit und Gewichtsreduzierung kann ich momentan noch nichts sagen. Trage Ihn jetzt immer beim Sport und ja, er erhöht das Schwitzen. Mir ist aber bewußt, dass man ohne Anstregung keine Pfunde verliert. Schauen wir mal...",4
134755,Sieht sehr schlicht aus und funktioniert. Bisschen klein aber für den Preis absolut in Ordnung.,4
143996,"Hallo Habe den Controller gebraucht gekauft , sah aber aus wie neu. Dieser liegt gut in der Hand und lässt sich alles gut spielen.",4
157791,Läst sich schnell verarbeiten,4
157808,"Habe ich als Sicherheit zu meinem Fahrrad Dachträger gekauft, erfüllen ihren Zweck sehr gut!",4
159794,"Was soll den das ? War die Frage meiner Lebensgefährtin. Später dann, WOW Geile Sache 😅 ist zwar etwas eng aber das schadet ja nicht",4
122365,Gute Funktion wie beschrieben. Die Optik ist auch OK.Sehr schnelle Lieferung.,4
148204,"Wie schon erwähnt sehr guter Strahler! Leider zu teuer bezahlt, der Preis schwankt zwischen 169€ und 99€, deshalb Stern abzug!",4
152058,Die Lieferung war schnell. Leider fehlen Teile in meinem Werkzeugkoffer. Das ist sehr schade. Vielleicht werden diese mir noch Nachgeliefert . Es fehlen die Bitz und die Schachtel mit den Dübeln und Schrauben ist kaputt.,4
134886,die Träger halten (noch?) meine schweren Jeans. Erst einmal in 2 Monaten hat sich eine Klemme gelöst. Da hatte ich schon viel schlechtere Hosenträger.,4
127278,"Der Artikel benötigte etwas länger zum Einbau als angenommen, man musste sich etwas Zeit lassen. Nachher im Helm mal eingebaut und gewusst wie zu nutzen > funktioniert tiptop! Jederzeit zu empfehlen.",4
148507,Meine Tochter benutzt den Rucksack für die Schule. Sie ist sehr zufrieden.,4
139702,"Top, besser als erwartet. Natürlich darf man bei diesem Preis nicht die beste Qualität erwarten.",4
