128766,"Optisch sehr schöne Zahndose für Mädchen. Leider ist der Deckel sehr lose, quasi nur aufgelegt. Aber zum Hinstellen und nicht durch die Gegend tragen ist es ok",4
115248,".. wie der Titel schon sagt - der Inhalt war total in Ordnung, aber die Packung total kaputt und unansehnlich! Deshalb 2 Sterne Abzug! (Ja, ich bin pingelig bei sowas!)",3
104630,"Klang ist spitze!!! Aber leider stört das Rauschen des noise cancelling. Mein größtes Problem war die elektromagnetische Spannung. Und dieser Druck. Das wurde bei längerem Tragen leider nicht besser. Schade, denn der Klang und die technischen Spielereien mit der app sind außergewöhnlich gut!!",3
110316,"Das Produkt ist gut aber ich kann nicht so gut mit die Kontrolle spielen, deshalb ich das zurück geschickt habe",3
97860,"Erfüllt seinen Zweck (Reinigung von kleineren Elektrogeräten bzw. deren mit dem Tuch unzugänglichen Stellen), allerdings löst sich die vordere Röhre bei zu hohem Druck. Auch lässt sie sich mit Klebestreifen nur umständlich fixieren",3
109746,"Viel zu eintönig. Fast alles war mit Nougat und wenn man vom Originalpreis ausgeht natürlich viel zu teuer, aber das sind fast alle Adventskalender.",3
107813,Billige Verarbeitung. War nach 2 Tagen kaputt,3
91757,"Leider stinkt das Täschchen heftig beißend.. Die nieten sind aus Plastik, das Emblem in der Mitte scheint aus Blech zu sein, es ist glänzend und wirkt dadurch zusätzlich günstig.",3
117219,"Sitzt sehr stramm, dadurch eher unangenehm. Hält die Haare aber perfekt trocken.",3
85356,"es ist schwer, sich notizen auf dem Block zu machen, da dieser schnell einklappt, und man bei einmaliger Nutzung den Block nicht mehr nutzen kann, deshalb nur drei Sterne, an sich aber ganz lustige Idee.",3
95722,"Die Ohropax sind wirklich sehr weich, aber sie passen einfach nicht. Trotz Befolgen der Anleitung rutschen sie immer wieder raus und tun daher auch nicht das was sie sollen: Stille erzeugen. Schade. Ich werde nun die für Kinder testen.",3
88455,"Habe inzwischen 40 AAA- Batterien gekauft, nur die Kerzen sind nicht die, welche ich ursprünglich wollte. es wurde extra- mini -geschrieben und als ich die Batterien einsetzen wollte, waren sie leider zu klein. Da ich weiß, das es zwei Größen gibt bin ich schon endtäuscht, da ich immer einen kleinen Tannenbaum habe.",3
82238,"Das Armband psst optisch sehr gut zum Fitbit Charge 2 und ist sehr angenehm im Tragekomfort. Im Gegensatz zum serienmäßigen Armand schwitzt man deutlich weniger, was bei sportlicher Aktivität nicht unwichtig ist. Leider ist das Magnetarmband nicht in der Lage, den Tracker ausreichend stramm am Handgelenk zu fixieren, so dass die Messwerte (Pulsschlag) deutlich beeinflusst werden.",3
101885,"Sehr gutes vernebeln der Flüssigkeit. Leider wird in der Produkbeschreibung nicht darauf hingewiesen, dass es sich bei der Maske um eine Kindermaske handelt. Schlauch und Vernebeler sind aber universell und passt auf die vorhandenen gängigen Geräte.",3
97292,"Ein sehr gutes Sommerkleid, leider gehen bei mir die Nähte an der Seite vom oberen Teil auf, (reißen etwas ein und ergibt Löcher) ich bestelle es mir nochmal und hoffe das es da besser ist.",3
83966,Funktioniert leider nicht so wie gehofft. Es muss viel Kraft angewendet werden und das Ergebnis ist gerade mal befriedigend. Sehr schade,3
90234,genau das richtige für den Winter,3
112986,"der Stoff ist zu dünn. Die nähte halten nicht, gehen auf. Die Finger sind zu kurz, bei Finger Arthrose. Werde sie nicht mehr kaufen",3
83687,"Grundsätzlich gute Strümpfe. Für die Person jedoch zu klein, da geschwollene Füße. Ich würde sagen ansonsten normale Passform.",3
80358,"Mit diesen Patronen hatte ich leider Pech, sie funktionierten nicht alle bei meinem Drucker, auch nach mehreren Wechsel nicht, leider.",3
102300,Richt und wirkt anders als aus der Drogerie.,3
102523,Hilft nicht wirklich bei rotem klee,3
86662,Ist ok denke mal wenn jemand damit richtig umgehen kann klappt das besser bei mir nicht. Wobei man damit nur kleine kuchenböden schneiden kann,3
104263,Schon nach kurzer Zeit am Ablösen,3
113634,"Da unser alter Britafilter brach, bestellte ich sofort einen neuen. Im Grunde ist er wie das voherige Modell, welches wir hatten. Was mir jedoch schon mehrmals passierte und mich stets ärgert, ist dass die weiße Abdeckung/der Deckel z.B. beim Befüllen einer Flasche wegrutscht (obwohl es richtig verschlossen war) und die Küche unter Wasser setzt. Außerdem funktionierte die Anzeige nicht gerade lange.",3
113361,"Nach 5-monatiger Nutzung- Die positiven Eigenschaften hebt ja schon der Hersteller hervor. Ich zähle mal die Mankos auf: Die Reibetrommel ist nicht durchgängig als Reibe abgelegt. Das ergibt eine sehr hakelige Kurbel- bzw. Drehbewegung. Das fühlt sich einfach unbeholfen an. Der Verschluss zum Entnehmen der Reibetrommel ist so glatt und mitunter sehr rutschig, dass man viel Kraft benötigt um ihn zu öffnen. Für eine gute Reinigung ist das aber zwingend erforderlich. Wer mit diesen Minuspunkten leben kann, sollte die Reibe mal ausprobieren.",3
107010,An sich eine tolle Hülle. Leider passt die Aussparung für das Ladekabel nicht ganz. Man muss leider die Hülle zum laden abnehmen.,3
92534,"Mir hat es leider überhaupt nicht geschmeckt und es kam eigentlich gleich wieder hoch. Es scheint aber anderen zu schmecken, Geschmäcker sind bekanntlich verschieden.",3
109393,"Schade, dass die Ösen der Warntafel schon nach einer Regenfahrt zu rosten beginnen. Ansonsten hätte das Produkt 4-5 Sterne verdient. Vor allem, weil es deutlich günstiger ist als im Fachhandel.",3
104505,Ich kann es noch nicht beurteilen. Der erste Eindruck ist in Ordnung. Werde sehen ob es schnell Verkalkung. Ist erst ein paar Wochen montiert,3
89520,"Das Produkt erfüllt zwar seinen Zweck und sieht dabei noch recht gut aus, allerdings sind die Hüllen zum Einen recht dick, zum Anderen durch den nach innen gefaltenen Kartong so eng, das man beim Einschieben der Karte regelmäßig hängen bleibt/anstößt. Man muss dann mit sanfter Gewalt nachhelfen, was vermutlich auf Dauer dazu führt, dass die Hülle beschädigt wird wenn man die Karte öfter benutz.",3
111425,Riecht gut fällt aber sehr leicht ab und war deswegen nicht sehr hilfreich.,3
109514,"Gut, allerdings zu kurz.",3
107965,Ja nur für schmerzfrei Menschen. Anwendung ziemlich aufwendig. Ergebnis nicht sehr befriedigend.,3
86307,"Die Armatur ist schnell geliefert worden. Sie macht einen wertigen Eindruck und funktioniert einwandfrei. Wie schon in einer der Bewertungen geschrieben ist es wirklich schwierig die Armatur mit dem Gewindeteil unterhalb des Waschbeckens so zu befestigen, dass sie nicht mehr wackelt. Mit den üblichen Werkzeugen ist das nicht möglich. Ich habe das Gewindestück mit der Hand (Handschuhe) so fest gezogen wie es ging. Mit der Festigkeit kann man leben, ist aber nichg perfekt. Also für die Armatur 4 Sterne, für die Art der Befestigung max. 2 Sterne. An der Armatur und auch in der Montageanleitung ist kein Hinweis darauf, wo jeweils der Flexschlauch für warm und kalt befestigt wird.",3
80472,"Mein grosser (5) ist begeistert, für meine kleine (2) ist die Sitzposition nicht angenehm.",3
119376,Für den Preis ganz ok. Allerdings keine lange Lebensdauer,3
116281,"Für den Preis ganz ok. Hält Staub, Schmutz und Sonne ab, ist jedoch nicht zu 100% Wasserdicht (nach dem Regen ist die Plane innen nass).",3
90305,"Die länge der Kabel reicht fast für zwei Motor längen. Wer hat da wohl Maß genommen . Wenn schon alle Daten verlangt werden, sollte Man sich auch mal den Motorraum ansehen. Mit besten Grüßen Karl",3
93048,"Das Produkt selber ist einwandfrei, jedoch wurde für eine Schachtel von ca. 10 cm ein viel zu großer Karton verwendet, welcher dann mit Luftpolsterfolie ausgestopft war. die Schachtel hätte auch problemlos in einen Umschlag oder ein viel kleineres Päckchen gepasst.",3
105756,"Die 3 Sterne beziehen sich natürlich auf das Verhältniss zu dem Preis, sonst wars nicht ganz so gut ausgefallen ;) Aber mit samt dem ganzen Zubehär wirklich günstig. hab mir zwar danach noch ein besseres Mic gekauft, aber den Ständer benutze ich weiterhin :)",3
106176,Einmal genutzt und anschließend kaputt gegangen. Das Metal an der Armlehne ist nicht sehr robust.,3
100698,"Qualität und Lieferung gut. Schwarz ist das Armband allerdings nicht, siehe Foto.",3
80447,"Ich habe diese Lichter im Badezimmer angebracht, damit man in der Badewanne bei gedämpften Licht entspannen kann. An und für sich sind die Lampen dafür auch sehr gut geeignet, aber der Batterieverbrauch ist doch recht hoch. Da sie aber nicht so häufig angeschaltet werden, ist das in Ordnung.Der Batteriewechsel ist schnell gemacht - kein großes Gefummel. Mir gefällt besonders die Magnethalterung, aber man muß die Oberfläche mit Bedacht wählen, das magnetische Klebepad hält auf manchen Oberflächen nicht so gut. Die Lampen sind schön flexibel und dezent, aber sie leuchten nicht besonders hell.",3
86713,"Mir schmeckt er nicht besser als andere Kaffee's aus dem Discounter, aber wie immer ist dies Geschmackssache. Der Rest läuft Amazon-Typisch perfekt.",3
109051,"sieht chic aus, leider kühlt der Weinkühler nicht, bzw. hält er den Wein nicht kühl. Mit dieser Funktion bin ich nicht zufrieden.",3
81257,"Die Kombidüse wäre perfekt, wenn sich das Gelenk vom Anschluß an das Saugrohr um 90° bewegen würde und nicht nur um ca. 45°. Wenn man nahe vor seinen Füßen saugen muss - weil der Platz fehlt - fehlt der Düse hinten der direkte Bodenkontakt. Was man dann auch an der Saugleistung merkt, was verständlich ist. Schade - deshalb leider nur 3 Sterne Zur Robustheit kann ich noch keine Angabe machen - das Teil ist erst seit kurzem in Betrieb.",3
81949,"5 Stück im November letzten Jahres bestellt ! Jetzt ist eine davon zerbrochen. Hoffentlich nur ne Ausnahme , Materialfehler kann ja immer mal sein. Vielleicht 3 x benutzt in dem Zeitraum. Ist mir noch nie mit irgend einer anderen Zwinge passiert und ich hatte schon einige in den Händen gehabt. UND bei Bergland-Handels-GmbH gekauft und Service / Kundenfreundlichkeit wird da klein geschrieben ! Erste Antwort von denen : Umtausch Zeitraum ist abgelaufen ! Ist wohl ein Witz ! Wollte einfach nur die kaputte getauscht bekommen, aber nein , jetzt haben sie das Geld gut geschrieben und ich muss wieder neu bestellen und wieder Versandgebühren bezahlen. NICHT zu empfehlen !",3
118619,Es ist zwar sehr günstig aber dafür kommen mit der Zeit viele Fehler und macken zum vorschein. Manche apps fangen an zu hängen Die Akku Laufzeit ist normal wie bei jedem anderen Handy auch ( also nichts besonderes) und beim schreiben hängen die Buchstaben sodass man sich öfter mal verschreibt Deshalb nur lieb gemeinte 3 Sterne,3
115504,Die kleine bzw arm Sachen waren nach 3 Wochen kaputt :-(,3
113705,Also wie soll ich anfange sie ist in Ordnung aber bekommt schnell Risse und die Farbe geht halt weg aber sonst ist sie ok,3
110297,Schönes Design aber rauscht immer ein bisschen. Sound ok aber nicht überwältigend.,3
87882,Habe unseren Arzt gefragt wie gut das Stetoskop ist....leider viele Nebengeräusche zu hören.,3
102434,Qualität mittelmäßig,3
94299,"Von der Aufteilung her übersichtlich, aber die einzelnen Spalten könnten einen Tick breiter sein.",3
91202,Anhänger war nach 6 Tagen kaputt,3
80731,Gerät schaltet sehr spät ein. Nachts ist nichts zu sehen. Bildqualität ist OK. Ganz schlimm finde ich die Kosten von 10€ /Monat wennich weiterhin speichern will. Wusste ich vorher nicht. Für die Rückgabe leider zu spät!! Wahrscheinlich lief es deshalb die ersten 4Wochen gratis!!,3
101594,Nach mehrfachem Benutzen riecht er immer noch komisch neu.,3
101442,"Leider hat die Farbe nicht das ergeben, was auf dem Foto und der Beschreibung zu sehen war. Das Rose ist so voller Schimmer, dass der Lippenstift golden wirkt. Da passt nicht zu mir.",3
116271,"Leider nur ein Stromkabel dabei, sonst 5 sterne. Fax und Usb anschlußkabel für Pc muss man auch selber kaufen. Für so ein Gerät müsste es dabei sein!",3
104623,Sind zwar schön lassen sich aber nicht gut färben dafür das es echthaar sein soll ..,3
107018,"Und die sich immer weiter aufklärende Geschichte. Alles in allem solide gespielt und extrem heftig, die wenigen Kilos des darstellers. Ob das etwas gebracht hat, für mich unschlüssig. Am Ende des Films, kann oder versteht man gewisse Dinge besser und es erklären sich letzte Lücken. Jedoch kein Streifen der Begeisterung weckt und den man lange mit nimmt. Gesehen und fertig.. Für mich 3 solide Sterne.",3
97591,"Die Jacke sieht toll aus und passt sehr gut. Das Material fühlt sich sehr gut an und die Jacke ist bequem und auch warm. Wind hält sie super ab. Soweit alles gut. Im ersten Regen dann die Ernüchterung. Das Material saugt sich voll wie ein Schwamm und man ist in kürzester Zeit völlig durchnässt. Leider nicht wie ich erwartet hatte. Ich kann die Jacke nur anziehen, wenn ich davon ausgehen kann, dass es trocken bleibt. Schade.",3
106834,"Macht was es soll aber, die angegebene Quadratmeterzahl schafft dieses Gerät bestimmt nicht. Auch bei der Lautstärke könnte man noch was verbessern.",3
97371,Der Klang ist nicht so toll und die Sender sind nicht stabil.,3
